number,value,datetime_start,datetime_complete,duration,params_ADX_THRESHOLD,params_ATR_MULTIPLIER,params_ATR_STOP_LOSS_MULT,params_BB_STD,params_ENTRY_PERIOD,params_ENTRY_TYPE,params_EXIT_TYPE,params_LEVERAGE,params_MA_PERIOD,params_MFI_THRESHOLD,params_MFI_WINDOW,params_RISK_PER_TRADE,params_RSI_OVERBOUGHT,params_RSI_OVERSOLD,params_RSI_WINDOW,params_SAR_STEP,params_STOCH_OVERBOUGHT,params_STOCH_OVERSOLD,params_STOCH_WINDOW,params_STOP_LOSS_PCT,params_STOP_LOSS_TYPE,params_SUPERTREND_MULT,params_SUPERTREND_PERIOD,params_TIMEFRAME,params_TREND_FILTER_TYPE,params_USE_ADX,params_USE_MFI,params_USE_RSI,params_USE_STOCHASTIC,params_USE_VHF,params_VHF_THRESHOLD,user_attrs_entry_type,user_attrs_leverage,user_attrs_mdd_BTC_USDT,user_attrs_mdd_ETH_USDT,user_attrs_mdd_avg,user_attrs_return_BTC_USDT,user_attrs_return_ETH_USDT,user_attrs_return_avg,user_attrs_timeframe,user_attrs_trades_BTC_USDT,user_attrs_trades_ETH_USDT,user_attrs_trades_avg,user_attrs_trend_filter,user_attrs_win_rate_avg,user_attrs_winrate_BTC_USDT,user_attrs_winrate_ETH_USDT,state
221,-687.8786717974417,2026-01-15 23:37:24.131211,2026-01-15 23:37:31.733849,0 days 00:00:07.602638,14,2.8,3.1,1.5,132,BOLLINGER,PARABOLIC_SAR,1.7000000000000002,38,16,16,0.035,76,27,10,0.014,82,22,13,0.025,ATR,4.7,19,15m,DEMA,True,True,False,False,False,0.5800000000000001,BOLLINGER,1.7000000000000002,-63.98461521467457,-74.34011645578494,-69.16236583522975,354.7804667765871,88.67249639523432,221.7264815859107,15m,52,56,54.0,DEMA,50.13736263736264,53.84615384615385,46.42857142857143,COMPLETE
222,-637.2161594033005,2026-01-15 23:37:26.088651,2026-01-15 23:37:32.548137,0 days 00:00:06.459486,14,2.8,3.1,1.5,131,BOLLINGER,PARABOLIC_SAR,1.7000000000000002,39,16,17,0.035,76,25,10,0.019000000000000003,82,22,13,0.023,ATR,4.800000000000001,19,15m,DEMA,True,True,False,False,False,0.5800000000000001,BOLLINGER,1.7000000000000002,-63.98297557077013,-73.6417472547377,-68.81236141275392,398.1615967402017,92.70608669530114,245.43384171775142,15m,52,56,54.0,DEMA,52.06043956043956,57.692307692307686,46.42857142857143,COMPLETE
223,-861.9760451640341,2026-01-15 23:37:26.456272,2026-01-15 23:37:32.100915,0 days 00:00:05.644643,14,3.0,3.1,1.5,128,BOLLINGER,PARABOLIC_SAR,1.7000000000000002,39,16,17,0.035,76,27,10,0.013000000000000001,82,22,13,0.024,ATR,4.800000000000001,19,15m,DEMA,False,True,False,False,False,0.5800000000000001,BOLLINGER,1.7000000000000002,-73.10754152152262,-82.62559159781378,-77.8665665596682,158.214060084143,-1.0585692766901686,78.57774540372641,15m,52,54,53.0,DEMA,47.293447293447294,53.84615384615385,40.74074074074074,COMPLETE
224,-625.541568018105,2026-01-15 23:37:26.865744,2026-01-15 23:37:32.171992,0 days 00:00:05.306248,14,2.5,3.1,1.5,129,BOLLINGER,PARABOLIC_SAR,1.7000000000000002,39,16,17,0.035,76,27,10,0.015,81,22,13,0.025,ATR,4.800000000000001,19,15m,DEMA,False,True,False,False,False,0.5800000000000001,BOLLINGER,1.7000000000000002,-55.56832206704831,-86.5013319949243,-71.0348270309863,489.0105480473548,33.956516411284404,261.4835322293196,15m,62,67,64.5,DEMA,46.76215695714973,53.2258064516129,40.298507462686565,COMPLETE
225,-860.8768829988176,2026-01-15 23:37:28.441939,2026-01-15 23:37:34.760651,0 days 00:00:06.318712,14,3.0,3.1,1.5,129,BOLLINGER,PARABOLIC_SAR,1.7000000000000002,39,16,17,0.035,76,27,10,0.012,81,22,13,0.025,ATR,4.7,16,15m,DEMA,False,True,False,False,False,0.5800000000000001,BOLLINGER,1.7000000000000002,-73.66526992410424,-82.68799382565899,-78.17663187488162,161.27037911103488,-1.471351388037461,79.89951386149872,15m,52,54,53.0,DEMA,47.293447293447294,53.84615384615385,40.74074074074074,COMPLETE
226,-566.5892629466143,2026-01-15 23:37:30.858063,2026-01-15 23:37:38.307187,0 days 00:00:07.449124,14,2.5,3.1,1.5,128,BOLLINGER,PARABOLIC_SAR,1.75,37,16,17,0.035,76,27,10,0.012,82,23,13,0.025,ATR,4.800000000000001,17,15m,DEMA,True,True,False,False,False,0.5800000000000001,BOLLINGER,1.75,-56.50923960189553,-84.20977221142938,-70.35950590666246,519.1517613805019,70.5228894882908,294.83732543439635,15m,60,65,62.5,DEMA,48.269230769230774,55.00000000000001,41.53846153846154,COMPLETE
227,-644.0148212562472,2026-01-15 23:37:31.786747,2026-01-15 23:37:35.989172,0 days 00:00:04.202425,14,2.5,3.0,1.5,128,BOLLINGER,PARABOLIC_SAR,1.75,49,16,17,0.035,76,28,10,0.012,81,23,13,0.024,ATR,4.800000000000001,17,15m,DEMA,True,True,False,False,False,0.5800000000000001,BOLLINGER,1.75,-58.79848951158455,-92.3349464823844,-75.56671799698447,515.5981823823628,-8.052537300167337,253.77282254109772,15m,61,66,63.5,DEMA,46.74615002483855,54.09836065573771,39.39393939393939,COMPLETE
228,-534.6346010867546,2026-01-15 23:37:32.217395,2026-01-15 23:37:38.423686,0 days 00:00:06.206291,14,2.5,3.0,1.5,123,BOLLINGER,PARABOLIC_SAR,1.75,50,18,17,0.034,76,25,10,0.013000000000000001,88,23,13,0.022,ATR,4.7,21,15m,DEMA,True,True,False,False,False,0.56,BOLLINGER,1.75,-47.7185354651723,-91.7209115373849,-69.7197235012786,620.1680513892331,4.897188028038177,312.53261970863565,15m,62,67,64.5,DEMA,47.50842561386615,53.2258064516129,41.7910447761194,COMPLETE
229,-460.90691696636804,2026-01-15 23:37:32.229608,2026-01-15 23:37:38.105882,0 days 00:00:05.876274,14,2.5,3.0,1.5,126,BOLLINGER,PARABOLIC_SAR,1.75,51,18,17,0.034,76,25,10,0.012,82,23,13,0.024,ATR,4.7,21,15m,DEMA,True,True,False,False,False,0.56,BOLLINGER,1.75,-46.250519973074326,-91.16922037615548,-68.7098701746149,720.4381491431969,13.377571671633143,366.90786040741506,15m,61,66,63.5,DEMA,47.50372578241431,54.09836065573771,40.909090909090914,COMPLETE
230,-733.9602968229865,2026-01-15 23:37:32.768047,2026-01-15 23:37:38.511459,0 days 00:00:05.743412,14,2.5,3.0,1.6,125,BOLLINGER,PARABOLIC_SAR,1.75,63,18,17,0.027000000000000003,76,28,10,0.012,81,23,13,0.024,ATR,4.7,21,15m,TEMA,True,True,False,False,False,0.56,BOLLINGER,1.75,-59.03518719116823,-81.53970503290057,-70.2874461120344,272.9299047660027,82.53203545546378,177.73097011073327,15m,59,61,60.0,TEMA,47.61044734648513,54.23728813559322,40.98360655737705,COMPLETE
231,-586.2333848544822,2026-01-15 23:37:35.336694,2026-01-15 23:37:44.076177,0 days 00:00:08.739483,14,2.5,3.0,1.6,125,BOLLINGER,PARABOLIC_SAR,1.75,50,28,17,0.026000000000000002,75,28,10,0.012,82,23,13,0.024,ATR,4.7,21,15m,TEMA,True,True,False,False,False,0.56,BOLLINGER,1.75,-44.775976227157486,-84.44620082379296,-64.61108852547522,459.5262689875617,30.594166802185146,245.06021789487343,15m,57,53,55.0,TEMA,46.93809996689838,56.14035087719298,37.735849056603776,COMPLETE
232,-2870.8489624038752,2026-01-15 23:37:37.002449,2026-01-15 23:37:42.400689,0 days 00:00:05.398240,13,2.5,3.2,1.6,137,BOLLINGER,PARABOLIC_SAR,1.75,34,28,17,0.024,75,28,10,0.017,82,23,13,0.022,ATR,4.7,24,15m,TEMA,True,True,False,False,True,0.56,BOLLINGER,1.75,-52.17480263758123,-33.84010548107085,-43.00745405932604,63.79867374920205,39.531868510807165,51.66527113000461,15m,19,12,15.5,TEMA,58.1140350877193,57.89473684210527,58.333333333333336,COMPLETE
233,-1554.9249891625059,2026-01-15 23:37:38.317526,2026-01-15 23:37:44.418994,0 days 00:00:06.101468,15,2.5,3.0,1.5,124,BOLLINGER,PARABOLIC_SAR,1.75,49,18,17,0.026000000000000002,76,25,10,0.013000000000000001,82,23,13,0.024,FIXED,4.7,21,15m,TEMA,True,True,False,False,True,0.56,BOLLINGER,1.75,-56.09586922071244,-40.2344901315255,-48.16517967611897,21.39129131800735,-27.80037323153864,-3.204540956765644,15m,59,40,49.5,TEMA,22.266949152542374,22.033898305084744,22.5,COMPLETE
234,-2509.996862562248,2026-01-15 23:37:38.376439,2026-01-15 23:37:44.324507,0 days 00:00:05.948068,15,2.7,3.0,1.6,124,BOLLINGER,PARABOLIC_SAR,1.8,43,17,13,0.038,75,26,10,0.017,82,23,13,0.024,ATR,4.7,21,15m,TEMA,True,True,False,False,True,0.56,BOLLINGER,1.8,-60.9737016679494,-28.38524429761518,-44.679472982782286,56.96618119837539,53.51589994258639,55.24104057048089,15m,20,13,16.5,TEMA,62.11538461538461,55.00000000000001,69.23076923076923,COMPLETE
235,-660.828759311551,2026-01-15 23:37:38.473498,2026-01-15 23:37:43.695553,0 days 00:00:05.222055,15,2.7,3.0,1.6,125,BOLLINGER,PARABOLIC_SAR,1.8,43,17,17,0.038,75,26,10,0.017,82,23,13,0.024,ATR,4.7,24,15m,TEMA,True,True,False,False,False,0.56,BOLLINGER,1.8,-77.28470844847372,-47.61539769463498,-62.45005307155435,77.39902824261297,351.23558371057464,214.31730597659381,15m,51,53,52.0,TEMA,51.94228634850167,52.94117647058824,50.943396226415096,COMPLETE
236,-1111.9863349966563,2026-01-15 23:37:38.604251,2026-01-15 23:37:43.753032,0 days 00:00:05.148781,13,2.6,3.2,1.6,138,BOLLINGER,PARABOLIC_SAR,1.6,34,28,13,0.038,75,28,10,0.019000000000000003,82,23,12,0.022,FIXED,4.7,20,15m,TEMA,True,True,False,False,False,0.5700000000000001,BOLLINGER,1.6,-40.368241959377585,-71.63563894726636,-56.00194045332197,136.33348492713054,-74.43865755303372,30.94741368704841,15m,110,183,146.5,TEMA,17.01192250372578,20.909090909090907,13.114754098360656,COMPLETE
237,-1184.4536427922449,2026-01-15 23:37:43.307728,2026-01-15 23:37:46.386547,0 days 00:00:03.078819,13,2.6,2.9000000000000004,1.5,133,BOLLINGER,PARABOLIC_SAR,1.8,43,17,16,0.034,76,28,10,0.017,82,23,12,0.023,FIXED,4.6,20,15m,TEMA,True,True,False,False,False,0.5700000000000001,BOLLINGER,1.8,-70.08648098087785,-72.84090524046563,-71.46369311067174,8.818649538044887,-68.60761869764109,-29.8944845797981,15m,140,180,160.0,TEMA,16.23015873015873,18.571428571428573,13.88888888888889,COMPLETE
238,-513.6279766989846,2026-01-15 23:37:43.897917,2026-01-15 23:37:47.482589,0 days 00:00:03.584672,13,2.4,2.9000000000000004,1.5,133,BOLLINGER,PARABOLIC_SAR,1.6,44,15,16,0.034,76,28,10,0.015,82,21,12,0.023,ATR,4.6,20,15m,DEMA,True,True,False,False,False,0.5700000000000001,BOLLINGER,1.6,-49.281642092191895,-90.01917681011979,-69.65040945115584,654.6170371399047,17.360776441634794,335.98890679076976,15m,63,74,68.5,DEMA,47.93007293007293,53.96825396825397,41.891891891891895,COMPLETE
239,-598.5816578394333,2026-01-15 23:37:44.307102,2026-01-15 23:37:47.904192,0 days 00:00:03.597090,13,2.4,2.9000000000000004,1.5,133,BOLLINGER,PARABOLIC_SAR,1.6,26,15,16,0.028000000000000004,76,25,10,0.013000000000000001,82,24,12,0.023,ATR,4.6,18,15m,DEMA,True,True,False,False,False,0.5700000000000001,BOLLINGER,1.6,-50.038804384257006,-80.36727081924722,-65.20303760175211,432.79402467321535,106.65027861875436,269.72215164598487,15m,63,70,66.5,DEMA,46.82539682539682,50.79365079365079,42.857142857142854,COMPLETE
240,-727.3445965680858,2026-01-15 23:37:44.272209,2026-01-15 23:37:47.668685,0 days 00:00:03.396476,13,2.4,2.9000000000000004,1.5,133,BOLLINGER,PARABOLIC_SAR,1.6,45,15,16,0.034,76,25,10,0.013000000000000001,82,21,12,0.027000000000000003,ATR,4.6,18,4h,DEMA,True,True,False,False,False,0.5700000000000001,BOLLINGER,1.6,-51.863210366237034,-92.04182691815952,-71.95251864219827,372.05033339910636,-38.43739531380741,166.80646904264947,4h,62,70,66.0,DEMA,48.13364055299539,54.83870967741935,41.42857142857143,COMPLETE
241,-733.9632337525272,2026-01-15 23:37:44.392677,2026-01-15 23:37:45.607569,0 days 00:00:01.214892,13,2.4,2.9000000000000004,1.5,132,BOLLINGER,PARABOLIC_SAR,1.6,26,15,16,0.034,76,27,10,0.015,82,21,12,0.023,ATR,4.6,20,4h,DEMA,True,True,False,False,False,0.5700000000000001,BOLLINGER,1.6,-50.92079678573109,-87.44543587013717,-69.18311632793413,325.49724561697684,-1.94071618978146,161.77826471359768,4h,61,68,64.5,DEMA,47.6374156219865,54.09836065573771,41.17647058823529,COMPLETE
242,-691.9358508787645,2026-01-15 23:37:44.481111,2026-01-15 23:37:46.981534,0 days 00:00:02.500423,13,2.4,2.9000000000000004,1.5,133,BOLLINGER,PARABOLIC_SAR,1.6,25,15,16,0.034,76,27,10,0.015,82,24,12,0.023,ATR,4.6,20,4h,DEMA,True,True,False,False,False,0.5700000000000001,BOLLINGER,1.6,-51.88500514555216,-79.55075398026426,-65.71787956290821,327.78623935538394,70.85580264197837,199.32102099868115,4h,62,66,64.0,DEMA,47.82502443792766,53.2258064516129,42.42424242424242,COMPLETE
243,-395.2894899133553,2026-01-15 23:37:45.878879,2026-01-15 23:37:49.004337,0 days 00:00:03.125458,13,2.6,2.9000000000000004,1.5,132,BOLLINGER,PARABOLIC_SAR,1.65,43,15,16,0.036000000000000004,76,28,10,0.01,81,24,12,0.022,ATR,4.6,25,15m,DEMA,True,True,False,False,False,0.5800000000000001,BOLLINGER,1.65,-53.998513595898125,-73.03194022425346,-63.515226910075796,607.1459035900127,239.16382943265154,423.1548665113321,15m,56,62,59.0,DEMA,50.25921658986175,55.35714285714286,45.16129032258064,COMPLETE
244,-670.6202923532255,2026-01-15 23:37:46.913750,2026-01-15 23:37:48.853558,0 days 00:00:01.939808,14,2.4,3.2,1.5,140,BOLLINGER,PARABOLIC_SAR,1.7000000000000002,35,15,15,0.028000000000000004,76,28,10,0.01,81,24,12,0.027000000000000003,ATR,5.0,25,15m,DEMA,True,True,False,False,False,0.5800000000000001,BOLLINGER,1.7000000000000002,-68.73273929727912,-82.43175719384514,-75.58224824556214,428.3691836231114,66.84556049682541,247.60737205996838,15m,62,69,65.5,DEMA,47.54558204768583,51.61290322580645,43.47826086956522,COMPLETE
245,-613.8621382273041,2026-01-15 23:37:47.457431,2026-01-15 23:37:53.228568,0 days 00:00:05.771137,14,2.6,3.2,1.5,139,BOLLINGER,PARABOLIC_SAR,1.65,46,16,16,0.028000000000000004,76,27,10,0.018000000000000002,82,22,13,0.022,ATR,4.5,24,15m,TEMA,True,True,False,False,False,0.5800000000000001,BOLLINGER,1.65,-70.17893308087824,-64.63093585553261,-67.40493446820543,358.085836401787,173.3554042234044,265.7206203125957,15m,52,58,55.0,TEMA,52.02254641909815,55.769230769230774,48.275862068965516,COMPLETE
246,-613.9495618244027,2026-01-15 23:37:47.662704,2026-01-15 23:37:53.197381,0 days 00:00:05.534677,14,2.6,3.2,1.5,139,BOLLINGER,PARABOLIC_SAR,1.65,79,16,16,0.036000000000000004,76,27,10,0.018000000000000002,82,22,13,0.026000000000000002,ATR,4.5,18,15m,TEMA,True,True,False,False,False,0.5800000000000001,BOLLINGER,1.65,-71.31583441213884,-65.2198356840447,-68.26783504809177,421.1609003147615,123.32482135792439,272.2428608363429,15m,54,61,57.5,TEMA,50.728597449908925,55.55555555555556,45.90163934426229,COMPLETE
247,-615.9133843168283,2026-01-15 23:37:47.704136,2026-01-15 23:37:52.754625,0 days 00:00:05.050489,14,2.6,3.1,1.5,139,BOLLINGER,PARABOLIC_SAR,1.65,47,16,15,0.036000000000000004,76,27,10,0.018000000000000002,81,24,13,0.022,ATR,4.4,18,15m,TEMA,True,True,False,False,False,0.5800000000000001,BOLLINGER,1.65,-68.43387028902656,-70.92184654618337,-69.67785841760497,419.03028903076597,119.67001047056476,269.35014975066537,15m,52,58,55.0,TEMA,51.1604774535809,55.769230769230774,46.55172413793103,COMPLETE
248,-807.668779395397,2026-01-15 23:37:48.330612,2026-01-15 23:37:51.006512,0 days 00:00:02.675900,14,2.6,3.1,1.5,139,BOLLINGER,PARABOLIC_SAR,1.65,35,16,15,0.036000000000000004,76,27,10,0.018000000000000002,81,22,13,0.022,ATR,5.0,23,15m,TEMA,True,True,False,False,False,0.5800000000000001,BOLLINGER,1.65,-72.66610546671272,-68.61611246897147,-70.64110896784209,122.29282808840676,122.7854473253903,122.53913770689853,15m,54,57,55.5,TEMA,47.807017543859644,50.0,45.614035087719294,COMPLETE
249,-469.99306203600736,2026-01-15 23:37:48.905819,2026-01-15 23:37:56.000671,0 days 00:00:07.094852,14,2.6,3.1,1.5,130,BOLLINGER,PARABOLIC_SAR,1.65,42,16,16,0.036000000000000004,76,27,10,0.018000000000000002,82,22,13,0.022,ATR,4.4,23,15m,TEMA,True,True,False,False,False,0.5800000000000001,BOLLINGER,1.65,-51.789440993521815,-63.53793723225424,-57.66368911288802,427.165305636818,267.6263175160841,347.395811576451,15m,51,59,55.0,TEMA,51.312728481223,56.86274509803921,45.76271186440678,COMPLETE
250,-419.05627185119374,2026-01-15 23:37:49.017979,2026-01-15 23:37:54.640168,0 days 00:00:05.622189,12,2.6,2.7,1.5,130,BOLLINGER,PARABOLIC_SAR,1.65,41,16,15,0.036000000000000004,76,27,10,0.011,81,24,12,0.022,ATR,4.4,25,15m,TEMA,True,True,False,False,False,0.5800000000000001,BOLLINGER,1.65,-51.04690529885333,-62.64466767001517,-56.84578648443425,465.03774890882806,301.7152546675561,383.37650178819206,15m,51,59,55.0,TEMA,51.312728481223,56.86274509803921,45.76271186440678,COMPLETE
251,-1368.2574752893624,2026-01-15 23:37:52.141798,2026-01-15 23:37:59.361714,0 days 00:00:07.219916,12,3.7,2.8,1.6,137,BOLLINGER,PARABOLIC_SAR,1.65,30,27,16,0.036000000000000004,76,27,10,0.011,81,24,12,0.02,ATR,4.4,25,15m,DEMA,True,True,False,False,False,0.59,BOLLINGER,1.65,-65.83350004543117,-89.65941411386945,-77.7464570796503,139.57720855607843,46.96624054404821,93.27172455006333,15m,35,36,35.5,DEMA,52.182539682539684,57.14285714285714,47.22222222222222,COMPLETE
252,-1139.2228622335915,2026-01-15 23:37:52.821093,2026-01-15 23:37:57.885495,0 days 00:00:05.064402,12,3.4000000000000004,4.0,1.6,130,BOLLINGER,PARABOLIC_SAR,1.7000000000000002,30,27,16,0.037,76,28,10,0.011,81,24,12,0.02,ATR,4.5,25,15m,ICHIMOKU,True,False,False,False,False,0.59,BOLLINGER,1.7000000000000002,-45.62314912453513,-92.91108216721454,-69.26711564587484,545.4804913099479,-53.836948120432616,245.82177159475762,15m,38,47,42.5,ICHIMOKU,49.972004479283314,55.26315789473685,44.680851063829785,COMPLETE
253,-1152.0201503847493,2026-01-15 23:37:53.431534,2026-01-15 23:37:58.793942,0 days 00:00:05.362408,12,3.6,2.8,1.6,130,BOLLINGER,PARABOLIC_SAR,1.7000000000000002,41,27,16,0.037,77,28,19,0.019000000000000003,81,24,12,0.02,ATR,4.800000000000001,25,15m,ICHIMOKU,True,False,False,False,False,0.59,BOLLINGER,1.7000000000000002,-55.64135102402962,-84.08819771992532,-69.86477437197746,485.0755669619131,43.66449709553041,264.37003202872177,15m,36,43,39.5,ICHIMOKU,49.87080103359173,55.55555555555556,44.18604651162791,COMPLETE
254,-615.858551850054,2026-01-15 23:37:53.413801,2026-01-15 23:38:00.301077,0 days 00:00:06.887276,12,2.8,3.0,1.6,131,BOLLINGER,PARABOLIC_SAR,1.7000000000000002,30,27,16,0.037,77,28,10,0.01,81,24,12,0.02,ATR,4.800000000000001,22,15m,ICHIMOKU,True,False,False,False,False,0.59,BOLLINGER,1.7000000000000002,-67.1618005456253,-85.19760723075966,-76.17970388819248,463.18124497080674,85.44707827927354,274.31416162504013,15m,53,55,54.0,ICHIMOKU,51.93825042881647,56.60377358490566,47.27272727272727,COMPLETE
255,-651.2638451472376,2026-01-15 23:37:54.923057,2026-01-15 23:38:01.375075,0 days 00:00:06.452018,12,2.8,2.7,1.5,130,BOLLINGER,PARABOLIC_SAR,1.7000000000000002,41,17,17,0.037,77,26,10,0.011,81,24,12,0.02,ATR,4.4,25,15m,DEMA,True,False,False,False,False,0.55,BOLLINGER,1.7000000000000002,-63.09119052850354,-78.72834010266479,-70.90976531558417,426.9478611131286,42.57165985916744,234.75976048614802,15m,52,57,54.5,DEMA,49.814439946018894,55.769230769230774,43.859649122807014,COMPLETE
256,-650.829811199108,2026-01-15 23:37:56.549730,2026-01-15 23:38:02.180446,0 days 00:00:05.630716,12,2.8,2.7,1.5,136,BOLLINGER,PARABOLIC_SAR,1.7000000000000002,41,17,17,0.037,77,26,10,0.01,81,24,12,0.02,ATR,4.9,25,15m,DEMA,True,False,False,False,False,0.59,BOLLINGER,1.7000000000000002,-64.67720385320682,-82.83191270892935,-73.75455828106809,460.75562639457655,18.60099952736597,239.67831296097125,15m,52,57,54.5,DEMA,50.69163292847503,55.769230769230774,45.614035087719294,COMPLETE
257,-642.5649442306549,2026-01-15 23:37:58.179428,2026-01-15 23:38:02.915823,0 days 00:00:04.736395,13,2.7,2.7,1.5,136,BOLLINGER,PARABOLIC_SAR,1.7000000000000002,41,17,17,0.037,77,26,19,0.011,81,24,12,0.02,ATR,4.9,25,15m,DEMA,True,True,False,False,False,0.55,BOLLINGER,1.7000000000000002,-66.80177051192764,-81.41557578282439,-74.10867314737601,487.82843103677817,52.90642247093961,270.36742675385887,15m,54,61,57.5,DEMA,48.98299939283546,53.70370370370371,44.26229508196721,COMPLETE
258,-703.8735870326655,2026-01-15 23:37:59.008291,2026-01-15 23:38:05.145361,0 days 00:00:06.137070,13,2.7,2.8,1.5,136,BOLLINGER,PARABOLIC_SAR,1.7000000000000002,36,17,17,0.037,77,26,10,0.01,81,24,12,0.020999999999999998,ATR,4.4,22,15m,DEMA,True,True,False,False,False,0.55,BOLLINGER,1.7000000000000002,-66.80177051192764,-77.28170555253878,-72.04173803223321,324.6952127672463,100.26413308252754,212.47967292488693,15m,54,61,57.5,DEMA,47.950819672131146,50.0,45.90163934426229,COMPLETE
259,-688.520159390745,2026-01-15 23:37:59.477673,2026-01-15 23:38:05.388302,0 days 00:00:05.910629,13,2.7,2.8,1.5,127,BOLLINGER,PARABOLIC_SAR,1.7000000000000002,52,17,17,0.035,77,26,11,0.01,81,24,12,0.020999999999999998,ATR,4.9,24,15m,TEMA,True,True,False,False,False,0.55,BOLLINGER,1.7000000000000002,-68.77678548968956,-73.94350092047178,-71.36014320508067,341.53380603516104,112.77283695112456,227.1533214931428,15m,52,57,54.5,TEMA,51.48448043184885,53.84615384615385,49.122807017543856,COMPLETE
260,-2280.629611507424,2026-01-15 23:38:01.135626,2026-01-15 23:38:06.796439,0 days 00:00:05.660813,13,2.7,2.8,1.5,135,CCI,PARABOLIC_SAR,1.55,50,15,17,0.035,76,26,11,0.01,83,23,12,0.020999999999999998,ATR,4.300000000000001,24,15m,TEMA,True,True,False,False,False,0.55,CCI,1.55,-25.63372405607833,-48.16012456297766,-36.89692430952799,430.4934872196194,33.93216252900583,232.21282487431262,15m,23,29,26.0,TEMA,51.12443778110945,60.86956521739131,41.37931034482759,COMPLETE
261,-1326.0108592213328,2026-01-15 23:38:02.134813,2026-01-15 23:38:07.144733,0 days 00:00:05.009920,13,2.7,2.8,1.5,127,CCI,PARABOLIC_SAR,1.55,90,15,14,0.035,76,26,11,0.017,83,23,12,0.020999999999999998,ATR,4.300000000000001,22,30m,TEMA,True,True,False,False,False,0.5700000000000001,CCI,1.55,-42.22443747256852,-80.66619313458352,-61.445315303576024,246.59541609209845,-55.64701550228557,95.47420029490644,30m,30,34,32.0,TEMA,45.98039215686275,56.666666666666664,35.294117647058826,COMPLETE
262,-2030.541945541553,2026-01-15 23:38:02.346451,2026-01-15 23:38:07.401954,0 days 00:00:05.055503,13,2.5,2.8,1.5,127,CCI,PARABOLIC_SAR,1.55,51,15,14,0.035,76,27,11,0.014,83,23,12,0.020999999999999998,ATR,4.300000000000001,27,30m,TEMA,True,True,False,False,False,0.42,CCI,1.55,-31.49654457180478,-69.26965866529672,-50.38310161855075,279.2210285974316,-28.792431644719247,125.21429847635618,30m,25,33,29.0,TEMA,49.696969696969695,60.0,39.39393939393939,COMPLETE
