number,value,datetime_start,datetime_complete,duration,params_ADX_THRESHOLD,params_ATR_MULTIPLIER,params_ATR_STOP_LOSS_MULT,params_BB_STD,params_ENTRY_PERIOD,params_ENTRY_TYPE,params_EXIT_TYPE,params_LEVERAGE,params_MA_PERIOD,params_MFI_THRESHOLD,params_MFI_WINDOW,params_RISK_PER_TRADE,params_RSI_OVERBOUGHT,params_RSI_OVERSOLD,params_RSI_WINDOW,params_SAR_STEP,params_STOCH_OVERBOUGHT,params_STOCH_OVERSOLD,params_STOCH_WINDOW,params_STOP_LOSS_PCT,params_STOP_LOSS_TYPE,params_SUPERTREND_MULT,params_SUPERTREND_PERIOD,params_TIMEFRAME,params_TREND_FILTER_TYPE,params_USE_ADX,params_USE_MFI,params_USE_RSI,params_USE_STOCHASTIC,params_USE_VHF,params_VHF_THRESHOLD,user_attrs_entry_type,user_attrs_leverage,user_attrs_mdd_BTC_USDT,user_attrs_mdd_ETH_USDT,user_attrs_mdd_avg,user_attrs_return_BTC_USDT,user_attrs_return_ETH_USDT,user_attrs_return_avg,user_attrs_timeframe,user_attrs_trades_BTC_USDT,user_attrs_trades_ETH_USDT,user_attrs_trades_avg,user_attrs_trend_filter,user_attrs_win_rate_avg,user_attrs_winrate_BTC_USDT,user_attrs_winrate_ETH_USDT,state
474,778.173332585352,2026-01-15 23:45:24.159923,2026-01-15 23:45:38.263846,0 days 00:00:14.103923,16,2.2,3.5,1.7,150,BOLLINGER,PARABOLIC_SAR,1.9500000000000002,32,18,13,0.035,72,25,15,0.011,81,15,14,0.049,ATR,2.5,14,5m,SUPERTREND,False,False,False,False,False,0.53,BOLLINGER,1.9500000000000002,-27.664922262116175,-78.71047276000797,-53.187697511062076,2153.2836039214308,7.002162555888761,1080.1428832386598,5m,53,60,56.5,SUPERTREND,57.075471698113205,64.15094339622641,50.0,COMPLETE
475,1155.8947355553973,2026-01-15 23:45:25.590742,2026-01-15 23:45:38.532061,0 days 00:00:12.941319,16,2.4,3.5,1.7,150,BOLLINGER,PARABOLIC_SAR,1.9,32,18,13,0.035,72,25,14,0.011,81,15,14,0.049,ATR,2.5,14,5m,SUPERTREND,False,False,False,False,False,0.53,BOLLINGER,1.9,-26.853093204380237,-78.63273644284264,-52.74291482361144,3285.5875291091415,19.434429610415247,1652.5109793597785,5m,44,54,49.0,SUPERTREND,59.090909090909086,68.18181818181817,50.0,COMPLETE
476,-940.6982154455618,2026-01-15 23:45:34.373921,2026-01-15 23:45:45.540075,0 days 00:00:11.166154,16,2.4,3.4000000000000004,1.7,145,BOLLINGER,PARABOLIC_SAR,1.9500000000000002,28,18,13,0.034,72,25,14,0.011,81,15,14,0.049,ATR,2.0,14,5m,SUPERTREND,False,True,False,True,False,0.53,BOLLINGER,1.9500000000000002,-22.757178501618707,-85.67810432080648,-54.2176414112126,869.4788817967489,-41.52612540147412,413.97637819763736,5m,28,36,32.0,SUPERTREND,53.96825396825396,60.71428571428571,47.22222222222222,COMPLETE
477,-960.4796780697407,2026-01-15 23:45:35.004486,2026-01-15 23:45:50.975109,0 days 00:00:15.970623,16,2.4,3.4000000000000004,1.7,144,BOLLINGER,PARABOLIC_SAR,1.9500000000000002,31,18,13,0.034,72,25,14,0.011,81,15,14,0.049,ATR,2.0,14,5m,SUPERTREND,False,True,False,True,False,0.54,BOLLINGER,1.9500000000000002,-23.186913786538224,-85.90860995639093,-54.54776187146458,857.5797548537404,-42.541242979034294,407.519255937353,5m,28,36,32.0,SUPERTREND,53.96825396825396,60.71428571428571,47.22222222222222,COMPLETE
478,-910.2450343675819,2026-01-15 23:45:37.546720,2026-01-15 23:45:54.135329,0 days 00:00:16.588609,16,2.4,3.6,1.8,144,BOLLINGER,PARABOLIC_SAR,1.85,39,19,13,0.034,72,26,14,0.013000000000000001,81,14,14,0.049,ATR,2.0,15,5m,SUPERTREND,False,True,False,True,False,0.54,BOLLINGER,1.85,-20.362020643607913,-74.09862882150951,-47.230324732558714,772.0733941142753,53.349516894107026,412.7114555041912,5m,26,30,28.0,SUPERTREND,54.1025641025641,61.53846153846154,46.666666666666664,COMPLETE
479,-910.2450343675819,2026-01-15 23:45:37.777181,2026-01-15 23:45:50.888757,0 days 00:00:13.111576,16,2.4,3.6,1.8,144,BOLLINGER,PARABOLIC_SAR,1.85,38,19,12,0.034,72,25,14,0.013000000000000001,81,14,14,0.049,ATR,2.0,15,5m,SUPERTREND,False,True,False,True,False,0.52,BOLLINGER,1.85,-20.362020643607913,-74.09862882150951,-47.230324732558714,772.0733941142753,53.349516894107026,412.7114555041912,5m,26,30,28.0,SUPERTREND,54.1025641025641,61.53846153846154,46.666666666666664,COMPLETE
480,-1004.6578930934838,2026-01-15 23:45:38.385563,2026-01-15 23:45:48.774977,0 days 00:00:10.389414,16,2.4,3.6,1.7,144,BOLLINGER,PARABOLIC_SAR,1.85,39,19,13,0.034,73,25,14,0.013000000000000001,81,14,14,0.049,ATR,2.0,15,5m,SUPERTREND,False,True,False,True,False,0.54,BOLLINGER,1.85,-22.071060893313234,-83.88029114121154,-52.97567601726239,777.6323103519541,-36.694944849196204,370.46868275137894,5m,28,36,32.0,SUPERTREND,53.96825396825396,60.71428571428571,47.22222222222222,COMPLETE
481,1171.649328812401,2026-01-15 23:45:38.654564,2026-01-15 23:45:52.403290,0 days 00:00:13.748726,16,2.4,3.6,1.7,144,BOLLINGER,PARABOLIC_SAR,1.9500000000000002,38,19,13,0.034,72,24,14,0.012,81,15,14,0.049,ATR,2.0,15,5m,SUPERTREND,False,False,False,False,False,0.52,BOLLINGER,1.9500000000000002,-27.557690076484892,-78.7440319458475,-53.15086101116619,3437.0714090022707,3.1512525635962145,1720.1113307829335,5m,44,54,49.0,SUPERTREND,57.95454545454545,65.9090909090909,50.0,COMPLETE
482,507.1350813372992,2026-01-15 23:45:46.634731,2026-01-15 23:45:59.571128,0 days 00:00:12.936397,16,2.4,3.6,1.8,147,BOLLINGER,PARABOLIC_SAR,1.85,38,19,13,0.034,72,24,14,0.01,81,14,14,0.049,ATR,2.9000000000000004,12,5m,SUPERTREND,False,False,False,False,False,0.54,BOLLINGER,1.85,-26.158063200516008,-66.33594493500884,-46.247004067762425,2797.85440943714,65.98622040833621,1431.920314922738,5m,41,46,43.5,SUPERTREND,59.146341463414636,68.29268292682927,50.0,COMPLETE
483,1161.2319113221965,2026-01-15 23:45:50.867615,2026-01-15 23:46:00.291797,0 days 00:00:09.424182,16,2.4,3.6,1.7,148,BOLLINGER,PARABOLIC_SAR,1.9,37,19,13,0.034,72,25,14,0.012,81,14,14,0.049,ATR,2.1,12,5m,SUPERTREND,False,False,False,False,False,0.54,BOLLINGER,1.9,-26.852149556480633,-79.36963661438496,-53.11089308543279,3332.938982335365,8.929310398595756,1670.9341463669803,5m,44,54,49.0,SUPERTREND,59.090909090909086,68.18181818181817,50.0,COMPLETE
484,-89.7797406472846,2026-01-15 23:45:51.577102,2026-01-15 23:46:00.542864,0 days 00:00:08.965762,16,2.4,3.6,1.8,148,BOLLINGER,PARABOLIC_SAR,1.9,35,17,13,0.023,73,26,14,0.01,81,14,14,0.048,ATR,2.2,12,4h,SUPERTREND,False,True,False,False,False,0.54,BOLLINGER,1.9,-27.49884666023632,-80.39570089076904,-53.94727377550268,1533.370059812044,34.010803119360375,783.6904314657022,4h,39,45,42.0,SUPERTREND,57.6068376068376,64.1025641025641,51.11111111111111,COMPLETE
485,-88.31130209360617,2026-01-15 23:45:51.681505,2026-01-15 23:45:59.404501,0 days 00:00:07.722996,16,2.4,3.5,1.8,148,BOLLINGER,PARABOLIC_SAR,1.9,35,17,13,0.034,73,24,14,0.01,81,14,14,0.048,ATR,2.9000000000000004,12,4h,SUPERTREND,False,False,False,False,False,0.54,BOLLINGER,1.9,-27.49884666023632,-80.18724476801168,-53.843045714124,1533.370059812044,35.55837000611664,784.4642149090803,4h,39,45,42.0,SUPERTREND,57.6068376068376,64.1025641025641,51.11111111111111,COMPLETE
486,594.5197856013638,2026-01-15 23:45:52.447077,2026-01-15 23:46:00.358223,0 days 00:00:07.911146,16,2.3,3.5,1.7,148,BOLLINGER,PARABOLIC_SAR,1.9,34,19,13,0.034,71,26,14,0.01,81,15,14,0.049,ATR,2.2,11,5m,SUPERTREND,False,False,False,False,False,0.45999999999999996,BOLLINGER,1.9,-30.850444159651268,-72.67810753078282,-51.76427584521704,2359.2373772477613,84.84301616587804,1222.0401967068196,5m,49,56,52.5,SUPERTREND,59.31122448979592,63.26530612244898,55.35714285714286,COMPLETE
487,641.6903215515194,2026-01-15 23:45:55.695208,2026-01-15 23:46:12.065924,0 days 00:00:16.370716,16,2.3,3.5,1.8,148,BOLLINGER,PARABOLIC_SAR,1.9,35,17,13,0.034,71,23,14,0.012,81,15,14,0.048,ATR,2.2,13,5m,SUPERTREND,False,False,False,False,False,0.52,BOLLINGER,1.9,-28.946215008690153,-73.22568811491477,-51.08595156180246,2116.0347422974883,42.51618287694729,1079.2754625872178,5m,45,52,48.5,SUPERTREND,57.072649572649574,62.22222222222222,51.92307692307693,COMPLETE
488,-726.166970821745,2026-01-15 23:46:00.065930,2026-01-15 23:46:14.168875,0 days 00:00:14.102945,16,2.3,3.5,1.7,150,BOLLINGER,PARABOLIC_SAR,1.9500000000000002,24,18,12,0.034,71,23,15,0.012,81,15,14,0.048,ATR,2.2,13,5m,SMA,False,False,False,False,False,0.52,BOLLINGER,1.9500000000000002,-74.50962278898093,-80.83690975084794,-77.67326626991444,297.9577193891293,107.08524169791096,202.5214805435201,5m,67,72,69.5,SMA,51.01575456053068,49.25373134328358,52.77777777777778,COMPLETE
489,-669.5394874128178,2026-01-15 23:46:00.092737,2026-01-15 23:46:12.134315,0 days 00:00:12.041578,16,2.3,3.5,1.7,150,BOLLINGER,PARABOLIC_SAR,1.9500000000000002,34,18,13,0.034,71,23,15,0.012,81,15,14,0.048,ATR,2.2,11,5m,SMA,False,False,False,False,False,0.52,BOLLINGER,1.9500000000000002,-72.92328207568546,-80.86781868996681,-76.89555038282614,399.73419144232383,106.67373506377531,253.20396325304958,5m,68,72,70.0,SMA,52.124183006535944,51.470588235294116,52.77777777777778,COMPLETE
490,-599.8418159140265,2026-01-15 23:46:00.399575,2026-01-15 23:46:11.253226,0 days 00:00:10.853651,16,2.3,3.5,1.7,147,BOLLINGER,PARABOLIC_SAR,1.9500000000000002,32,19,12,0.035,72,24,15,0.012,81,15,14,0.048,ATR,2.1,12,5m,EMA,False,False,False,False,False,0.52,BOLLINGER,1.9500000000000002,-70.58742989145199,-67.9466027361291,-69.26701631379055,341.52531027923106,256.8070301911709,299.166170235201,5m,69,70,69.5,EMA,52.50517598343686,50.72463768115942,54.285714285714285,COMPLETE
491,-876.9969736201538,2026-01-15 23:46:00.446926,2026-01-15 23:46:08.504641,0 days 00:00:08.057715,16,2.3,3.5,1.7,147,BOLLINGER,PARABOLIC_SAR,1.9500000000000002,33,19,12,0.035,72,23,15,0.012,81,15,21,0.048,ATR,2.2,13,2h,EMA,False,False,False,False,False,0.52,BOLLINGER,1.9500000000000002,-87.13483287933582,-82.10519581699289,-84.62001434816435,25.784138915618744,111.69912009294178,68.74162950428027,2h,67,64,65.5,EMA,47.31809701492537,47.76119402985074,46.875,COMPLETE
492,-685.3533599040111,2026-01-15 23:46:00.566361,2026-01-15 23:46:11.133524,0 days 00:00:10.567163,16,2.3,3.5,1.7,146,BOLLINGER,PARABOLIC_SAR,1.9500000000000002,24,19,12,0.035,72,24,15,0.012,81,15,14,0.048,ATR,2.1,13,5m,SMA,False,False,False,False,False,0.52,BOLLINGER,1.9500000000000002,-70.19819544511262,-79.34504835275378,-74.7716218989332,345.4021827673233,122.36095677980614,233.88156977356473,5m,68,70,69.0,SMA,52.14285714285714,50.0,54.285714285714285,COMPLETE
493,-864.1278010747301,2026-01-15 23:46:10.194880,2026-01-15 23:46:18.720266,0 days 00:00:08.525386,16,2.3,3.7,1.7,145,BOLLINGER,PARABOLIC_SAR,1.9500000000000002,38,18,12,0.034,72,24,15,0.012,81,15,14,0.048,ATR,2.1,13,5m,SMA,False,False,False,False,False,0.52,BOLLINGER,1.9500000000000002,-83.99831055997878,-84.60062092603621,-84.29946574300749,161.50083201740014,2.857658650787035,82.1792453340936,5m,70,73,71.5,SMA,51.74168297455968,51.42857142857142,52.054794520547944,COMPLETE
494,736.7667955833667,2026-01-15 23:46:11.787864,2026-01-15 23:46:18.770362,0 days 00:00:06.982498,16,2.1,3.7,1.7,150,BOLLINGER,PARABOLIC_SAR,1.9,39,18,13,0.034,72,23,14,0.013000000000000001,81,14,14,0.049,ATR,1.9,15,5m,SUPERTREND,False,False,False,False,False,0.53,BOLLINGER,1.9,-26.585447938074676,-86.7192265276079,-56.65233723284129,2113.4895687405424,-43.379766120700936,1035.0549013099208,5m,59,66,62.5,SUPERTREND,53.90344119157678,59.32203389830508,48.484848484848484,COMPLETE
495,586.569070882375,2026-01-15 23:46:11.817806,2026-01-15 23:46:20.316432,0 days 00:00:08.498626,16,2.1,3.7,1.7,144,BOLLINGER,PARABOLIC_SAR,1.9,26,18,13,0.034,72,25,14,0.013000000000000001,81,14,14,0.049,ATR,2.6,15,5m,SUPERTREND,False,False,False,False,False,0.53,BOLLINGER,1.9,-26.585566325138128,-85.13906722241381,-55.86231677377597,1778.7258475472768,-36.40064376133155,871.1626018929726,5m,60,65,62.5,SUPERTREND,52.11538461538462,55.00000000000001,49.23076923076923,COMPLETE
496,553.5563261993575,2026-01-15 23:46:12.644731,2026-01-15 23:46:19.786525,0 days 00:00:07.141794,16,2.1,3.7,1.7,144,BOLLINGER,PARABOLIC_SAR,1.85,27,18,13,0.034,72,25,15,0.013000000000000001,81,16,14,0.049,ATR,2.4000000000000004,15,5m,SUPERTREND,False,False,False,False,False,0.54,BOLLINGER,1.85,-25.887341336694313,-84.15469521989564,-55.021018278294974,1677.3214629737595,-32.97916273526007,822.1711501192497,5m,60,65,62.5,SUPERTREND,52.11538461538462,55.00000000000001,49.23076923076923,COMPLETE
497,1077.667715354106,2026-01-15 23:46:12.685895,2026-01-15 23:46:19.899773,0 days 00:00:07.213878,16,2.4,3.7,1.7,144,BOLLINGER,PARABOLIC_SAR,1.85,20,18,13,0.034,72,25,15,0.013000000000000001,81,14,14,0.049,ATR,2.3,15,5m,SUPERTREND,False,False,False,False,False,0.53,BOLLINGER,1.85,-26.1468540663232,-76.70504873068346,-51.42595139850333,2985.8803982037784,31.866809391680967,1508.8736037977296,5m,44,54,49.0,SUPERTREND,57.95454545454545,65.9090909090909,50.0,COMPLETE
498,553.5563261993575,2026-01-15 23:46:15.687953,2026-01-15 23:46:21.803590,0 days 00:00:06.115637,16,2.1,3.7,1.7,144,BOLLINGER,PARABOLIC_SAR,1.85,39,18,13,0.034,72,25,15,0.013000000000000001,81,14,14,0.049,ATR,2.7,15,5m,SUPERTREND,False,False,False,False,False,0.53,BOLLINGER,1.85,-25.887341336694313,-84.15469521989564,-55.021018278294974,1677.3214629737595,-32.97916273526007,822.1711501192497,5m,60,65,62.5,SUPERTREND,52.11538461538462,55.00000000000001,49.23076923076923,COMPLETE
499,1078.7051332054007,2026-01-15 23:46:19.233615,2026-01-15 23:46:27.017113,0 days 00:00:07.783498,16,2.4,3.4000000000000004,1.7,143,BOLLINGER,PARABOLIC_SAR,1.85,26,18,13,0.035,73,25,15,0.013000000000000001,80,16,14,0.049,ATR,1.9,15,5m,SUPERTREND,False,False,False,False,False,0.53,BOLLINGER,1.85,-26.14695944687668,-73.892248200242,-50.019603823559336,2995.442406961588,28.816775231378383,1512.1295910964832,5m,44,52,48.0,SUPERTREND,57.95454545454545,65.9090909090909,50.0,COMPLETE
500,1078.7051332054007,2026-01-15 23:46:19.227097,2026-01-15 23:46:26.950506,0 days 00:00:07.723409,16,2.4,3.4000000000000004,1.7,143,BOLLINGER,PARABOLIC_SAR,1.85,29,18,13,0.035,73,25,15,0.013000000000000001,80,16,14,0.049,ATR,2.0,10,5m,SUPERTREND,False,False,False,False,False,0.53,BOLLINGER,1.85,-26.14695944687668,-73.892248200242,-50.019603823559336,2995.442406961588,28.816775231378383,1512.1295910964832,5m,44,52,48.0,SUPERTREND,57.95454545454545,65.9090909090909,50.0,COMPLETE
501,1089.590250463306,2026-01-15 23:46:19.813840,2026-01-15 23:46:24.562676,0 days 00:00:04.748836,16,2.4,3.6,1.7,142,BOLLINGER,PARABOLIC_SAR,1.85,41,18,13,0.035,73,25,14,0.013000000000000001,80,14,13,0.049,ATR,2.6,15,5m,SUPERTREND,False,False,False,False,False,0.53,BOLLINGER,1.85,-26.14695944687668,-74.02713524964793,-50.0870473482623,3031.414933939487,26.10913683973318,1528.7620353896102,5m,44,52,48.0,SUPERTREND,57.95454545454545,65.9090909090909,50.0,COMPLETE
502,-1136.3354308041726,2026-01-15 23:46:19.929942,2026-01-15 23:46:29.055372,0 days 00:00:09.125430,16,2.4,3.6,1.7,142,CCI,PARABOLIC_SAR,1.85,16,18,13,0.035,72,25,15,0.011,81,14,14,0.05,ATR,2.1,15,5m,SUPERTREND,False,False,True,False,False,0.53,CCI,1.85,-33.56638009648758,-78.23471995809521,-55.900550027291395,1235.8597473818625,13.964902665294149,624.9123250235783,5m,25,30,27.5,SUPERTREND,57.33333333333333,68.0,46.666666666666664,COMPLETE
503,-592.6949088335477,2026-01-15 23:46:21.016622,2026-01-15 23:46:28.628667,0 days 00:00:07.612045,16,2.4,3.6,1.7,142,BOLLINGER,PARABOLIC_SAR,1.85,39,18,13,0.035,72,25,15,0.013000000000000001,81,14,20,0.05,ATR,2.3,15,5m,SUPERTREND,False,False,True,False,False,0.53,BOLLINGER,1.85,-20.378966502905836,-71.74430055571763,-46.061633529311734,1124.6154186456624,57.609571646906346,591.1124951462843,5m,29,37,33.0,SUPERTREND,58.061509785647715,62.06896551724138,54.054054054054056,COMPLETE
504,-2093.2868975990473,2026-01-15 23:46:21.917636,2026-01-15 23:46:32.055320,0 days 00:00:10.137684,16,4.9,3.6,1.7,141,CCI,PARABOLIC_SAR,1.85,19,18,13,0.035,73,25,15,0.011,81,14,13,0.05,ATR,2.3,16,5m,SUPERTREND,False,False,True,False,False,0.53,CCI,1.85,-22.51677149180634,-77.51758043397764,-50.01717596289199,523.8631589332704,162.80539368410194,343.3342763086862,5m,9,10,9.5,SUPERTREND,53.33333333333333,66.66666666666666,40.0,COMPLETE
505,-859.3038373095224,2026-01-15 23:46:25.260237,2026-01-15 23:46:33.853400,0 days 00:00:08.593163,17,2.4,3.6,1.7,143,BOLLINGER,PARABOLIC_SAR,1.9,22,18,13,0.035,73,25,14,0.011,79,14,13,0.05,ATR,2.3,14,5m,SUPERTREND,False,False,True,False,False,0.53,BOLLINGER,1.9,-32.74194373204971,-75.40215176319272,-54.07204774762121,782.1434306562832,8.520225390399853,395.33182802334153,5m,30,36,33.0,SUPERTREND,56.388888888888886,60.0,52.77777777777778,COMPLETE
506,-286.2226520445729,2026-01-15 23:46:27.848045,2026-01-15 23:46:34.932554,0 days 00:00:07.084509,17,2.2,3.4000000000000004,1.7,141,CCI,PARABOLIC_SAR,1.9,23,18,13,0.036000000000000004,73,25,15,0.011,79,16,13,0.05,ATR,2.5,10,5m,SUPERTREND,False,False,False,False,False,0.54,CCI,1.9,-31.548890141924613,-86.64435732839081,-59.09662373515771,1770.089364511026,-10.184059715466294,879.9526523977798,5m,36,45,40.5,SUPERTREND,55.55555555555555,66.66666666666666,44.44444444444444,COMPLETE
507,-2448.8658666096967,2026-01-15 23:46:27.855573,2026-01-15 23:46:36.189427,0 days 00:00:08.333854,17,6.0,3.6,1.8,141,CCI,PARABOLIC_SAR,1.9,19,18,13,0.036000000000000004,73,25,15,0.011,79,16,13,0.05,ATR,2.4000000000000004,14,5m,SUPERTREND,False,False,False,False,False,0.54,CCI,1.9,-38.794685346916694,-88.74420398636674,-63.76944466664172,690.5655038529864,33.61114238309441,362.08832311804036,5m,10,9,9.5,SUPERTREND,62.77777777777778,70.0,55.55555555555556,COMPLETE
508,-286.2226520445729,2026-01-15 23:46:28.731756,2026-01-15 23:46:36.144734,0 days 00:00:07.412978,17,2.2,3.4000000000000004,1.8,141,CCI,PARABOLIC_SAR,1.9,21,17,13,0.036000000000000004,73,25,15,0.011,79,16,13,0.05,ATR,2.5,10,5m,SUPERTREND,False,False,False,False,False,0.54,CCI,1.9,-31.548890141924613,-86.64435732839081,-59.09662373515771,1770.089364511026,-10.184059715466294,879.9526523977798,5m,36,45,40.5,SUPERTREND,55.55555555555555,66.66666666666666,44.44444444444444,COMPLETE
509,512.5891711184777,2026-01-15 23:46:29.422393,2026-01-15 23:46:36.676457,0 days 00:00:07.254064,17,2.2,3.4000000000000004,1.8,141,BOLLINGER,PARABOLIC_SAR,1.9,20,17,13,0.036000000000000004,73,25,14,0.011,79,15,13,0.05,ATR,2.4000000000000004,11,5m,SUPERTREND,False,False,False,False,False,0.54,BOLLINGER,1.9,-26.6260775134847,-78.5049876077548,-52.56553256061975,1516.0854399920172,31.76772851472036,773.9265842533688,5m,50,56,53.0,SUPERTREND,55.0,60.0,50.0,COMPLETE
510,86.40131320883847,2026-01-15 23:46:32.771737,2026-01-15 23:46:40.897285,0 days 00:00:08.125548,17,2.2,3.4000000000000004,1.8,140,BOLLINGER,PARABOLIC_SAR,1.9,23,17,13,0.02,73,25,15,0.012,80,16,13,0.049,ATR,2.4000000000000004,11,5m,SUPERTREND,False,False,False,False,False,0.54,BOLLINGER,1.9,-30.531962594639683,-79.29598544999047,-54.913974022315074,1307.9529368010792,25.629361327736106,666.7911490644077,5m,50,56,53.0,SUPERTREND,55.0,60.0,50.0,COMPLETE
511,86.40131320883847,2026-01-15 23:46:34.443746,2026-01-15 23:46:40.660926,0 days 00:00:06.217180,17,2.2,3.4000000000000004,1.8,140,BOLLINGER,PARABOLIC_SAR,1.9,19,17,13,0.035,73,25,15,0.012,79,16,13,0.049,ATR,2.5,9,5m,SUPERTREND,False,False,False,False,False,0.54,BOLLINGER,1.9,-30.531962594639683,-79.29598544999047,-54.913974022315074,1307.9529368010792,25.629361327736106,666.7911490644077,5m,50,56,53.0,SUPERTREND,55.0,60.0,50.0,COMPLETE
512,64.9256284822477,2026-01-15 23:46:35.542919,2026-01-15 23:46:42.392738,0 days 00:00:06.849819,16,2.2,3.4000000000000004,1.8,139,BOLLINGER,PARABOLIC_SAR,1.9,20,17,13,0.036000000000000004,73,24,14,0.012,80,16,13,0.049,ATR,1.9,14,5m,SUPERTREND,False,False,False,False,False,0.54,BOLLINGER,1.9,-30.531915423564392,-78.97345631513518,-54.75268586934979,1270.0717324646043,27.955674011069114,649.0137032378367,5m,50,56,53.0,SUPERTREND,55.0,60.0,50.0,COMPLETE
513,1020.4435361323995,2026-01-15 23:46:36.288648,2026-01-15 23:46:44.025622,0 days 00:00:07.736974,16,2.4,3.4000000000000004,1.7,143,BOLLINGER,PARABOLIC_SAR,1.8,30,17,13,0.035,73,24,14,0.012,80,15,13,0.049,ATR,1.9,11,5m,SUPERTREND,False,False,False,False,False,0.43,BOLLINGER,1.8,-25.441520675934044,-72.71980319885466,-49.08066193739435,2786.7021322314313,33.099850968602,1409.9009916000166,5m,44,52,48.0,SUPERTREND,57.95454545454545,65.9090909090909,50.0,COMPLETE
514,1001.4349935660966,2026-01-15 23:46:36.702337,2026-01-15 23:46:45.365267,0 days 00:00:08.662930,16,2.4,3.4000000000000004,1.7,144,BOLLINGER,PARABOLIC_SAR,1.8,29,19,13,0.035,73,24,14,0.013000000000000001,80,14,14,0.049,ATR,1.9,14,5m,SUPERTREND,False,False,False,False,False,0.52,BOLLINGER,1.8,-25.441420743011122,-75.59355380213391,-50.51748727257252,2777.9765454734857,19.327005143878843,1398.6517753086823,5m,44,54,49.0,SUPERTREND,57.95454545454545,65.9090909090909,50.0,COMPLETE
515,1001.4349935660966,2026-01-15 23:46:36.648255,2026-01-15 23:46:44.817099,0 days 00:00:08.168844,16,2.4,3.4000000000000004,1.7,144,BOLLINGER,PARABOLIC_SAR,1.8,28,19,13,0.02,73,24,14,0.013000000000000001,80,14,14,0.049,ATR,1.9,14,5m,SUPERTREND,False,False,False,False,False,0.52,BOLLINGER,1.8,-25.441420743011122,-75.59355380213391,-50.51748727257252,2777.9765454734857,19.327005143878843,1398.6517753086823,5m,44,54,49.0,SUPERTREND,57.95454545454545,65.9090909090909,50.0,COMPLETE
516,-275.62108393070685,2026-01-15 23:46:40.886727,2026-01-15 23:46:46.162398,0 days 00:00:05.275671,16,2.4,3.4000000000000004,1.7,144,BOLLINGER,PARABOLIC_SAR,1.8,28,19,13,0.035,73,24,14,0.013000000000000001,80,14,14,0.049,ATR,1.9,14,1h,SUPERTREND,False,False,False,False,False,0.52,BOLLINGER,1.8,-34.35048603359052,-75.2359638366046,-54.793224935097555,1568.2699122711135,175.46947631482698,871.8696942929703,1h,44,47,45.5,SUPERTREND,55.07736943907157,59.09090909090909,51.06382978723404,COMPLETE
