number,value,datetime_start,datetime_complete,duration,params_ADX_THRESHOLD,params_ATR_MULTIPLIER,params_ATR_STOP_LOSS_MULT,params_BB_STD,params_ENTRY_PERIOD,params_ENTRY_TYPE,params_EXIT_TYPE,params_LEVERAGE,params_MA_PERIOD,params_MFI_THRESHOLD,params_MFI_WINDOW,params_RISK_PER_TRADE,params_RSI_OVERBOUGHT,params_RSI_OVERSOLD,params_RSI_WINDOW,params_SAR_STEP,params_STOCH_OVERBOUGHT,params_STOCH_OVERSOLD,params_STOCH_WINDOW,params_STOP_LOSS_PCT,params_STOP_LOSS_TYPE,params_SUPERTREND_MULT,params_SUPERTREND_PERIOD,params_TIMEFRAME,params_TREND_FILTER_TYPE,params_USE_ADX,params_USE_MFI,params_USE_RSI,params_USE_STOCHASTIC,params_USE_VHF,params_VHF_THRESHOLD,user_attrs_entry_type,user_attrs_leverage,user_attrs_mdd_BTC_USDT,user_attrs_mdd_ETH_USDT,user_attrs_mdd_avg,user_attrs_return_BTC_USDT,user_attrs_return_ETH_USDT,user_attrs_return_avg,user_attrs_timeframe,user_attrs_trades_BTC_USDT,user_attrs_trades_ETH_USDT,user_attrs_trades_avg,user_attrs_trend_filter,user_attrs_win_rate_avg,user_attrs_winrate_BTC_USDT,user_attrs_winrate_ETH_USDT,state
990,956.1831365408389,2026-01-16 00:11:13.526878,2026-01-16 00:11:31.841018,0 days 00:00:18.314140,25,2.8,2.6,1.5,135,BOLLINGER,ATR,2.25,119,16,10,0.026000000000000002,66,34,13,0.015,83,10,10,0.037,ATR,2.7,34,3m,SUPERTREND,False,False,False,False,False,0.41,BOLLINGER,2.25,-39.138275382416445,-87.97501627224227,-63.55664582732936,4828.278796544993,268.7365339911536,2548.5076652680737,3m,41,45,43.0,SUPERTREND,58.26558265582656,60.97560975609756,55.55555555555556,COMPLETE
991,1349.6578061435248,2026-01-16 00:11:14.004537,2026-01-16 00:11:32.143240,0 days 00:00:18.138703,25,2.6,2.6,1.5,135,BOLLINGER,ATR,2.25,119,16,10,0.026000000000000002,66,34,13,0.015,83,10,10,0.038,ATR,2.7,35,3m,SUPERTREND,False,False,False,False,False,0.41,BOLLINGER,2.25,-39.483082063657726,-77.50938652008091,-58.496234291869314,4707.571989875531,189.67476213077467,2448.6233760031528,3m,46,51,48.5,SUPERTREND,53.85763000852515,58.69565217391305,49.01960784313725,COMPLETE
992,1069.0720401746048,2026-01-16 00:11:16.980458,2026-01-16 00:11:37.131129,0 days 00:00:20.150671,25,2.8,2.8,1.5,135,BOLLINGER,ATR,2.25,120,16,10,0.024,66,34,13,0.015,83,10,10,0.037,ATR,2.7,35,3m,SUPERTREND,False,False,False,False,False,0.41,BOLLINGER,2.25,-38.88991826811828,-84.67601397363725,-61.78296612087777,4849.275925529831,404.8399219709017,2627.057923750366,3m,41,44,42.5,SUPERTREND,57.76053215077605,60.97560975609756,54.54545454545454,COMPLETE
993,1349.6578061435248,2026-01-16 00:11:17.766075,2026-01-16 00:11:40.221203,0 days 00:00:22.455128,25,2.6,2.6,1.5,135,BOLLINGER,ATR,2.25,120,16,10,0.026000000000000002,66,34,13,0.015,83,10,10,0.038,ATR,2.8,35,3m,SUPERTREND,False,False,False,False,False,0.4,BOLLINGER,2.25,-39.483082063657726,-77.50938652008091,-58.496234291869314,4707.571989875531,189.67476213077467,2448.6233760031528,3m,46,51,48.5,SUPERTREND,53.85763000852515,58.69565217391305,49.01960784313725,COMPLETE
994,1349.6578061435248,2026-01-16 00:11:17.780462,2026-01-16 00:11:37.739114,0 days 00:00:19.958652,25,2.6,2.6,1.5,135,BOLLINGER,ATR,2.25,119,16,10,0.027000000000000003,66,34,13,0.015,83,10,10,0.038,ATR,2.8,35,3m,SUPERTREND,False,False,False,False,False,0.4,BOLLINGER,2.25,-39.483082063657726,-77.50938652008091,-58.496234291869314,4707.571989875531,189.67476213077467,2448.6233760031528,3m,46,51,48.5,SUPERTREND,53.85763000852515,58.69565217391305,49.01960784313725,COMPLETE
995,1252.6047888784651,2026-01-16 00:11:18.669414,2026-01-16 00:11:42.465398,0 days 00:00:23.795984,25,2.6,2.6,1.5,134,BOLLINGER,ATR,2.25,119,16,10,0.028000000000000004,66,33,13,0.013000000000000001,83,10,10,0.038,ATR,2.8,31,3m,SUPERTREND,False,False,False,False,False,0.4,BOLLINGER,2.25,-39.479423855722445,-83.37372448851461,-61.42657417211853,4704.285048163358,104.9073918612566,2404.596220012307,3m,46,53,49.5,SUPERTREND,52.93273174733388,58.69565217391305,47.16981132075472,COMPLETE
996,1398.976403021661,2026-01-16 00:11:33.154448,2026-01-16 00:11:50.370235,0 days 00:00:17.215787,26,2.6,2.7,1.5,135,BOLLINGER,ATR,2.25,121,16,10,0.028000000000000004,66,33,13,0.013000000000000001,83,10,10,0.037,ATR,2.8,34,3m,SUPERTREND,False,False,False,False,False,0.4,BOLLINGER,2.25,-38.11265986798109,-77.50485185916438,-57.80875586357273,4822.2056207109845,176.50887681123285,2499.3572487611086,3m,46,51,48.5,SUPERTREND,53.85763000852515,58.69565217391305,49.01960784313725,COMPLETE
997,1398.976403021661,2026-01-16 00:11:33.176199,2026-01-16 00:11:53.323542,0 days 00:00:20.147343,26,2.6,2.7,1.5,135,BOLLINGER,ATR,2.25,122,16,10,0.028000000000000004,66,33,13,0.013000000000000001,83,10,10,0.037,ATR,2.8,31,3m,SUPERTREND,False,False,False,False,False,0.4,BOLLINGER,2.25,-38.11265986798109,-77.50485185916438,-57.80875586357273,4822.2056207109845,176.50887681123285,2499.3572487611086,3m,46,51,48.5,SUPERTREND,53.85763000852515,58.69565217391305,49.01960784313725,COMPLETE
998,1340.8277060324353,2026-01-16 00:11:37.723232,2026-01-16 00:11:53.893850,0 days 00:00:16.170618,26,2.6,2.7,1.5,131,BOLLINGER,ATR,2.25,111,16,10,0.028000000000000004,66,33,13,0.013000000000000001,83,10,10,0.037,ATR,2.8,37,3m,SUPERTREND,False,False,False,False,False,0.4,BOLLINGER,2.25,-38.58096318369667,-83.31059291830836,-60.94577805100251,5045.518629088909,80.83593465184119,2563.177281870375,3m,45,53,49.0,SUPERTREND,53.58490566037736,60.0,47.16981132075472,COMPLETE
999,840.8160687785521,2026-01-16 00:11:40.074649,2026-01-16 00:11:56.165019,0 days 00:00:16.090370,26,2.6,2.7,1.5,132,BOLLINGER,ATR,2.3,111,16,10,0.028000000000000004,66,33,13,0.013000000000000001,83,10,10,0.037,ATR,2.8,37,3m,SUPERTREND,False,False,False,False,True,0.4,BOLLINGER,2.3,-33.73108296139759,-70.60861068145353,-52.16984682142556,5252.476625638918,26.482210508162996,2639.4794180735407,3m,34,34,34.0,SUPERTREND,60.294117647058826,70.58823529411765,50.0,COMPLETE
