number,value,datetime_start,datetime_complete,duration,params_ADX_THRESHOLD,params_ATR_MULTIPLIER,params_ATR_STOP_LOSS_MULT,params_BB_STD,params_ENTRY_PERIOD,params_ENTRY_TYPE,params_EXIT_TYPE,params_LEVERAGE,params_MA_PERIOD,params_MFI_THRESHOLD,params_MFI_WINDOW,params_RISK_PER_TRADE,params_RSI_OVERBOUGHT,params_RSI_OVERSOLD,params_RSI_WINDOW,params_SAR_STEP,params_STOCH_OVERBOUGHT,params_STOCH_OVERSOLD,params_STOCH_WINDOW,params_STOP_LOSS_PCT,params_STOP_LOSS_TYPE,params_SUPERTREND_MULT,params_SUPERTREND_PERIOD,params_TIMEFRAME,params_TREND_FILTER_TYPE,params_USE_ADX,params_USE_MFI,params_USE_RSI,params_USE_STOCHASTIC,params_USE_VHF,params_VHF_THRESHOLD,user_attrs_entry_type,user_attrs_leverage,user_attrs_mdd_BTC_USDT,user_attrs_mdd_ETH_USDT,user_attrs_mdd_avg,user_attrs_return_BTC_USDT,user_attrs_return_ETH_USDT,user_attrs_return_avg,user_attrs_timeframe,user_attrs_trades_BTC_USDT,user_attrs_trades_ETH_USDT,user_attrs_trades_avg,user_attrs_trend_filter,user_attrs_win_rate_avg,user_attrs_winrate_BTC_USDT,user_attrs_winrate_ETH_USDT,state
605,-7.836590674083709,2026-01-15 23:49:40.969824,2026-01-15 23:49:51.439567,0 days 00:00:10.469743,29,2.2,3.6,1.8,136,BOLLINGER,PARABOLIC_SAR,2.0,24,18,14,0.036000000000000004,71,25,14,0.011,79,15,13,0.05,ATR,2.6,10,5m,SUPERTREND,False,False,False,False,False,0.44,BOLLINGER,2.0,-32.34350425505216,-77.05095419802987,-54.69722922654101,1178.4051397671717,43.14026740047042,610.7727035838211,5m,51,54,52.5,SUPERTREND,53.431372549019606,56.86274509803921,50.0,COMPLETE
606,-2300.0,2026-01-15 23:49:41.166556,2026-01-15 23:49:51.304327,0 days 00:00:10.137771,30,2.2,3.6,1.8,10,BOLLINGER,PARABOLIC_SAR,2.0,24,33,14,0.036000000000000004,78,25,14,0.012,78,15,13,0.05,ATR,2.3,10,5m,SUPERTREND,False,False,False,False,False,0.44,BOLLINGER,2.0,0.0,0.0,0.0,0.0,0.0,0.0,5m,0,0,0.0,SUPERTREND,0.0,0.0,0.0,COMPLETE
607,478.4809810041461,2026-01-15 23:49:47.709575,2026-01-15 23:50:03.279581,0 days 00:00:15.570006,29,2.2,3.6,1.7,140,BOLLINGER,PARABOLIC_SAR,2.0,94,18,14,0.037,71,25,15,0.011,79,15,13,0.05,ATR,2.6,13,5m,SUPERTREND,False,False,False,False,False,0.44,BOLLINGER,2.0,-30.955025459179396,-77.82523017959616,-54.39012781938778,1900.5511456285578,102.46962919620974,1001.5103874123838,5m,54,57,55.5,SUPERTREND,55.0682261208577,59.25925925925925,50.877192982456144,COMPLETE
608,478.4809810041461,2026-01-15 23:49:48.211556,2026-01-15 23:50:03.376465,0 days 00:00:15.164909,25,2.2,3.6,1.7,140,BOLLINGER,PARABOLIC_SAR,2.0,23,18,14,0.037,72,25,15,0.011,79,15,13,0.05,ATR,2.5,13,5m,SUPERTREND,False,False,False,False,False,0.44,BOLLINGER,2.0,-30.955025459179396,-77.82523017959616,-54.39012781938778,1900.5511456285578,102.46962919620974,1001.5103874123838,5m,54,57,55.5,SUPERTREND,55.0682261208577,59.25925925925925,50.877192982456144,COMPLETE
609,-2940.685018843984,2026-01-15 23:49:50.433425,2026-01-15 23:50:02.364404,0 days 00:00:11.930979,24,2.5,3.6,2.9000000000000004,141,BOLLINGER,PARABOLIC_SAR,1.85,143,18,14,0.037,71,25,15,0.011,79,16,13,0.05,ATR,2.3,13,5m,SUPERTREND,False,False,False,False,False,0.44,BOLLINGER,1.85,-67.4386384364812,-44.82500421383502,-56.131821325158114,61.52547601997191,-1.3545442752323813,30.085465872369767,5m,18,20,19.0,SUPERTREND,47.77777777777778,55.55555555555556,40.0,COMPLETE
610,201.74079008554327,2026-01-15 23:49:50.801009,2026-01-15 23:50:06.042280,0 days 00:00:15.241271,30,2.4,3.6,1.7,71,BOLLINGER,PARABOLIC_SAR,1.85,23,35,14,0.037,80,25,14,0.047,79,15,13,0.05,ATR,2.6,13,5m,SUPERTREND,False,False,False,False,False,0.44999999999999996,BOLLINGER,1.85,-38.52512361599769,-53.59373546357224,-46.059429539784965,1055.8448127093743,485.2410236997801,770.5429182045772,5m,52,57,54.5,SUPERTREND,51.400134952766535,51.92307692307693,50.877192982456144,COMPLETE
611,1109.2862013422637,2026-01-15 23:49:51.360402,2026-01-15 23:50:06.247678,0 days 00:00:14.887276,30,2.4,3.5,1.7,145,BOLLINGER,PARABOLIC_SAR,1.85,22,35,14,0.034,71,25,15,0.011,79,16,13,0.05,ATR,2.7,13,5m,SUPERTREND,False,False,False,False,False,0.44999999999999996,BOLLINGER,1.85,-26.1468540663232,-72.11715679775024,-49.13200543203672,3017.6506535304893,48.16566749847354,1532.9081605144813,5m,44,53,48.5,SUPERTREND,58.426243567753005,65.9090909090909,50.943396226415096,COMPLETE
612,316.1817836377868,2026-01-15 23:49:51.509417,2026-01-15 23:50:06.151394,0 days 00:00:14.641977,30,2.5,3.5,1.7,139,BOLLINGER,PARABOLIC_SAR,1.85,31,18,14,0.034,72,25,15,0.011,79,16,13,0.047,ATR,2.3,13,5m,SUPERTREND,False,False,False,False,False,0.44999999999999996,BOLLINGER,1.85,-28.155340741643066,-76.2245813496762,-52.18996104565963,2345.9257151076213,92.30733755741264,1219.116526332517,5m,43,46,44.5,SUPERTREND,55.30839231547017,62.7906976744186,47.82608695652174,COMPLETE
613,1128.7790724521965,2026-01-15 23:50:04.038146,2026-01-15 23:50:13.105799,0 days 00:00:09.067653,30,2.4,3.5,1.7,146,BOLLINGER,PARABOLIC_SAR,1.85,31,17,13,0.034,79,25,15,0.013000000000000001,81,14,13,0.047,ATR,2.4000000000000004,13,5m,SUPERTREND,False,False,False,False,False,0.44999999999999996,BOLLINGER,1.85,-26.1468540663232,-72.35985414202281,-49.253354104173006,3061.5308564883203,50.5265677246456,1556.028712106483,5m,44,53,48.5,SUPERTREND,58.426243567753005,65.9090909090909,50.943396226415096,COMPLETE
614,1128.7790724521965,2026-01-15 23:50:04.075161,2026-01-15 23:50:18.733677,0 days 00:00:14.658516,30,2.4,3.5,1.7,146,BOLLINGER,PARABOLIC_SAR,1.85,31,17,13,0.034,80,25,15,0.013000000000000001,81,14,13,0.047,ATR,2.4000000000000004,11,5m,SUPERTREND,False,False,False,False,False,0.44999999999999996,BOLLINGER,1.85,-26.1468540663232,-72.35985414202281,-49.253354104173006,3061.5308564883203,50.5265677246456,1556.028712106483,5m,44,53,48.5,SUPERTREND,58.426243567753005,65.9090909090909,50.943396226415096,COMPLETE
615,1109.2862013422637,2026-01-15 23:50:04.141768,2026-01-15 23:50:16.970463,0 days 00:00:12.828695,30,2.4,3.5,1.7,145,BOLLINGER,PARABOLIC_SAR,1.85,31,17,13,0.034,68,25,15,0.013000000000000001,81,14,13,0.047,ATR,2.2,8,5m,SUPERTREND,False,False,False,False,False,0.44999999999999996,BOLLINGER,1.85,-26.1468540663232,-72.11715679775024,-49.13200543203672,3017.6506535304893,48.16566749847354,1532.9081605144813,5m,44,53,48.5,SUPERTREND,58.426243567753005,65.9090909090909,50.943396226415096,COMPLETE
616,1246.3196121031588,2026-01-15 23:50:06.222310,2026-01-15 23:50:20.323025,0 days 00:00:14.100715,30,2.4,3.5,1.7,146,BOLLINGER,PARABOLIC_SAR,1.9500000000000002,30,17,13,0.034,67,24,14,0.013000000000000001,81,14,14,0.048,ATR,2.2,12,5m,SUPERTREND,False,False,False,False,False,0.43,BOLLINGER,1.9500000000000002,-27.557690076484892,-74.64736524584656,-51.10252766116572,3527.6115875977202,41.48966421633214,1784.5506259070262,5m,44,53,48.5,SUPERTREND,58.426243567753005,65.9090909090909,50.943396226415096,COMPLETE
617,-2646.3493915812473,2026-01-15 23:50:06.368235,2026-01-15 23:50:20.464293,0 days 00:00:14.096058,30,2.4,3.5,1.7,146,CCI,PARABOLIC_SAR,1.9500000000000002,19,34,14,0.034,79,25,15,0.012,79,17,13,0.048,ATR,2.6,11,5m,SUPERTREND,False,False,False,False,True,0.44999999999999996,CCI,1.9500000000000002,-38.664203415734406,-71.84326164604215,-55.25373253088828,522.7369954529644,-55.68126542787974,233.52786501254232,5m,22,19,20.5,SUPERTREND,62.67942583732058,72.72727272727273,52.63157894736842,COMPLETE
618,-1900.482261793145,2026-01-15 23:50:06.370739,2026-01-15 23:50:20.175591,0 days 00:00:13.804852,30,2.4,3.5,1.7,146,BOLLINGER,PARABOLIC_SAR,1.9500000000000002,19,35,14,0.034,71,25,15,0.012,79,16,13,0.048,ATR,2.8,11,5m,SUPERTREND,False,False,False,False,True,0.44999999999999996,BOLLINGER,1.9500000000000002,-27.56332694594881,-66.32341821279168,-46.94337257937025,538.144164646353,4.662593488997722,271.40337906767536,5m,30,29,29.5,SUPERTREND,59.19540229885057,66.66666666666666,51.724137931034484,COMPLETE
619,554.0933025537279,2026-01-15 23:50:14.845709,2026-01-15 23:50:23.917112,0 days 00:00:09.071403,30,2.5,3.5,1.7,146,BOLLINGER,PARABOLIC_SAR,1.9,20,35,13,0.034,73,25,15,0.012,81,16,13,0.047,ATR,2.4000000000000004,11,5m,SUPERTREND,False,False,False,False,False,0.43,BOLLINGER,1.9,-28.917221653615847,-76.1338473806567,-52.52553451713628,2909.40047553386,135.19859496046348,1522.2995352471619,5m,43,47,45.0,SUPERTREND,55.96239485403266,65.11627906976744,46.808510638297875,COMPLETE
620,-2293.7547456750103,2026-01-15 23:50:18.726167,2026-01-15 23:50:25.961872,0 days 00:00:07.235705,30,2.5,3.5,1.7,148,CCI,PARABOLIC_SAR,1.9,31,17,13,0.034,80,25,15,0.013000000000000001,81,16,13,0.046000000000000006,ATR,2.8,7,1h,SUPERTREND,False,False,False,False,True,0.44999999999999996,CCI,1.9,-26.618614905841465,-56.951744920240124,-41.78517991304079,487.1680491149214,-43.08227608433637,222.04288651529254,1h,21,17,19.0,SUPERTREND,65.12605042016807,71.42857142857143,58.82352941176471,COMPLETE
621,-1112.8555715693292,2026-01-15 23:50:20.227655,2026-01-15 23:50:24.228939,0 days 00:00:04.001284,30,2.5,3.7,1.7,147,CCI,PARABOLIC_SAR,1.9,19,17,13,0.034,79,25,15,0.013000000000000001,81,17,13,0.046000000000000006,ATR,2.7,9,1h,SUPERTREND,False,False,False,False,False,0.44999999999999996,CCI,1.9,-43.06561707643309,-70.9971503108975,-57.03138369366529,1495.2122875150974,-3.5525073052151828,745.8298901049411,1h,28,37,32.5,SUPERTREND,53.33011583011583,60.71428571428571,45.94594594594595,COMPLETE
622,-1508.3159862889452,2026-01-15 23:50:20.146325,2026-01-15 23:50:30.776898,0 days 00:00:10.630573,30,5.4,3.5,1.7,147,BOLLINGER,PARABOLIC_SAR,1.9,30,17,12,0.034,66,25,15,0.013000000000000001,81,14,13,0.046000000000000006,ATR,2.3,9,5m,SUPERTREND,False,False,False,False,False,0.44999999999999996,BOLLINGER,1.9,-18.188262026305154,-91.739670371853,-54.963966199079074,1840.4372531480562,-0.537131930960063,919.9500606085481,5m,15,18,16.5,SUPERTREND,58.888888888888886,73.33333333333333,44.44444444444444,COMPLETE
623,-77.36648743813203,2026-01-15 23:50:20.521499,2026-01-15 23:50:26.455799,0 days 00:00:05.934300,30,2.3,3.5,1.7,147,BOLLINGER,PARABOLIC_SAR,1.9,32,17,12,0.034,67,25,15,0.013000000000000001,81,14,13,0.046000000000000006,ATR,2.5,12,1h,SUPERTREND,False,False,False,False,False,0.44999999999999996,BOLLINGER,1.9,-42.60037952850289,-72.66024381989386,-57.63031167419838,1364.969048183895,243.26965274619505,804.119350465045,1h,49,51,50.0,SUPERTREND,56.022408963585434,57.14285714285714,54.90196078431373,COMPLETE
624,658.2625855101141,2026-01-15 23:50:21.217970,2026-01-15 23:50:31.292918,0 days 00:00:10.074948,30,2.3,3.5,1.7,147,BOLLINGER,PARABOLIC_SAR,1.9,31,17,13,0.034,66,25,15,0.013000000000000001,81,14,13,0.046000000000000006,ATR,2.7,9,5m,SUPERTREND,False,False,False,False,False,0.44999999999999996,BOLLINGER,1.9,-30.951917685225254,-64.32621973435666,-47.639068709790955,2360.0540191624873,146.82641074807282,1253.44021495528,5m,49,55,52.0,SUPERTREND,59.814471243042675,63.26530612244898,56.36363636363636,COMPLETE
625,-1793.4596889821305,2026-01-15 23:50:24.139406,2026-01-15 23:50:35.232211,0 days 00:00:11.092805,30,2.3,3.5,2.5,148,BOLLINGER,PARABOLIC_SAR,1.9,31,17,12,0.034,67,25,15,0.013000000000000001,81,14,13,0.046000000000000006,ATR,2.3,9,5m,SUPERTREND,False,False,False,False,False,0.44999999999999996,BOLLINGER,1.9,-31.684856022717717,-53.258679050340795,-42.471767536529256,462.09721425087065,37.23589269240543,249.66655347163805,5m,29,30,29.5,SUPERTREND,57.758620689655174,65.51724137931035,50.0,COMPLETE
626,647.0252383000616,2026-01-15 23:50:24.428039,2026-01-15 23:50:37.643466,0 days 00:00:13.215427,30,2.3,3.5,1.7,148,BOLLINGER,PARABOLIC_SAR,1.9500000000000002,32,17,12,0.034,67,25,15,0.013000000000000001,81,14,13,0.046000000000000006,ATR,2.3,8,5m,SUPERTREND,False,False,False,False,False,0.44999999999999996,BOLLINGER,1.9500000000000002,-31.590750804115185,-73.79557633278392,-52.693163568449556,2511.2262024748984,80.52885845961377,1295.877530467256,5m,49,56,52.5,SUPERTREND,59.31122448979592,63.26530612244898,55.35714285714286,COMPLETE
627,-183.23369566234214,2026-01-15 23:50:26.432086,2026-01-15 23:50:42.312437,0 days 00:00:15.880351,30,2.3,3.5,1.8,79,BOLLINGER,PARABOLIC_SAR,1.9500000000000002,27,17,13,0.034,67,26,15,0.014,81,14,13,0.047,ATR,2.3,6,5m,SUPERTREND,False,False,False,False,False,0.44,BOLLINGER,1.9500000000000002,-45.91461927781668,-54.36037365130411,-50.1374964645604,829.8274840931969,599.0952781577897,714.4613811254933,5m,49,55,52.0,SUPERTREND,53.116883116883116,57.14285714285714,49.09090909090909,COMPLETE
628,-3.1675498188305937,2026-01-15 23:50:27.395896,2026-01-15 23:50:40.463845,0 days 00:00:13.067949,30,1.8,3.5,1.8,148,BOLLINGER,PARABOLIC_SAR,1.9500000000000002,27,16,13,0.034,65,26,15,0.014,81,14,13,0.047,ATR,2.3,5,5m,SUPERTREND,False,False,False,False,False,0.44,BOLLINGER,1.9500000000000002,-36.57198181991238,-77.2619538420169,-56.91696783096464,1394.123896087473,-18.070002200780365,688.0269469433463,5m,77,73,75.0,SUPERTREND,49.87546699875466,54.54545454545454,45.20547945205479,COMPLETE
629,641.5183047443552,2026-01-15 23:50:31.280232,2026-01-15 23:50:43.905777,0 days 00:00:12.625545,30,2.3,3.7,1.8,150,BOLLINGER,PARABOLIC_SAR,1.9500000000000002,158,16,13,0.034,65,26,15,0.014,81,14,13,0.047,ATR,2.3,13,5m,SUPERTREND,False,False,False,False,False,0.44,BOLLINGER,1.9500000000000002,-29.639105101647868,-74.03218172352068,-51.835643412584275,2098.594195959794,67.30934352957381,1082.9517697446838,5m,46,52,49.0,SUPERTREND,57.48327759197325,63.04347826086957,51.92307692307693,COMPLETE
630,643.0702461489018,2026-01-15 23:50:32.312347,2026-01-15 23:50:46.264905,0 days 00:00:13.952558,28,1.9,3.7,1.8,144,BOLLINGER,PARABOLIC_SAR,1.9500000000000002,27,16,13,0.034,65,26,15,0.014,81,14,13,0.047,ATR,2.2,13,5m,SUPERTREND,False,False,False,False,False,0.44,BOLLINGER,1.9500000000000002,-23.799654935042742,-72.08657175259208,-47.94311334381741,1597.0225992583028,57.0810490477032,827.0518241530029,5m,67,67,67.0,SUPERTREND,52.23880597014926,55.223880597014926,49.25373134328358,COMPLETE
631,-314.2824558596285,2026-01-15 23:50:36.271661,2026-01-15 23:50:47.601055,0 days 00:00:11.329394,29,1.9,3.7,1.8,150,BOLLINGER,PARABOLIC_SAR,1.9500000000000002,26,16,13,0.034,68,26,15,0.014,81,14,13,0.047,ATR,2.2,5,5m,ICHIMOKU,False,False,False,False,False,0.44,BOLLINGER,1.9500000000000002,-51.01328225772057,-76.09975289740977,-63.556517577565174,896.8305947221002,42.93212436290009,469.88135954250015,5m,82,88,85.0,ICHIMOKU,50.69290465631929,53.65853658536586,47.72727272727273,COMPLETE
632,-728.4527410909604,2026-01-15 23:50:39.279218,2026-01-15 23:50:50.220573,0 days 00:00:10.941355,29,2.1,3.7,1.8,144,BOLLINGER,PARABOLIC_SAR,1.9500000000000002,26,16,13,0.034,80,26,15,0.014,81,14,13,0.047,ATR,2.2,13,5m,ICHIMOKU,False,False,False,False,False,0.43,BOLLINGER,1.9500000000000002,-64.8470564548083,-78.88375037376893,-71.86540341428861,310.5541194287318,67.72305422439564,189.1385868265637,5m,75,74,74.5,ICHIMOKU,50.34234234234234,49.333333333333336,51.35135135135135,COMPLETE
633,456.53060046139944,2026-01-15 23:50:42.254421,2026-01-15 23:50:57.533521,0 days 00:00:15.279100,29,2.1,3.7,1.8,144,BOLLINGER,PARABOLIC_SAR,1.85,37,17,13,0.034,68,26,15,0.014,81,14,13,0.047,ATR,2.2,13,5m,SUPERTREND,False,False,False,False,False,0.43,BOLLINGER,1.85,-25.89739751413117,-74.36635886960066,-50.131878191865916,1300.0857846372182,87.68577821765781,693.885781427438,5m,57,58,57.5,SUPERTREND,54.79431336963097,56.14035087719298,53.44827586206896,COMPLETE
634,1077.667715354106,2026-01-15 23:50:43.845409,2026-01-15 23:51:00.729920,0 days 00:00:16.884511,29,2.4,3.7,1.7,144,BOLLINGER,PARABOLIC_SAR,1.85,35,16,13,0.035,68,35,15,0.01,81,14,13,0.047,ATR,2.2,13,5m,SUPERTREND,False,False,False,False,False,0.43,BOLLINGER,1.85,-26.1468540663232,-76.70504873068346,-51.42595139850333,2985.8803982037784,31.866809391680967,1508.8736037977296,5m,44,54,49.0,SUPERTREND,57.95454545454545,65.9090909090909,50.0,COMPLETE
635,553.5563261993575,2026-01-15 23:50:44.639505,2026-01-15 23:51:00.987636,0 days 00:00:16.348131,29,2.1,3.7,1.7,144,BOLLINGER,PARABOLIC_SAR,1.85,37,18,13,0.035,68,26,15,0.01,81,16,13,0.047,ATR,2.2,13,5m,SUPERTREND,False,False,False,False,False,0.43,BOLLINGER,1.85,-25.887341336694313,-84.15469521989564,-55.021018278294974,1677.3214629737595,-32.97916273526007,822.1711501192497,5m,60,65,62.5,SUPERTREND,52.11538461538462,55.00000000000001,49.23076923076923,COMPLETE
636,543.1250514636749,2026-01-15 23:50:46.335990,2026-01-15 23:51:01.757610,0 days 00:00:15.421620,29,2.1,3.6,1.7,144,BOLLINGER,PARABOLIC_SAR,1.85,38,18,13,0.035,68,25,15,0.01,81,16,13,0.047,ATR,2.5,12,5m,SUPERTREND,False,False,False,False,False,0.43,BOLLINGER,1.85,-25.887341336694313,-83.93939376389264,-54.91336755029347,1677.3214629737595,-44.428937916568074,816.4462625285958,5m,60,65,62.5,SUPERTREND,52.11538461538462,55.00000000000001,49.23076923076923,COMPLETE
637,543.1250514636749,2026-01-15 23:50:47.659892,2026-01-15 23:51:01.093460,0 days 00:00:13.433568,29,2.1,3.6,1.7,144,BOLLINGER,PARABOLIC_SAR,1.85,37,18,13,0.035,68,25,15,0.011,81,16,13,0.047,ATR,2.4000000000000004,7,5m,SUPERTREND,False,False,False,False,False,0.43,BOLLINGER,1.85,-25.887341336694313,-83.93939376389264,-54.91336755029347,1677.3214629737595,-44.428937916568074,816.4462625285958,5m,60,65,62.5,SUPERTREND,52.11538461538462,55.00000000000001,49.23076923076923,COMPLETE
638,1106.9198641270787,2026-01-15 23:50:50.521407,2026-01-15 23:51:08.081411,0 days 00:00:17.560004,29,2.4,3.6,1.7,145,BOLLINGER,PARABOLIC_SAR,1.85,38,18,13,0.035,70,25,15,0.01,81,16,13,0.048,ATR,2.5,12,5m,SUPERTREND,False,False,False,False,False,0.43,BOLLINGER,1.85,-26.1468540663232,-72.1157151742531,-49.13128462028815,3017.6506535304893,46.04019356438741,1531.8454235474383,5m,44,53,48.5,SUPERTREND,58.426243567753005,65.9090909090909,50.943396226415096,COMPLETE
639,483.4794689741002,2026-01-15 23:50:59.098261,2026-01-15 23:51:12.009456,0 days 00:00:12.911195,29,2.5,3.6,1.7,145,BOLLINGER,PARABOLIC_SAR,1.85,37,18,13,0.035,70,25,15,0.01,81,16,13,0.048,ATR,2.5,7,5m,SUPERTREND,False,False,False,False,False,0.54,BOLLINGER,1.85,-28.156467746293696,-74.98339151929515,-51.56992963279443,2669.5714458922866,132.23667487466759,1400.9040603834771,5m,43,47,45.0,SUPERTREND,55.96239485403266,65.11627906976744,46.808510638297875,COMPLETE
640,483.4794689741002,2026-01-15 23:51:00.973535,2026-01-15 23:51:15.934757,0 days 00:00:14.961222,29,2.5,3.6,1.7,145,BOLLINGER,PARABOLIC_SAR,1.85,34,16,13,0.035,68,35,15,0.01,81,14,13,0.048,ATR,2.4000000000000004,8,5m,SUPERTREND,False,False,False,False,False,0.43,BOLLINGER,1.85,-28.156467746293696,-74.98339151929515,-51.56992963279443,2669.5714458922866,132.23667487466759,1400.9040603834771,5m,43,47,45.0,SUPERTREND,55.96239485403266,65.11627906976744,46.808510638297875,COMPLETE
641,426.6391759186663,2026-01-15 23:51:01.594114,2026-01-15 23:51:15.520490,0 days 00:00:13.926376,30,2.5,3.6,1.7,142,BOLLINGER,PARABOLIC_SAR,1.85,33,16,13,0.035,80,24,15,0.01,81,14,13,0.048,ATR,2.4000000000000004,12,5m,SUPERTREND,False,False,False,False,False,0.42,BOLLINGER,1.85,-28.15614960720076,-75.76240283333958,-51.95927622027017,2578.494111617137,111.68661277688545,1345.0903621970112,5m,43,46,44.5,SUPERTREND,55.38422649140546,65.11627906976744,45.65217391304348,COMPLETE
642,394.72724089527037,2026-01-15 23:51:01.648154,2026-01-15 23:51:17.500552,0 days 00:00:15.852398,30,2.5,3.6,1.7,141,BOLLINGER,PARABOLIC_SAR,1.85,34,16,13,0.035,80,34,15,0.05,81,14,13,0.048,ATR,2.4000000000000004,12,3m,SUPERTREND,False,False,False,False,False,0.42,BOLLINGER,1.85,-28.154688649096656,-83.17033114316177,-55.662509896129215,2730.2192738768554,34.038244282137605,1382.1287590794964,3m,43,49,46.0,SUPERTREND,53.98671096345515,65.11627906976744,42.857142857142854,COMPLETE
643,1147.9110723614358,2026-01-15 23:51:01.879930,2026-01-15 23:51:17.746008,0 days 00:00:15.866078,30,2.4,3.6,1.7,142,BOLLINGER,PARABOLIC_SAR,1.9,34,16,13,0.035,70,34,15,0.01,81,14,13,0.048,ATR,2.4000000000000004,8,5m,SUPERTREND,False,False,False,False,False,0.54,BOLLINGER,1.9,-26.852387876079774,-75.1510858443486,-51.00173686021419,3255.0986405657673,21.658408518034314,1638.3785245419008,5m,44,52,48.0,SUPERTREND,57.95454545454545,65.9090909090909,50.0,COMPLETE
644,-1934.9913763327959,2026-01-15 23:51:11.174996,2026-01-15 23:51:24.369848,0 days 00:00:13.194852,30,2.5,3.6,1.7,141,DONCHIAN,PARABOLIC_SAR,1.9,34,16,13,0.036000000000000004,69,32,15,0.01,81,16,13,0.048,ATR,2.5,11,5m,SUPERTREND,False,False,False,False,False,0.42,DONCHIAN,1.9,-48.18624529411279,-35.42980168653095,-41.80802349032187,183.05999326824164,285.0779375419604,234.06896540510104,5m,35,25,30.0,SUPERTREND,54.285714285714285,48.57142857142857,60.0,COMPLETE
645,-2349.7665255343577,2026-01-15 23:51:13.880520,2026-01-15 23:51:23.539589,0 days 00:00:09.659069,30,2.4,3.6,1.7,141,DONCHIAN,PARABOLIC_SAR,1.9,35,16,13,0.036000000000000004,67,35,15,0.01,81,17,13,0.048,ATR,2.4000000000000004,11,4h,SUPERTREND,False,False,False,False,False,0.42,DONCHIAN,1.9,-50.27162887202522,-56.207596093959076,-53.23961248299214,86.34166467641136,12.462139805343723,49.40190224087754,4h,34,27,30.5,SUPERTREND,50.925925925925924,50.0,51.85185185185185,COMPLETE
646,634.8731657601929,2026-01-15 23:51:16.046771,2026-01-15 23:51:22.901273,0 days 00:00:06.854502,30,2.3,3.5,1.7,150,BOLLINGER,PARABOLIC_SAR,1.9,33,17,13,0.036000000000000004,70,25,15,0.01,81,17,13,0.046000000000000006,ATR,2.6,11,5m,SUPERTREND,False,False,False,False,False,0.43,BOLLINGER,1.9,-30.85044748218772,-71.92403573525722,-51.38724160872247,2415.6329106753747,97.25252569980681,1256.4427181875908,5m,49,56,52.5,SUPERTREND,59.31122448979592,63.26530612244898,55.35714285714286,COMPLETE
647,-2382.3631549535594,2026-01-15 23:51:17.029514,2026-01-15 23:51:22.360573,0 days 00:00:05.331059,30,2.3,3.5,1.7,150,DONCHIAN,PARABOLIC_SAR,1.9,134,17,13,0.036000000000000004,70,33,15,0.01,81,17,13,0.048,ATR,2.6,11,4h,SUPERTREND,False,False,False,False,False,0.43,DONCHIAN,1.9,-59.796368435236005,-58.591629785444695,-59.19399911034035,29.394774478627767,6.157871535775461,17.776323007201615,4h,36,29,32.5,SUPERTREND,49.47318007662835,47.22222222222222,51.724137931034484,COMPLETE
