number,value,datetime_start,datetime_complete,duration,params_ADX_THRESHOLD,params_ATR_MULTIPLIER,params_ATR_STOP_LOSS_MULT,params_BB_STD,params_ENTRY_PERIOD,params_ENTRY_TYPE,params_EXIT_TYPE,params_LEVERAGE,params_MA_PERIOD,params_MFI_THRESHOLD,params_MFI_WINDOW,params_RISK_PER_TRADE,params_RSI_OVERBOUGHT,params_RSI_OVERSOLD,params_RSI_WINDOW,params_SAR_STEP,params_STOCH_OVERBOUGHT,params_STOCH_OVERSOLD,params_STOCH_WINDOW,params_STOP_LOSS_PCT,params_STOP_LOSS_TYPE,params_SUPERTREND_MULT,params_SUPERTREND_PERIOD,params_TIMEFRAME,params_TREND_FILTER_TYPE,params_USE_ADX,params_USE_MFI,params_USE_RSI,params_USE_STOCHASTIC,params_USE_VHF,params_VHF_THRESHOLD,user_attrs_entry_type,user_attrs_leverage,user_attrs_mdd_BTC_USDT,user_attrs_mdd_ETH_USDT,user_attrs_mdd_avg,user_attrs_return_BTC_USDT,user_attrs_return_ETH_USDT,user_attrs_return_avg,user_attrs_timeframe,user_attrs_trades_BTC_USDT,user_attrs_trades_ETH_USDT,user_attrs_trades_avg,user_attrs_trend_filter,user_attrs_win_rate_avg,user_attrs_winrate_BTC_USDT,user_attrs_winrate_ETH_USDT,state
648,-2382.3631549535594,2026-01-15 23:51:17.609237,2026-01-15 23:51:24.385418,0 days 00:00:06.776181,28,2.3,3.5,1.7,150,DONCHIAN,PARABOLIC_SAR,1.9,23,17,13,0.036000000000000004,69,32,15,0.01,81,17,13,0.046000000000000006,ATR,2.6,11,4h,SUPERTREND,False,False,False,False,False,0.42,DONCHIAN,1.9,-59.796368435236005,-58.591629785444695,-59.19399911034035,29.394774478627767,6.157871535775461,17.776323007201615,4h,36,29,32.5,SUPERTREND,49.47318007662835,47.22222222222222,51.724137931034484,COMPLETE
649,-2372.908030445194,2026-01-15 23:51:17.822909,2026-01-15 23:51:24.729326,0 days 00:00:06.906417,30,2.3,3.6,1.7,138,DONCHIAN,PARABOLIC_SAR,1.9,23,16,13,0.036000000000000004,69,35,14,0.01,82,17,13,0.046000000000000006,ATR,2.7,7,4h,SUPERTREND,False,False,False,False,False,0.42,DONCHIAN,1.9,-54.18058291066606,-58.58968668349237,-56.38513479707922,52.71923828716956,4.92691009267522,28.82307418992239,4h,36,29,32.5,SUPERTREND,49.47318007662835,47.22222222222222,51.724137931034484,COMPLETE
650,247.6578163617578,2026-01-15 23:51:22.683800,2026-01-15 23:51:28.729410,0 days 00:00:06.045610,30,2.2,3.6,1.7,137,BOLLINGER,PARABOLIC_SAR,1.9,29,16,12,0.036000000000000004,69,34,14,0.01,82,14,13,0.046000000000000006,ATR,2.5,8,5m,SUPERTREND,False,False,False,False,False,0.41,BOLLINGER,1.9,-30.470220302681184,-81.98383881283074,-56.22702955775596,1644.3665937067653,-17.562443123579584,813.4020752915928,5m,54,60,57.0,SUPERTREND,54.72222222222223,61.111111111111114,48.333333333333336,COMPLETE
651,956.7645922823822,2026-01-15 23:51:23.311661,2026-01-15 23:51:35.195068,0 days 00:00:11.883407,30,2.4,3.6,1.7,137,BOLLINGER,PARABOLIC_SAR,1.9,29,16,13,0.036000000000000004,69,34,14,0.01,82,14,13,0.047,ATR,2.5,8,5m,SUPERTREND,False,False,False,False,False,0.54,BOLLINGER,1.9,-26.85085433999714,-83.21336055153881,-55.03210744576798,2719.364022841534,38.955345988547336,1379.1596844150406,5m,45,51,48.0,SUPERTREND,55.62091503267973,62.22222222222222,49.01960784313725,COMPLETE
652,539.3742476322259,2026-01-15 23:51:23.607629,2026-01-15 23:51:35.192018,0 days 00:00:11.584389,29,2.2,3.6,1.7,138,BOLLINGER,PARABOLIC_SAR,1.9,27,16,12,0.035,70,34,14,0.011,82,14,13,0.046000000000000006,ATR,2.5,8,5m,SUPERTREND,False,False,False,False,False,0.41,BOLLINGER,1.9,-29.765680143638555,-82.17162903874748,-55.968654591193015,1774.8307219190167,-17.824456761745004,878.5031325786358,5m,53,60,56.5,SUPERTREND,54.355345911949684,60.37735849056604,48.333333333333336,COMPLETE
653,271.28726379579166,2026-01-15 23:51:24.674547,2026-01-15 23:51:37.262090,0 days 00:00:12.587543,30,2.4,3.6,1.8,138,BOLLINGER,PARABOLIC_SAR,2.0,28,16,12,0.035,66,35,14,0.011,82,14,13,0.046000000000000006,ATR,2.5,8,5m,SUPERTREND,False,False,False,False,False,0.54,BOLLINGER,2.0,-28.257287091404187,-77.86827297055929,-53.06278003098174,2350.512228755688,50.55800187730621,1200.535115316497,5m,43,46,44.5,SUPERTREND,57.55813953488372,65.11627906976744,50.0,COMPLETE
654,-1164.4445766417857,2026-01-15 23:51:24.674547,2026-01-15 23:51:37.146577,0 days 00:00:12.472030,29,2.2,3.4000000000000004,2.4,137,BOLLINGER,PARABOLIC_SAR,2.0,28,16,12,0.035,70,25,16,0.011,82,14,13,0.047,ATR,2.5,8,5m,SUPERTREND,False,False,False,False,False,0.54,BOLLINGER,2.0,-36.83135193962115,-48.415398021536696,-42.62337498057892,304.3549723860428,87.17777250058374,195.76637244331326,5m,34,33,33.5,SUPERTREND,53.6096256684492,61.76470588235294,45.45454545454545,COMPLETE
655,-33.66267879313364,2026-01-15 23:51:25.296945,2026-01-15 23:51:40.828696,0 days 00:00:15.531751,29,2.2,3.4000000000000004,1.8,137,BOLLINGER,PARABOLIC_SAR,2.0,29,16,12,0.035,68,33,16,0.011,82,14,19,0.047,ATR,2.5,10,5m,SUPERTREND,False,False,False,False,False,0.55,BOLLINGER,2.0,-31.96326320306649,-77.04342479133688,-54.50334399720168,1149.1950450770212,48.763116915856955,598.979080996439,5m,51,55,53.0,SUPERTREND,52.90552584670232,54.90196078431373,50.90909090909091,COMPLETE
656,276.46001870250984,2026-01-15 23:51:30.159764,2026-01-15 23:51:45.476504,0 days 00:00:15.316740,29,2.4,3.4000000000000004,1.8,138,BOLLINGER,PARABOLIC_SAR,2.0,29,17,13,0.035,66,34,16,0.011,82,14,13,0.047,ATR,2.4000000000000004,8,5m,SUPERTREND,False,False,False,False,False,0.54,BOLLINGER,2.0,-28.257287091404187,-77.87147679132455,-53.064381941364374,2350.512228755688,55.50919541042328,1203.0107120830555,5m,43,46,44.5,SUPERTREND,57.55813953488372,65.11627906976744,50.0,COMPLETE
657,629.9526867770592,2026-01-15 23:51:35.802409,2026-01-15 23:51:48.423848,0 days 00:00:12.621439,29,2.4,3.4000000000000004,1.8,142,BOLLINGER,PARABOLIC_SAR,2.0,31,17,13,0.035,70,35,16,0.011,81,14,13,0.048,ATR,2.4000000000000004,10,5m,SUPERTREND,False,False,False,False,False,0.54,BOLLINGER,2.0,-28.27487426608497,-72.31361243473494,-50.29424335040996,3186.9046918522963,105.10059493150372,1646.0026433919,5m,42,45,43.5,SUPERTREND,58.888888888888886,66.66666666666666,51.11111111111111,COMPLETE
658,491.63315448862704,2026-01-15 23:51:36.818787,2026-01-15 23:51:49.056811,0 days 00:00:12.238024,29,2.4,3.4000000000000004,1.8,142,BOLLINGER,PARABOLIC_SAR,1.85,30,17,13,0.035,67,35,16,0.011,81,14,13,0.048,ATR,2.4000000000000004,10,5m,SUPERTREND,False,False,False,False,False,0.55,BOLLINGER,1.85,-26.157725120280812,-68.72862866107431,-47.44317689067756,2594.1342384572977,117.65113201361447,1355.8926852354562,5m,42,45,43.5,SUPERTREND,58.888888888888886,66.66666666666666,51.11111111111111,COMPLETE
659,789.4062376616776,2026-01-15 23:51:37.312023,2026-01-15 23:51:50.777133,0 days 00:00:13.465110,29,2.6,2.6,1.7,142,BOLLINGER,PARABOLIC_SAR,1.85,31,17,13,0.033,70,35,15,0.011,81,14,13,0.049,ATR,2.4000000000000004,12,5m,SUPERTREND,False,False,False,False,False,0.55,BOLLINGER,1.85,-27.10582441073867,-64.74235954687299,-45.92409197880583,3117.9235923843235,223.13084762039793,1670.5272200023608,5m,39,42,40.5,SUPERTREND,58.24175824175825,64.1025641025641,52.38095238095239,COMPLETE
660,510.42689181396054,2026-01-15 23:51:38.290701,2026-01-15 23:51:50.928460,0 days 00:00:12.637759,29,2.6,2.0,1.7,147,BOLLINGER,PARABOLIC_SAR,1.85,32,17,13,0.033,67,25,15,0.011,81,14,13,0.049,ATR,2.4000000000000004,10,5m,SUPERTREND,False,False,False,False,False,0.55,BOLLINGER,1.85,-27.10704186990327,-71.58081435131533,-49.3439281106093,2838.6275754002513,78.64579909594075,1458.636687248096,5m,40,46,43.0,SUPERTREND,56.413043478260875,65.0,47.82608695652174,COMPLETE
661,730.0968708841701,2026-01-15 23:51:42.722464,2026-01-15 23:52:04.539513,0 days 00:00:21.817049,29,2.6,3.7,1.7,147,BOLLINGER,PARABOLIC_SAR,1.85,24,17,13,0.033,70,35,15,0.011,81,14,13,0.049,ATR,2.4000000000000004,31,5m,SUPERTREND,False,False,False,False,False,0.55,BOLLINGER,1.85,-27.10604587953655,-71.33392394131349,-49.21998491042502,3132.190565852644,180.48525215166453,1656.3379090021542,5m,39,44,41.5,SUPERTREND,58.33333333333333,66.66666666666666,50.0,COMPLETE
662,793.5572130447945,2026-01-15 23:51:48.209550,2026-01-15 23:51:59.852706,0 days 00:00:11.643156,30,2.6,3.7,1.7,142,BOLLINGER,PARABOLIC_SAR,1.85,33,17,13,0.033,70,24,15,0.012,81,14,13,0.049,ATR,2.3,12,5m,SUPERTREND,False,False,False,False,False,0.55,BOLLINGER,1.85,-27.10582441073867,-64.74389004860747,-45.924857229673066,3117.9235923843235,226.5041382772141,1672.2138653307688,5m,39,42,40.5,SUPERTREND,58.24175824175825,64.1025641025641,52.38095238095239,COMPLETE
663,724.0029563184307,2026-01-15 23:51:50.022473,2026-01-15 23:52:05.899140,0 days 00:00:15.876667,30,2.6,2.6,1.7,147,BOLLINGER,PARABOLIC_SAR,1.85,106,17,13,0.034,71,25,15,0.012,81,14,13,0.049,ATR,2.3,12,5m,SUPERTREND,False,False,False,False,False,0.53,BOLLINGER,1.85,-27.10604587953655,-71.52710259843035,-49.31657423898345,3132.190565852644,175.573657727651,1653.8821117901475,5m,39,44,41.5,SUPERTREND,58.33333333333333,66.66666666666666,50.0,COMPLETE
664,730.0968708841701,2026-01-15 23:51:50.038730,2026-01-15 23:52:03.443148,0 days 00:00:13.404418,30,2.6,3.7,1.7,147,BOLLINGER,PARABOLIC_SAR,1.85,23,17,13,0.033,71,25,15,0.012,81,14,13,0.049,ATR,2.3,30,5m,SUPERTREND,False,False,False,False,False,0.53,BOLLINGER,1.85,-27.10604587953655,-71.33392394131349,-49.21998491042502,3132.190565852644,180.48525215166453,1656.3379090021542,5m,39,44,41.5,SUPERTREND,58.33333333333333,66.66666666666666,50.0,COMPLETE
665,841.0477036058701,2026-01-15 23:51:50.817428,2026-01-15 23:52:03.543659,0 days 00:00:12.726231,30,2.6,3.7,1.7,147,BOLLINGER,PARABOLIC_SAR,1.9500000000000002,22,17,13,0.033,67,25,15,0.012,81,16,13,0.049,ATR,2.2,30,5m,SUPERTREND,False,False,False,False,False,0.53,BOLLINGER,1.9500000000000002,-28.56856201999461,-73.87307224550159,-51.220817132748095,3647.266414509123,171.3023356207637,1909.2843750649433,5m,39,44,41.5,SUPERTREND,58.33333333333333,66.66666666666666,50.0,COMPLETE
666,641.5829174474075,2026-01-15 23:51:51.020558,2026-01-15 23:52:05.207771,0 days 00:00:14.187213,30,2.5,3.7,1.7,146,BOLLINGER,PARABOLIC_SAR,1.9500000000000002,23,17,13,0.034,71,24,14,0.012,81,16,20,0.049,ATR,2.2,13,5m,SUPERTREND,False,False,False,False,False,0.53,BOLLINGER,1.9500000000000002,-29.677773025468245,-77.29301993017582,-53.48539647782203,3118.8863534515694,166.71795771454273,1642.802155583056,5m,43,47,45.0,SUPERTREND,55.96239485403266,65.11627906976744,46.808510638297875,COMPLETE
667,646.6889001157442,2026-01-15 23:52:01.793722,2026-01-15 23:52:09.850535,0 days 00:00:08.056813,30,2.5,3.7,1.7,147,BOLLINGER,PARABOLIC_SAR,1.9500000000000002,23,19,13,0.034,71,24,14,0.012,81,16,13,0.049,ATR,2.2,13,5m,SUPERTREND,False,False,False,False,False,0.53,BOLLINGER,1.9500000000000002,-29.677773025468245,-77.20236218857977,-53.440067607024005,3129.6197681698873,168.032005689054,1648.8258869294707,5m,43,47,45.0,SUPERTREND,55.96239485403266,65.11627906976744,46.808510638297875,COMPLETE
668,65.86549845273566,2026-01-15 23:52:04.761625,2026-01-15 23:52:10.072239,0 days 00:00:05.310614,30,2.3,3.5,1.7,145,BOLLINGER,PARABOLIC_SAR,1.9500000000000002,40,19,13,0.034,79,24,14,0.012,81,14,13,0.048,ATR,2.2,13,30m,SUPERTREND,False,False,False,False,False,0.53,BOLLINGER,1.9500000000000002,-39.19644449541636,-69.58299497846164,-54.389719736939,1645.886601937421,146.99363469086822,896.4401183141446,30m,49,53,51.0,SUPERTREND,56.950327300731615,59.183673469387756,54.71698113207547,COMPLETE
669,-6.820815243348079,2026-01-15 23:52:04.764128,2026-01-15 23:52:11.221676,0 days 00:00:06.457548,28,2.3,3.5,1.7,144,BOLLINGER,PARABOLIC_SAR,1.9500000000000002,41,19,13,0.034,71,24,14,0.012,78,16,13,0.048,ATR,2.2,13,30m,SUPERTREND,False,False,False,False,False,0.53,BOLLINGER,1.9500000000000002,-39.531952367501965,-70.72382678949717,-55.12788957849956,1561.7605961880074,123.4599589219796,842.6102775549936,30m,49,53,51.0,SUPERTREND,55.9299191374663,57.14285714285714,54.71698113207547,COMPLETE
670,-1247.21857392117,2026-01-15 23:52:04.810371,2026-01-15 23:52:17.173414,0 days 00:00:12.363043,30,2.3,3.5,1.7,145,BOLLINGER,PARABOLIC_SAR,1.9500000000000002,142,19,13,0.034,71,24,14,0.012,81,16,13,0.048,ATR,2.2,13,3m,SUPERTREND,False,False,True,False,False,0.53,BOLLINGER,1.9500000000000002,-44.20095328079946,-80.39238253517938,-62.296667907989416,337.3841868254919,17.888924728240887,177.6365557768664,3m,33,38,35.5,SUPERTREND,50.75757575757576,51.515151515151516,50.0,COMPLETE
671,50.53274820886509,2026-01-15 23:52:05.729449,2026-01-15 23:52:11.571470,0 days 00:00:05.842021,30,2.3,3.5,1.7,144,BOLLINGER,PARABOLIC_SAR,2.05,104,18,13,0.034,68,25,14,0.012,81,16,13,0.048,ATR,2.2,13,30m,SUPERTREND,False,False,False,False,False,0.53,BOLLINGER,2.05,-41.2565824457017,-73.56790044620804,-57.412241445954876,1721.2175450623736,115.13364739091405,918.1755962266438,30m,49,53,51.0,SUPERTREND,55.9299191374663,57.14285714285714,54.71698113207547,COMPLETE
672,-845.3177461004861,2026-01-15 23:52:05.952594,2026-01-15 23:52:13.968234,0 days 00:00:08.015640,28,2.3,3.5,1.7,143,BOLLINGER,PARABOLIC_SAR,2.05,40,18,13,0.034,79,24,14,0.012,81,15,13,0.048,ATR,2.7,13,30m,SUPERTREND,False,False,True,False,False,0.44,BOLLINGER,2.05,-48.82287500679829,-78.82278399771053,-63.82282950225441,1011.1010828716553,19.216668786585984,515.1588758291207,30m,41,39,40.0,SUPERTREND,53.68980612883052,56.09756097560976,51.28205128205128,COMPLETE
673,-929.0177732700777,2026-01-15 23:52:10.411498,2026-01-15 23:52:26.629364,0 days 00:00:16.217866,28,2.3,3.3000000000000003,1.7,143,BOLLINGER,PARABOLIC_SAR,1.9,41,18,13,0.035,78,25,14,0.01,81,15,13,0.048,ATR,2.6,14,5m,SUPERTREND,False,False,True,False,False,0.44,BOLLINGER,1.9,-43.07571235940579,-70.02206323664926,-56.54888779802752,716.2895594631386,83.63175539327091,399.96065742820474,5m,38,41,39.5,SUPERTREND,57.092426187419775,60.526315789473685,53.65853658536586,COMPLETE
674,1257.809073462544,2026-01-15 23:52:10.662552,2026-01-15 23:52:24.534008,0 days 00:00:13.871456,28,2.4,3.3000000000000003,1.7,140,BOLLINGER,PARABOLIC_SAR,1.9,36,18,13,0.035,79,33,15,0.01,81,15,13,0.047,ATR,2.6,14,3m,SUPERTREND,False,False,False,False,False,0.54,BOLLINGER,1.9,-27.632710576952103,-84.33052271077271,-55.98161664386241,3566.435684841454,44.54695146470712,1805.4913181530806,3m,44,53,48.5,SUPERTREND,56.34648370497427,63.63636363636363,49.056603773584904,COMPLETE
675,-2957.055926181241,2026-01-15 23:52:11.714695,2026-01-15 23:52:26.235536,0 days 00:00:14.520841,28,2.4,1.3,1.7,150,BOLLINGER,PARABOLIC_SAR,1.9,36,18,13,0.035,79,25,14,0.01,81,15,13,0.047,ATR,2.7,14,5m,SUPERTREND,False,False,True,False,True,0.44,BOLLINGER,1.9,-55.683460434554334,-52.13902596046606,-53.911243197510196,59.540539716895665,-27.890754501574428,15.824892607660619,5m,29,21,25.0,SUPERTREND,46.633825944170766,55.172413793103445,38.095238095238095,COMPLETE
676,1159.7934147167061,2026-01-15 23:52:11.845913,2026-01-15 23:52:27.175556,0 days 00:00:15.329643,30,2.4,3.3000000000000003,1.7,150,BOLLINGER,PARABOLIC_SAR,1.9,35,18,13,0.035,69,33,14,0.01,81,15,13,0.047,ATR,2.7,14,5m,SUPERTREND,False,False,False,False,False,0.44,BOLLINGER,1.9,-26.853093204380237,-78.635676957403,-52.74438508089162,3285.5875291091415,23.002825003661496,1654.2951770564016,5m,44,54,49.0,SUPERTREND,59.090909090909086,68.18181818181817,50.0,COMPLETE
677,-3008.064979680407,2026-01-15 23:52:14.423400,2026-01-15 23:52:35.639603,0 days 00:00:21.216203,30,4.7,3.3000000000000003,1.8,150,BOLLINGER,PARABOLIC_SAR,1.9,36,18,13,0.035,69,22,15,0.01,81,13,13,0.047,ATR,2.9000000000000004,7,3m,SUPERTREND,False,False,False,True,True,0.54,BOLLINGER,1.9,-35.685686096046496,-77.70004679018388,-56.692866443115186,258.3003858757342,-77.32972807083833,90.48532890244795,3m,6,6,6.0,SUPERTREND,49.99999999999999,66.66666666666666,33.33333333333333,COMPLETE
678,-2823.434036614519,2026-01-15 23:52:19.235010,2026-01-15 23:52:39.498147,0 days 00:00:20.263137,30,2.4,3.3000000000000003,1.8,140,BOLLINGER,PARABOLIC_SAR,1.9,35,18,13,0.035,78,21,15,0.01,81,13,13,0.047,ATR,2.6,14,5m,SUPERTREND,False,False,False,True,True,0.54,BOLLINGER,1.9,-20.92029311284241,-57.853408560617545,-39.38685083672998,71.81961407865747,-58.83434058346585,6.492636747595807,5m,11,8,9.5,SUPERTREND,44.31818181818181,63.63636363636363,25.0,COMPLETE
679,-2824.341130092786,2026-01-15 23:52:25.298399,2026-01-15 23:52:44.641053,0 days 00:00:19.342654,30,2.4,3.3000000000000003,1.8,140,BOLLINGER,PARABOLIC_SAR,1.9,16,18,13,0.035,79,25,15,0.01,78,15,13,0.047,ATR,2.6,14,3m,SUPERTREND,False,False,False,True,True,0.54,BOLLINGER,1.9,-21.846463914598896,-64.21222230594334,-43.02934311027112,75.95798842359136,-65.09668727980895,5.430650571891206,3m,11,7,9.0,SUPERTREND,38.96103896103896,63.63636363636363,14.285714285714285,COMPLETE
680,-1482.0182000127907,2026-01-15 23:52:26.544177,2026-01-15 23:52:44.603874,0 days 00:00:18.059697,30,2.5,3.3000000000000003,1.8,140,BOLLINGER,PARABOLIC_SAR,1.9,15,18,13,0.036000000000000004,79,25,15,0.011,78,15,13,0.05,ATR,3.0,14,3m,ICHIMOKU,False,False,False,True,False,0.54,BOLLINGER,1.9,-71.50247903328413,-87.13223286468643,-79.31735594898528,67.46452156701984,-38.666292780358866,14.399114393330489,3m,36,40,38.0,ICHIMOKU,50.0,50.0,50.0,COMPLETE
681,-1997.7045329219663,2026-01-15 23:52:26.696532,2026-01-15 23:52:46.895712,0 days 00:00:20.199180,26,2.5,3.4000000000000004,1.8,139,BOLLINGER,PARABOLIC_SAR,1.9,16,18,13,0.035,79,25,15,0.011,78,15,13,0.05,ATR,2.9000000000000004,6,3m,SUPERTREND,False,False,False,True,False,0.54,BOLLINGER,1.9,-23.702124867854003,-70.0755941013382,-46.8888594845961,835.1545015418736,66.2751022363527,450.7148018891132,3m,23,24,23.5,SUPERTREND,57.518115942028984,60.86956521739131,54.166666666666664,COMPLETE
682,-975.6855723346116,2026-01-15 23:52:27.493394,2026-01-15 23:52:46.883507,0 days 00:00:19.390113,30,2.0,3.3000000000000003,1.8,27,KELTNER,PARABOLIC_SAR,1.9,36,18,12,0.037,80,34,14,0.01,81,15,13,0.046000000000000006,ATR,2.8,14,3m,ICHIMOKU,False,False,False,True,False,0.54,KELTNER,1.9,-57.456934354901236,-94.76377199962528,-76.11035317726325,-42.877641508427104,-95.33695833102377,-69.10729991972543,3m,84,87,85.5,ICHIMOKU,39.162561576354676,38.095238095238095,40.229885057471265,COMPLETE
683,-2445.6199436039346,2026-01-15 23:52:38.509587,2026-01-15 23:53:03.752155,0 days 00:00:25.242568,30,2.5,3.3000000000000003,1.8,140,KELTNER,PARABOLIC_SAR,1.9,37,18,12,0.036000000000000004,71,23,14,0.01,81,15,13,0.046000000000000006,ATR,2.7,6,3m,ICHIMOKU,False,False,False,False,False,0.54,KELTNER,1.9,-67.03837151891044,-109.00432280406223,-88.02134716148633,441.60167488899117,-109.17532280406223,166.21317604246445,3m,95,1,48.0,ICHIMOKU,22.63157894736842,45.26315789473684,0.0,COMPLETE
684,-2473.782944727862,2026-01-15 23:52:41.161271,2026-01-15 23:53:07.172488,0 days 00:00:26.011217,30,2.5,3.3000000000000003,1.8,150,KELTNER,PARABOLIC_SAR,1.9500000000000002,38,18,12,0.036000000000000004,78,33,14,0.011,82,15,13,0.045000000000000005,ATR,2.8,6,3m,ICHIMOKU,False,False,False,False,False,0.54,KELTNER,1.9500000000000002,-69.51216713708244,-111.87285761469548,-90.69251237588895,337.4556041167936,-112.04835761469548,112.70362325104907,3m,95,1,48.0,ICHIMOKU,23.157894736842106,46.31578947368421,0.0,COMPLETE
685,-2300.0,2026-01-15 23:52:44.983689,2026-01-15 23:53:06.565712,0 days 00:00:21.582023,29,2.5,3.2,1.7,150,KELTNER,PARABOLIC_SAR,1.9500000000000002,38,19,12,0.036000000000000004,80,34,14,0.011,77,15,13,0.046000000000000006,ATR,2.9000000000000004,11,3m,SUPERTREND,False,False,False,False,False,0.44999999999999996,KELTNER,1.9500000000000002,0.0,0.0,0.0,0.0,0.0,0.0,3m,0,0,0.0,SUPERTREND,0.0,0.0,0.0,COMPLETE
686,750.4684184494936,2026-01-15 23:52:45.015795,2026-01-15 23:53:01.519322,0 days 00:00:16.503527,29,2.5,3.2,1.7,150,BOLLINGER,PARABOLIC_SAR,1.9500000000000002,39,19,12,0.036000000000000004,80,32,14,0.011,77,15,13,0.045000000000000005,ATR,2.8,11,3m,SUPERTREND,False,False,False,False,False,0.44999999999999996,BOLLINGER,1.9500000000000002,-29.67714829693861,-80.32843582759237,-55.00279206226549,3640.202218607994,124.25403220655211,1882.228125407273,3m,43,49,46.0,SUPERTREND,54.864736592311345,62.7906976744186,46.93877551020408,COMPLETE
687,1148.5275319555703,2026-01-15 23:52:46.987754,2026-01-15 23:53:08.225900,0 days 00:00:21.238146,30,2.2,3.4000000000000004,1.7,150,BOLLINGER,PARABOLIC_SAR,1.9500000000000002,42,19,12,0.036000000000000004,69,34,14,0.011,82,15,13,0.046000000000000006,ATR,2.7,11,3m,SUPERTREND,False,False,False,False,False,0.44999999999999996,BOLLINGER,1.9500000000000002,-26.35437956831892,-77.0135604305588,-51.68396999943886,2865.3435766127654,52.579374802326825,1458.9614757075462,3m,53,61,57.0,SUPERTREND,59.12465202598206,64.15094339622641,54.09836065573771,COMPLETE
688,-552.2402486839956,2026-01-15 23:52:47.012908,2026-01-15 23:53:10.832170,0 days 00:00:23.819262,30,2.2,3.4000000000000004,2.0,148,BOLLINGER,PARABOLIC_SAR,1.9500000000000002,41,19,12,0.036000000000000004,80,33,14,0.011,82,15,13,0.046000000000000006,ATR,2.8,11,3m,SUPERTREND,False,False,False,False,False,0.44,BOLLINGER,1.9500000000000002,-33.7060633975089,-58.44748550611454,-46.076774451811715,999.6620940963171,174.68237885784097,587.1722364770791,3m,47,45,46.0,SUPERTREND,57.565011820330966,59.57446808510638,55.55555555555556,COMPLETE
689,-2623.8424670611225,2026-01-15 23:53:02.329262,2026-01-15 23:53:16.161667,0 days 00:00:13.832405,30,3.5,3.4000000000000004,2.0,148,BOLLINGER,PARABOLIC_SAR,1.9500000000000002,42,19,13,0.036000000000000004,69,33,14,0.011,82,15,13,0.046000000000000006,ATR,2.7,12,3m,SUPERTREND,False,False,False,False,False,0.44,BOLLINGER,1.9500000000000002,-33.60080984064188,-87.46472893019252,-60.5327693854172,436.2897049052397,-1.7804777452935465,217.2546135799731,3m,29,25,27.0,SUPERTREND,53.862068965517246,51.724137931034484,56.00000000000001,COMPLETE
