number,value,datetime_start,datetime_complete,duration,params_ADX_THRESHOLD,params_ATR_MULTIPLIER,params_ATR_STOP_LOSS_MULT,params_BB_STD,params_ENTRY_PERIOD,params_ENTRY_TYPE,params_EXIT_TYPE,params_LEVERAGE,params_MA_PERIOD,params_MFI_THRESHOLD,params_MFI_WINDOW,params_RISK_PER_TRADE,params_RSI_OVERBOUGHT,params_RSI_OVERSOLD,params_RSI_WINDOW,params_SAR_STEP,params_STOCH_OVERBOUGHT,params_STOCH_OVERSOLD,params_STOCH_WINDOW,params_STOP_LOSS_PCT,params_STOP_LOSS_TYPE,params_SUPERTREND_MULT,params_SUPERTREND_PERIOD,params_TIMEFRAME,params_TREND_FILTER_TYPE,params_USE_ADX,params_USE_MFI,params_USE_RSI,params_USE_STOCHASTIC,params_USE_VHF,params_VHF_THRESHOLD,user_attrs_entry_type,user_attrs_leverage,user_attrs_mdd_BTC_USDT,user_attrs_mdd_ETH_USDT,user_attrs_mdd_avg,user_attrs_return_BTC_USDT,user_attrs_return_ETH_USDT,user_attrs_return_avg,user_attrs_timeframe,user_attrs_trades_BTC_USDT,user_attrs_trades_ETH_USDT,user_attrs_trades_avg,user_attrs_trend_filter,user_attrs_win_rate_avg,user_attrs_winrate_BTC_USDT,user_attrs_winrate_ETH_USDT,state
90,-534.2281431685215,2026-01-15 23:32:40.798158,2026-01-15 23:33:04.197494,0 days 00:00:23.399336,16,2.2,2.1,1.7,95,KELTNER,ATR,1.45,195,23,20,0.011,76,32,11,0.035,82,17,14,0.015,ATR,4.300000000000001,39,3m,HMA,True,True,False,False,False,0.59,KELTNER,1.45,-50.052738071101686,-97.02255227483644,-73.53764517296906,602.979450786197,-95.89296189003504,253.543244448081,3m,103,121,112.0,HMA,44.5197785444917,48.54368932038835,40.49586776859504,COMPLETE
91,-565.1442922962624,2026-01-15 23:32:40.814539,2026-01-15 23:33:07.838339,0 days 00:00:27.023800,11,2.2,2.5,2.0,95,KELTNER,ATR,1.15,194,23,20,0.014,76,30,11,0.034,82,24,14,0.014,ATR,4.300000000000001,39,3m,HMA,True,True,False,False,False,0.59,KELTNER,1.15,-41.67474773547883,-89.43159237125352,-65.55317005336617,487.5393864406661,-84.78280581757008,201.378290311548,3m,106,126,116.0,HMA,44.21982629529799,47.16981132075472,41.269841269841265,COMPLETE
92,-841.3406599619966,2026-01-15 23:32:45.336393,2026-01-15 23:33:05.629625,0 days 00:00:20.293232,17,2.2,2.5,2.3,67,KELTNER,ATR,1.45,175,28,20,0.014,79,32,15,0.049,75,24,14,0.014,ATR,4.300000000000001,13,3m,HMA,False,True,False,False,False,0.59,KELTNER,1.45,-58.59357099325248,-82.87715696773662,-70.73536398049455,161.95874283382398,-77.45005386032769,42.254344486748145,3m,112,118,115.0,HMA,43.97699757869249,46.42857142857143,41.52542372881356,COMPLETE
93,-2770.762854295002,2026-01-15 23:32:49.256458,2026-01-15 23:33:10.948717,0 days 00:00:21.692259,13,5.0,2.4000000000000004,2.0,64,KELTNER,ATR,1.15,197,21,20,0.012,79,30,10,0.05,82,15,10,0.014,ATR,4.300000000000001,39,3m,HMA,False,True,False,True,False,0.6,KELTNER,1.15,-62.04926486276897,-88.83325344254436,-75.44125915265667,13.177889702069223,-80.73159378794526,-33.77685204293802,3m,41,24,32.5,HMA,32.52032520325203,31.70731707317073,33.33333333333333,COMPLETE
94,-877.9350460171463,2026-01-15 23:32:49.269887,2026-01-15 23:33:10.821830,0 days 00:00:21.551943,14,2.2,2.5,2.0,94,KELTNER,ATR,1.2,196,21,21,0.012,71,30,10,0.034,75,15,10,0.014,ATR,4.300000000000001,38,3m,HMA,False,True,False,True,False,0.5800000000000001,KELTNER,1.2,-57.00550053116956,-78.6065281966574,-67.80601436391348,127.18791014146325,-62.55832337447945,32.3147933834919,3m,79,87,83.0,HMA,45.37319947621126,49.36708860759494,41.37931034482759,COMPLETE
95,-905.4102267672897,2026-01-15 23:33:02.554171,2026-01-15 23:33:24.885444,0 days 00:00:22.331273,13,2.2,2.5,2.1,64,KELTNER,ATR,1.15,199,23,21,0.012,78,30,10,0.034,75,15,10,0.013000000000000001,ATR,4.4,39,3m,HMA,False,True,False,True,False,0.6,KELTNER,1.15,-60.86025597013411,-76.15806823357426,-68.50916210185419,49.28528353479707,-63.73971043275654,-7.227213448979736,3m,83,80,81.5,HMA,41.64156626506024,45.78313253012048,37.5,COMPLETE
96,-816.2109047448803,2026-01-15 23:33:05.298827,2026-01-15 23:33:26.294509,0 days 00:00:20.995682,14,2.5,2.5,1.7,63,KELTNER,ATR,1.15,197,23,21,0.012,76,34,10,0.033,82,15,10,0.014,ATR,4.4,40,3m,HMA,True,True,False,False,False,0.6,KELTNER,1.15,-62.95296142576604,-77.47172825517937,-70.21234484047271,201.780373140287,-64.93983765474422,68.42026774277139,3m,95,98,96.5,HMA,42.03544575725027,46.31578947368421,37.755102040816325,COMPLETE
97,-885.4526491599418,2026-01-15 23:33:07.545854,2026-01-15 23:33:26.127574,0 days 00:00:18.581720,14,2.4,2.4000000000000004,1.7,61,KELTNER,ATR,1.15,196,21,21,0.012,76,30,10,0.034,82,15,10,0.013000000000000001,ATR,4.4,35,3m,HMA,True,True,False,False,False,0.6,KELTNER,1.15,-63.02558269399488,-73.78329162593586,-68.40443715996537,76.08691005831145,-55.06680424718883,10.51005290556131,3m,102,104,103.0,HMA,41.76093514328809,43.13725490196079,40.38461538461539,COMPLETE
98,-719.3765559532549,2026-01-15 23:33:09.121650,2026-01-15 23:33:32.390525,0 days 00:00:23.268875,14,2.5,2.5,1.7,93,KELTNER,ATR,1.2,195,21,21,0.013000000000000001,77,32,10,0.033,82,23,10,0.013000000000000001,ATR,4.4,39,3m,HMA,True,True,False,True,False,0.56,KELTNER,1.2,-47.602793588421825,-75.29380114531202,-61.448297366866925,348.1515062527051,-15.9657928563528,166.09285669817615,3m,68,74,71.0,HMA,43.85930047694754,48.529411764705884,39.189189189189186,COMPLETE
99,-553.3738864700326,2026-01-15 23:33:10.943976,2026-01-15 23:33:33.376566,0 days 00:00:22.432590,12,2.5,2.9000000000000004,1.7,97,KELTNER,ATR,1.15,193,22,21,0.013000000000000001,76,30,10,0.033,82,25,11,0.018000000000000002,ATR,4.2,35,3m,HMA,True,True,False,False,False,0.55,KELTNER,1.15,-56.56339826378585,-73.74381668122099,-65.15360747250342,597.2390458366248,-26.42044809938129,285.40929886862176,3m,87,102,94.5,HMA,44.979716024340775,51.724137931034484,38.23529411764706,COMPLETE
100,-520.1433778559986,2026-01-15 23:33:11.581427,2026-01-15 23:33:33.453896,0 days 00:00:21.872469,12,2.5,2.9000000000000004,1.9,98,DONCHIAN,ATR,1.15,175,23,21,0.013000000000000001,76,31,11,0.033,82,25,11,0.018000000000000002,ATR,4.4,35,3m,HMA,True,True,False,False,False,0.55,DONCHIAN,1.15,-19.588120799579528,-33.11297425888226,-26.350547529230894,195.7398605092973,273.5246867542648,234.63227363178106,3m,44,35,39.5,HMA,56.13636363636364,52.27272727272727,60.0,COMPLETE
101,-2088.4055081872293,2026-01-15 23:33:26.274830,2026-01-15 23:33:35.966303,0 days 00:00:09.691473,12,2.5,2.7,1.6,100,DONCHIAN,PARABOLIC_SAR,1.4,175,22,20,0.014,78,32,11,0.031,83,25,11,0.018000000000000002,ATR,5.0,34,30m,SUPERTREND,True,True,False,False,True,0.55,DONCHIAN,1.4,-25.626903011477825,-29.62388948219619,-27.625396246837006,19.351269427315124,42.248505780897894,30.79988760410651,30m,14,10,12.0,SUPERTREND,72.14285714285714,64.28571428571429,80.0,COMPLETE
102,-2949.4592390735643,2026-01-15 23:33:26.317254,2026-01-15 23:33:37.576541,0 days 00:00:11.259287,12,5.8,2.7,1.5,94,DONCHIAN,PARABOLIC_SAR,1.55,193,22,20,0.014,78,32,11,0.03,83,25,11,0.017,ATR,4.9,33,3m,SUPERTREND,True,True,False,False,True,0.55,DONCHIAN,1.55,-39.53800184648224,-32.6823773208552,-36.11018958366872,25.334534282724558,6.034230368900998,15.684382325812777,3m,9,6,7.5,SUPERTREND,52.77777777777778,55.55555555555556,50.0,COMPLETE
103,-2088.4055081872293,2026-01-15 23:33:28.511590,2026-01-15 23:33:35.063836,0 days 00:00:06.552246,11,2.5,2.7,1.9,99,DONCHIAN,PARABOLIC_SAR,1.4,191,22,20,0.014,78,32,11,0.036000000000000004,81,25,11,0.018000000000000002,ATR,4.9,35,30m,HMA,True,True,False,False,True,0.55,DONCHIAN,1.4,-25.626903011477825,-29.62388948219619,-27.625396246837006,19.351269427315124,42.248505780897894,30.79988760410651,30m,14,10,12.0,HMA,72.14285714285714,64.28571428571429,80.0,COMPLETE
104,-2221.005531201942,2026-01-15 23:33:33.802011,2026-01-15 23:33:48.211865,0 days 00:00:14.409854,12,2.6,2.9000000000000004,1.6,96,DONCHIAN,ATR,1.05,189,22,21,0.013000000000000001,76,32,11,0.03,83,25,11,0.018000000000000002,ATR,4.9,34,30m,HMA,True,True,False,True,False,0.56,DONCHIAN,1.05,-37.315255911803746,-35.394880235732046,-36.355068073767896,11.758805675725755,113.2737762338219,62.51629095477383,30m,31,23,27.0,HMA,49.22861150070126,41.935483870967744,56.52173913043478,COMPLETE
105,-2512.145411385624,2026-01-15 23:33:33.804010,2026-01-15 23:33:46.364397,0 days 00:00:12.560387,12,2.6,3.1,1.6,98,DONCHIAN,ATR,1.05,191,22,21,0.01,76,32,11,0.031,83,25,11,0.018000000000000002,ATR,4.9,35,3m,SUPERTREND,True,True,False,True,False,0.55,DONCHIAN,1.05,-33.98172313712692,-25.163486365601358,-29.57260475136414,37.940430272835286,88.74367302250599,63.34205164767064,3m,29,20,24.5,SUPERTREND,50.689655172413794,41.37931034482759,60.0,COMPLETE
106,-2444.819155896256,2026-01-15 23:33:33.804010,2026-01-15 23:33:39.978507,0 days 00:00:06.174497,12,2.6,2.9000000000000004,1.6,97,DONCHIAN,ATR,1.05,190,22,21,0.013000000000000001,76,31,11,0.03,83,23,11,0.018000000000000002,ATR,4.9,34,30m,SUPERTREND,True,True,False,True,False,0.55,DONCHIAN,1.05,-35.64596274413618,-19.707616910863972,-27.676789827500073,15.881854284156416,101.31306260683692,58.59745844549667,30m,29,19,24.0,SUPERTREND,52.26860254083485,41.37931034482759,63.1578947368421,COMPLETE
107,-2225.381110339043,2026-01-15 23:33:36.308369,2026-01-15 23:33:53.923011,0 days 00:00:17.614642,12,2.9000000000000004,2.9000000000000004,1.6,97,DONCHIAN,ATR,1.05,190,22,21,0.013000000000000001,76,31,11,0.03,82,23,11,0.02,ATR,4.800000000000001,36,3m,EMA,True,True,False,True,False,0.56,DONCHIAN,1.05,-35.503102210846514,-45.63980005234127,-40.57145113159389,4.530650297654583,132.14142836240848,68.33603933003153,3m,31,21,26.0,EMA,54.3010752688172,41.935483870967744,66.66666666666666,COMPLETE
108,-2889.953361875057,2026-01-15 23:33:36.313861,2026-01-15 23:33:50.685225,0 days 00:00:14.371364,12,2.9000000000000004,2.9000000000000004,1.6,113,DONCHIAN,ATR,1.2,191,23,21,0.013000000000000001,76,31,11,0.03,82,23,11,0.02,ATR,4.800000000000001,32,3m,EMA,True,True,False,True,False,0.56,DONCHIAN,1.2,-42.64806109773654,-51.76215572961071,-47.20510841367363,4.57929488832897,123.32640142376363,63.9528481560463,3m,29,19,24.0,EMA,52.26860254083485,41.37931034482759,63.1578947368421,COMPLETE
109,-2220.704345328166,2026-01-15 23:33:38.585469,2026-01-15 23:33:56.320886,0 days 00:00:17.735417,15,2.9000000000000004,3.1,1.8,109,DONCHIAN,ATR,1.2,193,19,21,0.013000000000000001,76,31,11,0.033,82,23,11,0.022,ATR,3.9000000000000004,36,3m,EMA,True,True,False,True,False,0.56,DONCHIAN,1.2,-40.03505988948152,-51.77524206307277,-45.90515097627714,9.271551472098102,144.70905489933463,76.99030318571637,3m,30,19,24.5,EMA,53.24561403508772,43.333333333333336,63.1578947368421,COMPLETE
110,-2187.1840620039343,2026-01-15 23:33:41.755604,2026-01-15 23:34:01.045366,0 days 00:00:19.289762,10,2.8,3.0,1.8,118,DONCHIAN,ATR,1.2,169,19,21,0.01,77,31,10,0.033,82,24,11,0.022,ATR,4.2,38,3m,EMA,True,True,False,True,False,0.56,DONCHIAN,1.2,-37.41995941454288,-36.43256691031207,-36.926263162427475,13.96351705877101,143.63490201803629,78.79920953840364,3m,30,19,24.5,EMA,51.578947368421055,40.0,63.1578947368421,COMPLETE
111,-856.2895990920415,2026-01-15 23:33:47.296554,2026-01-15 23:34:07.863533,0 days 00:00:20.566979,10,2.3,2.9000000000000004,1.8,87,KELTNER,ATR,1.25,186,19,21,0.013000000000000001,76,31,10,0.032,82,24,14,0.02,ATR,3.9000000000000004,36,3m,HMA,True,True,False,True,False,0.56,KELTNER,1.25,-46.72285169313754,-78.65314466208152,-62.68799817760953,136.55657675635155,-53.40660853659108,41.57498410988023,3m,74,86,80.0,HMA,40.32055311125079,44.5945945945946,36.04651162790697,COMPLETE
112,-2300.0,2026-01-15 23:33:50.679215,2026-01-15 23:34:11.316564,0 days 00:00:20.637349,15,2.9000000000000004,3.1,1.8,112,KELTNER,ATR,1.25,169,18,21,0.011,75,31,10,0.033,82,24,14,0.022,ATR,3.9000000000000004,31,3m,EMA,True,True,False,False,False,0.53,KELTNER,1.25,0.0,0.0,0.0,0.0,0.0,0.0,3m,0,0,0.0,EMA,0.0,0.0,0.0,COMPLETE
113,-681.2226703972929,2026-01-15 23:33:51.736760,2026-01-15 23:34:13.427205,0 days 00:00:21.690445,10,2.3,3.0,1.8,110,KELTNER,ATR,1.25,169,24,20,0.011,75,31,10,0.032,81,24,14,0.022,ATR,4.0,38,3m,HMA,True,True,False,False,False,0.53,KELTNER,1.25,-45.85151502131147,-88.47752623799131,-67.16452062965139,365.08379893119934,-66.70311472985941,149.19034210066997,3m,108,115,111.5,HMA,44.01771336553945,46.2962962962963,41.73913043478261,COMPLETE
114,-2300.0,2026-01-15 23:33:55.210915,2026-01-15 23:34:13.383996,0 days 00:00:18.173081,15,2.3,3.3000000000000003,1.7,87,KELTNER,ATR,1.25,168,24,20,0.011,75,31,10,0.033,81,24,14,0.022,ATR,4.2,38,3m,TEMA,True,True,False,False,False,0.52,KELTNER,1.25,0.0,0.0,0.0,0.0,0.0,0.0,3m,0,0,0.0,TEMA,0.0,0.0,0.0,COMPLETE
115,-2300.0,2026-01-15 23:33:56.443723,2026-01-15 23:34:14.610595,0 days 00:00:18.166872,15,2.3,3.3000000000000003,1.7,103,KELTNER,ATR,1.25,176,21,20,0.011,77,31,10,0.033,81,24,12,0.01,ATR,4.2,38,3m,TEMA,True,True,False,False,False,0.53,KELTNER,1.25,0.0,0.0,0.0,0.0,0.0,0.0,3m,0,0,0.0,TEMA,0.0,0.0,0.0,COMPLETE
116,-740.4945892236055,2026-01-15 23:34:02.059064,2026-01-15 23:34:15.424203,0 days 00:00:13.365139,15,2.3,2.1,1.7,87,KELTNER,ATR,1.25,178,21,20,0.011,77,30,10,0.032,81,24,14,0.017,ATR,4.2,41,3m,HMA,True,True,False,False,False,0.52,KELTNER,1.25,-51.78385019847121,-67.08607173958994,-59.43496096903057,238.00934109428346,0.5402771531399573,119.2748091237117,3m,106,115,110.5,HMA,43.51107465135357,45.28301886792453,41.73913043478261,COMPLETE
117,-715.5168905781875,2026-01-15 23:34:08.422391,2026-01-15 23:34:24.421418,0 days 00:00:15.999027,15,2.0,2.1,1.7,92,KELTNER,ATR,1.25,176,24,20,0.011,77,30,12,0.036000000000000004,81,17,10,0.017,ATR,4.6,41,3m,HMA,True,True,False,False,False,0.53,KELTNER,1.25,-50.16312201258488,-74.36852616431108,-62.26582408844798,235.78339123076896,-43.32393221914888,96.22972950581004,3m,132,141,136.5,HMA,42.91586073500967,44.696969696969695,41.13475177304964,COMPLETE
118,-591.861229558267,2026-01-15 23:34:13.355673,2026-01-15 23:34:24.113645,0 days 00:00:10.757972,13,2.4,3.3000000000000003,1.7,103,KELTNER,ATR,1.35,178,24,20,0.04,77,30,12,0.036000000000000004,81,17,10,0.01,ATR,4.2,41,3m,HMA,True,True,False,False,False,0.59,KELTNER,1.35,-47.500467140332844,-93.98752745324398,-70.74399729678842,517.4603180297177,-72.4314842819502,222.51441687388373,3m,94,107,100.5,HMA,44.36766752833565,45.744680851063826,42.99065420560748,COMPLETE
119,-699.5808974737729,2026-01-15 23:34:13.611646,2026-01-15 23:34:28.571184,0 days 00:00:14.959538,11,2.1,2.1,1.7,103,KELTNER,ATR,1.1,176,23,20,0.01,74,30,12,0.035,80,17,10,0.01,ATR,4.6,41,3m,HMA,True,True,False,False,False,0.59,KELTNER,1.1,-38.370646819802275,-76.32566977464835,-57.34815829722531,233.52779040819422,-59.13052007219341,87.19863516800041,3m,122,139,130.5,HMA,44.27408892558084,47.540983606557376,41.007194244604314,COMPLETE
120,-771.5136514902988,2026-01-15 23:34:13.626901,2026-01-15 23:34:23.202452,0 days 00:00:09.575551,11,2.4,2.1,1.7,92,KELTNER,ATR,1.0,177,23,20,0.01,74,30,12,0.035,80,16,10,0.01,ATR,4.6,40,2h,HMA,True,True,False,False,False,0.59,KELTNER,1.0,-42.28625572553252,-51.8308433929686,-47.058549559250565,144.87144247077893,25.243627711852362,85.05753509131564,2h,92,103,97.5,HMA,43.757914731954415,46.73913043478261,40.77669902912621,COMPLETE
121,-712.6941910643136,2026-01-15 23:34:14.666513,2026-01-15 23:34:28.399970,0 days 00:00:13.733457,11,2.0,2.1,1.9,82,KELTNER,ATR,1.0,179,23,20,0.01,75,30,12,0.039,80,17,10,0.013000000000000001,ATR,4.6,41,3m,HMA,True,True,False,False,False,0.5800000000000001,KELTNER,1.0,-44.21967590497118,-77.75230520772028,-60.98599055634573,218.39952502802208,-39.14036417014934,89.62958042893638,3m,136,140,138.0,HMA,44.22268907563025,45.588235294117645,42.857142857142854,COMPLETE
122,-691.3887133581047,2026-01-15 23:34:18.039437,2026-01-15 23:34:31.609177,0 days 00:00:13.569740,13,2.0,3.0,1.7,92,BOLLINGER,ATR,1.15,179,23,20,0.01,77,30,12,0.028000000000000004,81,17,15,0.013000000000000001,ATR,4.4,41,2h,HMA,True,True,False,False,False,0.54,BOLLINGER,1.15,-45.80065309962438,-55.531272849483045,-50.66596297455371,72.81545600297358,236.1239061724894,154.4696810877315,2h,92,81,86.5,HMA,44.50483091787439,44.565217391304344,44.44444444444444,COMPLETE
123,-377.911485269442,2026-01-15 23:34:23.300571,2026-01-15 23:34:38.163659,0 days 00:00:14.863088,13,2.0,3.0,2.1,93,BOLLINGER,ATR,1.35,172,24,20,0.016,77,29,12,0.028000000000000004,81,17,15,0.017,ATR,4.0,41,3m,HMA,True,True,False,False,False,0.54,BOLLINGER,1.35,-31.195778431416983,-59.36591647157897,-45.280847451497976,186.0885947055811,597.667763546081,391.878179125831,3m,71,69,70.0,HMA,51.500306184935695,46.478873239436616,56.52173913043478,COMPLETE
124,-652.4823165865082,2026-01-15 23:34:24.439226,2026-01-15 23:34:42.752356,0 days 00:00:18.313130,16,2.0,3.6,1.7,93,BOLLINGER,ATR,1.35,173,24,20,0.032,77,30,12,0.032,81,17,10,0.013000000000000001,ATR,4.0,40,3m,HMA,True,True,False,False,False,0.5800000000000001,BOLLINGER,1.35,-66.06504201344158,-68.20096409102234,-67.13300305223197,115.46373661667788,304.8546746798598,210.15920564826882,3m,95,88,91.5,HMA,47.58971291866029,46.31578947368421,48.86363636363637,COMPLETE
125,-614.5380589184188,2026-01-15 23:34:24.522749,2026-01-15 23:34:38.102992,0 days 00:00:13.580243,16,2.7,3.2,1.7,92,BOLLINGER,ATR,1.1,173,24,10,0.034,77,30,12,0.032,81,17,10,0.017,ATR,4.0,41,3m,MACD,True,True,False,False,False,0.5800000000000001,BOLLINGER,1.1,-55.48309797143951,-33.62563500336304,-44.554366487401275,71.20878791077044,334.43765501106856,202.8232214609195,3m,54,54,54.0,MACD,50.0,50.0,50.0,COMPLETE
126,-710.0427060469619,2026-01-15 23:34:28.565661,2026-01-15 23:34:44.986351,0 days 00:00:16.420690,11,2.0,3.0,1.7,121,KELTNER,ATR,1.1,186,24,20,0.01,75,29,12,0.036000000000000004,80,17,10,0.013000000000000001,ATR,4.7,43,3m,HMA,True,True,False,False,False,0.59,KELTNER,1.1,-46.08721269572392,-77.46439375411268,-61.7758032249183,209.97127855631197,-18.299384007668472,95.83594727432175,3m,131,136,133.5,HMA,42.725639874270314,44.274809160305345,41.17647058823529,COMPLETE
127,-672.7751209482412,2026-01-15 23:34:28.932227,2026-01-15 23:34:46.439672,0 days 00:00:17.507445,11,2.7,3.8000000000000003,1.7,102,BOLLINGER,ATR,1.1,19,24,20,0.033,75,29,12,0.039,80,17,10,0.013000000000000001,ATR,4.7,41,3m,HMA,True,True,False,False,False,0.5800000000000001,BOLLINGER,1.1,-34.932004293597515,-46.25162219724312,-40.59181324542032,192.74537407857426,147.79169132555313,170.26853270206368,3m,56,53,54.5,HMA,47.69204851752022,48.214285714285715,47.16981132075472,COMPLETE
128,-839.1982094607365,2026-01-15 23:34:33.295378,2026-01-15 23:34:45.033766,0 days 00:00:11.738388,11,2.0,3.7,1.9,121,BOLLINGER,ATR,1.1,172,24,20,0.037,75,29,12,0.028000000000000004,80,16,15,0.012,ATR,4.7,41,2h,HMA,True,True,False,False,False,0.5800000000000001,BOLLINGER,1.1,-42.38759108428864,-63.81064567719375,-53.09911838074119,79.58174841384171,79.81896687203849,79.7003576429401,2h,72,71,71.5,HMA,42.65453834115806,43.05555555555556,42.25352112676056,COMPLETE
129,-1073.1044477098549,2026-01-15 23:34:38.235717,2026-01-15 23:34:46.505948,0 days 00:00:08.270231,10,2.1,3.2,2.1,103,BOLLINGER,ATR,1.1,172,24,10,0.039,78,29,12,0.027000000000000003,80,17,15,0.011,ATR,4.0,43,2h,MACD,True,True,False,False,False,0.5700000000000001,BOLLINGER,1.1,-40.97856795426985,-50.948460350529764,-45.96351415239981,129.99384156034256,85.46788638986624,107.7308639751044,2h,49,53,51.0,MACD,50.11551790527532,53.06122448979592,47.16981132075472,COMPLETE
130,-809.7615559763071,2026-01-15 23:34:40.906257,2026-01-15 23:34:47.652613,0 days 00:00:06.746356,10,2.1,3.2,2.1,122,BOLLINGER,ATR,1.1,151,24,20,0.036000000000000004,78,29,12,0.027000000000000003,80,17,15,0.012,ATR,4.0,43,2h,ICHIMOKU,True,True,False,False,False,0.5700000000000001,BOLLINGER,1.1,-41.770133802635186,-51.48791352223986,-46.62902366243752,95.28626140830582,94.57506818337149,94.93066479583865,2h,55,56,55.5,ICHIMOKU,46.866883116883116,49.09090909090909,44.642857142857146,COMPLETE
131,-771.6154010826349,2026-01-15 23:34:44.931923,2026-01-15 23:34:48.435572,0 days 00:00:03.503649,16,2.1,3.8000000000000003,1.8,103,BOLLINGER,ATR,1.35,153,25,20,0.033,77,29,12,0.028000000000000004,81,17,15,0.011,ATR,4.0,40,2h,MACD,True,True,False,False,False,0.5700000000000001,BOLLINGER,1.35,-45.37350604454776,-70.98444926108533,-58.17897765281654,245.74561608036842,2.2791591647894935,124.01238762257896,2h,63,64,63.5,MACD,47.27182539682539,50.79365079365079,43.75,COMPLETE
132,-771.5070246776731,2026-01-15 23:34:45.407789,2026-01-15 23:34:48.115638,0 days 00:00:02.707849,16,2.1,3.3000000000000003,1.8,102,BOLLINGER,ATR,1.35,153,25,12,0.033,77,29,12,0.027000000000000003,81,17,15,0.01,ATR,3.7,37,2h,MACD,True,True,False,False,False,0.5700000000000001,BOLLINGER,1.35,-33.65193290626606,-65.6618353770796,-49.65688414167283,190.68384462283217,20.372504972989507,105.52817479791084,2h,58,63,60.5,MACD,47.153804050355774,48.275862068965516,46.03174603174603,COMPLETE
133,-760.330080347705,2026-01-15 23:34:45.551230,2026-01-15 23:34:47.504139,0 days 00:00:01.952909,16,2.1,3.6,1.8,103,BOLLINGER,ATR,1.35,158,25,11,0.032,77,29,12,0.027000000000000003,81,17,15,0.01,ATR,4.0,40,2h,MACD,True,True,False,False,False,0.5700000000000001,BOLLINGER,1.35,-31.938397159500802,-73.44238645656769,-52.69039180803425,217.87295604086324,-7.31828484646274,105.27733559720025,2h,58,66,62.0,MACD,48.58934169278997,51.724137931034484,45.45454545454545,COMPLETE
134,-1475.713934007852,2026-01-15 23:34:46.609582,2026-01-15 23:34:48.232359,0 days 00:00:01.622777,18,2.7,3.7,1.8,110,BOLLINGER,ATR,1.35,153,24,11,0.032,77,30,12,0.028999999999999998,81,17,15,0.016,ATR,4.0,40,2h,MACD,True,True,False,False,False,0.5700000000000001,BOLLINGER,1.35,-72.13432601290033,-72.91431221345107,-72.5243191131757,63.62933280307694,-20.546785269365518,21.54127376685571,2h,43,46,44.5,MACD,48.407482305358954,51.162790697674424,45.65217391304348,COMPLETE
