number,value,datetime_start,datetime_complete,duration,params_ADX_THRESHOLD,params_ATR_MULTIPLIER,params_ATR_STOP_LOSS_MULT,params_BB_STD,params_ENTRY_PERIOD,params_ENTRY_TYPE,params_EXIT_TYPE,params_LEVERAGE,params_MA_PERIOD,params_MFI_THRESHOLD,params_MFI_WINDOW,params_RISK_PER_TRADE,params_RSI_OVERBOUGHT,params_RSI_OVERSOLD,params_RSI_WINDOW,params_SAR_STEP,params_STOCH_OVERBOUGHT,params_STOCH_OVERSOLD,params_STOCH_WINDOW,params_STOP_LOSS_PCT,params_STOP_LOSS_TYPE,params_SUPERTREND_MULT,params_SUPERTREND_PERIOD,params_TIMEFRAME,params_TREND_FILTER_TYPE,params_USE_ADX,params_USE_MFI,params_USE_RSI,params_USE_STOCHASTIC,params_USE_VHF,params_VHF_THRESHOLD,user_attrs_entry_type,user_attrs_leverage,user_attrs_mdd_BTC_USDT,user_attrs_mdd_ETH_USDT,user_attrs_mdd_avg,user_attrs_return_BTC_USDT,user_attrs_return_ETH_USDT,user_attrs_return_avg,user_attrs_timeframe,user_attrs_trades_BTC_USDT,user_attrs_trades_ETH_USDT,user_attrs_trades_avg,user_attrs_trend_filter,user_attrs_win_rate_avg,user_attrs_winrate_BTC_USDT,user_attrs_winrate_ETH_USDT,state
517,-275.62108393070685,2026-01-15 23:46:41.719867,2026-01-15 23:46:46.602415,0 days 00:00:04.882548,16,2.4,3.4000000000000004,1.7,144,BOLLINGER,PARABOLIC_SAR,1.8,29,19,13,0.035,72,24,14,0.013000000000000001,80,14,14,0.049,ATR,1.9,9,1h,SUPERTREND,False,False,False,False,False,0.43,BOLLINGER,1.8,-34.35048603359052,-75.2359638366046,-54.793224935097555,1568.2699122711135,175.46947631482698,871.8696942929703,1h,44,47,45.5,SUPERTREND,55.07736943907157,59.09090909090909,51.06382978723404,COMPLETE
518,-403.5191899644133,2026-01-15 23:46:43.533643,2026-01-15 23:46:47.793443,0 days 00:00:04.259800,16,2.4,3.5,1.7,144,BOLLINGER,PARABOLIC_SAR,1.8,28,19,13,0.035,72,24,14,0.013000000000000001,81,15,14,0.049,ATR,2.0,14,2h,SUPERTREND,False,False,False,False,False,0.53,BOLLINGER,1.8,-31.303109362488517,-80.80440553770191,-56.05375745009521,1364.4522626343364,104.93709830452251,734.6946804694295,2h,44,46,45.0,SUPERTREND,54.594861660079054,61.36363636363637,47.82608695652174,COMPLETE
519,-403.5191899644133,2026-01-15 23:46:44.787763,2026-01-15 23:46:46.751602,0 days 00:00:01.963839,16,2.4,3.5,1.7,144,BOLLINGER,PARABOLIC_SAR,1.8,27,19,13,0.035,72,24,14,0.013000000000000001,81,15,14,0.049,ATR,2.0,9,2h,SUPERTREND,False,False,False,False,False,0.42,BOLLINGER,1.8,-31.303109362488517,-80.80440553770191,-56.05375745009521,1364.4522626343364,104.93709830452251,734.6946804694295,2h,44,46,45.0,SUPERTREND,54.594861660079054,61.36363636363637,47.82608695652174,COMPLETE
520,-333.9209596645851,2026-01-15 23:46:44.903998,2026-01-15 23:46:46.688564,0 days 00:00:01.784566,16,2.4,3.4000000000000004,1.7,143,BOLLINGER,PARABOLIC_SAR,1.8,29,19,13,0.035,73,24,14,0.013000000000000001,81,15,14,0.049,ATR,2.0,10,1h,SUPERTREND,False,False,False,False,False,0.43,BOLLINGER,1.8,-34.35048603359052,-78.34491876101428,-56.3477023973024,1547.0570008722273,121.95380265205344,834.5054017621403,1h,44,47,45.5,SUPERTREND,54.013539651837526,59.09090909090909,48.93617021276596,COMPLETE
521,-306.22804998339143,2026-01-15 23:46:45.864212,2026-01-15 23:46:47.866472,0 days 00:00:02.002260,16,2.3,3.4000000000000004,1.7,143,BOLLINGER,PARABOLIC_SAR,1.8,28,19,13,0.022,73,24,14,0.013000000000000001,81,15,14,0.049,ATR,2.0,9,1h,SUPERTREND,False,False,False,False,False,0.43,BOLLINGER,1.8,-41.252527760565705,-73.90777394241647,-57.580150851491084,1064.1551431387618,168.30681790274153,616.2309805207517,1h,49,51,50.0,SUPERTREND,54.021608643457384,55.10204081632652,52.94117647058824,COMPLETE
522,-823.3097560325232,2026-01-15 23:46:46.636743,2026-01-15 23:46:51.361514,0 days 00:00:04.724771,16,2.3,3.4000000000000004,1.7,139,BOLLINGER,PARABOLIC_SAR,1.85,27,19,13,0.019000000000000003,73,24,14,0.01,81,15,14,0.049,ATR,2.0,12,2h,ICHIMOKU,False,False,False,False,False,0.52,BOLLINGER,1.85,-68.41166777763384,-87.05638681139493,-77.73402729451439,245.96831331025376,-26.246661791690727,109.86082575928151,2h,63,69,66.0,ICHIMOKU,46.273291925465834,47.61904761904761,44.927536231884055,COMPLETE
523,423.1604157659249,2026-01-15 23:46:46.719318,2026-01-15 23:46:52.337523,0 days 00:00:05.618205,16,2.3,3.3000000000000003,1.7,142,BOLLINGER,PARABOLIC_SAR,1.85,27,19,13,0.019000000000000003,73,24,14,0.01,81,15,13,0.05,ATR,2.0,12,5m,SUPERTREND,False,False,False,False,False,0.41,BOLLINGER,1.85,-31.609257404237574,-67.60630158022742,-49.607779492232495,2126.9791720311755,88.45383720075294,1107.7165046159641,5m,49,55,52.0,SUPERTREND,57.99628942486085,63.26530612244898,52.72727272727272,COMPLETE
524,364.3220804857192,2026-01-15 23:46:46.905338,2026-01-15 23:46:59.641665,0 days 00:00:12.736327,16,2.3,3.3000000000000003,1.7,139,BOLLINGER,PARABOLIC_SAR,1.85,25,19,13,0.019000000000000003,73,24,14,0.01,81,15,13,0.05,ATR,2.0,11,5m,SUPERTREND,False,False,False,False,False,0.52,BOLLINGER,1.85,-32.626681458989005,-70.99700177158968,-51.81184161528934,1925.0829004388506,175.81242861863817,1050.4476645287443,5m,49,53,51.0,SUPERTREND,56.00693107431652,59.183673469387756,52.83018867924528,COMPLETE
525,412.8025180170589,2026-01-15 23:46:46.583701,2026-01-15 23:47:02.665182,0 days 00:00:16.081481,16,2.3,3.3000000000000003,1.7,140,BOLLINGER,PARABOLIC_SAR,1.85,25,19,13,0.019000000000000003,73,24,14,0.012,81,15,13,0.049,ATR,2.0,12,5m,SUPERTREND,False,False,False,False,False,0.52,BOLLINGER,1.85,-32.48186190921358,-71.06684436036467,-51.77435313478912,2006.955765075224,175.10604612805048,1091.0309056016372,5m,49,53,51.0,SUPERTREND,57.02733923758183,61.224489795918366,52.83018867924528,COMPLETE
526,-2577.814045720482,2026-01-15 23:46:47.857457,2026-01-15 23:47:00.681703,0 days 00:00:12.824246,17,2.3,3.3000000000000003,1.7,41,BOLLINGER,PARABOLIC_SAR,1.85,32,19,12,0.02,73,24,14,0.01,80,15,13,0.05,ATR,2.1,12,5m,ICHIMOKU,False,False,False,False,False,0.52,BOLLINGER,1.85,-85.11138739360726,-121.27237111008608,-103.19187925184667,-58.96541295730277,-121.43887111008608,-90.20214203369443,5m,86,1,43.5,ICHIMOKU,21.511627906976745,43.02325581395349,0.0,COMPLETE
527,412.8025180170589,2026-01-15 23:46:47.949772,2026-01-15 23:46:59.770575,0 days 00:00:11.820803,17,2.3,3.3000000000000003,1.7,140,BOLLINGER,PARABOLIC_SAR,1.85,24,19,12,0.036000000000000004,73,24,14,0.01,80,15,13,0.05,ATR,2.1,12,5m,SUPERTREND,False,False,False,False,False,0.52,BOLLINGER,1.85,-32.48186190921358,-71.06684436036467,-51.77435313478912,2006.955765075224,175.10604612805048,1091.0309056016372,5m,49,53,51.0,SUPERTREND,57.02733923758183,61.224489795918366,52.83018867924528,COMPLETE
528,412.8025180170589,2026-01-15 23:46:51.611318,2026-01-15 23:47:04.994870,0 days 00:00:13.383552,17,2.3,3.3000000000000003,1.7,140,BOLLINGER,PARABOLIC_SAR,1.85,32,17,12,0.036000000000000004,73,24,14,0.012,80,15,13,0.05,ATR,2.1,12,5m,SUPERTREND,False,False,False,False,False,0.52,BOLLINGER,1.85,-32.48186190921358,-71.06684436036467,-51.77435313478912,2006.955765075224,175.10604612805048,1091.0309056016372,5m,49,53,51.0,SUPERTREND,57.02733923758183,61.224489795918366,52.83018867924528,COMPLETE
529,790.2311278152929,2026-01-15 23:46:53.787275,2026-01-15 23:47:07.400596,0 days 00:00:13.613321,17,2.5,3.5,1.7,40,BOLLINGER,PARABOLIC_SAR,1.85,31,17,12,0.016,73,24,14,0.012,80,14,13,0.05,ATR,2.1,13,5m,SUPERTREND,False,False,False,False,False,0.52,BOLLINGER,1.85,-68.58026626329244,-36.52730035874997,-52.553783311021206,407.5870230926383,2196.2428790364024,1301.9149510645204,5m,59,57,58.0,SUPERTREND,50.04460303300624,47.45762711864407,52.63157894736842,COMPLETE
530,-1936.928261852459,2026-01-15 23:46:59.835259,2026-01-15 23:47:14.170654,0 days 00:00:14.335395,17,2.5,3.5,1.8,145,DONCHIAN,PARABOLIC_SAR,1.75,33,17,12,0.036000000000000004,73,25,15,0.012,80,14,14,0.038,ATR,1.8,13,5m,SUPERTREND,False,False,False,False,False,0.42,DONCHIAN,1.75,-45.165628662592525,-31.737472227430626,-38.45155044501158,158.50757685678158,272.37069677974284,215.43913681826223,5m,35,25,30.0,SUPERTREND,54.285714285714285,48.57142857142857,60.0,COMPLETE
531,-1930.7150873595779,2026-01-15 23:47:00.080865,2026-01-15 23:47:13.263993,0 days 00:00:13.183128,17,2.5,3.5,1.7,142,DONCHIAN,PARABOLIC_SAR,1.75,32,17,13,0.036000000000000004,73,25,15,0.012,80,14,14,0.048,ATR,1.8,13,5m,SUPERTREND,False,False,False,False,False,0.37,DONCHIAN,1.75,-45.165628662592525,-31.737472227430626,-38.45155044501158,169.8168866336795,272.37069677974284,221.09379170671116,5m,35,25,30.0,SUPERTREND,54.285714285714285,48.57142857142857,60.0,COMPLETE
532,393.51529819082316,2026-01-15 23:47:01.285661,2026-01-15 23:47:14.407999,0 days 00:00:13.122338,17,2.5,3.5,1.7,145,BOLLINGER,PARABOLIC_SAR,1.75,31,17,13,0.036000000000000004,73,25,15,0.012,80,14,14,0.038,ATR,1.8,13,5m,SUPERTREND,False,False,False,False,False,0.53,BOLLINGER,1.75,-26.635567984274683,-72.45845898769393,-49.54701348598431,2310.3445622788636,144.09370305868575,1227.2191326687746,5m,43,47,45.0,SUPERTREND,55.96239485403266,65.11627906976744,46.808510638297875,COMPLETE
533,-1924.8165374840369,2026-01-15 23:47:03.045937,2026-01-15 23:47:15.980561,0 days 00:00:12.934624,17,2.5,3.4000000000000004,1.7,145,DONCHIAN,PARABOLIC_SAR,1.75,31,17,13,0.036000000000000004,73,25,15,0.012,80,14,14,0.048,ATR,1.8,13,5m,SUPERTREND,False,False,False,False,False,0.53,DONCHIAN,1.75,-45.165628662592525,-30.839671906244558,-38.00265028441854,158.50757685678158,277.28824094297573,217.89790889987864,5m,35,25,30.0,SUPERTREND,54.285714285714285,48.57142857142857,60.0,COMPLETE
534,-1936.928261852459,2026-01-15 23:47:05.293955,2026-01-15 23:47:21.009361,0 days 00:00:15.715406,16,2.5,3.5,1.7,145,DONCHIAN,PARABOLIC_SAR,1.75,31,17,13,0.036000000000000004,73,25,15,0.012,80,14,14,0.048,ATR,1.8,13,5m,SUPERTREND,False,False,False,False,False,0.53,DONCHIAN,1.75,-45.165628662592525,-31.737472227430626,-38.45155044501158,158.50757685678158,272.37069677974284,215.43913681826223,5m,35,25,30.0,SUPERTREND,54.285714285714285,48.57142857142857,60.0,COMPLETE
535,-1936.928261852459,2026-01-15 23:47:07.846876,2026-01-15 23:47:23.738425,0 days 00:00:15.891549,16,2.5,3.5,1.8,145,DONCHIAN,PARABOLIC_SAR,1.75,31,18,13,0.035,73,25,15,0.012,80,14,14,0.048,ATR,1.8,14,5m,SUPERTREND,False,False,False,False,False,0.44,DONCHIAN,1.75,-45.165628662592525,-31.737472227430626,-38.45155044501158,158.50757685678158,272.37069677974284,215.43913681826223,5m,35,25,30.0,SUPERTREND,54.285714285714285,48.57142857142857,60.0,COMPLETE
536,-152.39489434221196,2026-01-15 23:47:13.314500,2026-01-15 23:47:24.095412,0 days 00:00:10.780912,20,2.5,3.5,1.9,145,BOLLINGER,PARABOLIC_SAR,1.75,33,18,13,0.035,73,25,15,0.012,80,14,14,0.048,ATR,1.9,15,5m,SUPERTREND,False,False,False,False,False,0.53,BOLLINGER,1.75,-26.60259223343652,-61.22903128442852,-43.91581175893252,1202.9341473940906,125.49567077878217,664.2149090864364,5m,41,39,40.0,SUPERTREND,51.06316447779862,58.536585365853654,43.58974358974359,COMPLETE
537,608.9358303685322,2026-01-15 23:47:14.687147,2026-01-15 23:47:30.470142,0 days 00:00:15.782995,16,2.4,3.4000000000000004,1.8,147,BOLLINGER,PARABOLIC_SAR,1.9500000000000002,34,18,13,0.035,73,23,15,0.013000000000000001,80,14,14,0.048,ATR,1.9,14,5m,SUPERTREND,False,False,False,False,False,0.53,BOLLINGER,1.9500000000000002,-27.56953371249209,-68.82228878857643,-48.19591125053426,3224.763478453918,61.94242918074091,1643.3529538173295,5m,41,46,43.5,SUPERTREND,59.146341463414636,68.29268292682927,50.0,COMPLETE
538,1155.0212269714148,2026-01-15 23:47:15.622051,2026-01-15 23:47:27.630895,0 days 00:00:12.008844,16,2.4,1.4,1.8,147,BOLLINGER,PARABOLIC_SAR,2.0,35,18,13,0.035,73,25,15,0.013000000000000001,80,14,14,0.048,ATR,1.9,14,5m,SUPERTREND,False,False,False,False,False,0.53,BOLLINGER,2.0,-24.560622735323072,-65.51051690578662,-45.03556982055484,2666.3917511919462,172.07422658668222,1419.2329888893141,5m,46,51,48.5,SUPERTREND,51.896845694799666,58.69565217391305,45.09803921568628,COMPLETE
539,1329.534223397869,2026-01-15 23:47:16.994886,2026-01-15 23:47:30.774011,0 days 00:00:13.779125,30,2.4,3.5,1.7,147,BOLLINGER,PARABOLIC_SAR,2.0,141,18,13,0.035,73,23,15,0.011,81,16,14,0.048,ATR,1.9,10,5m,SUPERTREND,False,False,False,False,False,0.44,BOLLINGER,2.0,-28.26295351417168,-75.10397045104624,-51.68346198260896,3843.662553461636,40.79945274991642,1942.2310031057762,5m,44,53,48.5,SUPERTREND,59.56260720411663,68.18181818181817,50.943396226415096,COMPLETE
540,464.65324078728827,2026-01-15 23:47:21.340373,2026-01-15 23:47:35.257922,0 days 00:00:13.917549,16,2.4,3.4000000000000004,1.8,147,BOLLINGER,PARABOLIC_SAR,1.8,35,18,13,0.035,73,23,15,0.013000000000000001,81,16,14,0.049,ATR,1.9,14,5m,SUPERTREND,False,False,False,False,False,0.53,BOLLINGER,1.8,-25.452307985965994,-65.05692841230531,-45.25461819913565,2601.672029327386,74.9160847055543,1338.29405701647,5m,41,46,43.5,SUPERTREND,59.146341463414636,68.29268292682927,50.0,COMPLETE
541,7.138595930004158,2026-01-15 23:47:24.558889,2026-01-15 23:47:35.002548,0 days 00:00:10.443659,16,2.4,3.6,1.7,138,BOLLINGER,PARABOLIC_SAR,1.9500000000000002,15,18,13,0.035,72,26,14,0.013000000000000001,81,16,14,0.049,ATR,2.2,14,4h,SUPERTREND,False,False,False,False,False,0.55,BOLLINGER,1.9500000000000002,-28.194907357954925,-87.6535003280959,-57.92420384302541,1855.4106038767397,-9.540688205131842,922.934957835804,4h,44,48,46.0,SUPERTREND,55.776515151515156,63.63636363636363,47.91666666666667,COMPLETE
542,22.722494619053577,2026-01-15 23:47:24.795231,2026-01-15 23:47:33.859159,0 days 00:00:09.063928,16,2.4,3.6,1.7,137,BOLLINGER,PARABOLIC_SAR,1.9500000000000002,17,18,13,0.035,72,26,14,0.013000000000000001,81,16,14,0.049,ATR,2.2,14,4h,SUPERTREND,False,False,False,False,False,0.55,BOLLINGER,1.9500000000000002,-28.194907357954925,-86.82245210712512,-57.50867973254002,1875.8902847327163,-2.448321186366817,936.7209817731747,4h,44,48,46.0,SUPERTREND,55.776515151515156,63.63636363636363,47.91666666666667,COMPLETE
543,71.40031534746868,2026-01-15 23:47:28.446083,2026-01-15 23:47:36.158162,0 days 00:00:07.712079,16,2.4,1.5,1.8,137,BOLLINGER,PARABOLIC_SAR,2.0,16,18,13,0.035,72,25,14,0.043000000000000003,81,16,14,0.049,ATR,2.2,14,5m,SUPERTREND,False,False,False,False,False,0.53,BOLLINGER,2.0,-26.28083967686452,-62.98797623764714,-44.63440795725583,1530.1314649684653,177.13927970354516,853.6353723360052,5m,48,49,48.5,SUPERTREND,50.552721088435376,54.166666666666664,46.93877551020408,COMPLETE
544,-2835.858768706827,2026-01-15 23:47:30.709877,2026-01-15 23:47:36.323103,0 days 00:00:05.613226,16,2.4,3.6,1.8,138,BOLLINGER,PARABOLIC_SAR,2.0,16,18,13,0.024,72,25,14,0.011,81,16,14,0.049,ATR,2.2,10,4h,SUPERTREND,False,False,False,False,True,0.55,BOLLINGER,2.0,-49.502029183441934,-66.99263907418315,-58.24733412881254,262.9592360653614,-48.64737383192861,107.15593111671639,4h,21,17,19.0,SUPERTREND,59.24369747899159,71.42857142857143,47.05882352941176,COMPLETE
545,-496.7685340431908,2026-01-15 23:47:31.026944,2026-01-15 23:47:38.067288,0 days 00:00:07.040344,16,2.0,3.6,1.7,137,BOLLINGER,PARABOLIC_SAR,2.0,36,18,13,0.035,72,25,15,0.011,81,16,14,0.049,ATR,2.2,10,4h,SUPERTREND,False,False,False,False,False,0.43,BOLLINGER,2.0,-35.51374413672998,-88.51031223581293,-62.01202818627146,599.3969184276888,-61.374441737236616,269.0112383452261,4h,66,64,65.0,SUPERTREND,49.12405303030303,56.060606060606055,42.1875,COMPLETE
546,-1299.8176654820054,2026-01-15 23:47:34.989688,2026-01-15 23:47:42.614529,0 days 00:00:07.624841,16,2.2,1.7000000000000002,1.8,148,BOLLINGER,PARABOLIC_SAR,1.9500000000000002,138,18,13,0.035,70,23,15,0.011,81,16,14,0.049,ATR,2.3,6,5m,EMA,False,False,False,False,True,0.43,BOLLINGER,1.9500000000000002,-46.94494554604074,-67.30798211656904,-57.12646383130489,267.9491985550057,-15.933813854071394,126.00769235046715,5m,44,41,42.5,EMA,51.57982261640798,56.81818181818182,46.34146341463415,COMPLETE
547,-1088.1556798365555,2026-01-15 23:47:35.304370,2026-01-15 23:47:42.008694,0 days 00:00:06.704324,16,2.2,1.5,1.8,150,BOLLINGER,PARABOLIC_SAR,2.0,23,19,13,0.035,73,22,15,0.011,81,15,14,0.05,ATR,2.1,10,5m,EMA,False,False,False,False,True,0.43,BOLLINGER,2.0,-35.80990956011282,-63.80197173424506,-49.80594064717894,536.3566959879106,-10.466023943307553,262.94533602230155,5m,43,43,43.0,EMA,48.837209302325576,53.48837209302325,44.18604651162791,COMPLETE
548,-1297.270631726643,2026-01-15 23:47:35.899852,2026-01-15 23:47:50.037431,0 days 00:00:14.137579,25,2.2,3.6,1.7,150,BOLLINGER,PARABOLIC_SAR,1.9,25,19,13,0.024,70,21,15,0.042,81,15,14,0.05,ATR,2.1,10,5m,EMA,False,False,False,False,True,0.44,BOLLINGER,1.9,-61.17419655101743,-76.50420001906507,-68.83919828504125,356.5307118255718,-53.28041912963032,151.62514634797074,5m,40,43,41.5,EMA,49.68023255813954,57.49999999999999,41.86046511627907,COMPLETE
549,-740.3025676716634,2026-01-15 23:47:36.285615,2026-01-15 23:47:47.400453,0 days 00:00:11.114838,28,2.2,3.5,1.7,150,BOLLINGER,PARABOLIC_SAR,2.0,23,19,13,0.035,73,23,15,0.011,81,15,14,0.05,ATR,2.3,11,5m,EMA,False,False,False,False,False,0.44,BOLLINGER,2.0,-73.27641975173105,-82.76400550996648,-78.02021263084876,348.5891351683843,32.6095727240466,190.59935394621544,5m,72,75,73.5,EMA,50.361111111111114,51.388888888888886,49.333333333333336,COMPLETE
550,-938.0190535760503,2026-01-15 23:47:36.402126,2026-01-15 23:47:48.692756,0 days 00:00:12.290630,16,2.2,3.5,1.7,142,BOLLINGER,PARABOLIC_SAR,2.0,23,19,13,0.035,73,23,15,0.01,81,15,14,0.05,ATR,2.3,7,5m,EMA,False,False,False,False,False,0.44,BOLLINGER,2.0,-85.60177563561591,-89.2551334377405,-87.4284545366782,41.12269826777717,-18.352626597658055,11.385035835059556,5m,75,75,75.0,EMA,48.0,48.0,48.0,COMPLETE
551,-936.5253724710383,2026-01-15 23:47:39.414442,2026-01-15 23:47:56.255969,0 days 00:00:16.841527,24,2.2,3.4000000000000004,1.7,142,BOLLINGER,PARABOLIC_SAR,2.0,24,19,13,0.035,73,22,15,0.011,81,15,14,0.05,ATR,2.0,8,5m,EMA,False,False,False,False,False,0.51,BOLLINGER,2.0,-85.60177563561591,-89.19497885071654,-87.39837724316622,42.0336072118999,-16.39064852211338,12.821479344893259,5m,75,75,75.0,EMA,48.0,48.0,48.0,COMPLETE
552,-319.0950359591088,2026-01-15 23:47:42.240367,2026-01-15 23:47:54.298941,0 days 00:00:12.058574,17,2.2,1.0,1.7,142,BOLLINGER,PARABOLIC_SAR,1.9500000000000002,26,19,13,0.036000000000000004,73,23,15,0.011,81,15,14,0.05,ATR,2.0,11,5m,SUPERTREND,False,False,False,False,False,0.44,BOLLINGER,1.9500000000000002,-40.518378568499244,-65.29387355978588,-52.90612606414256,869.0506843754437,26.77121682649129,447.91095060096745,5m,72,77,74.5,SUPERTREND,40.35894660894661,43.05555555555556,37.66233766233766,COMPLETE
553,-134.29265093429694,2026-01-15 23:47:44.517936,2026-01-15 23:47:58.346656,0 days 00:00:13.828720,17,2.3,1.1,1.7,142,BOLLINGER,PARABOLIC_SAR,2.0,25,19,13,0.036000000000000004,73,22,15,0.011,79,15,14,0.05,ATR,2.0,11,5m,SUPERTREND,False,False,False,False,False,0.51,BOLLINGER,2.0,-33.03287364252462,-68.82566093559957,-50.929267289062096,976.4119182735114,80.39063897311188,528.4012786233117,5m,67,68,67.5,SUPERTREND,42.97629499561018,44.776119402985074,41.17647058823529,COMPLETE
554,-159.47785321935862,2026-01-15 23:47:47.753578,2026-01-15 23:48:00.983597,0 days 00:00:13.230019,21,2.3,1.1,1.7,142,BOLLINGER,PARABOLIC_SAR,1.9,36,19,13,0.036000000000000004,73,25,15,0.01,79,15,14,0.048,ATR,2.0,15,5m,SUPERTREND,False,False,False,False,False,0.51,BOLLINGER,1.9,-31.54505420806651,-66.31477912382857,-48.929916665947545,904.2795194139788,85.94808353551333,495.1138014747461,5m,67,68,67.5,SUPERTREND,42.97629499561018,44.776119402985074,41.17647058823529,COMPLETE
555,132.384105775046,2026-01-15 23:47:49.807669,2026-01-15 23:48:03.585146,0 days 00:00:13.777477,17,2.3,1.0,1.7,142,BOLLINGER,PARABOLIC_SAR,1.9500000000000002,37,17,13,0.020999999999999998,73,24,15,0.011,81,14,14,0.048,ATR,2.0,15,5m,SUPERTREND,False,False,False,False,False,0.42,BOLLINGER,1.9500000000000002,-29.674574010670746,-67.78200800687299,-48.72829100877186,999.1776117581189,5.287298094264371,502.2324549261916,5m,69,76,72.5,SUPERTREND,40.160183066361554,43.47826086956522,36.84210526315789,COMPLETE
556,383.1708809863594,2026-01-15 23:47:51.554357,2026-01-15 23:48:06.788194,0 days 00:00:15.233837,23,2.3,1.9,1.7,142,BOLLINGER,PARABOLIC_SAR,1.9500000000000002,130,35,13,0.036000000000000004,73,24,15,0.011,79,14,14,0.048,ATR,2.6,15,5m,SUPERTREND,False,False,False,False,False,0.51,BOLLINGER,1.9500000000000002,-31.74920787502305,-67.65080330063432,-49.700005587828684,1638.2409297626427,165.55459133176007,901.8977605472014,5m,52,55,53.5,SUPERTREND,56.171328671328666,59.61538461538461,52.72727272727272,COMPLETE
557,774.2956587281715,2026-01-15 23:47:55.937180,2026-01-15 23:48:09.916252,0 days 00:00:13.979072,17,2.3,3.4000000000000004,1.7,147,BOLLINGER,PARABOLIC_SAR,1.8,37,17,12,0.034,73,24,14,0.012,79,14,13,0.048,ATR,1.9,15,5m,SUPERTREND,False,False,False,False,False,0.54,BOLLINGER,1.8,-29.456857638067035,-61.792473780604155,-45.624665709335595,2075.965444114519,156.22752920715863,1116.0964866608388,5m,49,55,52.0,SUPERTREND,59.814471243042675,63.26530612244898,56.36363636363636,COMPLETE
558,774.2956587281715,2026-01-15 23:47:56.571795,2026-01-15 23:48:12.461032,0 days 00:00:15.889237,17,2.3,3.4000000000000004,1.7,147,BOLLINGER,PARABOLIC_SAR,1.8,148,17,12,0.034,71,24,14,0.012,79,14,13,0.048,ATR,1.9,15,5m,SUPERTREND,False,False,False,False,False,0.54,BOLLINGER,1.8,-29.456857638067035,-61.792473780604155,-45.624665709335595,2075.965444114519,156.22752920715863,1116.0964866608388,5m,49,55,52.0,SUPERTREND,59.814471243042675,63.26530612244898,56.36363636363636,COMPLETE
559,-565.2936117208519,2026-01-15 23:47:58.695553,2026-01-15 23:48:12.534143,0 days 00:00:13.838590,16,2.3,3.4000000000000004,1.9,147,BOLLINGER,PARABOLIC_SAR,1.8,120,17,12,0.034,71,25,14,0.013000000000000001,80,14,13,0.048,ATR,2.8,15,5m,SUPERTREND,False,False,False,False,False,0.52,BOLLINGER,1.8,-33.389524403773095,-61.70914665452043,-47.54933552914676,1044.8050030002894,123.66477668676032,584.2348898435248,5m,45,45,45.0,SUPERTREND,56.666666666666664,57.77777777777777,55.55555555555556,COMPLETE
