number,value,datetime_start,datetime_complete,duration,params_ADX_THRESHOLD,params_ATR_MULTIPLIER,params_ATR_STOP_LOSS_MULT,params_BB_STD,params_ENTRY_PERIOD,params_ENTRY_TYPE,params_EXIT_TYPE,params_LEVERAGE,params_MA_PERIOD,params_MFI_THRESHOLD,params_MFI_WINDOW,params_RISK_PER_TRADE,params_RSI_OVERBOUGHT,params_RSI_OVERSOLD,params_RSI_WINDOW,params_SAR_STEP,params_STOCH_OVERBOUGHT,params_STOCH_OVERSOLD,params_STOCH_WINDOW,params_STOP_LOSS_PCT,params_STOP_LOSS_TYPE,params_SUPERTREND_MULT,params_SUPERTREND_PERIOD,params_TIMEFRAME,params_TREND_FILTER_TYPE,params_USE_ADX,params_USE_MFI,params_USE_RSI,params_USE_STOCHASTIC,params_USE_VHF,params_VHF_THRESHOLD,user_attrs_entry_type,user_attrs_leverage,user_attrs_mdd_BTC_USDT,user_attrs_mdd_ETH_USDT,user_attrs_mdd_avg,user_attrs_return_BTC_USDT,user_attrs_return_ETH_USDT,user_attrs_return_avg,user_attrs_timeframe,user_attrs_trades_BTC_USDT,user_attrs_trades_ETH_USDT,user_attrs_trades_avg,user_attrs_trend_filter,user_attrs_win_rate_avg,user_attrs_winrate_BTC_USDT,user_attrs_winrate_ETH_USDT,state
179,-561.3742820889775,2026-01-15 23:36:25.507773,2026-01-15 23:36:36.491309,0 days 00:00:10.983536,12,2.4,3.2,1.6,134,BOLLINGER,PARABOLIC_SAR,1.6,31,25,15,0.04,76,28,10,0.02,82,24,11,0.018000000000000002,ATR,4.2,29,5m,MACD,True,True,False,False,False,0.59,BOLLINGER,1.6,-36.513425166031006,-85.90519011953106,-61.20930764278103,470.5191599981223,-6.9147692437154245,231.80219537720345,5m,57,64,60.5,MACD,50.04111842105263,57.89473684210527,42.1875,COMPLETE
180,-693.3487536440844,2026-01-15 23:36:30.141060,2026-01-15 23:36:42.383325,0 days 00:00:12.242265,12,2.5,3.1,1.6,101,BOLLINGER,PARABOLIC_SAR,1.6,17,25,15,0.04,76,28,10,0.02,84,24,11,0.02,ATR,4.2,39,5m,MACD,True,True,False,False,False,0.59,BOLLINGER,1.6,-38.11853732056695,-83.72494027683226,-60.92173879869961,310.9664951399236,-19.237107321153047,145.86469390938527,5m,61,66,63.5,MACD,48.32339791356185,55.73770491803278,40.909090909090914,COMPLETE
181,-1340.9276746605228,2026-01-15 23:36:33.324585,2026-01-15 23:36:43.526200,0 days 00:00:10.201615,12,2.6,3.1,1.5,100,CCI,PARABOLIC_SAR,1.65,38,27,16,0.038,76,28,11,0.020999999999999998,82,24,12,0.02,ATR,4.4,26,15m,MACD,True,True,False,False,False,0.59,CCI,1.65,-50.260254999400836,-62.51516041475226,-56.387707707076544,184.54982390002874,14.49595783772799,99.52289086887836,15m,33,41,37.0,MACD,50.73909830007391,57.57575757575758,43.90243902439025,COMPLETE
182,-2630.4324723447617,2026-01-15 23:36:33.998468,2026-01-15 23:36:41.657668,0 days 00:00:07.659200,12,4.1,3.1,1.5,101,CCI,PARABOLIC_SAR,1.65,37,27,16,0.038,76,28,11,0.018000000000000002,82,24,12,0.02,ATR,4.4,37,15m,MACD,True,True,False,False,False,0.59,CCI,1.65,-37.17258978303871,-64.18672513435605,-50.67965745869738,288.21507712821483,172.425774472555,230.3204258003849,15m,19,25,22.0,MACD,51.684210526315795,47.368421052631575,56.00000000000001,COMPLETE
183,-449.75020486521134,2026-01-15 23:36:34.205032,2026-01-15 23:36:44.147405,0 days 00:00:09.942373,12,2.6,3.3000000000000003,1.5,100,BOLLINGER,PARABOLIC_SAR,1.65,39,27,16,0.038,76,28,11,0.018000000000000002,82,24,12,0.02,ATR,4.4,37,15m,MACD,True,True,False,False,False,0.59,BOLLINGER,1.65,-42.59699920545179,-77.00446540682698,-59.80073230613938,620.1604605763154,61.724544975705776,340.94250277601054,15m,59,57,58.0,MACD,49.01873327386262,55.932203389830505,42.10526315789473,COMPLETE
184,-1207.1275590237474,2026-01-15 23:36:36.423000,2026-01-15 23:36:45.349361,0 days 00:00:08.926361,13,2.8,3.1,1.6,140,BOLLINGER,PARABOLIC_SAR,1.6,18,27,16,0.038,76,29,11,0.018000000000000002,82,24,11,0.02,ATR,4.4,25,15m,MACD,True,True,False,False,False,0.5700000000000001,BOLLINGER,1.6,-80.50946729333508,-80.7622469006222,-80.63585709697864,91.02425973662695,-42.36224041195038,24.331009662338282,15m,48,50,49.0,MACD,47.08333333333333,54.166666666666664,40.0,COMPLETE
185,-585.09931407777,2026-01-15 23:36:36.537535,2026-01-15 23:36:45.701721,0 days 00:00:09.164186,13,2.4,3.1,1.5,138,BOLLINGER,PARABOLIC_SAR,1.65,41,25,16,0.037,76,28,10,0.022,82,24,12,0.020999999999999998,ATR,4.4,26,5m,MACD,True,True,False,False,False,0.59,BOLLINGER,1.65,-51.84109072521991,-86.92497009882423,-69.38303041202207,552.238634303757,-17.96307545469487,267.13777942453106,5m,59,66,62.5,MACD,48.420647149460706,55.932203389830505,40.909090909090914,COMPLETE
186,-640.1788915819616,2026-01-15 23:36:43.001895,2026-01-15 23:36:54.983453,0 days 00:00:11.981558,13,2.4,3.3000000000000003,1.6,142,BOLLINGER,PARABOLIC_SAR,1.55,200,25,15,0.028000000000000004,76,29,10,0.022,82,24,11,0.018000000000000002,ATR,4.4,32,5m,MACD,True,True,False,False,False,0.5800000000000001,BOLLINGER,1.55,-39.359811968875796,-89.09493035807449,-64.22737116347514,405.2673212585819,-36.778555999281515,184.24438262965018,5m,57,64,60.5,MACD,48.38267543859649,56.14035087719298,40.625,COMPLETE
187,-333.98498605894747,2026-01-15 23:36:43.467567,2026-01-15 23:36:47.996862,0 days 00:00:04.529295,13,2.4,3.1,1.5,133,BOLLINGER,PARABOLIC_SAR,1.65,42,15,16,0.028000000000000004,76,29,10,0.020999999999999998,82,24,12,0.018000000000000002,ATR,4.4,38,5m,MACD,True,True,False,False,False,0.5700000000000001,BOLLINGER,1.65,-38.375996314580725,-86.49506955178126,-62.435532933180994,829.6944405119114,-10.509837989099823,409.59230126140574,5m,59,72,65.5,MACD,49.64689265536724,57.6271186440678,41.66666666666667,COMPLETE
188,-447.6344648526174,2026-01-15 23:36:43.966552,2026-01-15 23:36:54.647753,0 days 00:00:10.681201,13,2.4,3.3000000000000003,1.5,142,BOLLINGER,PARABOLIC_SAR,1.7000000000000002,41,27,14,0.037,76,27,10,0.017,82,24,12,0.018000000000000002,ATR,4.4,23,15m,MACD,True,True,False,False,False,0.5700000000000001,BOLLINGER,1.7000000000000002,-41.06872279985559,-84.16170183970739,-62.61521231978149,686.8446322513065,17.11048002239787,351.9775561368522,15m,55,61,58.0,MACD,49.40387481371087,54.54545454545454,44.26229508196721,COMPLETE
189,-706.3901101169331,2026-01-15 23:36:44.644626,2026-01-15 23:36:54.692932,0 days 00:00:10.048306,13,2.4,3.3000000000000003,1.5,139,BOLLINGER,PARABOLIC_SAR,1.7000000000000002,32,15,14,0.037,76,27,10,0.017,82,24,12,0.018000000000000002,ATR,4.4,37,15m,MACD,True,True,False,False,False,0.5700000000000001,BOLLINGER,1.7000000000000002,-68.16639743724657,-86.70635393488588,-77.43637568606623,398.64605285059343,-7.729476912252477,195.45828796917047,15m,57,68,62.5,MACD,49.393704850361196,56.14035087719298,42.64705882352941,COMPLETE
190,-818.2811650724343,2026-01-15 23:36:45.409429,2026-01-15 23:36:56.835224,0 days 00:00:11.425795,13,2.2,3.3000000000000003,1.5,142,BOLLINGER,PARABOLIC_SAR,1.6,32,22,14,0.037,76,27,10,0.016,82,24,12,0.018000000000000002,ATR,4.4,37,5m,DEMA,True,True,False,False,False,0.59,BOLLINGER,1.6,-68.37503616909538,-76.89318968844825,-72.63411292877181,122.59657482085527,61.82913029999302,92.21285256042414,5m,73,80,76.5,DEMA,46.59246575342466,50.68493150684932,42.5,COMPLETE
191,-702.192298738195,2026-01-15 23:36:46.606491,2026-01-15 23:36:57.476656,0 days 00:00:10.870165,13,2.4,3.0,1.5,142,BOLLINGER,PARABOLIC_SAR,1.7000000000000002,42,22,15,0.037,76,27,10,0.016,82,24,12,0.018000000000000002,ATR,4.4,26,5m,DEMA,True,True,False,False,False,0.5800000000000001,BOLLINGER,1.7000000000000002,-69.78629189148322,-88.79985552272566,-79.29307370710444,441.7760121375494,3.9387047498863423,222.85735844371789,5m,65,74,69.5,DEMA,48.45114345114345,52.307692307692314,44.5945945945946,COMPLETE
192,-309.4264916969232,2026-01-15 23:36:48.662596,2026-01-15 23:36:59.678453,0 days 00:00:11.015857,13,2.4,3.0,1.5,134,BOLLINGER,PARABOLIC_SAR,1.7000000000000002,41,15,16,0.037,76,28,10,0.016,82,23,12,0.020999999999999998,ATR,4.5,27,5m,TEMA,True,True,False,False,False,0.5800000000000001,BOLLINGER,1.7000000000000002,-47.45628398714361,-80.84475256585469,-64.15051827649916,865.5653951516539,123.20390213046004,494.38464864105697,5m,59,71,65.0,TEMA,50.358080687514914,54.23728813559322,46.478873239436616,COMPLETE
193,-518.0788417475314,2026-01-15 23:36:54.993075,2026-01-15 23:37:02.397934,0 days 00:00:07.404859,13,2.6,3.0,1.5,144,BOLLINGER,PARABOLIC_SAR,1.65,42,27,16,0.036000000000000004,76,27,10,0.016,82,23,12,0.020999999999999998,ATR,4.5,27,15m,DEMA,True,True,False,False,False,0.5700000000000001,BOLLINGER,1.65,-66.68908401692252,-74.41667646892272,-70.55288024292261,596.4712202803197,119.9815055210053,358.2263629006625,15m,54,58,56.0,DEMA,50.255427841634734,57.407407407407405,43.103448275862064,COMPLETE
194,-342.58719173136524,2026-01-15 23:36:55.595634,2026-01-15 23:37:03.220979,0 days 00:00:07.625345,13,2.6,3.0,1.5,136,BOLLINGER,PARABOLIC_SAR,1.65,41,17,16,0.036000000000000004,76,27,10,0.018000000000000002,82,24,12,0.020999999999999998,ATR,4.5,21,15m,DEMA,True,True,False,False,False,0.5700000000000001,BOLLINGER,1.65,-55.061039941033584,-73.49037767694469,-64.27570880898914,781.9484574488455,170.39793981907982,476.17319863396267,15m,56,61,58.5,DEMA,49.809718969555036,55.35714285714286,44.26229508196721,COMPLETE
195,-515.1541619061036,2026-01-15 23:36:56.337117,2026-01-15 23:37:03.399697,0 days 00:00:07.062580,13,2.6,3.0,1.5,148,BOLLINGER,PARABOLIC_SAR,1.65,46,17,16,0.037,76,27,10,0.016,82,23,12,0.018000000000000002,ATR,4.5,22,15m,TEMA,True,True,False,False,False,0.5700000000000001,BOLLINGER,1.65,-60.98409868150764,-74.34808708640611,-67.66609288395688,578.0998083521822,115.52427671072161,346.8120425314519,15m,51,59,55.0,TEMA,52.16018610834164,56.86274509803921,47.45762711864407,COMPLETE
196,-308.46683283091807,2026-01-15 23:36:56.921385,2026-01-15 23:37:03.904253,0 days 00:00:06.982868,13,2.6,3.0,1.5,135,BOLLINGER,PARABOLIC_SAR,1.65,44,27,16,0.036000000000000004,76,27,10,0.016,82,23,12,0.020999999999999998,ATR,4.5,36,15m,TEMA,True,True,False,False,False,0.5800000000000001,BOLLINGER,1.65,-55.143547218457115,-62.35339997268669,-58.7484735955719,581.826483011668,414.05309464551385,497.9397888285909,15m,51,54,52.5,TEMA,51.52505446623094,54.90196078431373,48.148148148148145,COMPLETE
197,-463.5570449897541,2026-01-15 23:36:59.078446,2026-01-15 23:37:04.735214,0 days 00:00:05.656768,12,2.6,3.0,1.5,135,BOLLINGER,PARABOLIC_SAR,1.65,42,16,16,0.036000000000000004,76,28,10,0.018000000000000002,82,23,12,0.017,ATR,4.5,23,15m,TEMA,True,True,False,False,False,0.5700000000000001,BOLLINGER,1.65,-55.143547218457115,-61.497763734763176,-58.32065547661014,427.76406056184345,324.1493097876759,375.9566851747597,15m,52,59,55.5,TEMA,50.651890482398954,53.84615384615385,47.45762711864407,COMPLETE
198,-518.3310111253068,2026-01-15 23:37:00.179653,2026-01-15 23:37:06.473759,0 days 00:00:06.294106,12,2.6,2.9000000000000004,1.5,136,BOLLINGER,PARABOLIC_SAR,1.65,55,15,16,0.036000000000000004,77,28,10,0.016,83,23,12,0.020999999999999998,ATR,4.5,23,15m,TEMA,True,True,False,False,False,0.5700000000000001,BOLLINGER,1.65,-57.18374873452596,-69.69028365204241,-63.43701619328419,506.1620743341316,188.8414731709958,347.50177375256374,15m,52,58,55.0,TEMA,50.19893899204244,53.84615384615385,46.55172413793103,COMPLETE
199,-677.5554130767568,2026-01-15 23:37:02.569011,2026-01-15 23:37:07.443694,0 days 00:00:04.874683,12,2.6,2.9000000000000004,1.5,149,BOLLINGER,PARABOLIC_SAR,1.65,55,16,16,0.036000000000000004,76,27,10,0.016,83,23,12,0.020999999999999998,ATR,4.5,27,15m,TEMA,True,True,False,False,False,0.5700000000000001,BOLLINGER,1.65,-67.8513268410811,-75.29003151948518,-71.57067918028315,333.83191947060675,97.51515193857544,215.6735357045911,15m,50,58,54.0,TEMA,51.27586206896552,56.00000000000001,46.55172413793103,COMPLETE
200,-440.6302643162144,2026-01-15 23:37:03.274800,2026-01-15 23:37:08.496467,0 days 00:00:05.221667,12,2.6,2.8,1.5,133,BOLLINGER,PARABOLIC_SAR,1.65,53,17,16,0.036000000000000004,76,26,10,0.018000000000000002,83,23,13,0.020999999999999998,ATR,4.5,22,15m,TEMA,True,True,False,False,False,0.5700000000000001,BOLLINGER,1.65,-53.99850447180698,-72.78760913272629,-63.393056802266635,661.4989969400026,151.85318930108386,406.6760931205432,15m,51,59,55.0,TEMA,50.332336324360256,54.90196078431373,45.76271186440678,COMPLETE
201,-699.5119320219246,2026-01-15 23:37:03.768941,2026-01-15 23:37:10.142000,0 days 00:00:06.373059,12,2.6,2.9000000000000004,1.5,148,BOLLINGER,PARABOLIC_SAR,1.8,58,17,16,0.036000000000000004,76,26,10,0.016,83,23,12,0.020999999999999998,ATR,4.5,21,15m,TEMA,True,True,False,False,False,0.56,BOLLINGER,1.8,-67.54227182825133,-85.17992280271574,-76.36109731548353,420.32178115900354,21.390334259380587,220.85605770919207,15m,51,60,55.5,TEMA,49.950980392156865,54.90196078431373,45.0,COMPLETE
202,-1114.416142242646,2026-01-15 23:37:04.392386,2026-01-15 23:37:10.893471,0 days 00:00:06.501085,13,2.8,2.9000000000000004,1.5,147,BOLLINGER,PARABOLIC_SAR,1.8,54,17,16,0.037,77,26,10,0.016,83,23,12,0.020999999999999998,ATR,4.5,22,15m,TEMA,True,True,False,False,False,0.5700000000000001,BOLLINGER,1.8,-80.520611823439,-79.4332443988527,-79.97692811114584,209.6769335382072,4.293532939386612,106.98523323879691,15m,46,54,50.0,TEMA,51.24798711755233,54.347826086956516,48.148148148148145,COMPLETE
203,-1141.5935643907715,2026-01-15 23:37:05.010785,2026-01-15 23:37:10.317000,0 days 00:00:05.306215,12,2.8,2.9000000000000004,1.5,148,BOLLINGER,PARABOLIC_SAR,1.7000000000000002,57,17,16,0.037,77,26,10,0.015,83,23,12,0.020999999999999998,ATR,4.5,22,15m,TEMA,True,True,False,False,False,0.56,BOLLINGER,1.7000000000000002,-80.74846727820626,-74.56771043477875,-77.6580888564925,144.2728295206604,25.61068504302895,84.94175728184467,15m,47,53,50.0,TEMA,51.12404656764352,53.191489361702125,49.056603773584904,COMPLETE
204,-1085.8283684875423,2026-01-15 23:37:07.139922,2026-01-15 23:37:12.200696,0 days 00:00:05.060774,13,2.7,3.0,1.5,148,BOLLINGER,PARABOLIC_SAR,1.65,56,17,16,0.036000000000000004,77,26,10,0.016,83,23,12,0.020999999999999998,ATR,4.5,22,15m,TEMA,True,True,False,False,False,0.56,BOLLINGER,1.65,-72.68691451445748,-80.6718783737812,-76.67939644411933,231.77100743822794,21.1532545081371,126.46213097318252,15m,49,58,53.5,TEMA,49.806474313863475,53.06122448979592,46.55172413793103,COMPLETE
205,-1018.8016851116518,2026-01-15 23:37:08.165766,2026-01-15 23:37:12.323469,0 days 00:00:04.157703,13,2.7,2.8,1.5,145,BOLLINGER,PARABOLIC_SAR,1.7000000000000002,53,15,16,0.036000000000000004,77,26,10,0.013000000000000001,83,23,12,0.023,ATR,4.5,22,15m,TEMA,True,True,False,False,False,0.56,BOLLINGER,1.7000000000000002,-74.0775973212159,-82.55404397121,-78.31582064621296,357.7460960661801,9.079054320285284,183.4125751932327,15m,48,59,53.5,TEMA,49.96468926553672,54.166666666666664,45.76271186440678,COMPLETE
206,-693.3710889697722,2026-01-15 23:37:09.404446,2026-01-15 23:37:14.794103,0 days 00:00:05.389657,13,2.7,2.8,1.5,135,BOLLINGER,PARABOLIC_SAR,1.75,48,15,16,0.036000000000000004,77,26,10,0.017,83,23,12,0.020999999999999998,ATR,4.5,22,15m,TEMA,True,True,False,False,False,0.56,BOLLINGER,1.75,-69.47382484108766,-81.95781211184074,-75.7158184764642,404.67376970972515,51.810279472827006,228.24202459127608,15m,51,58,54.5,TEMA,49.74645030425964,52.94117647058824,46.55172413793103,COMPLETE
207,-667.7049344969837,2026-01-15 23:37:10.592093,2026-01-15 23:37:18.000016,0 days 00:00:07.407923,13,2.7,2.8,1.5,135,BOLLINGER,PARABOLIC_SAR,1.65,46,15,16,0.036000000000000004,77,27,10,0.018000000000000002,83,22,13,0.022,ATR,4.6,23,15m,TEMA,True,True,False,False,False,0.5700000000000001,BOLLINGER,1.65,-67.0162046693835,-74.6359829248022,-70.82609379709285,383.0630467162888,104.53858568754136,243.80081620191507,15m,51,58,54.5,TEMA,50.60851926977688,52.94117647058824,48.275862068965516,COMPLETE
208,-686.1206205500339,2026-01-15 23:37:10.805832,2026-01-15 23:37:15.187455,0 days 00:00:04.381623,13,2.7,2.8,1.5,135,BOLLINGER,PARABOLIC_SAR,1.75,51,15,16,0.036000000000000004,77,27,10,0.017,83,22,13,0.020999999999999998,ATR,4.6,23,15m,TEMA,True,True,False,False,False,0.5700000000000001,BOLLINGER,1.75,-69.47382484108766,-81.94202952459065,-75.70792718283916,424.466017475953,45.9361446145527,235.20108104525283,15m,51,58,54.5,TEMA,49.74645030425964,52.94117647058824,46.55172413793103,COMPLETE
209,-694.8047687086055,2026-01-15 23:37:11.461351,2026-01-15 23:37:17.604745,0 days 00:00:06.143394,13,2.7,3.0,1.5,135,BOLLINGER,PARABOLIC_SAR,1.65,45,15,16,0.036000000000000004,77,27,10,0.018000000000000002,83,22,13,0.022,ATR,4.6,23,15m,TEMA,True,True,False,False,False,0.5700000000000001,BOLLINGER,1.65,-67.05037317089298,-72.43990217478799,-69.74513767284049,313.4880045125786,123.26157999487887,218.37479225372874,15m,50,58,54.0,TEMA,50.13793103448276,52.0,48.275862068965516,COMPLETE
210,-467.9870187359693,2026-01-15 23:37:12.284539,2026-01-15 23:37:18.648049,0 days 00:00:06.363510,13,2.6,2.8,1.5,136,BOLLINGER,PARABOLIC_SAR,1.75,45,15,17,0.036000000000000004,76,27,10,0.013000000000000001,82,22,13,0.022,ATR,4.6,21,15m,TEMA,True,True,False,False,False,0.5700000000000001,BOLLINGER,1.75,-57.67542787169108,-66.91097806116336,-62.293202966427216,506.81163028019796,265.0376619981942,385.92464613919606,15m,52,58,55.0,TEMA,51.06100795755968,53.84615384615385,48.275862068965516,COMPLETE
211,-468.63708306750686,2026-01-15 23:37:13.163576,2026-01-15 23:37:19.367868,0 days 00:00:06.204292,13,2.6,3.0,1.5,130,BOLLINGER,PARABOLIC_SAR,1.75,43,16,16,0.035,76,27,10,0.017,82,22,13,0.022,ATR,4.6,24,15m,TEMA,True,True,False,False,False,0.5700000000000001,BOLLINGER,1.75,-54.223774184504705,-69.89886423517446,-62.06131920983958,477.42714869073427,244.79906345411925,361.1131060724268,15m,51,60,55.5,TEMA,50.931372549019606,56.86274509803921,45.0,COMPLETE
212,-511.37889806779185,2026-01-15 23:37:15.661512,2026-01-15 23:37:21.609869,0 days 00:00:05.948357,14,2.6,3.0,1.5,132,BOLLINGER,PARABOLIC_SAR,1.65,45,16,16,0.035,76,27,10,0.018000000000000002,82,22,13,0.023,ATR,4.6,20,15m,TEMA,True,True,False,False,False,0.5700000000000001,BOLLINGER,1.65,-51.78995552647512,-67.01655823689481,-59.40325688168497,459.66723623894694,214.14945933085127,336.9083477848991,15m,51,58,54.5,TEMA,50.72684246112238,54.90196078431373,46.55172413793103,COMPLETE
213,-557.2032628501338,2026-01-15 23:37:15.666544,2026-01-15 23:37:20.231920,0 days 00:00:04.565376,14,2.6,3.0,1.5,128,BOLLINGER,PARABOLIC_SAR,1.65,44,16,16,0.035,76,27,10,0.018000000000000002,82,22,13,0.023,ATR,4.6,20,15m,TEMA,True,True,False,False,False,0.5700000000000001,BOLLINGER,1.65,-58.88142933558744,-67.65320514920477,-63.2673172423961,381.12281185058407,213.90998223261005,297.5163970415971,15m,52,58,55.0,TEMA,51.1604774535809,55.769230769230774,46.55172413793103,COMPLETE
214,-278.4771600641616,2026-01-15 23:37:17.849355,2026-01-15 23:37:23.039995,0 days 00:00:05.190640,14,2.6,3.0,1.5,130,BOLLINGER,PARABOLIC_SAR,1.65,42,16,16,0.035,76,27,10,0.017,82,22,13,0.023,ATR,4.7,19,15m,DEMA,True,True,False,False,False,0.5700000000000001,BOLLINGER,1.65,-51.712530181556424,-69.10896310345211,-60.410746642504265,824.8332660823085,198.23792587304024,511.53559597767435,15m,55,61,58.0,DEMA,51.2220566318927,58.18181818181818,44.26229508196721,COMPLETE
215,-17.58799253811776,2026-01-15 23:37:18.175860,2026-01-15 23:37:23.424226,0 days 00:00:05.248366,14,2.6,3.0,1.5,131,BOLLINGER,PARABOLIC_SAR,1.7000000000000002,41,28,17,0.035,76,27,10,0.017,82,23,12,0.023,ATR,4.7,20,15m,DEMA,True,True,False,False,False,0.5800000000000001,BOLLINGER,1.7000000000000002,-37.79161754531378,-70.72223171158124,-54.25692462844751,1080.7090202906973,196.84970033663808,638.7793603136677,15m,54,56,55.0,DEMA,51.9510582010582,59.25925925925925,44.642857142857146,COMPLETE
216,-266.2444307651158,2026-01-15 23:37:19.161230,2026-01-15 23:37:25.738425,0 days 00:00:06.577195,14,2.6,3.0,1.5,130,BOLLINGER,PARABOLIC_SAR,1.7000000000000002,41,16,17,0.035,76,27,10,0.014,82,23,13,0.023,ATR,4.7,20,15m,DEMA,True,True,False,False,False,0.5700000000000001,BOLLINGER,1.7000000000000002,-52.93643657988961,-70.60568806547212,-61.77106232268086,864.286098446413,194.88138519243378,529.5837418194234,15m,55,61,58.0,DEMA,51.2220566318927,58.18181818181818,44.26229508196721,COMPLETE
217,-465.06393179452425,2026-01-15 23:37:19.666345,2026-01-15 23:37:26.234046,0 days 00:00:06.567701,14,2.5,3.0,1.5,130,BOLLINGER,PARABOLIC_SAR,1.7000000000000002,41,16,17,0.035,76,27,10,0.013000000000000001,82,23,13,0.023,ATR,4.7,20,15m,TEMA,True,True,False,False,False,0.5700000000000001,BOLLINGER,1.7000000000000002,-47.33568235979582,-80.90627772326084,-64.12098004152833,601.5856381247906,96.9038641017135,349.24475111325205,15m,55,62,58.5,TEMA,49.14956011730205,56.36363636363636,41.935483870967744,COMPLETE
218,-688.9426947254424,2026-01-15 23:37:20.719933,2026-01-15 23:37:26.472794,0 days 00:00:05.752861,12,2.6,3.1,1.5,143,BOLLINGER,PARABOLIC_SAR,1.8,40,16,17,0.035,76,27,10,0.014,82,23,13,0.02,ATR,4.6,20,15m,TEMA,True,True,False,False,False,0.5800000000000001,BOLLINGER,1.8,-73.01947495085518,-66.19766447594071,-69.60856971339794,231.37696161474324,214.71693540145074,223.046948508097,15m,51,59,55.0,TEMA,51.1797939514789,54.90196078431373,47.45762711864407,COMPLETE
219,-455.4787042172584,2026-01-15 23:37:22.125156,2026-01-15 23:37:28.021120,0 days 00:00:05.895964,14,2.6,3.1,1.5,132,BOLLINGER,PARABOLIC_SAR,1.7000000000000002,40,16,17,0.035,76,27,10,0.014,82,23,13,0.023,ATR,4.7,20,15m,TEMA,True,True,False,False,False,0.5800000000000001,BOLLINGER,1.7000000000000002,-51.88454944313507,-60.72986045492706,-56.30720494903107,435.76429662519763,310.9941317725562,373.3792141988769,15m,51,58,54.5,TEMA,50.72684246112238,54.90196078431373,46.55172413793103,COMPLETE
220,-775.1036139880389,2026-01-15 23:37:23.228745,2026-01-15 23:37:29.588727,0 days 00:00:06.359982,14,3.0,3.1,1.5,130,BOLLINGER,PARABOLIC_SAR,1.7000000000000002,40,16,17,0.035,76,27,10,0.014,82,22,13,0.023,ATR,4.7,19,15m,DEMA,True,True,False,False,False,0.5800000000000001,BOLLINGER,1.7000000000000002,-67.64521650182472,-77.18399209374473,-72.41460429778473,237.71337026687286,23.716439083238853,130.71490467505586,15m,50,53,51.5,DEMA,48.75471698113208,56.00000000000001,41.509433962264154,COMPLETE
