number,value,datetime_start,datetime_complete,duration,params_ADX_THRESHOLD,params_ATR_MULTIPLIER,params_ATR_STOP_LOSS_MULT,params_BB_STD,params_ENTRY_PERIOD,params_ENTRY_TYPE,params_EXIT_TYPE,params_LEVERAGE,params_MA_PERIOD,params_MFI_THRESHOLD,params_MFI_WINDOW,params_RISK_PER_TRADE,params_RSI_OVERBOUGHT,params_RSI_OVERSOLD,params_RSI_WINDOW,params_SAR_STEP,params_STOCH_OVERBOUGHT,params_STOCH_OVERSOLD,params_STOCH_WINDOW,params_STOP_LOSS_PCT,params_STOP_LOSS_TYPE,params_SUPERTREND_MULT,params_SUPERTREND_PERIOD,params_TIMEFRAME,params_TREND_FILTER_TYPE,params_USE_ADX,params_USE_MFI,params_USE_RSI,params_USE_STOCHASTIC,params_USE_VHF,params_VHF_THRESHOLD,user_attrs_entry_type,user_attrs_leverage,user_attrs_mdd_BTC_USDT,user_attrs_mdd_ETH_USDT,user_attrs_mdd_avg,user_attrs_return_BTC_USDT,user_attrs_return_ETH_USDT,user_attrs_return_avg,user_attrs_timeframe,user_attrs_trades_BTC_USDT,user_attrs_trades_ETH_USDT,user_attrs_trades_avg,user_attrs_trend_filter,user_attrs_win_rate_avg,user_attrs_winrate_BTC_USDT,user_attrs_winrate_ETH_USDT,state
732,-730.0392848326837,2026-01-15 23:55:23.760284,2026-01-15 23:55:45.618147,0 days 00:00:21.857863,28,1.8,3.7,1.6,148,BOLLINGER,PARABOLIC_SAR,1.9500000000000002,32,16,11,0.032,67,33,13,0.01,82,13,12,0.045000000000000005,ATR,2.6,5,3m,SMA,False,False,False,False,False,0.4,BOLLINGER,1.9500000000000002,-54.47007179971733,-85.28817721227459,-69.87912450599596,281.1485236438839,-20.834466659184265,130.1570284923498,3m,112,112,112.0,SMA,45.982142857142854,49.107142857142854,42.857142857142854,COMPLETE
733,1227.8844284098896,2026-01-15 23:55:30.570893,2026-01-15 23:55:48.560249,0 days 00:00:17.989356,28,2.3,3.7,1.6,150,BOLLINGER,PARABOLIC_SAR,1.9500000000000002,32,16,12,0.033,67,33,13,0.01,82,13,12,0.045000000000000005,ATR,2.6,6,3m,SUPERTREND,False,False,False,False,False,0.42,BOLLINGER,1.9500000000000002,-26.918270714249083,-73.71372325939298,-50.315996986821034,2793.2885316202623,118.64281283846204,1455.965672229362,3m,53,60,56.5,SUPERTREND,57.688679245283026,60.37735849056604,55.00000000000001,COMPLETE
734,412.18273625395705,2026-01-15 23:55:37.882499,2026-01-15 23:55:58.630752,0 days 00:00:20.748253,28,2.0,3.6,1.6,148,BOLLINGER,PARABOLIC_SAR,1.9500000000000002,32,15,12,0.033,66,34,13,0.01,82,13,12,0.045000000000000005,ATR,2.6,6,3m,SUPERTREND,False,False,False,False,False,0.4,BOLLINGER,1.9500000000000002,-32.37499403404897,-75.03327540939516,-53.70413472172206,1915.752256466785,48.418879669171574,982.0855680679782,3m,72,72,72.0,SUPERTREND,52.77777777777778,58.333333333333336,47.22222222222222,COMPLETE
735,412.18273625395705,2026-01-15 23:55:39.037826,2026-01-15 23:55:58.686829,0 days 00:00:19.649003,28,2.0,3.6,1.6,148,BOLLINGER,PARABOLIC_SAR,1.9500000000000002,33,16,11,0.033,67,34,13,0.01,82,13,12,0.045000000000000005,ATR,2.6,7,3m,SUPERTREND,False,False,False,False,False,0.41,BOLLINGER,1.9500000000000002,-32.37499403404897,-75.03327540939516,-53.70413472172206,1915.752256466785,48.418879669171574,982.0855680679782,3m,72,72,72.0,SUPERTREND,52.77777777777778,58.333333333333336,47.22222222222222,COMPLETE
736,1108.7659829414733,2026-01-15 23:55:41.548926,2026-01-15 23:55:58.639761,0 days 00:00:17.090835,28,2.3,3.6,1.6,148,BOLLINGER,PARABOLIC_SAR,1.9500000000000002,32,15,11,0.033,66,34,13,0.01,82,13,12,0.045000000000000005,ATR,2.8,6,3m,SUPERTREND,False,False,False,False,False,0.42,BOLLINGER,1.9500000000000002,-27.276411548057617,-77.88320850415695,-52.57981002610728,2766.2228310650385,73.27520752672004,1419.7490192958792,3m,53,61,57.0,SUPERTREND,57.23785957315187,60.37735849056604,54.09836065573771,COMPLETE
737,1153.5110281700372,2026-01-15 23:55:42.767457,2026-01-15 23:56:02.743087,0 days 00:00:19.975630,28,2.3,3.6,1.6,148,BOLLINGER,PARABOLIC_SAR,2.0,33,17,12,0.033,67,34,13,0.01,82,13,12,0.045000000000000005,ATR,2.6,6,3m,SUPERTREND,False,False,False,False,False,0.42,BOLLINGER,2.0,-27.918223010644304,-78.90386887350006,-53.41104594207218,2943.177876278425,68.05126317436336,1505.6145697263942,3m,53,61,57.0,SUPERTREND,57.23785957315187,60.37735849056604,54.09836065573771,COMPLETE
738,1153.5110281700372,2026-01-15 23:55:46.066736,2026-01-15 23:56:05.674773,0 days 00:00:19.608037,29,2.3,3.6,1.6,148,BOLLINGER,PARABOLIC_SAR,2.0,33,15,12,0.033,66,34,13,0.01,82,13,12,0.045000000000000005,ATR,2.8,7,3m,SUPERTREND,False,False,False,False,False,0.42,BOLLINGER,2.0,-27.918223010644304,-78.90386887350006,-53.41104594207218,2943.177876278425,68.05126317436336,1505.6145697263942,3m,53,61,57.0,SUPERTREND,57.23785957315187,60.37735849056604,54.09836065573771,COMPLETE
739,1153.5110281700372,2026-01-15 23:55:48.897860,2026-01-15 23:56:09.351645,0 days 00:00:20.453785,28,2.3,3.6,1.6,148,BOLLINGER,PARABOLIC_SAR,2.0,34,16,12,0.033,67,34,13,0.011,82,13,12,0.045000000000000005,ATR,2.8,6,3m,SUPERTREND,False,False,False,False,False,0.42,BOLLINGER,2.0,-27.918223010644304,-78.90386887350006,-53.41104594207218,2943.177876278425,68.05126317436336,1505.6145697263942,3m,53,61,57.0,SUPERTREND,57.23785957315187,60.37735849056604,54.09836065573771,COMPLETE
740,1117.6546889343335,2026-01-15 23:55:58.772342,2026-01-15 23:56:17.566616,0 days 00:00:18.794274,29,2.2,3.6,1.6,147,BOLLINGER,PARABOLIC_SAR,2.0,35,16,12,0.033,67,33,13,0.011,83,13,12,0.046000000000000006,ATR,2.7,7,3m,SUPERTREND,False,False,False,False,False,0.42,BOLLINGER,2.0,-27.03051848172698,-80.54683600545584,-53.78867724359141,2777.196451773874,73.05215342737105,1425.1243026006225,3m,56,64,60.0,SUPERTREND,56.138392857142854,60.71428571428571,51.5625,COMPLETE
741,1117.6546889343335,2026-01-15 23:55:58.810184,2026-01-15 23:56:19.797967,0 days 00:00:20.987783,27,2.2,3.6,1.6,147,BOLLINGER,PARABOLIC_SAR,2.0,32,15,12,0.033,67,33,13,0.011,83,13,12,0.046000000000000006,ATR,2.9000000000000004,7,3m,SUPERTREND,False,False,False,False,False,0.42,BOLLINGER,2.0,-27.03051848172698,-80.54683600545584,-53.78867724359141,2777.196451773874,73.05215342737105,1425.1243026006225,3m,56,64,60.0,SUPERTREND,56.138392857142854,60.71428571428571,51.5625,COMPLETE
742,1117.6546889343335,2026-01-15 23:55:59.855746,2026-01-15 23:56:22.830452,0 days 00:00:22.974706,29,2.2,3.6,1.6,147,BOLLINGER,PARABOLIC_SAR,2.0,34,15,12,0.033,67,33,13,0.011,83,13,12,0.046000000000000006,ATR,2.9000000000000004,7,3m,SUPERTREND,False,False,False,False,False,0.42,BOLLINGER,2.0,-27.03051848172698,-80.54683600545584,-53.78867724359141,2777.196451773874,73.05215342737105,1425.1243026006225,3m,56,64,60.0,SUPERTREND,56.138392857142854,60.71428571428571,51.5625,COMPLETE
743,1114.933485437171,2026-01-15 23:56:03.769034,2026-01-15 23:56:27.864957,0 days 00:00:24.095923,27,2.2,3.6,1.6,148,BOLLINGER,PARABOLIC_SAR,2.0,34,15,12,0.032,66,33,13,0.011,82,13,12,0.044000000000000004,ATR,2.9000000000000004,6,3m,SUPERTREND,False,False,False,False,False,0.42,BOLLINGER,2.0,-27.03051848172698,-80.6783243930523,-53.85442143738965,2767.675346005194,74.03569617263052,1420.8555210889124,3m,56,64,60.0,SUPERTREND,56.138392857142854,60.71428571428571,51.5625,COMPLETE
744,1211.0625273634741,2026-01-15 23:56:05.805180,2026-01-15 23:56:27.721902,0 days 00:00:21.916722,27,2.2,2.3,1.6,150,BOLLINGER,PARABOLIC_SAR,2.0,35,15,12,0.032,66,34,13,0.01,83,13,12,0.045000000000000005,ATR,2.8,6,3m,SUPERTREND,False,False,False,False,False,0.42,BOLLINGER,2.0,-27.030700423922017,-77.3152116429763,-52.172956033449154,2758.211090704059,166.83781976220254,1462.5244552331308,3m,56,63,59.5,SUPERTREND,56.54761904761905,60.71428571428571,52.38095238095239,COMPLETE
745,1094.4364967901674,2026-01-15 23:56:13.049554,2026-01-15 23:56:30.485625,0 days 00:00:17.436071,27,2.2,1.9,1.6,150,BOLLINGER,PARABOLIC_SAR,2.0,34,15,12,0.032,66,34,13,0.01,83,13,12,0.044000000000000004,ATR,3.0,6,3m,SUPERTREND,False,False,False,False,False,0.42,BOLLINGER,2.0,-27.02331566228945,-79.3544747453726,-53.188895203831024,2539.953417797242,142.15971178637784,1341.05656479181,3m,57,64,60.5,SUPERTREND,55.60581140350877,59.64912280701754,51.5625,COMPLETE
746,1249.2926373920327,2026-01-15 23:56:18.998283,2026-01-15 23:56:36.781367,0 days 00:00:17.783084,28,2.2,3.6,1.6,150,BOLLINGER,PARABOLIC_SAR,2.1,34,15,12,0.032,66,34,13,0.01,83,13,12,0.044000000000000004,ATR,2.7,6,3m,SUPERTREND,False,False,False,False,False,0.42,BOLLINGER,2.1,-28.379143589697748,-79.00498464951333,-53.69206411960554,3104.1140471995004,113.64035579430862,1608.8772014969045,3m,56,63,59.5,SUPERTREND,56.54761904761905,60.71428571428571,52.38095238095239,COMPLETE
747,657.0669481595569,2026-01-15 23:56:22.812980,2026-01-15 23:56:49.121065,0 days 00:00:26.308085,28,2.1,3.6,1.6,150,BOLLINGER,PARABOLIC_SAR,2.05,26,15,12,0.032,66,34,13,0.01,83,13,12,0.043000000000000003,ATR,2.8,6,3m,SUPERTREND,False,False,False,False,False,0.41,BOLLINGER,2.05,-31.219689326576873,-78.54768547022186,-54.88368739839937,2446.760050163903,15.581324598986376,1231.1706873814446,3m,64,69,66.5,SUPERTREND,52.038043478260875,56.25,47.82608695652174,COMPLETE
748,-1336.1172457257908,2026-01-15 23:56:24.037720,2026-01-15 23:56:49.424812,0 days 00:00:25.387092,28,2.1,3.6,1.6,150,BOLLINGER,PARABOLIC_SAR,2.05,35,15,12,0.032,66,34,13,0.01,83,13,12,0.043000000000000003,ATR,2.8,6,3m,SUPERTREND,False,False,True,False,False,0.41,BOLLINGER,2.05,-36.73775966505015,-85.68629954957949,-61.21202960731482,238.74011040325234,-52.26018297068736,93.23996371628249,3m,34,41,37.5,SUPERTREND,45.98278335724534,52.94117647058824,39.02439024390244,COMPLETE
749,-1336.1172457257908,2026-01-15 23:56:28.191618,2026-01-15 23:56:51.517651,0 days 00:00:23.326033,28,2.1,2.2,1.6,150,BOLLINGER,PARABOLIC_SAR,2.05,36,16,12,0.032,66,34,13,0.01,83,13,11,0.044000000000000004,ATR,2.8,6,3m,SUPERTREND,False,False,True,False,False,0.4,BOLLINGER,2.05,-36.73775966505015,-85.68629954957949,-61.21202960731482,238.74011040325234,-52.26018297068736,93.23996371628249,3m,34,41,37.5,SUPERTREND,45.98278335724534,52.94117647058824,39.02439024390244,COMPLETE
750,-1338.4032886323093,2026-01-15 23:56:28.278812,2026-01-15 23:56:49.497200,0 days 00:00:21.218388,28,2.1,1.3,1.6,150,BOLLINGER,PARABOLIC_SAR,2.1,35,15,12,0.032,66,34,13,0.01,83,13,12,0.043000000000000003,ATR,2.8,6,3m,SUPERTREND,False,False,True,False,False,0.4,BOLLINGER,2.1,-33.61722007398773,-86.47038621636449,-60.04380314517611,220.44086780592,-48.81267178442384,85.81409801074807,3m,35,45,40.0,SUPERTREND,42.06349206349206,48.57142857142857,35.55555555555556,COMPLETE
751,-1336.1172457257908,2026-01-15 23:56:30.561529,2026-01-15 23:56:51.317761,0 days 00:00:20.756232,28,2.1,2.5,1.6,150,BOLLINGER,PARABOLIC_SAR,2.05,26,15,12,0.032,66,34,13,0.01,83,13,11,0.042,ATR,2.8,6,3m,SUPERTREND,False,False,True,False,False,0.41,BOLLINGER,2.05,-36.73775966505015,-85.68629954957949,-61.21202960731482,238.74011040325234,-52.26018297068736,93.23996371628249,3m,34,41,37.5,SUPERTREND,45.98278335724534,52.94117647058824,39.02439024390244,COMPLETE
752,-1337.0081973993074,2026-01-15 23:56:39.030076,2026-01-15 23:57:01.938262,0 days 00:00:22.908186,28,2.1,3.5,1.6,150,BOLLINGER,PARABOLIC_SAR,2.0,26,15,12,0.032,66,34,13,0.01,83,13,11,0.042,ATR,3.1,5,3m,SUPERTREND,False,False,True,False,False,0.41,BOLLINGER,2.0,-35.97643185857627,-84.78143666694874,-60.3789342627625,232.9104728710104,-49.849846847919046,91.53031301154567,3m,34,41,37.5,SUPERTREND,45.98278335724534,52.94117647058824,39.02439024390244,COMPLETE
753,606.8788255020781,2026-01-15 23:56:51.105610,2026-01-15 23:57:12.355441,0 days 00:00:21.249831,27,2.0,2.3,1.6,150,BOLLINGER,PARABOLIC_SAR,2.05,27,15,12,0.032,66,34,13,0.01,83,13,11,0.044000000000000004,ATR,2.8,6,3m,SUPERTREND,False,False,False,False,False,0.41,BOLLINGER,2.05,-33.77064197925423,-82.04088433885215,-57.905763159053194,2426.067859675474,29.07115254283028,1227.5695061091521,3m,71,72,71.5,SUPERTREND,52.48435054773083,57.74647887323944,47.22222222222222,COMPLETE
754,-240.09460857958402,2026-01-15 23:56:51.123658,2026-01-15 23:57:12.565911,0 days 00:00:21.442253,27,2.1,3.5,1.6,150,BOLLINGER,ATR,2.1,26,15,12,0.032,66,34,13,0.01,83,13,11,0.044000000000000004,ATR,2.8,5,3m,SUPERTREND,False,False,False,False,True,0.41,BOLLINGER,2.1,-28.811214883364418,-58.72212837848628,-43.76667163092535,1179.6104475321374,82.79556568370054,631.203006607919,3m,46,42,44.0,SUPERTREND,56.72877846790891,58.69565217391305,54.761904761904766,COMPLETE
755,-1030.5542028793361,2026-01-15 23:56:51.140830,2026-01-15 23:57:11.118824,0 days 00:00:19.977994,27,2.0,1.7000000000000002,1.6,150,BOLLINGER,ATR,2.05,26,15,12,0.031,66,34,13,0.01,83,13,12,0.042,ATR,2.8,5,3m,MACD,False,False,False,False,True,0.41,BOLLINGER,2.05,-55.59703443985163,-48.14138114000313,-51.86920778992739,59.490714732595976,187.15348709408514,123.32210091334056,3m,56,49,52.5,MACD,50.89285714285714,44.642857142857146,57.14285714285714,COMPLETE
756,-1081.430093610541,2026-01-15 23:56:51.669143,2026-01-15 23:57:14.088545,0 days 00:00:22.419402,28,1.9,1.7000000000000002,1.6,150,BOLLINGER,ATR,2.05,26,15,12,0.031,66,34,13,0.01,83,12,12,0.044000000000000004,ATR,2.7,5,3m,MACD,False,False,False,False,True,0.42,BOLLINGER,2.05,-45.44791912897484,-57.432535501588134,-51.44022731528149,121.74394312179508,108.34035502416342,115.04214907297924,3m,56,49,52.5,MACD,51.53061224489796,50.0,53.06122448979592,COMPLETE
757,-60.95326152107191,2026-01-15 23:56:52.609114,2026-01-15 23:57:14.283544,0 days 00:00:21.674430,28,2.2,2.3,1.6,150,BOLLINGER,ATR,2.1,41,15,12,0.032,66,34,13,0.01,83,12,12,0.042,ATR,2.7,7,3m,SUPERTREND,False,False,False,False,True,0.42,BOLLINGER,2.1,-28.35165111472281,-60.36621499130599,-44.3589330530144,1360.790022496872,117.19258783301805,738.9913051649451,3m,39,39,39.0,SUPERTREND,61.53846153846154,64.1025641025641,58.97435897435898,COMPLETE
758,-825.4555335402656,2026-01-15 23:57:04.540945,2026-01-15 23:57:32.964478,0 days 00:00:28.423533,27,2.2,1.7000000000000002,1.6,150,BOLLINGER,PARABOLIC_SAR,2.05,41,15,12,0.031,67,34,12,0.01,83,12,12,0.044000000000000004,ATR,2.7,5,3m,MACD,False,False,False,False,False,0.42,BOLLINGER,2.05,-71.29374966888571,-91.21140766444424,-81.25257866666497,227.1415103708271,-55.276638403677524,85.93243598357478,3m,67,82,74.5,MACD,44.33927921368766,44.776119402985074,43.90243902439025,COMPLETE
759,1159.1377726522069,2026-01-15 23:57:12.320496,2026-01-15 23:57:32.974751,0 days 00:00:20.654255,27,2.2,3.5,1.6,148,BOLLINGER,PARABOLIC_SAR,2.05,40,15,12,0.031,67,34,12,0.01,83,12,12,0.045000000000000005,ATR,2.7,7,3m,SUPERTREND,False,False,False,False,False,0.42,BOLLINGER,2.05,-27.704755082533726,-81.60462347088946,-54.65468927671159,2937.6399290672266,71.46825002093254,1504.5540895440795,3m,56,64,60.0,SUPERTREND,56.138392857142854,60.71428571428571,51.5625,COMPLETE
760,-1315.418884518228,2026-01-15 23:57:14.075940,2026-01-15 23:57:36.370729,0 days 00:00:22.294789,28,2.2,1.4,1.6,147,DONCHIAN,PARABOLIC_SAR,2.0,41,15,11,0.033,67,34,12,0.011,83,12,12,0.045000000000000005,ATR,2.7,7,3m,SUPERTREND,False,False,False,False,False,0.42,DONCHIAN,2.0,-41.40748003083233,-59.47103434233838,-50.43925718658535,220.4533462502983,25.12051202830183,122.78692913930007,3m,41,36,38.5,SUPERTREND,44.00406504065041,46.34146341463415,41.66666666666667,COMPLETE
761,912.359893256672,2026-01-15 23:57:14.080447,2026-01-15 23:57:36.587724,0 days 00:00:22.507277,28,2.3,1.2,1.6,148,BOLLINGER,PARABOLIC_SAR,2.0,42,15,12,0.033,67,34,12,0.011,84,12,12,0.045000000000000005,ATR,2.7,7,3m,SUPERTREND,False,False,False,False,False,0.42,BOLLINGER,2.0,-28.14332790658145,-67.06463032149871,-47.60397911404008,1824.1886911461916,316.64714478584267,1070.417917966017,3m,63,68,65.5,SUPERTREND,47.33893557422969,47.61904761904761,47.05882352941176,COMPLETE
762,-895.6764078917804,2026-01-15 23:57:14.175975,2026-01-15 23:57:30.344758,0 days 00:00:16.168783,28,2.2,3.6,1.6,147,CCI,PARABOLIC_SAR,2.0,41,15,12,0.033,67,34,12,0.011,83,12,12,0.045000000000000005,ATR,2.7,7,3m,SUPERTREND,False,False,False,False,False,0.42,CCI,2.0,-47.54498629409311,-86.24072298810162,-66.89285464109736,919.3435460180502,6.499659598906664,462.92160280847844,3m,37,45,41.0,SUPERTREND,56.87687687687688,64.86486486486487,48.888888888888886,COMPLETE
763,-1227.9648876021702,2026-01-15 23:57:14.358804,2026-01-15 23:57:36.367479,0 days 00:00:22.008675,27,2.3,3.7,1.6,147,DONCHIAN,PARABOLIC_SAR,2.0,40,15,11,0.033,67,34,12,0.011,82,12,12,0.045000000000000005,ATR,2.7,7,3m,SUPERTREND,False,False,False,False,False,0.42,DONCHIAN,2.0,-43.51628558584675,-59.32974124956451,-51.42301341770563,342.01042882085443,34.892353823045156,188.45139132194979,3m,36,30,33.0,SUPERTREND,50.0,50.0,50.0,COMPLETE
764,1358.337012413991,2026-01-15 23:57:32.957901,2026-01-15 23:57:51.228141,0 days 00:00:18.270240,28,2.3,2.1,1.6,147,BOLLINGER,PARABOLIC_SAR,2.1,32,15,11,0.033,67,35,13,0.011,82,13,12,0.045000000000000005,ATR,2.9000000000000004,8,3m,SUPERTREND,False,False,False,False,False,0.42,BOLLINGER,2.1,-28.986472553788644,-80.72249967842612,-54.85448611610738,3525.863391786738,97.08389916442289,1811.4736454755803,3m,52,61,56.5,SUPERTREND,57.81841109709963,61.53846153846154,54.09836065573771,COMPLETE
765,-586.8218947812093,2026-01-15 23:57:33.331360,2026-01-15 23:57:54.716598,0 days 00:00:21.385238,27,2.2,2.0,1.6,44,DONCHIAN,PARABOLIC_SAR,2.1,42,15,11,0.031,67,35,12,0.01,84,12,12,0.045000000000000005,ATR,2.9000000000000004,7,3m,SUPERTREND,False,False,False,False,False,0.42,DONCHIAN,2.1,-49.930420370569045,-58.49036280953863,-54.21039159005384,546.8403685460192,6.698998499895516,276.7696835229574,3m,53,59,56.0,SUPERTREND,44.86728493763991,49.056603773584904,40.67796610169492,COMPLETE
766,-1158.474751203672,2026-01-15 23:57:33.359286,2026-01-15 23:57:53.836119,0 days 00:00:20.476833,27,2.2,2.1,1.6,147,DONCHIAN,PARABOLIC_SAR,2.1,39,15,11,0.031,67,35,12,0.01,84,12,12,0.045000000000000005,ATR,2.9000000000000004,7,3m,SUPERTREND,False,False,False,False,False,0.42,DONCHIAN,2.1,-40.76410799736707,-57.562300291132786,-49.16320414424993,490.2958441777903,-23.3212838454508,233.48728016616974,3m,36,35,35.5,SUPERTREND,47.817460317460316,52.77777777777778,42.857142857142854,COMPLETE
767,1279.1693959163995,2026-01-15 23:57:36.444672,2026-01-15 23:57:59.469418,0 days 00:00:23.024746,27,2.3,3.2,1.6,147,BOLLINGER,PARABOLIC_SAR,2.05,44,15,12,0.031,67,35,13,0.01,83,12,12,0.045000000000000005,ATR,2.9000000000000004,8,3m,SUPERTREND,False,False,False,False,False,0.4,BOLLINGER,2.05,-28.58547123862369,-81.99450909056078,-55.28999016459224,3410.0517955252394,50.77531808030277,1730.4135568027712,3m,52,61,56.5,SUPERTREND,57.81841109709963,61.53846153846154,54.09836065573771,COMPLETE
768,1228.758109680276,2026-01-15 23:57:36.486657,2026-01-15 23:57:57.767533,0 days 00:00:21.280876,27,2.3,3.2,1.6,148,BOLLINGER,PARABOLIC_SAR,2.1,44,15,12,0.031,65,35,12,0.01,84,12,12,0.043000000000000003,ATR,2.9000000000000004,8,3m,SUPERTREND,False,False,False,False,False,0.42,BOLLINGER,2.1,-29.233580924976383,-83.01330734784244,-56.12344413640941,3319.916792248805,46.64683336094073,1683.281812804873,3m,53,61,57.0,SUPERTREND,57.23785957315187,60.37735849056604,54.09836065573771,COMPLETE
769,1279.1693959163995,2026-01-15 23:57:36.790646,2026-01-15 23:57:59.213736,0 days 00:00:22.423090,27,2.3,3.2,1.6,147,BOLLINGER,PARABOLIC_SAR,2.05,35,15,12,0.031,67,35,13,0.01,84,12,12,0.043000000000000003,ATR,2.9000000000000004,8,3m,SUPERTREND,False,False,False,False,False,0.4,BOLLINGER,2.05,-28.58547123862369,-81.99450909056078,-55.28999016459224,3410.0517955252394,50.77531808030277,1730.4135568027712,3m,52,61,56.5,SUPERTREND,57.81841109709963,61.53846153846154,54.09836065573771,COMPLETE
770,509.7225610492005,2026-01-15 23:57:53.480108,2026-01-15 23:58:17.711390,0 days 00:00:24.231282,24,2.0,1.8,1.6,147,BOLLINGER,PARABOLIC_SAR,2.1,35,15,11,0.031,67,34,13,0.01,84,13,12,0.045000000000000005,ATR,3.1,8,3m,SUPERTREND,False,False,False,False,False,0.39,BOLLINGER,2.1,-36.8943422166378,-78.01949222329657,-57.45691721996718,2249.304034537038,71.22176994466712,1160.2629022408526,3m,72,72,72.0,SUPERTREND,53.47222222222222,59.72222222222222,47.22222222222222,COMPLETE
771,526.6525632029907,2026-01-15 23:57:54.469941,2026-01-15 23:58:14.040795,0 days 00:00:19.570854,26,2.0,3.5,1.6,148,BOLLINGER,PARABOLIC_SAR,2.1,35,15,10,0.032,65,35,13,0.01,83,13,12,0.043000000000000003,ATR,3.0,8,3m,SUPERTREND,False,False,False,False,False,0.41,BOLLINGER,2.1,-34.637421777450335,-78.05232817893159,-56.34487497819096,2267.1268278347693,36.24459445800882,1151.6857111463892,3m,72,72,72.0,SUPERTREND,52.77777777777778,58.333333333333336,47.22222222222222,COMPLETE
772,1266.476580563497,2026-01-15 23:57:56.748362,2026-01-15 23:58:13.796761,0 days 00:00:17.048399,26,2.3,2.5,1.6,148,BOLLINGER,PARABOLIC_SAR,2.1,35,15,12,0.032,67,35,13,0.01,83,13,12,0.043000000000000003,ATR,3.0,8,3m,SUPERTREND,False,False,False,False,False,0.41,BOLLINGER,2.1,-29.233580924976383,-81.35990762811343,-55.296744276544906,3319.916792248805,81.04958570465713,1700.483188976731,3m,53,61,57.0,SUPERTREND,57.23785957315187,60.37735849056604,54.09836065573771,COMPLETE
773,528.111471789538,2026-01-15 23:57:57.826340,2026-01-15 23:58:18.219210,0 days 00:00:20.392870,26,2.0,1.8,1.6,148,BOLLINGER,PARABOLIC_SAR,2.1,35,15,11,0.03,65,35,13,0.011,84,13,12,0.043000000000000003,ATR,2.9000000000000004,8,3m,SUPERTREND,False,False,False,False,False,0.4,BOLLINGER,2.1,-36.20862169496486,-78.206892156988,-57.20775692597643,2258.276531678859,74.0353371960754,1166.1559344374673,3m,72,72,72.0,SUPERTREND,52.77777777777778,58.333333333333336,47.22222222222222,COMPLETE
774,1327.1552298626511,2026-01-15 23:57:59.285748,2026-01-15 23:58:20.918054,0 days 00:00:21.632306,26,2.3,2.2,1.6,147,BOLLINGER,PARABOLIC_SAR,2.1,149,15,11,0.031,65,35,13,0.01,83,12,12,0.042,ATR,3.0,8,3m,SUPERTREND,False,False,False,False,False,0.39,BOLLINGER,2.1,-28.986472553788644,-81.03054559247973,-55.008509073134185,3477.6256387308053,83.14158131381501,1780.3836100223102,3m,52,61,56.5,SUPERTREND,57.81841109709963,61.53846153846154,54.09836065573771,COMPLETE
