number,value,datetime_start,datetime_complete,duration,params_ADX_THRESHOLD,params_ATR_MULTIPLIER,params_ATR_STOP_LOSS_MULT,params_BB_STD,params_ENTRY_PERIOD,params_ENTRY_TYPE,params_EXIT_TYPE,params_LEVERAGE,params_MA_PERIOD,params_MFI_THRESHOLD,params_MFI_WINDOW,params_RISK_PER_TRADE,params_RSI_OVERBOUGHT,params_RSI_OVERSOLD,params_RSI_WINDOW,params_SAR_STEP,params_STOCH_OVERBOUGHT,params_STOCH_OVERSOLD,params_STOCH_WINDOW,params_STOP_LOSS_PCT,params_STOP_LOSS_TYPE,params_SUPERTREND_MULT,params_SUPERTREND_PERIOD,params_TIMEFRAME,params_TREND_FILTER_TYPE,params_USE_ADX,params_USE_MFI,params_USE_RSI,params_USE_STOCHASTIC,params_USE_VHF,params_VHF_THRESHOLD,user_attrs_entry_type,user_attrs_leverage,user_attrs_mdd_BTC_USDT,user_attrs_mdd_ETH_USDT,user_attrs_mdd_avg,user_attrs_return_BTC_USDT,user_attrs_return_ETH_USDT,user_attrs_return_avg,user_attrs_timeframe,user_attrs_trades_BTC_USDT,user_attrs_trades_ETH_USDT,user_attrs_trades_avg,user_attrs_trend_filter,user_attrs_win_rate_avg,user_attrs_winrate_BTC_USDT,user_attrs_winrate_ETH_USDT,state
389,-507.96154441195813,2026-01-15 23:42:18.849762,2026-01-15 23:42:32.559471,0 days 00:00:13.709709,16,4.0,3.9000000000000004,1.5,141,BOLLINGER,PARABOLIC_SAR,2.35,55,19,15,0.033,75,28,20,0.018000000000000002,79,12,17,0.046000000000000006,ATR,1.4,20,5m,SUPERTREND,False,True,False,False,False,0.47,BOLLINGER,2.35,-35.20354517548833,-88.92261678678453,-62.06308098113643,4298.679978116526,690.4921637915829,2494.586070954055,5m,24,26,25.0,SUPERTREND,64.42307692307692,75.0,53.84615384615385,COMPLETE
390,-621.4624878449231,2026-01-15 23:42:19.729268,2026-01-15 23:42:35.320483,0 days 00:00:15.591215,17,4.0,3.9000000000000004,1.5,141,CCI,PARABOLIC_SAR,2.35,56,19,14,0.033,75,28,20,0.018000000000000002,78,12,17,0.046000000000000006,ATR,3.1,20,5m,SUPERTREND,False,True,False,False,False,0.4,CCI,2.35,-20.02159543234065,-70.25209813103878,-45.13684678168971,3385.8927602881736,378.7962910875519,1882.3445256878626,5m,13,17,15.0,SUPERTREND,64.93212669683258,76.92307692307693,52.94117647058824,COMPLETE
391,-2232.2394234286257,2026-01-15 23:42:28.389485,2026-01-15 23:42:44.098904,0 days 00:00:15.709419,17,4.2,3.9000000000000004,1.5,141,CCI,PARABOLIC_SAR,2.4000000000000004,54,19,14,0.027000000000000003,75,28,20,0.018000000000000002,79,20,16,0.041,ATR,1.6,20,5m,SUPERTREND,False,True,False,False,True,0.45999999999999996,CCI,2.4000000000000004,-43.37241298464252,-101.40540778308595,-72.38891038386424,1524.9780091077716,-106.74826918898621,709.1148699593928,5m,12,7,9.5,SUPERTREND,50.595238095238095,58.333333333333336,42.857142857142854,COMPLETE
392,-2232.5310682141644,2026-01-15 23:42:31.805843,2026-01-15 23:42:45.344195,0 days 00:00:13.538352,17,5.2,3.9000000000000004,1.5,141,CCI,PARABOLIC_SAR,2.35,46,20,14,0.033,75,28,20,0.018000000000000002,79,12,17,0.041,ATR,1.4,19,5m,SUPERTREND,False,True,False,False,True,0.47,CCI,2.35,-51.44268595987999,-75.7850977421556,-63.6138918510178,964.7659030356623,269.23218680034336,616.9990449180028,5m,10,9,9.5,SUPERTREND,52.22222222222222,60.0,44.44444444444444,COMPLETE
393,-1315.5310205614733,2026-01-15 23:42:33.011408,2026-01-15 23:42:45.869491,0 days 00:00:12.858083,17,3.9000000000000004,3.8000000000000003,1.5,140,BOLLINGER,PARABOLIC_SAR,2.4000000000000004,45,20,14,0.033,75,28,20,0.017,78,12,16,0.041,ATR,1.5,18,5m,SUPERTREND,False,True,False,False,True,0.44999999999999996,BOLLINGER,2.4000000000000004,-39.88035575272405,-59.88514582425167,-49.88275078848786,2016.0378323324514,532.802676261091,1274.4202542967712,5m,19,18,18.5,SUPERTREND,61.98830409356725,68.42105263157895,55.55555555555556,COMPLETE
394,-1537.1130885572393,2026-01-15 23:42:33.441201,2026-01-15 23:42:45.949679,0 days 00:00:12.508478,17,4.6,3.8000000000000003,1.5,140,CCI,PARABOLIC_SAR,2.4000000000000004,44,20,14,0.033,75,28,18,0.017,78,12,16,0.041,ATR,1.5,18,5m,SUPERTREND,False,True,False,False,False,0.47,CCI,2.4000000000000004,-29.058854554397172,-94.17263906136283,-61.61574680788,2617.0565567586755,-32.8153780408068,1292.1205893589342,5m,11,14,12.5,SUPERTREND,61.36363636363637,72.72727272727273,50.0,COMPLETE
395,-277.07988704084073,2026-01-15 23:42:33.848142,2026-01-15 23:42:45.873496,0 days 00:00:12.025354,17,3.9000000000000004,3.8000000000000003,1.5,139,CCI,PARABOLIC_SAR,2.4000000000000004,44,20,14,0.034,75,28,20,0.017,79,19,14,0.045000000000000005,ATR,1.5,18,5m,SUPERTREND,False,True,False,False,False,0.44999999999999996,CCI,2.4000000000000004,-19.016082411642046,-64.85711930543741,-41.93660085853973,3639.673114813263,522.2581908445488,2080.965652828906,5m,14,17,15.5,SUPERTREND,69.32773109243698,85.71428571428571,52.94117647058824,COMPLETE
396,-1714.693192207871,2026-01-15 23:42:36.019186,2026-01-15 23:42:54.431323,0 days 00:00:18.412137,17,3.8000000000000003,3.8000000000000003,1.5,140,BOLLINGER,PARABOLIC_SAR,1.8,45,20,14,0.034,75,28,20,0.017,79,20,14,0.041,ATR,1.6,18,5m,SUPERTREND,False,True,False,False,True,0.49,BOLLINGER,1.8,-21.124821803776157,-45.74147646529819,-33.433149134537175,953.516466285855,160.0992371361398,556.8078517109974,5m,17,17,17.0,SUPERTREND,64.70588235294119,70.58823529411765,58.82352941176471,COMPLETE
397,-977.1043289489544,2026-01-15 23:42:45.154682,2026-01-15 23:43:00.089626,0 days 00:00:14.934944,19,4.2,3.8000000000000003,1.5,138,BOLLINGER,PARABOLIC_SAR,1.9,45,34,15,0.034,75,28,19,0.017,85,11,14,0.045000000000000005,ATR,1.6,18,5m,SUPERTREND,False,True,False,False,False,0.44999999999999996,BOLLINGER,1.9,-31.756447042115475,-74.88993215056973,-53.3231895963426,1951.140074395697,910.0898981318747,1430.6149862637858,5m,23,24,23.5,SUPERTREND,61.8659420289855,69.56521739130434,54.166666666666664,COMPLETE
398,-1388.8162167013543,2026-01-15 23:42:45.802689,2026-01-15 23:43:04.182387,0 days 00:00:18.379698,19,3.8000000000000003,4.0,1.6,137,BOLLINGER,PARABOLIC_SAR,1.8,46,20,15,0.034,75,28,21,0.017,85,11,14,0.045000000000000005,ATR,1.6,18,5m,SUPERTREND,False,True,False,False,False,0.49,BOLLINGER,1.8,-29.03989441025288,-79.61988152193187,-54.32988796609238,1960.7834268705644,265.0101941764439,1112.8968105235042,5m,26,28,27.0,SUPERTREND,65.24725274725276,76.92307692307693,53.57142857142857,COMPLETE
399,-1178.7783399240852,2026-01-15 23:42:45.928005,2026-01-15 23:42:54.066828,0 days 00:00:08.138823,19,2.6,4.0,1.6,24,BOLLINGER,PARABOLIC_SAR,1.8,50,21,15,0.034,75,28,21,0.016,85,11,15,0.047,FIXED,4.7,21,5m,SMA,False,True,False,False,False,0.49,BOLLINGER,1.8,-73.74102808312598,-74.35143939007153,-74.04623373659877,18.983579403033527,-69.0852408952878,-25.050830746127133,5m,144,155,149.5,SMA,28.850806451612904,31.25,26.451612903225808,COMPLETE
400,-1171.6518382637714,2026-01-15 23:42:46.015370,2026-01-15 23:43:00.005911,0 days 00:00:13.990541,18,3.7,4.0,1.6,146,BOLLINGER,PARABOLIC_SAR,1.8,51,21,15,0.034,75,28,21,0.016,90,11,15,0.047,FIXED,4.7,21,5m,SMA,False,True,False,False,False,0.49,BOLLINGER,1.8,-60.39280852975466,-78.79521393431521,-69.59401123203494,100.94254093451278,-18.20913747864496,41.36670172793391,5m,68,85,76.5,SMA,28.529411764705884,32.35294117647059,24.705882352941178,COMPLETE
401,-1169.7740685044637,2026-01-15 23:42:46.028020,2026-01-15 23:42:58.202118,0 days 00:00:12.174098,18,4.2,4.0,1.6,146,BOLLINGER,PARABOLIC_SAR,1.8,48,21,15,0.034,75,28,21,0.016,90,11,14,0.047,FIXED,4.7,21,5m,SMA,False,True,False,False,False,0.49,BOLLINGER,1.8,-61.30318179418695,-80.55650361465008,-70.92984270441852,148.22672659795714,-19.376095535891608,64.42531553103277,5m,57,76,66.5,SMA,24.561403508771928,28.07017543859649,21.052631578947366,COMPLETE
402,-858.3866482243129,2026-01-15 23:42:54.927000,2026-01-15 23:43:09.679452,0 days 00:00:14.752452,19,4.2,1.2,1.6,137,BOLLINGER,PARABOLIC_SAR,1.9,51,21,15,0.032,75,28,13,0.015,89,11,14,0.045000000000000005,FIXED,1.7000000000000002,19,5m,SUPERTREND,False,True,False,False,False,0.48,BOLLINGER,1.9,-48.14624933394393,-74.66401630498156,-61.40513281946274,740.0564198588758,24.082524994542148,382.06947242670896,5m,37,59,48.0,SUPERTREND,31.28721942281264,40.54054054054054,22.033898305084744,COMPLETE
403,-545.1767394074059,2026-01-15 23:42:55.559468,2026-01-15 23:43:10.059723,0 days 00:00:14.500255,18,4.2,4.0,1.6,52,BOLLINGER,PARABOLIC_SAR,1.9,51,33,15,0.032,75,28,19,0.015,80,11,14,0.045000000000000005,FIXED,1.7000000000000002,19,5m,SUPERTREND,False,True,False,False,False,0.48,BOLLINGER,1.9,-58.888383351998066,-46.380547875535086,-52.63446561376658,123.82553313720976,941.86440749559,532.8449703163999,5m,62,55,58.5,SUPERTREND,33.2991202346041,33.87096774193548,32.72727272727273,COMPLETE
404,-457.1033678191325,2026-01-15 23:42:58.716826,2026-01-15 23:43:08.198139,0 days 00:00:09.481313,16,2.6,4.0,1.5,137,BOLLINGER,PARABOLIC_SAR,1.85,52,18,15,0.032,74,28,19,0.015,89,12,15,0.045000000000000005,ATR,4.7,19,5m,ICHIMOKU,False,True,False,False,False,0.48,BOLLINGER,1.85,-61.74146111934093,-83.20067017673432,-72.47106564803762,811.3304227455034,51.209260487288375,431.26984161639587,5m,61,66,63.5,ICHIMOKU,49.65226030799801,50.81967213114754,48.484848484848484,COMPLETE
405,799.8750034927889,2026-01-15 23:43:00.026966,2026-01-15 23:43:09.504184,0 days 00:00:09.477218,16,2.6,4.0,1.5,137,BOLLINGER,PARABOLIC_SAR,1.85,52,18,15,0.032,74,27,16,0.015,80,12,14,0.045000000000000005,ATR,1.7000000000000002,19,5m,SUPERTREND,False,True,False,False,False,0.48,BOLLINGER,1.85,-31.224560472661857,-70.733646875094,-50.97910367387793,2669.830989302197,192.57163434471389,1431.2013118234554,5m,46,50,48.0,SUPERTREND,54.26086956521739,56.52173913043478,52.0,COMPLETE
406,-44.55075457790099,2026-01-15 23:43:00.126706,2026-01-15 23:43:09.550873,0 days 00:00:09.424167,16,2.6,4.0,1.5,52,BOLLINGER,PARABOLIC_SAR,1.85,52,18,15,0.032,74,34,16,0.015,84,12,15,0.045000000000000005,ATR,4.7,19,2h,SUPERTREND,False,True,False,False,False,0.48,BOLLINGER,1.85,-53.797105116865055,-52.57131077849796,-53.18420794768151,1318.896779615367,417.94075334768127,868.4187664815241,2h,48,55,51.5,SUPERTREND,52.67045454545455,56.25,49.09090909090909,COMPLETE
407,-622.5234156750512,2026-01-15 23:43:06.509811,2026-01-15 23:43:12.696210,0 days 00:00:06.186399,16,2.6,4.0,1.5,143,BOLLINGER,PARABOLIC_SAR,1.85,51,18,12,0.032,74,27,13,0.015,80,12,15,0.048,ATR,2.6,19,2h,EMA,False,True,False,False,False,0.48,BOLLINGER,1.85,-49.090682013728596,-92.42024123074624,-70.75546162223742,546.3619209387695,-57.78986371569476,244.28602861153735,2h,57,64,60.5,EMA,47.409539473684205,52.63157894736842,42.1875,COMPLETE
408,-551.6550091664258,2026-01-15 23:43:08.600535,2026-01-15 23:43:11.687751,0 days 00:00:03.087216,15,2.6,4.0,1.5,52,BOLLINGER,PARABOLIC_SAR,1.9,53,20,15,0.032,75,27,16,0.015,80,12,15,0.048,FIXED,4.7,19,2h,SUPERTREND,False,True,False,False,False,0.48,BOLLINGER,1.9,-45.38145387480989,-41.11725642029464,-43.249355147552265,367.8669614922737,319.1349996236782,343.50098055797594,2h,72,80,76.0,SUPERTREND,37.708333333333336,41.66666666666667,33.75,COMPLETE
409,870.2161849800668,2026-01-15 23:43:09.576757,2026-01-15 23:43:13.934939,0 days 00:00:04.358182,15,2.6,3.9000000000000004,1.5,145,BOLLINGER,PARABOLIC_SAR,1.85,48,19,15,0.032,74,27,13,0.015,80,13,14,0.048,ATR,4.7,17,5m,SUPERTREND,False,True,False,False,False,0.48,BOLLINGER,1.85,-27.099605291688594,-68.28835849840013,-47.69398189504436,2454.0577375640637,67.17208338921246,1260.614910476638,5m,47,51,49.0,SUPERTREND,53.14977054651648,55.319148936170215,50.98039215686274,COMPLETE
410,-850.040731309181,2026-01-15 23:43:09.816441,2026-01-15 23:43:19.019124,0 days 00:00:09.202683,15,2.7,3.9000000000000004,1.5,145,BOLLINGER,PARABOLIC_SAR,1.9,58,19,15,0.033,74,27,17,0.014,80,13,14,0.048,ATR,1.8,17,5m,EMA,False,True,False,False,False,0.48,BOLLINGER,1.9,-81.4932210738826,-85.39478037449292,-83.44400072418776,218.39739319202627,-27.307603920969996,95.54489463552814,5m,60,65,62.5,EMA,47.243589743589745,48.333333333333336,46.15384615384615,COMPLETE
411,-842.028032264292,2026-01-15 23:43:09.863882,2026-01-15 23:43:21.734902,0 days 00:00:11.871020,15,2.7,3.9000000000000004,1.5,145,BOLLINGER,PARABOLIC_SAR,1.9,58,18,15,0.033,72,27,15,0.014,80,13,14,0.047,ATR,4.800000000000001,17,5m,EMA,False,True,False,False,False,0.48,BOLLINGER,1.9,-81.4932210738826,-85.39478037449292,-83.44400072418776,234.08028026030254,-27.307603920969996,103.38633816966627,5m,60,65,62.5,EMA,47.243589743589745,48.333333333333336,46.15384615384615,COMPLETE
412,977.7800448114049,2026-01-15 23:43:10.184404,2026-01-15 23:43:22.009782,0 days 00:00:11.825378,15,2.7,3.9000000000000004,1.5,145,BOLLINGER,PARABOLIC_SAR,1.85,58,18,15,0.033,74,27,13,0.016,80,13,14,0.048,ATR,1.9,17,5m,SUPERTREND,False,True,False,False,False,0.45999999999999996,BOLLINGER,1.85,-29.24072490786338,-73.7634534068416,-51.50208915735249,2896.0221389312087,47.30402405207625,1471.6630814916425,5m,42,50,46.0,SUPERTREND,53.57142857142857,57.14285714285714,50.0,COMPLETE
413,861.1179409375281,2026-01-15 23:43:12.683808,2026-01-15 23:43:27.703309,0 days 00:00:15.019501,15,2.7,3.9000000000000004,1.5,146,BOLLINGER,PARABOLIC_SAR,1.75,57,19,15,0.033,74,27,17,0.014,80,13,14,0.047,ATR,3.3000000000000003,17,5m,SUPERTREND,False,True,False,False,False,0.45999999999999996,BOLLINGER,1.75,-27.66608169467129,-71.64967617154564,-49.657878933108464,2492.750309101321,57.54109356436934,1275.1457013328452,5m,42,50,46.0,SUPERTREND,53.57142857142857,57.14285714285714,50.0,COMPLETE
414,915.4155597166528,2026-01-15 23:43:12.953766,2026-01-15 23:43:29.197481,0 days 00:00:16.243715,15,2.7,3.9000000000000004,1.5,146,BOLLINGER,PARABOLIC_SAR,1.8,58,19,15,0.033,74,27,17,0.014,80,13,14,0.047,ATR,4.800000000000001,17,5m,SUPERTREND,False,True,False,False,False,0.45999999999999996,BOLLINGER,1.8,-28.45345534565166,-72.9809841879051,-50.71721976677838,2679.670063538818,52.30763605053823,1365.9888497946781,5m,42,50,46.0,SUPERTREND,53.57142857142857,57.14285714285714,50.0,COMPLETE
415,970.265729855244,2026-01-15 23:43:14.105082,2026-01-15 23:43:29.144902,0 days 00:00:15.039820,15,2.7,3.9000000000000004,1.5,147,BOLLINGER,PARABOLIC_SAR,1.85,47,18,15,0.033,74,27,15,0.014,80,13,14,0.047,ATR,1.9,17,5m,SUPERTREND,False,True,False,False,False,0.45999999999999996,BOLLINGER,1.85,-29.24072490786338,-73.94568057510511,-51.59320274148425,2873.668325890353,48.57938180392641,1461.1238538471398,5m,42,50,46.0,SUPERTREND,53.57142857142857,57.14285714285714,50.0,COMPLETE
416,922.0007819416196,2026-01-15 23:43:20.326588,2026-01-15 23:43:34.654119,0 days 00:00:14.327531,15,2.5,3.9000000000000004,1.5,147,BOLLINGER,PARABOLIC_SAR,1.85,47,18,15,0.033,74,27,13,0.014,80,13,14,0.047,ATR,4.800000000000001,17,5m,SUPERTREND,False,True,False,False,False,0.53,BOLLINGER,1.85,-28.151804638649274,-75.49316711545504,-51.82248587705216,2400.9063932960566,54.24135885461469,1227.5738760753356,5m,50,55,52.5,SUPERTREND,52.63636363636363,57.99999999999999,47.27272727272727,COMPLETE
417,-2914.10637890296,2026-01-15 23:43:22.423731,2026-01-15 23:43:35.901537,0 days 00:00:13.477806,15,2.5,3.9000000000000004,2.8,147,BOLLINGER,PARABOLIC_SAR,1.85,57,18,15,0.033,74,27,13,0.014,80,14,14,0.047,ATR,4.800000000000001,17,5m,SUPERTREND,False,True,False,False,False,0.47,BOLLINGER,1.85,-65.2308796889376,-48.85379014376236,-57.042334916349986,101.88653794961313,2.1085659978880082,51.99755197375057,5m,20,22,21.0,SUPERTREND,45.68181818181819,55.00000000000001,36.36363636363637,COMPLETE
418,922.0007819416196,2026-01-15 23:43:22.476382,2026-01-15 23:43:35.779760,0 days 00:00:13.303378,15,2.5,3.9000000000000004,1.5,147,BOLLINGER,PARABOLIC_SAR,1.85,57,18,15,0.033,74,27,13,0.014,80,13,14,0.047,ATR,2.1,17,5m,SUPERTREND,False,True,False,False,False,0.45999999999999996,BOLLINGER,1.85,-28.151804638649274,-75.49316711545504,-51.82248587705216,2400.9063932960566,54.24135885461469,1227.5738760753356,5m,50,55,52.5,SUPERTREND,52.63636363636363,57.99999999999999,47.27272727272727,COMPLETE
419,928.4496947367561,2026-01-15 23:43:28.288674,2026-01-15 23:43:41.553450,0 days 00:00:13.264776,15,2.5,3.9000000000000004,1.5,146,BOLLINGER,PARABOLIC_SAR,1.85,58,18,15,0.033,74,27,17,0.014,80,14,14,0.047,ATR,2.5,17,5m,SUPERTREND,False,True,False,False,False,0.53,BOLLINGER,1.85,-28.151804638649274,-76.20412020400252,-52.1779624213259,2428.3068052114136,49.65758102820965,1238.9821931198117,5m,50,55,52.5,SUPERTREND,52.63636363636363,57.99999999999999,47.27272727272727,COMPLETE
420,873.7307787671689,2026-01-15 23:43:30.667956,2026-01-15 23:43:42.030261,0 days 00:00:11.362305,15,2.5,3.7,1.6,147,BOLLINGER,PARABOLIC_SAR,1.85,58,18,15,0.033,73,27,17,0.014,80,13,14,0.047,ATR,1.8,16,5m,SUPERTREND,False,True,False,False,False,0.44999999999999996,BOLLINGER,1.85,-28.72322174506161,-78.86843446018783,-53.79582810262472,2495.3519861859695,99.06852848362408,1297.2102573347968,5m,46,51,48.5,SUPERTREND,55.051150895140665,63.04347826086957,47.05882352941176,COMPLETE
421,873.7307787671689,2026-01-15 23:43:30.821453,2026-01-15 23:43:44.501470,0 days 00:00:13.680017,15,2.5,3.9000000000000004,1.6,147,BOLLINGER,PARABOLIC_SAR,1.85,58,19,15,0.033,74,27,16,0.014,80,13,14,0.047,ATR,1.9,16,5m,SUPERTREND,False,True,False,False,False,0.45999999999999996,BOLLINGER,1.85,-28.72322174506161,-78.86843446018783,-53.79582810262472,2495.3519861859695,99.06852848362408,1297.2102573347968,5m,46,51,48.5,SUPERTREND,55.051150895140665,63.04347826086957,47.05882352941176,COMPLETE
422,788.2616325115832,2026-01-15 23:43:35.857424,2026-01-15 23:43:51.637590,0 days 00:00:15.780166,15,2.5,3.8000000000000003,1.6,148,BOLLINGER,PARABOLIC_SAR,1.85,46,18,15,0.033,73,27,13,0.014,80,14,14,0.047,ATR,2.0,16,5m,SUPERTREND,False,True,False,False,False,0.45999999999999996,BOLLINGER,1.85,-28.160018986578905,-79.92555008937144,-54.04278453797517,2273.7537203368715,101.67168763227514,1187.7127039845734,5m,47,51,49.0,SUPERTREND,54.38047559449311,61.702127659574465,47.05882352941176,COMPLETE
423,873.7307787671689,2026-01-15 23:43:35.173595,2026-01-15 23:43:50.175026,0 days 00:00:15.001431,15,2.5,3.8000000000000003,1.6,147,BOLLINGER,PARABOLIC_SAR,1.85,46,18,15,0.033,73,27,17,0.014,80,14,14,0.048,ATR,2.1,17,5m,SUPERTREND,False,True,False,False,False,0.45999999999999996,BOLLINGER,1.85,-28.72322174506161,-78.86843446018783,-53.79582810262472,2495.3519861859695,99.06852848362408,1297.2102573347968,5m,46,51,48.5,SUPERTREND,55.051150895140665,63.04347826086957,47.05882352941176,COMPLETE
424,873.7307787671689,2026-01-15 23:43:36.221896,2026-01-15 23:43:49.872434,0 days 00:00:13.650538,15,2.5,3.8000000000000003,1.6,147,BOLLINGER,PARABOLIC_SAR,1.85,45,18,15,0.033,73,27,17,0.014,80,14,14,0.048,ATR,2.1,16,5m,SUPERTREND,False,True,False,False,False,0.45999999999999996,BOLLINGER,1.85,-28.72322174506161,-78.86843446018783,-53.79582810262472,2495.3519861859695,99.06852848362408,1297.2102573347968,5m,46,51,48.5,SUPERTREND,55.051150895140665,63.04347826086957,47.05882352941176,COMPLETE
425,-1845.6560654128716,2026-01-15 23:43:41.790036,2026-01-15 23:43:54.622828,0 days 00:00:12.832792,15,2.5,3.8000000000000003,1.6,147,BOLLINGER,PARABOLIC_SAR,1.85,46,18,15,0.025,73,26,17,0.014,80,14,14,0.048,ATR,1.9,16,5m,SUPERTREND,False,True,True,False,False,0.45999999999999996,BOLLINGER,1.85,-38.541354325670866,-83.93384384388995,-61.237599084780406,489.53746516852965,67.3566263088646,278.4470457386971,5m,28,36,32.0,SUPERTREND,49.007936507936506,53.57142857142857,44.44444444444444,COMPLETE
426,-1845.6560654128716,2026-01-15 23:43:43.562913,2026-01-15 23:43:56.343004,0 days 00:00:12.780091,15,2.5,3.7,1.6,147,BOLLINGER,PARABOLIC_SAR,1.85,60,18,13,0.033,73,26,17,0.014,80,14,14,0.048,ATR,2.2,16,5m,SUPERTREND,False,True,True,False,False,0.44999999999999996,BOLLINGER,1.85,-38.541354325670866,-83.93384384388995,-61.237599084780406,489.53746516852965,67.3566263088646,278.4470457386971,5m,28,36,32.0,SUPERTREND,49.007936507936506,53.57142857142857,44.44444444444444,COMPLETE
427,788.2616325115832,2026-01-15 23:43:46.826950,2026-01-15 23:44:00.111984,0 days 00:00:13.285034,15,2.5,3.7,1.6,148,BOLLINGER,PARABOLIC_SAR,1.85,62,18,15,0.033,73,26,17,0.014,80,14,14,0.048,ATR,2.0,16,5m,SUPERTREND,False,True,False,False,False,0.45999999999999996,BOLLINGER,1.85,-28.160018986578905,-79.92555008937144,-54.04278453797517,2273.7537203368715,101.67168763227514,1187.7127039845734,5m,47,51,49.0,SUPERTREND,54.38047559449311,61.702127659574465,47.05882352941176,COMPLETE
428,-1871.6687152852628,2026-01-15 23:43:51.623401,2026-01-15 23:44:05.769597,0 days 00:00:14.146196,15,2.5,3.7,1.6,148,BOLLINGER,PARABOLIC_SAR,1.85,60,18,15,0.033,73,26,17,0.014,80,14,14,0.048,ATR,2.1,16,5m,SUPERTREND,False,True,True,False,False,0.44999999999999996,BOLLINGER,1.85,-37.35498706070854,-83.06345631181186,-60.2092216862602,444.32400255828253,90.41743032631742,267.37071644229997,5m,29,36,32.5,SUPERTREND,49.47318007662835,51.724137931034484,47.22222222222222,COMPLETE
429,788.2616325115832,2026-01-15 23:43:51.627420,2026-01-15 23:44:06.635629,0 days 00:00:15.008209,15,2.5,3.7,1.6,148,BOLLINGER,PARABOLIC_SAR,1.85,61,18,15,0.033,73,26,17,0.014,80,14,14,0.048,ATR,2.1,16,5m,SUPERTREND,False,True,False,False,False,0.44,BOLLINGER,1.85,-28.160018986578905,-79.92555008937144,-54.04278453797517,2273.7537203368715,101.67168763227514,1187.7127039845734,5m,47,51,49.0,SUPERTREND,54.38047559449311,61.702127659574465,47.05882352941176,COMPLETE
430,-1871.6687152852628,2026-01-15 23:43:51.954002,2026-01-15 23:44:05.716361,0 days 00:00:13.762359,15,2.5,3.8000000000000003,1.6,148,BOLLINGER,PARABOLIC_SAR,1.85,62,18,15,0.033,73,26,17,0.014,80,14,14,0.048,ATR,2.1,16,5m,SUPERTREND,False,True,True,False,False,0.44,BOLLINGER,1.85,-37.35498706070854,-83.06345631181186,-60.2092216862602,444.32400255828253,90.41743032631742,267.37071644229997,5m,29,36,32.5,SUPERTREND,49.47318007662835,51.724137931034484,47.22222222222222,COMPLETE
