number,value,datetime_start,datetime_complete,duration,params_ADX_THRESHOLD,params_ATR_MULTIPLIER,params_ATR_STOP_LOSS_MULT,params_BB_STD,params_ENTRY_PERIOD,params_ENTRY_TYPE,params_EXIT_TYPE,params_LEVERAGE,params_MA_PERIOD,params_MFI_THRESHOLD,params_MFI_WINDOW,params_RISK_PER_TRADE,params_RSI_OVERBOUGHT,params_RSI_OVERSOLD,params_RSI_WINDOW,params_SAR_STEP,params_STOCH_OVERBOUGHT,params_STOCH_OVERSOLD,params_STOCH_WINDOW,params_STOP_LOSS_PCT,params_STOP_LOSS_TYPE,params_SUPERTREND_MULT,params_SUPERTREND_PERIOD,params_TIMEFRAME,params_TREND_FILTER_TYPE,params_USE_ADX,params_USE_MFI,params_USE_RSI,params_USE_STOCHASTIC,params_USE_VHF,params_VHF_THRESHOLD,user_attrs_entry_type,user_attrs_leverage,user_attrs_mdd_BTC_USDT,user_attrs_mdd_ETH_USDT,user_attrs_mdd_avg,user_attrs_return_BTC_USDT,user_attrs_return_ETH_USDT,user_attrs_return_avg,user_attrs_timeframe,user_attrs_trades_BTC_USDT,user_attrs_trades_ETH_USDT,user_attrs_trades_avg,user_attrs_trend_filter,user_attrs_win_rate_avg,user_attrs_winrate_BTC_USDT,user_attrs_winrate_ETH_USDT,state
861,-1300.3754607076244,2026-01-16 00:03:21.081801,2026-01-16 00:03:42.628097,0 days 00:00:21.546296,24,2.1,3.2,2.6,148,DONCHIAN,PARABOLIC_SAR,2.2,145,15,11,0.032,65,35,12,0.011,84,11,12,0.043000000000000003,ATR,3.0,5,3m,SUPERTREND,False,False,False,False,False,0.36,DONCHIAN,2.2,-42.23926276695574,-69.80871002953984,-56.023986398247786,323.76009378085837,-60.15697698919017,131.8015583958341,3m,41,39,40.0,SUPERTREND,44.96560350218887,46.34146341463415,43.58974358974359,COMPLETE
862,197.9904723801801,2026-01-16 00:03:31.137917,2026-01-16 00:03:48.340549,0 days 00:00:17.202632,24,2.1,3.1,1.6,111,BOLLINGER,PARABOLIC_SAR,2.2,127,15,11,0.032,65,35,12,0.031,84,11,12,0.043000000000000003,ATR,3.2,5,3m,SUPERTREND,False,False,False,False,False,0.39,BOLLINGER,2.2,-36.89338569682804,-88.66300451386736,-62.778195105347706,1733.180781540546,14.027030821686168,873.603906181116,3m,64,71,67.5,SUPERTREND,51.287411971830984,54.6875,47.88732394366197,COMPLETE
863,1014.7657623464729,2026-01-16 00:03:40.718434,2026-01-16 00:04:00.454575,0 days 00:00:19.736141,24,2.3,1.9,1.6,148,BOLLINGER,PARABOLIC_SAR,2.2,133,15,11,0.032,65,35,12,0.01,84,11,12,0.043000000000000003,ATR,3.2,5,3m,SUPERTREND,False,False,False,False,False,0.39,BOLLINGER,2.2,-31.491450942963574,-80.28063368113932,-55.886042312051444,3044.991356539929,133.92833746837317,1589.459847004151,3m,55,61,58.0,SUPERTREND,56.14008941877795,58.18181818181818,54.09836065573771,COMPLETE
864,-711.8123056527184,2026-01-16 00:03:40.754799,2026-01-16 00:04:05.553776,0 days 00:00:24.798977,24,2.3,2.5,1.6,148,CCI,PARABOLIC_SAR,2.2,131,15,11,0.032,65,35,12,0.01,84,11,12,0.043000000000000003,ATR,2.9000000000000004,5,3m,SUPERTREND,False,False,False,False,False,0.39,CCI,2.2,-54.03256861287606,-90.89459585583877,-72.46358223435742,1461.0451954941796,-50.14067647296449,705.4522595106075,3m,33,41,37.0,SUPERTREND,54.69327420546933,60.60606060606061,48.78048780487805,COMPLETE
865,-711.8123056527184,2026-01-16 00:03:41.104270,2026-01-16 00:04:01.424909,0 days 00:00:20.320639,25,2.3,2.5,1.6,148,CCI,PARABOLIC_SAR,2.2,134,15,11,0.032,65,35,12,0.01,84,11,12,0.043000000000000003,ATR,3.2,5,3m,SUPERTREND,False,False,False,False,False,0.39,CCI,2.2,-54.03256861287606,-90.89459585583877,-72.46358223435742,1461.0451954941796,-50.14067647296449,705.4522595106075,3m,33,41,37.0,SUPERTREND,54.69327420546933,60.60606060606061,48.78048780487805,COMPLETE
866,-62.153420417288544,2026-01-16 00:03:43.185358,2026-01-16 00:04:04.389813,0 days 00:00:21.204455,24,2.0,2.0,1.6,150,BOLLINGER,PARABOLIC_SAR,2.2,126,15,11,0.031,65,20,12,0.01,84,12,12,0.042,ATR,3.2,6,3m,SUPERTREND,False,False,False,True,False,0.39,BOLLINGER,2.2,-42.15834640304814,-83.6949658790888,-62.92665614106847,1381.8767112171495,-23.55162049723796,679.1625453599557,3m,57,50,53.5,SUPERTREND,50.70175438596492,61.40350877192983,40.0,COMPLETE
867,1181.8346200017731,2026-01-16 00:03:45.696003,2026-01-16 00:04:08.593796,0 days 00:00:22.897793,24,2.3,3.2,1.6,148,BOLLINGER,PARABOLIC_SAR,2.2,127,15,11,0.031,65,35,12,0.01,84,12,12,0.042,ATR,3.2,6,3m,SUPERTREND,False,False,False,False,False,0.39,BOLLINGER,2.2,-30.538986384498003,-84.6723970678706,-57.605691726184304,3727.712190975606,35.22976057270409,1881.470975774155,3m,53,61,57.0,SUPERTREND,57.23785957315187,60.37735849056604,54.09836065573771,COMPLETE
868,-911.8408010325356,2026-01-16 00:03:49.040535,2026-01-16 00:04:11.825166,0 days 00:00:22.784631,25,2.3,3.3000000000000003,1.6,150,CCI,PARABOLIC_SAR,2.1,142,15,11,0.031,65,35,12,0.01,84,12,12,0.042,ATR,3.2,6,3m,SUPERTREND,False,False,False,True,False,0.39,CCI,2.1,-57.13268464205258,-86.78877596508896,-71.96073030357077,940.1006596360402,44.367691812896076,492.2341757244681,3m,30,33,31.5,SUPERTREND,54.09090909090909,56.666666666666664,51.515151515151516,COMPLETE
869,-971.7570119166885,2026-01-16 00:04:00.584781,2026-01-16 00:04:20.785579,0 days 00:00:20.200798,25,2.0,3.3000000000000003,1.6,150,CCI,PARABOLIC_SAR,2.25,141,15,11,0.031,65,35,12,0.01,85,12,12,0.042,ATR,2.9000000000000004,6,3m,SUPERTREND,False,False,False,True,False,0.38,CCI,2.25,-59.37879935740506,-78.95109498612649,-69.16494717176577,681.5452690810432,172.71895422920437,427.1321116551238,3m,41,40,40.5,SUPERTREND,54.298780487804876,56.09756097560976,52.5,COMPLETE
870,-234.4585419164814,2026-01-16 00:04:03.693397,2026-01-16 00:04:22.511480,0 days 00:00:18.818083,25,2.0,3.3000000000000003,1.6,150,BOLLINGER,PARABOLIC_SAR,2.1,142,15,11,0.031,65,35,12,0.028999999999999998,85,12,12,0.042,ATR,2.9000000000000004,6,3m,SUPERTREND,False,False,False,True,False,0.39,BOLLINGER,2.1,-43.653021160513326,-79.08087835910386,-61.36694975980859,977.0641005158934,66.53796829744321,521.8010344066684,3m,59,54,56.5,SUPERTREND,51.80477087256749,61.016949152542374,42.592592592592595,COMPLETE
871,1386.242774840669,2026-01-16 00:04:05.493049,2026-01-16 00:04:21.841986,0 days 00:00:16.348937,23,2.3,2.3,1.6,150,BOLLINGER,PARABOLIC_SAR,2.1,140,15,11,0.031,65,35,12,0.01,85,12,12,0.042,ATR,2.9000000000000004,6,3m,SUPERTREND,False,False,False,False,False,0.38,BOLLINGER,2.1,-28.986563690553186,-77.28763345910191,-53.13709857482755,3356.6093449684104,125.42789312279791,1741.018619045604,3m,53,60,56.5,SUPERTREND,57.688679245283026,60.37735849056604,55.00000000000001,COMPLETE
872,1348.029756335498,2026-01-16 00:04:05.759526,2026-01-16 00:04:30.241197,0 days 00:00:24.481671,25,2.3,3.2,1.6,150,BOLLINGER,PARABOLIC_SAR,2.1,148,15,10,0.03,65,35,12,0.028999999999999998,85,12,12,0.042,ATR,3.1,7,3m,SUPERTREND,False,False,False,False,False,0.38,BOLLINGER,2.1,-28.986563690553186,-79.42584028678212,-54.20620198866765,3356.6093449684104,92.06955536224879,1724.3394501653295,3m,53,60,56.5,SUPERTREND,57.688679245283026,60.37735849056604,55.00000000000001,COMPLETE
873,1261.1197509705253,2026-01-16 00:04:09.045226,2026-01-16 00:04:34.505852,0 days 00:00:25.460626,25,2.2,3.3000000000000003,1.6,150,BOLLINGER,PARABOLIC_SAR,2.1,141,15,10,0.03,66,35,12,0.037,85,12,12,0.042,ATR,3.1,7,3m,SUPERTREND,False,False,False,False,False,0.33999999999999997,BOLLINGER,2.1,-28.379143589697748,-79.00819458374295,-53.69366908672035,3104.1140471995004,124.65468477935977,1614.38436598943,3m,56,63,59.5,SUPERTREND,56.54761904761905,60.71428571428571,52.38095238095239,COMPLETE
874,-1034.2637589015803,2026-01-16 00:04:12.754883,2026-01-16 00:04:35.664350,0 days 00:00:22.909467,26,2.2,3.2,2.5,150,BOLLINGER,PARABOLIC_SAR,2.1,140,15,10,0.03,66,35,12,0.012,85,12,12,0.044000000000000004,ATR,2.9000000000000004,7,3m,SUPERTREND,False,False,False,False,False,0.38,BOLLINGER,2.1,-33.64335184540882,-53.32623473114256,-43.4847932882757,481.1583040799533,63.83668132406156,272.49749270200743,3m,31,32,31.5,SUPERTREND,54.03225806451613,58.06451612903226,50.0,COMPLETE
875,-666.5434225213648,2026-01-16 00:04:21.863352,2026-01-16 00:04:42.595644,0 days 00:00:20.732292,26,2.2,3.2,1.6,145,BOLLINGER,PARABOLIC_SAR,2.1,148,16,10,0.03,66,35,13,0.012,85,12,12,0.041,ATR,3.1,7,3m,SMA,False,False,False,False,False,0.33999999999999997,BOLLINGER,2.1,-63.893900717158736,-95.18730494293203,-79.54060283004539,518.3972886266221,-77.548020050317,220.42463428815253,3m,76,87,81.5,SMA,49.2211131276467,51.31578947368421,47.12643678160919,COMPLETE
876,-672.1330426645663,2026-01-16 00:04:22.752539,2026-01-16 00:04:43.896931,0 days 00:00:21.144392,26,2.2,3.2,1.6,145,BOLLINGER,PARABOLIC_SAR,2.1500000000000004,136,16,10,0.03,65,35,12,0.012,85,12,12,0.041,ATR,3.1,7,3m,SMA,False,False,False,False,False,0.37,BOLLINGER,2.1500000000000004,-65.2690723183665,-95.4483916520051,-80.3587319851858,516.2160085690499,-79.75471613752309,218.23064621576341,3m,76,87,81.5,SMA,49.2211131276467,51.31578947368421,47.12643678160919,COMPLETE
877,-2300.0,2026-01-16 00:04:23.664438,2026-01-16 00:04:45.429326,0 days 00:00:21.764888,23,2.2,3.2,1.6,145,KELTNER,PARABOLIC_SAR,2.1500000000000004,135,16,10,0.03,65,35,12,0.037,85,12,12,0.041,ATR,3.1,7,3m,SUPERTREND,False,False,False,False,False,0.33999999999999997,KELTNER,2.1500000000000004,0.0,0.0,0.0,0.0,0.0,0.0,3m,0,0,0.0,SUPERTREND,0.0,0.0,0.0,COMPLETE
878,-630.2276891010033,2026-01-16 00:04:30.361938,2026-01-16 00:04:52.390193,0 days 00:00:22.028255,23,2.3,3.2,1.6,150,KELTNER,PARABOLIC_SAR,2.1,149,15,10,0.03,65,35,12,0.032,85,12,12,0.043000000000000003,ATR,3.1,7,3m,SMA,False,False,False,False,False,0.37,KELTNER,2.1,-86.4292448822363,-97.30397437775473,-91.86660962999551,552.1442682293548,-97.40102721485812,227.37162050724834,3m,121,128,124.5,SMA,41.45467458677686,44.62809917355372,38.28125,COMPLETE
879,-601.4524316482684,2026-01-16 00:04:35.435978,2026-01-16 00:05:00.436423,0 days 00:00:25.000445,23,2.3,1.9,1.6,147,KELTNER,PARABOLIC_SAR,2.1,148,15,10,0.03,65,35,12,0.043000000000000003,85,12,12,0.041,ATR,3.1,7,3m,SMA,False,False,False,False,False,0.33999999999999997,KELTNER,2.1,-82.96674741242853,-96.82547422953975,-89.89611082098415,594.4748358418823,-90.41976712588436,252.02753435799895,3m,124,131,127.5,SMA,42.809652794878104,45.16129032258064,40.458015267175576,COMPLETE
880,-660.2147610361608,2026-01-16 00:04:37.111587,2026-01-16 00:04:56.209463,0 days 00:00:19.097876,24,2.3,3.3000000000000003,1.6,147,KELTNER,PARABOLIC_SAR,2.1,149,15,10,0.03,65,35,12,0.031,85,12,12,0.041,ATR,3.1,7,3m,SMA,False,False,False,False,False,0.32,KELTNER,2.1,-86.4292448822363,-97.21098344224889,-91.82011416224259,487.5091561602191,-97.47791548321312,195.015620338503,3m,122,128,125.0,SMA,42.462858606557376,45.08196721311475,39.84375,COMPLETE
881,-2300.0,2026-01-16 00:04:42.702362,2026-01-16 00:05:05.401049,0 days 00:00:22.698687,23,2.3,3.3000000000000003,1.6,147,KELTNER,PARABOLIC_SAR,2.1,149,15,10,0.028999999999999998,65,35,12,0.037,86,12,12,0.042,ATR,3.3000000000000003,7,3m,TEMA,False,False,False,False,False,0.32,KELTNER,2.1,0.0,0.0,0.0,0.0,0.0,0.0,3m,0,0,0.0,TEMA,0.0,0.0,0.0,COMPLETE
882,-2300.0,2026-01-16 00:04:44.957355,2026-01-16 00:05:03.769018,0 days 00:00:18.811663,23,2.3,3.3000000000000003,1.6,147,KELTNER,PARABOLIC_SAR,2.1,149,15,10,0.027000000000000003,65,35,12,0.038,85,12,12,0.042,ATR,3.1,7,3m,TEMA,False,False,False,False,False,0.32999999999999996,KELTNER,2.1,0.0,0.0,0.0,0.0,0.0,0.0,3m,0,0,0.0,TEMA,0.0,0.0,0.0,COMPLETE
883,-721.3659379841092,2026-01-16 00:04:46.700485,2026-01-16 00:05:11.844340,0 days 00:00:25.143855,23,2.3,3.3000000000000003,1.6,147,BOLLINGER,PARABOLIC_SAR,2.1,149,15,10,0.028999999999999998,65,35,12,0.026000000000000002,85,12,11,0.042,ATR,3.1,7,3m,TEMA,False,False,False,False,False,0.37,BOLLINGER,2.1,-75.64390015615056,-91.39820902616417,-83.52105459115737,405.190043626876,-28.317669017986198,188.4361873044449,3m,68,81,74.5,TEMA,51.77923021060276,52.94117647058824,50.617283950617285,COMPLETE
884,-2509.6174259850495,2026-01-16 00:04:54.347628,2026-01-16 00:05:15.931932,0 days 00:00:21.584304,24,4.5,3.3000000000000003,1.6,147,BOLLINGER,PARABOLIC_SAR,2.1,144,15,10,0.028999999999999998,65,35,12,0.046000000000000006,85,12,11,0.042,ATR,3.3000000000000003,7,3m,TEMA,False,False,False,False,False,0.38,BOLLINGER,2.1,-112.79083686738143,-96.36381824209094,-104.57732755473619,-207.65545928265414,-18.05340165995811,-112.85443047130612,3m,9,33,21.0,TEMA,54.54545454545454,66.66666666666666,42.42424242424242,COMPLETE
885,-805.0892856738919,2026-01-16 00:04:56.848592,2026-01-16 00:05:16.338200,0 days 00:00:19.489608,23,2.3,1.9,1.6,147,BOLLINGER,PARABOLIC_SAR,2.1,145,15,10,0.028999999999999998,65,35,12,0.028999999999999998,86,12,11,0.042,ATR,3.3000000000000003,9,3m,TEMA,False,False,False,False,False,0.36,BOLLINGER,2.1,-77.19141428233749,-91.75964917956291,-84.4755317309502,238.98001959782408,-19.427860980863777,109.77607930848015,3m,71,83,77.0,TEMA,49.94909214322077,49.29577464788733,50.602409638554214,COMPLETE
886,-3137.30422157206,2026-01-16 00:05:01.435146,2026-01-16 00:05:24.828687,0 days 00:00:23.393541,25,5.6000000000000005,3.3000000000000003,1.6,147,BOLLINGER,PARABOLIC_SAR,2.1500000000000004,158,15,11,0.028999999999999998,65,35,12,0.046000000000000006,86,12,11,0.042,ATR,3.0,9,3m,TEMA,False,False,False,False,False,0.38,BOLLINGER,2.1500000000000004,-120.27130841696922,-98.48356061735927,-109.37743451716425,-279.2840645324817,-71.72460331380734,-175.50433392314451,3m,7,26,16.5,TEMA,56.86813186813187,71.42857142857143,42.30769230769231,COMPLETE
887,747.9440876669114,2026-01-16 00:05:04.540589,2026-01-16 00:05:24.099674,0 days 00:00:19.559085,25,2.1,3.3000000000000003,1.6,150,BOLLINGER,PARABOLIC_SAR,2.1500000000000004,145,15,11,0.028999999999999998,65,35,12,0.044000000000000004,86,12,12,0.042,ATR,3.3000000000000003,9,3m,SUPERTREND,False,False,False,False,False,0.32999999999999996,BOLLINGER,2.1500000000000004,-32.4969950825577,-80.8027501227172,-56.64987260263745,2735.348414902917,11.696707055464712,1373.5225609791908,3m,64,69,66.5,SUPERTREND,52.038043478260875,56.25,47.82608695652174,COMPLETE
888,731.3558020949858,2026-01-16 00:05:06.424548,2026-01-16 00:05:26.285685,0 days 00:00:19.861137,25,2.1,3.1,1.6,150,BOLLINGER,PARABOLIC_SAR,2.1500000000000004,145,15,11,0.028999999999999998,65,35,12,0.011,85,12,11,0.043000000000000003,ATR,3.0,9,3m,SUPERTREND,False,False,False,False,False,0.35,BOLLINGER,2.1500000000000004,-32.4969950825577,-83.84036882037806,-58.16868195146788,2735.348414902917,-5.63325215376555,1364.8575813745756,3m,64,69,66.5,SUPERTREND,52.038043478260875,56.25,47.82608695652174,COMPLETE
889,731.3558020949858,2026-01-16 00:05:12.213023,2026-01-16 00:05:35.910780,0 days 00:00:23.697757,25,2.1,3.1,1.6,150,BOLLINGER,PARABOLIC_SAR,2.1500000000000004,146,15,11,0.03,65,35,12,0.011,85,11,11,0.043000000000000003,ATR,3.0,9,3m,SUPERTREND,False,False,False,False,False,0.35,BOLLINGER,2.1500000000000004,-32.4969950825577,-83.84036882037806,-58.16868195146788,2735.348414902917,-5.63325215376555,1364.8575813745756,3m,64,69,66.5,SUPERTREND,52.038043478260875,56.25,47.82608695652174,COMPLETE
890,731.3558020949858,2026-01-16 00:05:16.290017,2026-01-16 00:05:45.516680,0 days 00:00:29.226663,25,2.1,3.1,1.6,150,BOLLINGER,PARABOLIC_SAR,2.1500000000000004,156,15,11,0.03,65,34,12,0.04,85,11,12,0.04,ATR,3.0,9,3m,SUPERTREND,False,False,False,False,False,0.35,BOLLINGER,2.1500000000000004,-32.4969950825577,-83.84036882037806,-58.16868195146788,2735.348414902917,-5.63325215376555,1364.8575813745756,3m,64,69,66.5,SUPERTREND,52.038043478260875,56.25,47.82608695652174,COMPLETE
891,731.3558020949858,2026-01-16 00:05:20.086363,2026-01-16 00:05:41.541895,0 days 00:00:21.455532,25,2.1,3.1,1.6,150,BOLLINGER,PARABOLIC_SAR,2.1500000000000004,156,15,11,0.03,65,34,12,0.035,85,11,12,0.04,ATR,3.0,9,3m,SUPERTREND,False,False,False,False,False,0.38,BOLLINGER,2.1500000000000004,-32.4969950825577,-83.84036882037806,-58.16868195146788,2735.348414902917,-5.63325215376555,1364.8575813745756,3m,64,69,66.5,SUPERTREND,52.038043478260875,56.25,47.82608695652174,COMPLETE
892,-780.9521159693859,2026-01-16 00:05:24.523901,2026-01-16 00:05:45.587950,0 days 00:00:21.064049,25,4.800000000000001,3.1,1.6,150,BOLLINGER,PARABOLIC_SAR,2.1500000000000004,139,15,11,0.028000000000000004,65,34,12,0.042,85,11,12,0.04,ATR,3.0,8,3m,SUPERTREND,False,False,False,False,False,0.35,BOLLINGER,2.1500000000000004,-32.19655813226634,-74.52244872079355,-53.35950342652994,2613.026661471504,756.820588544342,1684.923625007923,3m,18,19,18.5,SUPERTREND,62.28070175438596,66.66666666666666,57.89473684210527,COMPLETE
893,-1212.9865968044987,2026-01-16 00:05:26.219450,2026-01-16 00:05:47.836531,0 days 00:00:21.617081,26,4.7,3.1,1.6,150,BOLLINGER,PARABOLIC_SAR,2.25,138,15,11,0.031,66,34,13,0.044000000000000004,85,11,12,0.043000000000000003,ATR,2.9000000000000004,8,3m,SUPERTREND,False,False,False,False,False,0.38,BOLLINGER,2.25,-33.42078733155754,-89.74901673359821,-61.58490203257787,3196.953046753659,278.76757275454105,1737.8603097541,3m,18,22,20.0,SUPERTREND,58.33333333333333,66.66666666666666,50.0,COMPLETE
894,1219.3112309303224,2026-01-16 00:05:26.681669,2026-01-16 00:05:47.702106,0 days 00:00:21.020437,26,2.2,3.1,1.6,150,BOLLINGER,PARABOLIC_SAR,2.25,139,15,11,0.031,66,34,13,0.034,85,11,12,0.04,ATR,2.9000000000000004,8,3m,SUPERTREND,False,False,False,False,False,0.38,BOLLINGER,2.25,-30.401456671203892,-84.0102288718778,-57.205842771540844,3672.8695253515016,84.75629440281452,1878.812909877158,3m,56,63,59.5,SUPERTREND,56.54761904761905,60.71428571428571,52.38095238095239,COMPLETE
895,1212.5332674318042,2026-01-16 00:05:36.837499,2026-01-16 00:06:06.588642,0 days 00:00:29.751143,26,2.2,3.2,1.6,150,BOLLINGER,PARABOLIC_SAR,2.25,139,15,10,0.031,66,34,13,0.038,85,11,12,0.04,ATR,2.9000000000000004,8,3m,SUPERTREND,False,False,False,False,False,0.38,BOLLINGER,2.25,-30.401456671203892,-84.25254350826276,-57.327000089733325,3672.8695253515016,78.39936130338026,1875.634443327441,3m,56,63,59.5,SUPERTREND,56.54761904761905,60.71428571428571,52.38095238095239,COMPLETE
896,163.23566666262923,2026-01-16 00:05:41.635733,2026-01-16 00:05:57.931512,0 days 00:00:16.295779,26,2.2,3.2,1.6,24,BOLLINGER,PARABOLIC_SAR,2.05,139,15,10,0.031,66,34,13,0.033,85,11,12,0.044000000000000004,ATR,2.9000000000000004,8,3m,SUPERTREND,False,False,False,False,False,0.36,BOLLINGER,2.05,-65.76032056118049,-54.96583361235267,-60.36307708676658,1222.0445475926524,554.692538152352,888.3685428725022,3m,78,84,81.0,SUPERTREND,50.595238095238095,50.0,51.19047619047619,COMPLETE
897,1146.1882099041932,2026-01-16 00:05:45.931029,2026-01-16 00:06:09.481234,0 days 00:00:23.550205,26,2.2,3.2,1.6,145,BOLLINGER,PARABOLIC_SAR,2.05,139,15,10,0.031,66,35,13,0.034,84,12,12,0.043000000000000003,ATR,2.9000000000000004,8,3m,SUPERTREND,False,False,False,False,False,0.36,BOLLINGER,2.05,-27.704805458373166,-83.32985636822502,-55.51733091329909,2976.3276356502574,46.2157458011345,1511.2716907256959,3m,56,63,59.5,SUPERTREND,55.75396825396825,60.71428571428571,50.79365079365079,COMPLETE
898,1146.1882099041932,2026-01-16 00:05:46.174706,2026-01-16 00:06:09.792044,0 days 00:00:23.617338,26,2.2,3.2,1.6,145,BOLLINGER,PARABOLIC_SAR,2.05,136,15,10,0.031,66,35,13,0.039,84,12,12,0.043000000000000003,ATR,2.9000000000000004,8,3m,SUPERTREND,False,False,False,False,False,0.36,BOLLINGER,2.05,-27.704805458373166,-83.32985636822502,-55.51733091329909,2976.3276356502574,46.2157458011345,1511.2716907256959,3m,56,63,59.5,SUPERTREND,55.75396825396825,60.71428571428571,50.79365079365079,COMPLETE
899,1146.1882099041932,2026-01-16 00:05:47.794649,2026-01-16 00:06:09.476698,0 days 00:00:21.682049,26,2.2,3.2,1.6,145,BOLLINGER,PARABOLIC_SAR,2.05,142,16,10,0.031,67,35,13,0.012,84,12,12,0.044000000000000004,ATR,3.2,6,3m,SUPERTREND,False,False,False,False,False,0.37,BOLLINGER,2.05,-27.704805458373166,-83.32985636822502,-55.51733091329909,2976.3276356502574,46.2157458011345,1511.2716907256959,3m,56,63,59.5,SUPERTREND,55.75396825396825,60.71428571428571,50.79365079365079,COMPLETE
900,529.538741602445,2026-01-16 00:05:47.994399,2026-01-16 00:06:11.178564,0 days 00:00:23.184165,26,2.2,3.2,1.6,77,BOLLINGER,PARABOLIC_SAR,2.05,141,16,10,0.031,67,35,13,0.038,84,12,12,0.044000000000000004,ATR,3.2,6,3m,SUPERTREND,False,False,False,False,False,0.37,BOLLINGER,2.05,-47.89959527939057,-58.024819165691035,-52.9622072225408,1094.1068479984604,1067.747003822856,1080.9269259106582,3m,64,66,65.0,SUPERTREND,52.272727272727266,50.0,54.54545454545454,COMPLETE
901,-760.7639774439758,2026-01-16 00:06:00.244972,2026-01-16 00:06:26.580980,0 days 00:00:26.336008,24,2.3,3.2,1.6,145,BOLLINGER,PARABOLIC_SAR,2.1,142,16,10,0.031,67,35,13,0.012,84,12,12,0.044000000000000004,ATR,3.1,6,3m,DEMA,False,False,False,False,False,0.37,BOLLINGER,2.1,-74.81093987979011,-93.60448708423054,-84.20771348201032,347.20164553831177,-47.860546316094315,149.67054961110873,3m,72,81,76.5,DEMA,49.76851851851852,51.388888888888886,48.148148148148145,COMPLETE
902,-868.8840456166736,2026-01-16 00:06:09.467396,2026-01-16 00:06:27.359051,0 days 00:00:17.891655,24,2.3,2.3,1.6,145,BOLLINGER,PARABOLIC_SAR,2.05,142,16,10,0.031,67,35,13,0.039,84,12,12,0.043000000000000003,ATR,3.2,6,3m,DEMA,False,False,False,False,False,0.37,BOLLINGER,2.05,-85.371590370931,-92.34122552311258,-88.8564079470218,137.02865796492543,-30.164449084278754,53.432104440323336,3m,72,81,76.5,DEMA,49.76851851851852,51.388888888888886,48.148148148148145,COMPLETE
903,-714.2988039809879,2026-01-16 00:06:09.613336,2026-01-16 00:06:30.192713,0 days 00:00:20.579377,24,2.3,2.1,1.6,145,BOLLINGER,PARABOLIC_SAR,2.1,134,16,10,0.03,67,35,13,0.041,84,12,12,0.035,ATR,3.2,5,3m,DEMA,False,False,False,False,True,0.37,BOLLINGER,2.1,-83.75612535026097,-63.65595309291099,-73.70603922158598,148.40277715874757,216.5367519608146,182.46976455978108,3m,54,54,54.0,DEMA,54.62962962962963,53.70370370370371,55.55555555555556,COMPLETE
