number,value,datetime_start,datetime_complete,duration,params_ADX_THRESHOLD,params_ATR_MULTIPLIER,params_ATR_STOP_LOSS_MULT,params_BB_STD,params_ENTRY_PERIOD,params_ENTRY_TYPE,params_EXIT_TYPE,params_LEVERAGE,params_MA_PERIOD,params_MFI_THRESHOLD,params_MFI_WINDOW,params_RISK_PER_TRADE,params_RSI_OVERBOUGHT,params_RSI_OVERSOLD,params_RSI_WINDOW,params_SAR_STEP,params_STOCH_OVERBOUGHT,params_STOCH_OVERSOLD,params_STOCH_WINDOW,params_STOP_LOSS_PCT,params_STOP_LOSS_TYPE,params_SUPERTREND_MULT,params_SUPERTREND_PERIOD,params_TIMEFRAME,params_TREND_FILTER_TYPE,params_USE_ADX,params_USE_MFI,params_USE_RSI,params_USE_STOCHASTIC,params_USE_VHF,params_VHF_THRESHOLD,user_attrs_entry_type,user_attrs_leverage,user_attrs_mdd_BTC_USDT,user_attrs_mdd_ETH_USDT,user_attrs_mdd_avg,user_attrs_return_BTC_USDT,user_attrs_return_ETH_USDT,user_attrs_return_avg,user_attrs_timeframe,user_attrs_trades_BTC_USDT,user_attrs_trades_ETH_USDT,user_attrs_trades_avg,user_attrs_trend_filter,user_attrs_win_rate_avg,user_attrs_winrate_BTC_USDT,user_attrs_winrate_ETH_USDT,state
135,-668.3074233290263,2026-01-15 23:34:46.494015,2026-01-15 23:34:54.227289,0 days 00:00:07.733274,16,2.4,3.8000000000000003,1.5,108,BOLLINGER,ATR,1.4,19,24,14,0.032,77,30,12,0.024,81,17,15,0.016,ATR,4.0,40,2h,MACD,True,True,False,False,False,0.5800000000000001,BOLLINGER,1.4,-33.805492134343424,-72.30591828245461,-53.05570520839902,262.24864774691406,55.6001708507963,158.92440929885518,2h,62,65,63.5,MACD,48.99503722084368,56.451612903225815,41.53846153846154,COMPLETE
136,-766.0854122271285,2026-01-15 23:34:47.570571,2026-01-15 23:34:59.498503,0 days 00:00:11.927932,16,2.7,3.9000000000000004,1.5,109,BOLLINGER,ATR,1.4,46,24,12,0.033,77,30,12,0.032,81,17,10,0.012,ATR,3.8000000000000003,37,3m,MACD,True,True,False,False,False,0.54,BOLLINGER,1.4,-62.93316091047871,-55.58168281783934,-59.25742186415903,168.11968807141434,120.91031118667199,144.51499962904316,3m,51,59,55.0,MACD,52.02725157859754,54.90196078431373,49.152542372881356,COMPLETE
137,-1306.3040642045144,2026-01-15 23:34:47.853317,2026-01-15 23:35:04.244717,0 days 00:00:16.391400,20,2.7,3.9000000000000004,1.8,109,BOLLINGER,ATR,1.35,28,24,20,0.032,77,30,12,0.028000000000000004,81,17,10,0.011,ATR,3.7,37,5m,MACD,True,True,False,False,False,0.54,BOLLINGER,1.35,-51.023252845443125,-50.66859926947479,-50.84592605745895,134.04669669114384,143.58373484562793,138.81521576838588,5m,49,45,47.0,MACD,47.73242630385488,51.02040816326531,44.44444444444444,COMPLETE
138,-751.9533897214051,2026-01-15 23:34:48.223143,2026-01-15 23:35:03.550433,0 days 00:00:15.327290,13,2.4,4.0,2.0,90,BOLLINGER,ATR,1.4,21,24,14,0.028999999999999998,76,30,12,0.031,79,18,10,0.011,ATR,4.1,39,3m,HMA,True,True,False,False,False,0.5800000000000001,BOLLINGER,1.4,-48.30756907495831,-66.41594057549106,-57.361754825224686,198.1009728715966,95.00142147827647,146.55119717493653,3m,53,56,54.5,HMA,47.64150943396227,45.28301886792453,50.0,COMPLETE
139,-650.3094963412113,2026-01-15 23:34:48.276871,2026-01-15 23:35:03.543909,0 days 00:00:15.267038,13,2.4,3.9000000000000004,2.0,96,BOLLINGER,ATR,1.4,22,24,20,0.03,76,30,12,0.031,79,18,10,0.011,ATR,4.1,39,5m,HMA,True,True,False,False,False,0.5800000000000001,BOLLINGER,1.4,-41.77944707135932,-70.05778077018411,-55.91861392077172,324.1265068353076,90.89490683602048,207.51070683566405,5m,51,55,53.0,HMA,48.14616755793226,49.01960784313725,47.27272727272727,COMPLETE
140,-881.2911764576647,2026-01-15 23:34:48.473388,2026-01-15 23:35:05.244481,0 days 00:00:16.771093,13,2.4,4.0,2.0,108,BOLLINGER,ATR,1.2,18,24,16,0.028999999999999998,76,30,12,0.031,81,18,10,0.015,ATR,3.8000000000000003,39,5m,HMA,True,True,False,False,False,0.54,BOLLINGER,1.2,-40.785193752751546,-43.13050396354961,-41.95784885815058,125.47105982857663,321.0491371714499,223.26009850001327,5m,52,47,49.5,HMA,47.647299509001634,44.230769230769226,51.06382978723404,COMPLETE
141,-559.8239421580138,2026-01-15 23:34:55.262868,2026-01-15 23:35:07.742226,0 days 00:00:12.479358,18,2.4,3.0,1.5,108,BOLLINGER,ATR,1.45,20,24,14,0.033,76,30,12,0.023,79,18,10,0.015,ATR,3.8000000000000003,39,5m,MACD,True,True,False,False,False,0.5800000000000001,BOLLINGER,1.45,-36.501180811197074,-73.2340863443907,-54.86763357779389,439.4554361507572,30.405648112446443,234.9305421316018,5m,62,68,65.0,MACD,51.16223908918406,59.67741935483871,42.64705882352941,COMPLETE
142,-274.1440835526637,2026-01-15 23:34:59.920460,2026-01-15 23:35:09.781212,0 days 00:00:09.860752,13,2.4,4.0,1.6,106,BOLLINGER,ATR,1.15,15,23,10,0.028999999999999998,76,30,11,0.025,81,18,10,0.015,ATR,4.1,39,5m,MACD,True,True,False,False,False,0.59,BOLLINGER,1.15,-26.480872256826775,-71.4081353681302,-48.94450381247849,321.1883101438919,20.357330666383007,170.77282040513745,5m,55,70,62.5,MACD,49.8051948051948,58.18181818181818,41.42857142857143,COMPLETE
143,-1257.9023160815968,2026-01-15 23:35:03.650669,2026-01-15 23:35:15.556133,0 days 00:00:11.905464,14,2.4,3.9000000000000004,1.5,96,BOLLINGER,ATR,1.45,26,23,14,0.03,76,30,11,0.025,81,18,10,0.015,ATR,3.7,38,5m,HMA,True,True,True,False,False,0.5800000000000001,BOLLINGER,1.45,-40.72234975408568,-67.28838910536287,-54.00536942972427,240.45662549531136,91.41543285687558,165.93602917609348,5m,49,48,48.5,HMA,49.48979591836735,48.97959183673469,50.0,COMPLETE
144,-1323.4477840186464,2026-01-15 23:35:04.226349,2026-01-15 23:35:16.964774,0 days 00:00:12.738425,14,3.1,3.8000000000000003,1.5,95,BOLLINGER,ATR,1.45,15,23,14,0.03,76,30,11,0.024,79,18,14,0.015,ATR,4.1,38,5m,HMA,True,True,True,False,False,0.5800000000000001,BOLLINGER,1.45,-72.9960979334247,-60.02702309699165,-66.51156051520817,9.482538592185383,279.7100187540366,144.596278673111,5m,41,36,38.5,HMA,46.78184281842819,46.34146341463415,47.22222222222222,COMPLETE
145,-638.0056976452988,2026-01-15 23:35:05.272214,2026-01-15 23:35:20.842458,0 days 00:00:15.570244,14,2.4,3.4000000000000004,1.7,95,BOLLINGER,ATR,1.45,6,23,10,0.034,76,30,11,0.034,79,16,10,0.014,ATR,4.1,41,5m,HMA,True,True,False,False,False,0.59,BOLLINGER,1.45,-46.262145831176795,-51.53614973736652,-48.89914778427166,313.81884276489063,122.10358241569172,217.96121259029118,5m,59,59,59.0,HMA,50.847457627118644,52.54237288135594,49.152542372881356,COMPLETE
146,-339.4061997672643,2026-01-15 23:35:05.356175,2026-01-15 23:35:22.214460,0 days 00:00:16.858285,14,2.2,3.8000000000000003,1.7,95,BOLLINGER,ATR,1.45,6,23,14,0.034,76,30,11,0.024,81,16,10,0.014,ATR,4.1,41,5m,HMA,True,True,False,False,False,0.59,BOLLINGER,1.45,-43.02698896760341,-56.38774580292413,-49.707367385263765,371.2359032904405,494.1925356888114,432.714219489626,5m,68,62,65.0,HMA,51.470588235294116,52.94117647058824,50.0,COMPLETE
147,-683.5346413533398,2026-01-15 23:35:09.087727,2026-01-15 23:35:22.485411,0 days 00:00:13.397684,17,2.5,3.8000000000000003,1.6,95,BOLLINGER,ATR,1.45,5,23,10,0.034,76,31,11,0.024,79,18,14,0.016,ATR,4.1,38,5m,MACD,True,True,False,False,False,0.5800000000000001,BOLLINGER,1.45,-35.74024335582025,-81.31874516211168,-58.52949425896597,295.353123756369,1.8450596761452382,148.5990917162571,5m,59,65,62.0,MACD,49.50456323337679,55.932203389830505,43.07692307692308,COMPLETE
148,-841.774583449881,2026-01-15 23:35:10.445923,2026-01-15 23:35:22.367224,0 days 00:00:11.921301,18,2.5,3.5,1.5,99,BOLLINGER,ATR,1.4,7,23,10,0.034,76,31,11,0.024,79,21,10,0.015,ATR,4.1,38,5m,MACD,True,True,False,False,False,0.5800000000000001,BOLLINGER,1.4,-51.9856845436862,-76.5525711304166,-64.2691278370514,146.2466352080062,16.404942617695035,81.32578891285063,5m,59,65,62.0,MACD,48.65710560625815,54.23728813559322,43.07692307692308,COMPLETE
149,-778.5588710986394,2026-01-15 23:35:16.990869,2026-01-15 23:35:33.682286,0 days 00:00:16.691417,18,2.6,3.5,1.6,106,BOLLINGER,ATR,1.3,8,24,10,0.035,76,31,11,0.023,79,21,10,0.016,ATR,4.1,36,5m,MACD,True,True,False,False,False,0.6,BOLLINGER,1.3,-56.80669409609382,-71.66758450110213,-64.23713929859798,173.84960034324496,60.28904566404621,117.0693230036456,5m,50,57,53.5,MACD,52.56140350877193,56.00000000000001,49.122807017543856,COMPLETE
150,-784.3342259352012,2026-01-15 23:35:17.348306,2026-01-15 23:35:36.873405,0 days 00:00:19.525099,18,2.6,3.6,1.6,99,BOLLINGER,ATR,1.55,33,24,10,0.034,76,31,11,0.022,79,20,10,0.016,ATR,4.1,36,5m,MACD,True,True,False,False,False,0.6,BOLLINGER,1.55,-58.75982066282488,-80.18877471400269,-69.47429768841378,208.36942215009037,20.339865979746683,114.35464406491853,5m,54,58,56.0,MACD,50.191570881226056,55.55555555555556,44.827586206896555,COMPLETE
151,-725.744987438813,2026-01-15 23:35:21.194711,2026-01-15 23:35:36.344126,0 days 00:00:15.149415,17,2.5,3.5,1.6,106,BOLLINGER,ATR,1.5,7,24,10,0.034,76,31,11,0.034,79,20,10,0.016,ATR,3.9000000000000004,39,5m,MACD,True,True,False,False,False,0.59,BOLLINGER,1.5,-42.18410682702448,-83.70386728933887,-62.943987058181676,262.7416151883038,7.54916036851285,135.14538777840832,5m,54,62,58.0,MACD,49.551971326164875,55.55555555555556,43.54838709677419,COMPLETE
152,-850.5798524049042,2026-01-15 23:35:22.277013,2026-01-15 23:35:33.397988,0 days 00:00:11.120975,18,2.5,3.5,1.6,99,BOLLINGER,ATR,1.55,6,22,10,0.035,76,29,11,0.022,79,16,10,0.016,ATR,3.9000000000000004,44,5m,MACD,True,True,False,False,False,0.59,BOLLINGER,1.55,-52.39905789632855,-84.49180006574139,-68.44542898103496,152.87249198224552,-5.894591705882608,73.48895013818145,5m,57,63,60.0,MACD,48.62155388471178,54.385964912280706,42.857142857142854,COMPLETE
153,-815.7155693696195,2026-01-15 23:35:22.396851,2026-01-15 23:35:36.855506,0 days 00:00:14.458655,17,2.6,3.6,1.6,99,BOLLINGER,ATR,1.5,11,22,10,0.035,76,29,11,0.022,79,16,10,0.017,ATR,3.9000000000000004,44,5m,MACD,True,True,False,False,False,0.59,BOLLINGER,1.5,-57.071792701582844,-81.66933665496859,-69.37056467827571,210.68372088268325,0.7131045153993182,105.69841269904128,5m,55,60,57.5,MACD,48.93939393939394,54.54545454545454,43.333333333333336,COMPLETE
154,-437.40004931337535,2026-01-15 23:35:22.569083,2026-01-15 23:35:37.032294,0 days 00:00:14.463211,16,2.6,3.6,1.6,105,BOLLINGER,ATR,1.55,11,22,15,0.035,76,29,11,0.02,79,16,10,0.014,ATR,3.9000000000000004,44,5m,MACD,True,True,False,False,False,0.59,BOLLINGER,1.55,-33.02811663640498,-78.78895695697214,-55.908536796688566,590.1281954767169,12.232401977548212,301.18029872713254,5m,56,61,58.5,MACD,52.41510538641686,58.92857142857143,45.90163934426229,COMPLETE
155,-913.2652845511166,2026-01-15 23:35:34.090878,2026-01-15 23:35:48.859874,0 days 00:00:14.768996,16,2.3,3.4000000000000004,1.7,113,BOLLINGER,ATR,1.5,35,25,12,0.031,75,29,11,0.020999999999999998,82,16,10,0.014,ATR,4.2,40,5m,MACD,True,True,False,False,False,0.59,BOLLINGER,1.5,-59.92088767904027,-86.16961343617294,-73.04525055760661,103.1074246423546,-51.627725093014284,25.73984977467016,5m,58,70,64.0,MACD,45.0,50.0,40.0,COMPLETE
156,-613.802866399039,2026-01-15 23:35:34.521264,2026-01-15 23:35:45.997317,0 days 00:00:11.476053,16,2.3,3.6,1.7,100,BOLLINGER,ATR,1.5,12,25,15,0.031,75,29,11,0.020999999999999998,82,16,10,0.017,ATR,4.2,40,5m,MACD,True,True,False,False,False,0.59,BOLLINGER,1.5,-34.33942625910918,-73.19628362003469,-53.76785493957193,396.04744698033556,12.820289729252993,204.43386835479427,5m,62,67,64.5,MACD,49.80741454020222,54.83870967741935,44.776119402985074,COMPLETE
157,-637.5670448269948,2026-01-15 23:35:36.895220,2026-01-15 23:35:53.571549,0 days 00:00:16.676329,13,2.3,3.4000000000000004,1.7,115,BOLLINGER,ATR,1.4,14,25,11,0.031,75,30,10,0.025,82,25,10,0.014,ATR,3.6,40,5m,HMA,True,True,False,False,False,0.59,BOLLINGER,1.4,-42.66827636583555,-68.17222807401578,-55.420252219925665,358.6227071007062,75.71041859059187,217.16656284564903,5m,56,66,61.0,HMA,46.96969696969697,50.0,43.93939393939394,COMPLETE
158,-634.4797788655942,2026-01-15 23:35:36.950609,2026-01-15 23:35:47.245086,0 days 00:00:10.294477,13,2.3,3.4000000000000004,1.7,114,BOLLINGER,ATR,1.4,14,25,11,0.031,75,30,10,0.020999999999999998,82,25,10,0.014,ATR,4.2,40,5m,HMA,True,True,False,False,False,0.59,BOLLINGER,1.4,-42.12149222722669,-67.37063577588648,-54.74606400155659,352.7604351027509,83.38663142070826,218.07353326172955,5m,56,66,61.0,HMA,47.72727272727273,50.0,45.45454545454545,COMPLETE
159,-692.6962780787535,2026-01-15 23:35:36.959852,2026-01-15 23:35:51.080899,0 days 00:00:14.121047,13,2.3,3.7,1.7,116,BOLLINGER,ATR,1.4,14,25,15,0.031,75,30,10,0.025,82,25,10,0.014,ATR,3.6,40,5m,HMA,True,True,False,False,False,0.59,BOLLINGER,1.4,-42.54116607690943,-73.60334603059682,-58.07225605375312,300.2389797326369,56.26320072106933,178.2510902268531,5m,60,64,62.0,HMA,45.26041666666667,48.333333333333336,42.1875,COMPLETE
160,-716.6127250569698,2026-01-15 23:35:37.094600,2026-01-15 23:35:49.285542,0 days 00:00:12.190942,13,2.8,3.4000000000000004,1.5,113,BOLLINGER,ATR,1.45,14,23,15,0.031,78,29,11,0.020999999999999998,78,16,10,0.014,ATR,3.6,41,5m,MACD,True,True,False,False,False,0.59,BOLLINGER,1.45,-54.074118536308944,-58.681418869122005,-56.37776870271547,345.10707298863576,16.138239417872555,180.62265620325417,5m,53,54,53.5,MACD,47.693920335429766,50.943396226415096,44.44444444444444,COMPLETE
161,-831.7317703169756,2026-01-15 23:35:48.079727,2026-01-15 23:36:01.316801,0 days 00:00:13.237074,14,2.2,3.4000000000000004,1.7,115,BOLLINGER,ATR,1.45,14,25,15,0.031,75,29,11,0.02,78,25,10,0.014,ATR,4.2,40,5m,MACD,True,True,False,False,False,0.59,BOLLINGER,1.45,-55.32222064948399,-77.94737107840261,-66.6347958639433,199.15911528937002,-18.38433691870264,90.38738918533369,5m,64,69,66.5,MACD,44.565217391304344,50.0,39.130434782608695,COMPLETE
162,-597.4797036147647,2026-01-15 23:35:48.097504,2026-01-15 23:35:59.575892,0 days 00:00:11.478388,14,2.2,3.4000000000000004,1.7,90,BOLLINGER,ATR,1.45,14,25,15,0.031,75,29,11,0.020999999999999998,78,25,10,0.014,ATR,4.2,40,5m,MACD,True,True,False,False,False,0.59,BOLLINGER,1.45,-37.65534700089916,-65.13940138262998,-51.39737419176457,373.7237334957065,86.62183278909984,230.17278314240315,5m,69,72,70.5,MACD,48.33937198067633,53.62318840579711,43.05555555555556,COMPLETE
163,-2536.744859085992,2026-01-15 23:35:50.266649,2026-01-15 23:36:01.300253,0 days 00:00:11.033604,14,2.2,3.3000000000000003,1.7,89,BOLLINGER,ATR,1.45,13,25,11,0.031,75,30,10,0.02,82,25,11,0.014,ATR,4.300000000000001,44,5m,ICHIMOKU,True,True,False,False,True,0.6,BOLLINGER,1.45,-44.40215064187161,-28.782449204443573,-36.59229992315759,90.90384693461822,-4.392195827485237,43.25582555356649,5m,23,18,20.5,ICHIMOKU,49.8792270531401,60.86956521739131,38.88888888888889,COMPLETE
164,-593.38543184623,2026-01-15 23:35:50.285285,2026-01-15 23:36:03.942309,0 days 00:00:13.657024,14,2.2,3.3000000000000003,1.7,117,BOLLINGER,PARABOLIC_SAR,1.45,12,25,11,0.04,75,30,10,0.02,82,25,11,0.019000000000000003,ATR,4.300000000000001,44,5m,HMA,True,True,False,False,False,0.6,BOLLINGER,1.45,-48.35268763845432,-67.40114652525281,-57.87691708185356,493.236128041889,37.776664114243864,265.5063960780664,5m,57,68,62.5,HMA,48.37461300309597,52.63157894736842,44.11764705882353,COMPLETE
165,-2951.5707790294396,2026-01-15 23:35:51.190907,2026-01-15 23:36:05.911714,0 days 00:00:14.720807,14,2.2,3.4000000000000004,1.7,91,BOLLINGER,ATR,1.45,11,22,11,0.04,76,30,11,0.018000000000000002,82,25,11,0.017,ATR,4.300000000000001,43,5m,HMA,True,True,False,False,True,0.6,BOLLINGER,1.45,-33.860841625376565,-30.85287803861273,-32.35685983199465,35.663505304395336,-7.483291277581756,14.09010701340679,5m,18,13,15.5,HMA,50.85470085470085,55.55555555555556,46.15384615384615,COMPLETE
166,132.1003603693398,2026-01-15 23:35:54.176694,2026-01-15 23:36:09.437542,0 days 00:00:15.260848,14,2.2,3.3000000000000003,1.7,127,BOLLINGER,ATR,1.6,24,26,11,0.028999999999999998,75,30,10,0.02,82,25,11,0.017,ATR,4.300000000000001,39,5m,HMA,True,True,False,False,False,0.6,BOLLINGER,1.6,-28.24728332651058,-80.34086285925768,-54.29407309288413,906.1362300197509,55.059358145739935,480.5977940827454,5m,58,73,65.5,HMA,50.011809163911195,53.44827586206896,46.57534246575342,COMPLETE
167,-829.9148080806535,2026-01-15 23:36:00.169527,2026-01-15 23:36:11.678953,0 days 00:00:11.509426,14,2.2,3.3000000000000003,1.7,131,BOLLINGER,ATR,1.45,23,26,11,0.028999999999999998,75,29,10,0.019000000000000003,78,25,11,0.017,ATR,4.300000000000001,42,5m,MACD,True,True,False,False,False,0.6,BOLLINGER,1.45,-49.947575457075125,-81.63167430597045,-65.78962488152278,216.2752160438612,-48.67641902617714,83.79939850884203,5m,55,73,64.0,MACD,48.50560398505604,54.54545454545454,42.465753424657535,COMPLETE
168,-464.7740797214892,2026-01-15 23:36:02.085030,2026-01-15 23:36:16.265497,0 days 00:00:14.180467,13,2.4,3.3000000000000003,1.6,96,BOLLINGER,PARABOLIC_SAR,1.6,26,26,15,0.04,76,28,10,0.023,78,25,11,0.019000000000000003,ATR,4.300000000000001,39,5m,MACD,True,True,False,False,False,0.6,BOLLINGER,1.6,-34.88801057361922,-83.41044792883727,-59.14922925122825,602.9136619448776,-21.23664665745278,290.83850764371243,5m,63,71,67.0,MACD,49.083389224234296,58.730158730158735,39.436619718309856,COMPLETE
169,-464.7740797214892,2026-01-15 23:36:02.090036,2026-01-15 23:36:14.492051,0 days 00:00:12.402015,13,2.4,3.3000000000000003,1.6,96,BOLLINGER,PARABOLIC_SAR,1.6,23,26,15,0.04,76,28,10,0.023,83,25,11,0.017,ATR,4.300000000000001,39,5m,MACD,True,True,False,False,False,0.6,BOLLINGER,1.6,-34.88801057361922,-83.41044792883727,-59.14922925122825,602.9136619448776,-21.23664665745278,290.83850764371243,5m,63,71,67.0,MACD,49.083389224234296,58.730158730158735,39.436619718309856,COMPLETE
170,-890.6486065022345,2026-01-15 23:36:04.392500,2026-01-15 23:36:17.879834,0 days 00:00:13.487334,15,2.2,3.4000000000000004,1.7,118,BOLLINGER,PARABOLIC_SAR,1.5,11,26,11,0.039,75,28,10,0.019000000000000003,83,25,11,0.019000000000000003,ATR,4.300000000000001,43,5m,MACD,True,True,False,False,False,0.6,BOLLINGER,1.5,-58.37627345860128,-80.87647536591524,-69.62637441225826,116.03661362104518,-25.673155580199243,45.181729020422964,5m,59,71,65.0,MACD,45.70303174982096,49.152542372881356,42.25352112676056,COMPLETE
171,-886.5193179978078,2026-01-15 23:36:05.962672,2026-01-15 23:36:17.935346,0 days 00:00:11.972674,12,2.3,3.3000000000000003,1.6,126,BOLLINGER,PARABOLIC_SAR,1.5,10,26,11,0.039,75,28,10,0.023,83,25,11,0.018000000000000002,ATR,4.300000000000001,41,5m,MACD,True,True,False,False,False,0.6,BOLLINGER,1.5,-60.05789098080139,-82.28391514003626,-71.17090306041882,139.21766803690764,-41.804430720531734,48.70661865818795,5m,59,75,67.0,MACD,46.75706214689266,50.847457627118644,42.66666666666667,COMPLETE
172,-911.4410585287724,2026-01-15 23:36:10.041716,2026-01-15 23:36:22.770522,0 days 00:00:12.728806,15,2.3,3.3000000000000003,1.6,126,BOLLINGER,PARABOLIC_SAR,1.55,22,26,11,0.039,75,29,10,0.023,83,25,11,0.019000000000000003,ATR,4.300000000000001,42,5m,MACD,True,True,False,False,False,0.6,BOLLINGER,1.55,-61.446732764180034,-81.98507204330257,-71.7159024037413,105.35288287810818,-47.94135262418584,28.705765126961168,5m,59,73,66.0,MACD,46.49407940561876,49.152542372881356,43.83561643835616,COMPLETE
173,-818.491422718158,2026-01-15 23:36:12.601733,2026-01-15 23:36:23.295134,0 days 00:00:10.693401,15,2.3,3.2,1.6,105,BOLLINGER,PARABOLIC_SAR,1.5,27,26,12,0.039,74,29,10,0.023,83,25,11,0.019000000000000003,ATR,4.300000000000001,42,5m,MACD,True,True,False,False,False,0.6,BOLLINGER,1.5,-50.1166405715486,-78.13238680475555,-64.12451368815208,201.6187354577237,-11.120413545577206,95.24916095607324,5m,60,72,66.0,MACD,48.75,51.66666666666667,45.83333333333333,COMPLETE
174,-783.0733092452965,2026-01-15 23:36:16.225724,2026-01-15 23:36:29.614428,0 days 00:00:13.388704,15,2.3,3.2,1.6,131,BOLLINGER,PARABOLIC_SAR,1.55,28,26,15,0.038,74,28,10,0.023,83,25,11,0.018000000000000002,ATR,4.5,42,5m,MACD,True,True,False,False,False,0.6,BOLLINGER,1.55,-52.844033108178564,-81.36925388627839,-67.10664349722848,278.4692320870577,-27.811485347554775,125.32887336975148,5m,60,68,64.0,MACD,48.72549019607843,53.333333333333336,44.11764705882353,COMPLETE
175,-675.2090660640897,2026-01-15 23:36:17.346865,2026-01-15 23:36:33.013675,0 days 00:00:15.666810,12,2.5,3.2,1.6,135,BOLLINGER,PARABOLIC_SAR,1.6,30,26,15,0.04,74,28,10,0.02,84,25,11,0.019000000000000003,ATR,4.5,39,5m,MACD,True,True,False,False,False,0.6,BOLLINGER,1.6,-43.0141601976193,-85.86400505387323,-64.43908262574627,361.8395722114942,-20.125280001314856,170.85714610508967,5m,54,58,56.0,MACD,47.60536398467433,55.55555555555556,39.6551724137931,COMPLETE
176,-713.9411285140623,2026-01-15 23:36:18.125911,2026-01-15 23:36:32.794289,0 days 00:00:14.668378,12,2.5,3.2,1.6,104,BOLLINGER,PARABOLIC_SAR,1.6,23,26,15,0.04,74,28,10,0.02,84,25,11,0.019000000000000003,ATR,4.2,29,5m,MACD,True,True,False,False,False,0.6,BOLLINGER,1.6,-38.315884486578696,-84.0842910882719,-61.200087787425296,289.9734601057224,-26.596359553425096,131.68855027614865,5m,59,65,62.0,MACD,47.96610169491525,55.932203389830505,40.0,COMPLETE
177,-633.3442571445185,2026-01-15 23:36:18.638847,2026-01-15 23:36:32.829501,0 days 00:00:14.190654,12,2.5,3.2,1.6,105,BOLLINGER,PARABOLIC_SAR,1.6,36,26,15,0.04,74,28,10,0.02,83,25,11,0.019000000000000003,ATR,4.5,39,5m,MACD,True,True,False,False,False,0.6,BOLLINGER,1.6,-36.24483172983016,-82.64480642517361,-59.44481907750189,367.3360481507218,-2.39567487151433,182.47018663960375,5m,58,63,60.5,MACD,49.0831964969896,56.896551724137936,41.269841269841265,COMPLETE
178,-498.09631862473,2026-01-15 23:36:22.858710,2026-01-15 23:36:36.394950,0 days 00:00:13.536240,12,2.4,3.2,1.6,133,BOLLINGER,PARABOLIC_SAR,1.6,28,26,15,0.04,74,28,10,0.02,82,25,11,0.018000000000000002,ATR,4.5,39,5m,MACD,True,True,False,False,False,0.59,BOLLINGER,1.6,-36.54760894618905,-80.48913633728682,-58.51837264173794,521.4633149018914,35.58030679615059,278.521810849021,5m,56,62,59.0,MACD,52.13133640552995,60.71428571428571,43.54838709677419,COMPLETE
