number,value,datetime_start,datetime_complete,duration,params_ADX_THRESHOLD,params_ATR_MULTIPLIER,params_ATR_STOP_LOSS_MULT,params_BB_STD,params_ENTRY_PERIOD,params_ENTRY_TYPE,params_EXIT_TYPE,params_LEVERAGE,params_MA_PERIOD,params_MFI_THRESHOLD,params_MFI_WINDOW,params_RISK_PER_TRADE,params_RSI_OVERBOUGHT,params_RSI_OVERSOLD,params_RSI_WINDOW,params_SAR_STEP,params_STOCH_OVERBOUGHT,params_STOCH_OVERSOLD,params_STOCH_WINDOW,params_STOP_LOSS_PCT,params_STOP_LOSS_TYPE,params_SUPERTREND_MULT,params_SUPERTREND_PERIOD,params_TIMEFRAME,params_TREND_FILTER_TYPE,params_USE_ADX,params_USE_MFI,params_USE_RSI,params_USE_STOCHASTIC,params_USE_VHF,params_VHF_THRESHOLD,user_attrs_entry_type,user_attrs_leverage,user_attrs_mdd_BTC_USDT,user_attrs_mdd_ETH_USDT,user_attrs_mdd_avg,user_attrs_return_BTC_USDT,user_attrs_return_ETH_USDT,user_attrs_return_avg,user_attrs_timeframe,user_attrs_trades_BTC_USDT,user_attrs_trades_ETH_USDT,user_attrs_trades_avg,user_attrs_trend_filter,user_attrs_win_rate_avg,user_attrs_winrate_BTC_USDT,user_attrs_winrate_ETH_USDT,state
263,-2210.1959412333363,2026-01-15 23:38:03.050441,2026-01-15 23:38:07.357186,0 days 00:00:04.306745,13,2.7,2.8,1.5,134,CCI,PARABOLIC_SAR,1.55,50,15,14,0.035,76,27,11,0.014,83,23,12,0.022,ATR,4.300000000000001,28,30m,TEMA,True,True,False,False,False,0.5700000000000001,CCI,1.55,-21.585402991617045,-47.63559976709329,-34.61050137935517,445.0625001869961,59.28671972866768,252.17460995783188,30m,23,28,25.5,TEMA,50.077639751552795,60.86956521739131,39.285714285714285,COMPLETE
264,-1924.904854393918,2026-01-15 23:38:05.698887,2026-01-15 23:38:10.996532,0 days 00:00:05.297645,11,2.5,2.9000000000000004,1.5,120,CCI,PARABOLIC_SAR,1.65,48,15,15,0.036000000000000004,76,27,11,0.017,83,23,12,0.022,ATR,4.300000000000001,21,30m,TEMA,True,True,False,False,False,0.5700000000000001,CCI,1.65,-30.86092313905934,-69.61061755284797,-50.235770345953654,379.678094882997,-55.54358974070125,162.0672525711479,30m,25,37,31.0,TEMA,48.91891891891892,60.0,37.83783783783784,COMPLETE
265,-2018.4241980358015,2026-01-15 23:38:05.702460,2026-01-15 23:38:10.659626,0 days 00:00:04.957166,11,2.5,2.9000000000000004,1.5,128,CCI,PARABOLIC_SAR,1.55,49,15,14,0.036000000000000004,76,27,11,0.014,83,23,12,0.022,ATR,4.300000000000001,27,30m,TEMA,True,True,False,False,False,0.5700000000000001,CCI,1.55,-31.49654457180478,-69.61906444816807,-50.557804509986426,277.2625558452284,2.4241362833016438,139.84334606426503,30m,25,32,28.5,TEMA,50.3125,60.0,40.625,COMPLETE
266,-632.6213618463289,2026-01-15 23:38:07.094853,2026-01-15 23:38:12.184782,0 days 00:00:05.089929,13,2.5,2.9000000000000004,1.5,127,BOLLINGER,PARABOLIC_SAR,1.65,89,15,14,0.036000000000000004,76,27,10,0.024,83,23,12,0.022,ATR,4.6,27,30m,TEMA,True,True,False,False,False,0.5700000000000001,BOLLINGER,1.65,-57.12321881747273,-80.6426139034787,-68.88291636047572,483.80662513948954,33.525341252832604,258.66598319616105,30m,60,66,63.0,TEMA,47.04545454545455,51.66666666666667,42.42424242424242,COMPLETE
267,-526.7208046655196,2026-01-15 23:38:07.322336,2026-01-15 23:38:11.525603,0 days 00:00:04.203267,11,2.5,3.0,1.5,127,BOLLINGER,PARABOLIC_SAR,1.75,61,16,15,0.036000000000000004,75,27,10,0.024,82,23,14,0.017,ATR,4.6,21,15m,TEMA,True,True,False,False,False,0.6,BOLLINGER,1.75,-54.799913439165174,-86.32595613142098,-70.56293478529308,595.0334355678865,55.21865079053032,325.1260431792084,15m,58,65,61.5,TEMA,49.12466843501326,55.172413793103445,43.07692307692308,COMPLETE
268,-480.13013790989135,2026-01-15 23:38:07.412066,2026-01-15 23:38:11.776518,0 days 00:00:04.364452,11,2.5,3.0,1.5,131,BOLLINGER,PARABOLIC_SAR,1.65,46,16,15,0.036000000000000004,75,27,10,0.025,82,23,13,0.017,ATR,4.6,21,15m,TEMA,True,True,False,False,False,0.6,BOLLINGER,1.65,-46.87115321115764,-80.8088510959878,-63.840002153572726,589.4760612308783,81.3548100974023,335.41543566414026,15m,57,63,60.0,TEMA,48.705096073517126,56.14035087719298,41.269841269841265,COMPLETE
269,-626.7529069215025,2026-01-15 23:38:07.500260,2026-01-15 23:38:12.248021,0 days 00:00:04.747761,11,2.5,3.0,1.5,131,BOLLINGER,PARABOLIC_SAR,1.65,37,16,15,0.036000000000000004,75,27,10,0.025,82,23,13,0.017,ATR,4.6,21,15m,TEMA,True,True,False,False,False,0.6,BOLLINGER,1.65,-54.403975602452114,-81.79433989368991,-68.09915774807101,438.9057614535064,75.75400322747635,257.3298823404914,15m,54,64,59.0,TEMA,47.019675925925924,51.85185185185185,42.1875,COMPLETE
270,-1071.85972238889,2026-01-15 23:38:11.758572,2026-01-15 23:38:17.255455,0 days 00:00:05.496883,15,2.9000000000000004,3.0,1.6,131,BOLLINGER,PARABOLIC_SAR,1.65,70,16,16,0.039,76,28,10,0.019000000000000003,82,24,13,0.023,ATR,4.5,19,15m,DEMA,True,True,False,False,False,0.5800000000000001,BOLLINGER,1.65,-73.92163545550792,-76.68067363362397,-75.30115454456595,111.61094775563585,145.6588108055364,128.63487928058612,15m,53,49,51.0,DEMA,52.791682710820176,56.60377358490566,48.97959183673469,COMPLETE
271,-857.3038721779913,2026-01-15 23:38:11.926424,2026-01-15 23:38:19.905546,0 days 00:00:07.979122,15,2.3,3.0,1.6,133,BOLLINGER,PARABOLIC_SAR,1.65,37,28,16,0.028999999999999998,76,28,10,0.019000000000000003,82,24,13,0.023,ATR,2.8,23,15m,DEMA,True,True,False,False,False,0.5800000000000001,BOLLINGER,1.65,-76.0255064051329,-74.99606947781778,-75.51078794147534,50.74857698990473,114.85275273564804,82.80066486277639,15m,68,69,68.5,DEMA,49.637681159420296,50.0,49.275362318840585,COMPLETE
272,-1195.7894450024278,2026-01-15 23:38:11.949418,2026-01-15 23:38:16.113317,0 days 00:00:04.163899,14,2.9000000000000004,3.7,1.6,133,BOLLINGER,PARABOLIC_SAR,1.65,36,28,16,0.033,76,28,10,0.026000000000000002,82,24,13,0.023,ATR,4.5,23,15m,DEMA,True,True,False,False,False,0.5800000000000001,BOLLINGER,1.65,-57.021574834962564,-57.680156616850134,-57.350865725906345,293.3710219477495,175.49707257252285,234.4340472601362,15m,48,46,47.0,DEMA,48.82246376811594,54.166666666666664,43.47826086956522,COMPLETE
273,-1160.635493310263,2026-01-15 23:38:12.137707,2026-01-15 23:38:18.261706,0 days 00:00:06.123999,15,2.9000000000000004,3.0,1.6,133,BOLLINGER,PARABOLIC_SAR,1.65,37,28,16,0.039,76,28,10,0.026000000000000002,82,24,13,0.023,ATR,4.5,23,15m,DEMA,True,True,False,False,False,0.5800000000000001,BOLLINGER,1.65,-70.27908365024945,-49.46666122619951,-59.872872438224476,232.89291511068097,252.28241334316985,242.58766422692543,15m,47,45,46.0,DEMA,50.945626477541374,57.446808510638306,44.44444444444444,COMPLETE
274,-1463.5619666528573,2026-01-15 23:38:12.241657,2026-01-15 23:38:18.196632,0 days 00:00:05.954975,15,2.9000000000000004,3.0,1.6,134,BOLLINGER,PARABOLIC_SAR,1.6,35,28,16,0.028999999999999998,76,28,10,0.019000000000000003,82,24,13,0.023,ATR,4.5,23,15m,DEMA,True,True,True,False,False,0.5800000000000001,BOLLINGER,1.6,-77.9116769173494,-67.92304574276827,-72.91736133005884,-6.0533927457002115,67.80113060124756,30.873868927773678,15m,34,34,34.0,DEMA,41.17647058823529,38.23529411764706,44.11764705882353,COMPLETE
275,-1425.7727948151878,2026-01-15 23:38:12.311572,2026-01-15 23:38:17.402684,0 days 00:00:05.091112,15,2.3,3.0,1.6,134,BOLLINGER,PARABOLIC_SAR,1.6,35,18,18,0.039,76,28,10,0.015,82,24,13,0.019000000000000003,ATR,4.5,23,15m,DEMA,True,True,True,False,False,0.5800000000000001,BOLLINGER,1.6,-66.24347706447944,-61.228197616395995,-63.73583734043771,0.23070008608999196,120.04162542814004,60.13616275711502,15m,46,49,47.5,DEMA,44.12156166814552,41.30434782608695,46.93877551020408,COMPLETE
276,-817.4724744945497,2026-01-15 23:38:17.050220,2026-01-15 23:38:22.549845,0 days 00:00:05.499625,15,2.3,3.0,1.6,137,BOLLINGER,PARABOLIC_SAR,1.6,43,16,18,0.039,76,24,10,0.019000000000000003,82,12,13,0.019000000000000003,ATR,4.5,23,15m,EMA,True,True,True,False,False,0.5800000000000001,BOLLINGER,1.6,-63.818853068944605,-83.58000085245831,-73.69942696070146,222.62435434476822,-0.72753277522641,110.9484107847709,15m,51,54,52.5,EMA,49.56427015250544,50.98039215686274,48.148148148148145,COMPLETE
277,-570.3119878745701,2026-01-15 23:38:17.511604,2026-01-15 23:38:25.986323,0 days 00:00:08.474719,14,2.6,2.9000000000000004,1.6,137,BOLLINGER,PARABOLIC_SAR,1.75,44,16,16,0.028999999999999998,76,28,10,0.019000000000000003,82,23,14,0.019000000000000003,ATR,4.7,19,5m,EMA,True,True,False,False,False,0.5800000000000001,BOLLINGER,1.75,-63.80271835874062,-85.89813005383417,-74.85042420628739,638.5313964967078,26.96689677033103,332.7491466335194,5m,58,64,61.0,EMA,49.38038793103448,53.44827586206896,45.3125,COMPLETE
278,465.07346126858374,2026-01-15 23:38:17.785082,2026-01-15 23:38:29.149781,0 days 00:00:11.364699,14,2.6,3.9000000000000004,1.6,136,BOLLINGER,PARABOLIC_SAR,1.75,44,16,16,0.028999999999999998,76,28,10,0.019000000000000003,82,23,12,0.019000000000000003,ATR,4.7,20,5m,SUPERTREND,True,True,False,False,False,0.48,BOLLINGER,1.75,-25.64466452930882,-78.67445052703421,-52.15955752817152,2516.557693608074,117.68935155247506,1317.1235225802745,5m,43,48,45.5,SUPERTREND,55.23255813953488,60.46511627906976,50.0,COMPLETE
279,876.0178318361641,2026-01-15 23:38:18.237176,2026-01-15 23:38:29.141369,0 days 00:00:10.904193,14,2.6,3.9000000000000004,1.5,141,BOLLINGER,PARABOLIC_SAR,1.75,44,16,16,0.034,75,28,10,0.016,80,23,14,0.024,ATR,4.7,20,5m,SUPERTREND,True,True,False,False,False,0.56,BOLLINGER,1.75,-26.834196053510084,-63.69205446997476,-45.26312526174242,2439.7521382932305,69.4982982598899,1254.6252182765602,5m,46,50,48.0,SUPERTREND,54.26086956521739,56.52173913043478,52.0,COMPLETE
280,876.0178318361641,2026-01-15 23:38:18.445452,2026-01-15 23:38:29.083860,0 days 00:00:10.638408,14,2.6,3.9000000000000004,1.5,141,BOLLINGER,PARABOLIC_SAR,1.75,44,16,15,0.034,75,27,10,0.016,80,23,14,0.019000000000000003,ATR,4.800000000000001,20,5m,SUPERTREND,True,True,False,False,False,0.59,BOLLINGER,1.75,-26.834196053510084,-63.69205446997476,-45.26312526174242,2439.7521382932305,69.4982982598899,1254.6252182765602,5m,46,50,48.0,SUPERTREND,54.26086956521739,56.52173913043478,52.0,COMPLETE
281,864.3981777405706,2026-01-15 23:38:21.285855,2026-01-15 23:38:36.881509,0 days 00:00:15.595654,14,2.6,3.1,1.5,141,BOLLINGER,PARABOLIC_SAR,1.75,44,16,15,0.034,75,27,10,0.016,84,12,14,0.047,ATR,4.7,20,5m,SUPERTREND,True,True,False,False,False,0.56,BOLLINGER,1.75,-26.834196053510084,-63.68658411458079,-45.26039008404544,2439.7521382932305,58.947599910762605,1249.3498691019965,5m,46,50,48.0,SUPERTREND,54.26086956521739,56.52173913043478,52.0,COMPLETE
282,-262.19996573070785,2026-01-15 23:38:23.946973,2026-01-15 23:38:40.171118,0 days 00:00:16.224145,14,2.6,3.9000000000000004,1.5,141,BOLLINGER,PARABOLIC_SAR,1.75,46,29,15,0.034,75,27,10,0.012,80,23,14,0.032,ATR,4.800000000000001,20,5m,MACD,True,True,False,False,False,0.48,BOLLINGER,1.75,-39.1542057563978,-71.31213704507257,-55.23317140073519,917.078916960737,49.001502438322056,483.04020969952956,5m,50,56,53.0,MACD,51.10714285714286,54.0,48.214285714285715,COMPLETE
283,897.1625611812169,2026-01-15 23:38:26.966227,2026-01-15 23:38:39.232124,0 days 00:00:12.265897,13,2.6,3.9000000000000004,1.5,142,BOLLINGER,PARABOLIC_SAR,1.7000000000000002,46,20,15,0.035,75,27,10,0.016,84,25,12,0.047,ATR,4.800000000000001,20,5m,SUPERTREND,True,True,False,False,False,0.56,BOLLINGER,1.7000000000000002,-24.915410209602666,-66.21441269537054,-45.564911452486605,2389.8101541628175,63.08190763359065,1226.446030898204,5m,46,51,48.5,SUPERTREND,53.75106564364876,56.52173913043478,50.98039215686274,COMPLETE
284,815.0428111195852,2026-01-15 23:38:29.213400,2026-01-15 23:38:42.868878,0 days 00:00:13.655478,14,2.6,3.9000000000000004,1.5,146,BOLLINGER,PARABOLIC_SAR,1.8,47,26,15,0.033,75,28,11,0.016,81,23,14,0.017,ATR,4.800000000000001,19,5m,SUPERTREND,True,True,False,False,False,0.6,BOLLINGER,1.8,-26.368391687408366,-63.93220084297596,-45.15029626519216,2252.700606091891,82.47756756848457,1167.5890868301879,5m,47,50,48.5,SUPERTREND,53.65957446808511,55.319148936170215,52.0,COMPLETE
285,1055.0503802868698,2026-01-15 23:38:29.258597,2026-01-15 23:38:42.477424,0 days 00:00:13.218827,14,2.6,4.0,1.5,143,BOLLINGER,PARABOLIC_SAR,1.8,19,29,15,0.033,75,28,11,0.016,80,23,12,0.032,ATR,4.800000000000001,19,5m,SUPERTREND,True,True,False,False,False,0.6,BOLLINGER,1.8,-26.37850121633066,-62.73784490959833,-44.55817306296449,2805.980145088594,76.12993060879447,1441.0550378486942,5m,46,50,48.0,SUPERTREND,54.26086956521739,56.52173913043478,52.0,COMPLETE
286,817.4151652234896,2026-01-15 23:38:29.257029,2026-01-15 23:38:44.655350,0 days 00:00:15.398321,14,2.6,3.9000000000000004,1.5,145,BOLLINGER,PARABOLIC_SAR,1.8,46,20,15,0.033,75,28,11,0.016,80,23,14,0.017,ATR,4.800000000000001,19,5m,SUPERTREND,True,True,False,False,False,0.49,BOLLINGER,1.8,-26.368391687408366,-63.7133987056798,-45.040895196544085,2261.81282271297,80.46894937791407,1171.1408860454421,5m,47,50,48.5,SUPERTREND,53.65957446808511,55.319148936170215,52.0,COMPLETE
287,640.8284162401187,2026-01-15 23:38:39.848940,2026-01-15 23:38:54.455906,0 days 00:00:14.606966,14,2.8,4.0,1.5,143,BOLLINGER,PARABOLIC_SAR,1.8,53,18,15,0.034,75,29,11,0.016,85,11,14,0.048,ATR,4.800000000000001,19,5m,SUPERTREND,True,True,False,False,False,0.56,BOLLINGER,1.8,-27.892209210323614,-69.43305220596855,-48.66263070814608,3046.9286014381682,142.9082591850528,1594.9184303116106,5m,40,44,42.0,SUPERTREND,57.272727272727266,60.0,54.54545454545454,COMPLETE
288,-703.3124155819569,2026-01-15 23:38:39.863664,2026-01-15 23:38:52.714110,0 days 00:00:12.850446,14,2.8,3.9000000000000004,1.5,145,BOLLINGER,PARABOLIC_SAR,1.75,47,18,15,0.033,75,27,11,0.016,85,11,14,0.048,ATR,4.9,20,5m,SUPERTREND,True,True,False,True,False,0.45999999999999996,BOLLINGER,1.75,-36.84101059933349,-74.99995621155854,-55.920483405446014,959.6909071239076,121.04343596719853,540.367171545553,5m,37,34,35.5,SUPERTREND,53.37837837837838,56.75675675675676,50.0,COMPLETE
289,-555.7243627431753,2026-01-15 23:38:41.633055,2026-01-15 23:38:52.661963,0 days 00:00:11.028908,14,2.8,3.9000000000000004,1.5,143,BOLLINGER,PARABOLIC_SAR,1.75,54,29,15,0.033,75,27,11,0.016,85,10,14,0.047,ATR,4.9,20,5m,SUPERTREND,True,True,False,True,False,0.48,BOLLINGER,1.75,-36.959796846486896,-77.10136250337395,-57.03057967493042,1178.1665132191836,145.6230659696103,661.8947895943969,5m,36,33,34.5,SUPERTREND,54.92424242424242,58.333333333333336,51.515151515151516,COMPLETE
290,-1022.3706668160357,2026-01-15 23:38:42.582895,2026-01-15 23:38:52.263782,0 days 00:00:09.680887,14,2.8,3.9000000000000004,1.5,145,BOLLINGER,PARABOLIC_SAR,1.8,47,29,15,0.033,75,29,11,0.016,80,11,14,0.035,ATR,4.9,19,5m,SUPERTREND,True,True,False,True,False,0.48,BOLLINGER,1.8,-34.53767984555871,-76.59547496793685,-55.56657740674778,549.4266098937533,60.126800252121946,304.7767050729376,5m,31,30,30.5,SUPERTREND,50.806451612903224,51.61290322580645,50.0,COMPLETE
291,-1028.8094874974922,2026-01-15 23:38:43.084123,2026-01-15 23:38:55.965734,0 days 00:00:12.881611,14,2.8,3.9000000000000004,1.5,145,BOLLINGER,PARABOLIC_SAR,1.8,47,29,15,0.033,75,29,11,0.016,80,13,14,0.048,ATR,4.800000000000001,17,5m,SUPERTREND,False,True,False,True,False,0.51,BOLLINGER,1.8,-34.53767984555871,-78.80790318719119,-56.67279151637495,549.4266098937533,51.13920788360367,300.2829088886785,5m,31,31,31.0,SUPERTREND,50.0,51.61290322580645,48.38709677419355,COMPLETE
292,-1031.5687597304677,2026-01-15 23:38:48.332159,2026-01-15 23:39:02.532133,0 days 00:00:14.199974,14,2.8,3.9000000000000004,1.5,144,BOLLINGER,PARABOLIC_SAR,1.85,54,20,15,0.033,75,29,11,0.016,80,13,14,0.048,ATR,4.9,18,5m,SUPERTREND,False,True,False,True,False,0.48,BOLLINGER,1.85,-35.54667134963651,-80.2057138109529,-57.876192580294706,567.0284501003091,38.9528873225376,302.9906687114233,5m,31,31,31.0,SUPERTREND,50.0,51.61290322580645,48.38709677419355,COMPLETE
293,923.3349966319856,2026-01-15 23:38:52.449108,2026-01-15 23:39:04.233063,0 days 00:00:11.783955,14,2.7,3.9000000000000004,1.5,145,BOLLINGER,PARABOLIC_SAR,1.8,47,29,15,0.033,75,29,11,0.016,80,10,14,0.048,ATR,4.9,17,5m,SUPERTREND,False,True,False,False,False,0.49,BOLLINGER,1.8,-28.45345534565166,-72.46703686072186,-50.46024610318676,2697.1906595962773,52.712583433195434,1374.9516215147364,5m,42,50,46.0,SUPERTREND,53.57142857142857,57.14285714285714,50.0,COMPLETE
294,1209.9397036890095,2026-01-15 23:38:53.324872,2026-01-15 23:39:07.417589,0 days 00:00:14.092717,14,2.7,4.0,1.5,142,BOLLINGER,PARABOLIC_SAR,1.85,47,29,15,0.033,75,29,11,0.015,80,12,14,0.046000000000000006,ATR,4.800000000000001,17,5m,SUPERTREND,False,True,False,False,False,0.49,BOLLINGER,1.85,-29.251388737338196,-74.81915578214664,-52.03527225974241,3589.8015373504995,31.14197671842461,1810.4717570344621,5m,41,50,45.5,SUPERTREND,54.26829268292683,58.536585365853654,50.0,COMPLETE
295,365.5803164093877,2026-01-15 23:38:53.326911,2026-01-15 23:39:09.147671,0 days 00:00:15.820760,14,2.7,4.0,1.5,144,BOLLINGER,PARABOLIC_SAR,1.9,46,20,15,0.033,75,29,11,0.015,80,23,14,0.047,ATR,4.800000000000001,18,5m,SUPERTREND,True,True,False,False,False,0.47,BOLLINGER,1.9,-30.02789042243648,-72.03621179773292,-51.0320511100847,3136.94566088244,42.855845117794914,1589.9007530001174,5m,42,49,45.5,SUPERTREND,54.08163265306122,57.14285714285714,51.02040816326531,COMPLETE
296,1145.6032161711228,2026-01-15 23:38:54.507430,2026-01-15 23:39:09.114916,0 days 00:00:14.607486,14,2.7,4.0,1.5,142,BOLLINGER,PARABOLIC_SAR,1.8,53,19,15,0.033,75,29,18,0.015,80,12,14,0.049,ATR,4.800000000000001,17,5m,SUPERTREND,False,True,False,False,False,0.48,BOLLINGER,1.8,-28.46389002044056,-73.5354474240012,-50.99966872222088,3323.5665258486065,36.55577983797023,1680.0611528432883,5m,41,50,45.5,SUPERTREND,54.26829268292683,58.536585365853654,50.0,COMPLETE
297,680.2349176081934,2026-01-15 23:38:56.786701,2026-01-15 23:39:09.808743,0 days 00:00:13.022042,15,2.7,4.0,1.5,141,BOLLINGER,PARABOLIC_SAR,1.9,60,20,15,0.034,75,29,11,0.015,86,11,14,0.049,ATR,4.800000000000001,18,5m,SUPERTREND,True,True,False,False,False,0.49,BOLLINGER,1.9,-30.03887862581068,-68.76743443306673,-49.403156529438704,4057.439806672361,64.35772177879515,2060.898764225578,5m,41,48,44.5,SUPERTREND,56.52947154471545,60.97560975609756,52.083333333333336,COMPLETE
298,-2637.269166944227,2026-01-15 23:39:04.015336,2026-01-15 23:39:17.620699,0 days 00:00:13.605363,15,2.7,4.0,1.5,141,BOLLINGER,PARABOLIC_SAR,1.9,59,20,15,0.034,75,29,11,0.015,84,12,14,0.046000000000000006,ATR,4.800000000000001,17,5m,SUPERTREND,True,True,False,False,True,0.49,BOLLINGER,1.9,-50.26920903560027,-39.03860012803079,-44.653904581815524,508.5089487339462,23.59768774363112,266.0533182387887,5m,25,24,24.5,SUPERTREND,55.0,60.0,50.0,COMPLETE
299,-213.7559091758285,2026-01-15 23:39:05.722613,2026-01-15 23:39:18.174791,0 days 00:00:12.452178,15,2.7,4.0,1.5,141,BOLLINGER,PARABOLIC_SAR,1.85,100,29,15,0.032,75,29,11,0.015,80,10,14,0.032,FIXED,4.800000000000001,17,5m,SUPERTREND,True,True,False,False,False,0.47,BOLLINGER,1.85,-37.298537934508154,-72.51252770913086,-54.905532821819506,1328.204723118833,-0.5921762188088847,663.8062734500121,5m,77,118,97.5,SUPERTREND,27.701959057891262,35.064935064935064,20.33898305084746,COMPLETE
300,-1460.249645521225,2026-01-15 23:39:08.784918,2026-01-15 23:39:17.665699,0 days 00:00:08.880781,15,2.7,4.0,1.5,140,BOLLINGER,PARABOLIC_SAR,1.85,47,29,15,0.032,74,29,11,0.015,80,12,14,0.047,FIXED,5.0,16,5m,SUPERTREND,False,True,False,False,True,0.49,BOLLINGER,1.85,-53.234810296148936,-62.11164070320911,-57.67322549967902,369.2985671410929,-35.4226710796995,166.9379480306967,5m,36,43,39.5,SUPERTREND,36.17571059431525,44.44444444444444,27.906976744186046,COMPLETE
301,-2637.269166944227,2026-01-15 23:39:09.649864,2026-01-15 23:39:24.126653,0 days 00:00:14.476789,15,2.7,4.0,1.5,141,BOLLINGER,PARABOLIC_SAR,1.9,52,19,15,0.032,74,29,11,0.015,80,12,14,0.046000000000000006,ATR,4.800000000000001,16,5m,SUPERTREND,False,True,False,False,True,0.49,BOLLINGER,1.9,-50.26920903560027,-39.03860012803079,-44.653904581815524,508.5089487339462,23.59768774363112,266.0533182387887,5m,25,24,24.5,SUPERTREND,55.0,60.0,50.0,COMPLETE
302,-1439.713166039527,2026-01-15 23:39:09.648362,2026-01-15 23:39:23.418009,0 days 00:00:13.769647,15,2.7,4.0,1.5,141,BOLLINGER,PARABOLIC_SAR,1.9,59,20,15,0.032,74,29,17,0.015,80,12,14,0.046000000000000006,FIXED,5.0,17,5m,SUPERTREND,False,True,False,False,True,0.49,BOLLINGER,1.9,-53.45634125476418,-62.765902279998755,-58.11112176738147,406.7976614003341,-35.350604959262476,185.72352822053583,5m,36,43,39.5,SUPERTREND,36.17571059431525,44.44444444444444,27.906976744186046,COMPLETE
303,-1466.8727064817786,2026-01-15 23:39:09.900817,2026-01-15 23:39:24.420225,0 days 00:00:14.519408,15,2.7,4.0,1.5,150,BOLLINGER,PARABOLIC_SAR,1.9500000000000002,59,20,15,0.032,74,29,18,0.015,86,12,14,0.046000000000000006,FIXED,5.0,16,5m,SUPERTREND,False,True,False,False,True,0.49,BOLLINGER,1.9500000000000002,-58.072856547581075,-67.15938536628371,-62.61612095693239,383.3030885265611,-42.67734005629753,170.3128742351318,5m,36,44,40.0,SUPERTREND,35.858585858585855,44.44444444444444,27.27272727272727,COMPLETE
304,-307.7725983468117,2026-01-15 23:39:18.523333,2026-01-15 23:39:30.276941,0 days 00:00:11.753608,15,2.9000000000000004,4.0,1.5,146,BOLLINGER,PARABOLIC_SAR,2.0,63,19,15,0.032,74,29,11,0.015,80,10,14,0.05,FIXED,5.0,16,5m,SUPERTREND,False,True,False,False,False,0.49,BOLLINGER,2.0,-41.21398967963377,-70.96571085854812,-56.089850269090945,1202.6827307949957,16.158306085906293,609.420518440451,5m,58,82,70.0,SUPERTREND,35.82842724978974,44.827586206896555,26.82926829268293,COMPLETE
305,-368.77676105884984,2026-01-15 23:39:18.536032,2026-01-15 23:39:32.898357,0 days 00:00:14.362325,15,2.9000000000000004,4.0,1.5,145,BOLLINGER,PARABOLIC_SAR,1.9,59,19,15,0.032,74,29,18,0.015,86,10,14,0.05,FIXED,5.0,16,5m,SUPERTREND,False,True,False,False,False,0.49,BOLLINGER,1.9,-39.58222414917094,-74.59820675722379,-57.09021545319737,1112.6711848369284,-18.98588290186578,546.8426509675313,5m,58,86,72.0,SUPERTREND,35.20449077786688,44.827586206896555,25.581395348837212,COMPLETE
