number,value,datetime_start,datetime_complete,duration,params_ADX_THRESHOLD,params_ATR_MULTIPLIER,params_ATR_STOP_LOSS_MULT,params_BB_STD,params_ENTRY_PERIOD,params_ENTRY_TYPE,params_EXIT_TYPE,params_LEVERAGE,params_MA_PERIOD,params_MFI_THRESHOLD,params_MFI_WINDOW,params_RISK_PER_TRADE,params_RSI_OVERBOUGHT,params_RSI_OVERSOLD,params_RSI_WINDOW,params_SAR_STEP,params_STOCH_OVERBOUGHT,params_STOCH_OVERSOLD,params_STOCH_WINDOW,params_STOP_LOSS_PCT,params_STOP_LOSS_TYPE,params_SUPERTREND_MULT,params_SUPERTREND_PERIOD,params_TIMEFRAME,params_TREND_FILTER_TYPE,params_USE_ADX,params_USE_MFI,params_USE_RSI,params_USE_STOCHASTIC,params_USE_VHF,params_VHF_THRESHOLD,user_attrs_entry_type,user_attrs_leverage,user_attrs_mdd_BTC_USDT,user_attrs_mdd_ETH_USDT,user_attrs_mdd_avg,user_attrs_return_BTC_USDT,user_attrs_return_ETH_USDT,user_attrs_return_avg,user_attrs_timeframe,user_attrs_trades_BTC_USDT,user_attrs_trades_ETH_USDT,user_attrs_trades_avg,user_attrs_trend_filter,user_attrs_win_rate_avg,user_attrs_winrate_BTC_USDT,user_attrs_winrate_ETH_USDT,state
690,734.5673876899027,2026-01-15 23:53:05.478184,2026-01-15 23:53:24.472809,0 days 00:00:18.994625,27,2.2,3.4000000000000004,1.7,148,BOLLINGER,PARABOLIC_SAR,1.9500000000000002,33,19,13,0.036000000000000004,69,33,14,0.011,82,16,13,0.047,ATR,2.6,12,5m,SUPERTREND,False,False,False,False,False,0.44999999999999996,BOLLINGER,1.9500000000000002,-27.664919659391774,-79.21259940046735,-53.43875952992956,2066.953425049883,1.8757089173394021,1034.4145669836114,5m,53,60,56.5,SUPERTREND,55.18867924528302,60.37735849056604,50.0,COMPLETE
691,663.7347600579606,2026-01-15 23:53:08.145656,2026-01-15 23:53:24.097191,0 days 00:00:15.951535,27,2.2,3.4000000000000004,1.7,148,BOLLINGER,PARABOLIC_SAR,1.85,42,19,13,0.034,69,34,14,0.011,80,16,13,0.048,ATR,2.7,12,5m,SUPERTREND,False,False,False,False,False,0.44,BOLLINGER,1.85,-26.323971858569845,-77.2184453975214,-51.77120862804563,1837.2972878793512,10.087916045952214,923.6926019626517,5m,53,60,56.5,SUPERTREND,55.18867924528302,60.37735849056604,50.0,COMPLETE
692,-898.9744592442457,2026-01-15 23:53:08.192695,2026-01-15 23:53:25.902377,0 days 00:00:17.709682,26,2.2,3.4000000000000004,1.7,150,CCI,PARABOLIC_SAR,2.0,42,19,12,0.037,69,34,14,0.01,82,15,13,0.046000000000000006,ATR,2.7,12,3m,SUPERTREND,False,False,False,False,False,0.44999999999999996,CCI,2.0,-47.54458347244244,-84.64781463908785,-66.09619905576514,896.0298546015931,20.493088378128782,458.2614714898609,3m,37,45,41.0,SUPERTREND,56.63663663663664,62.16216216216216,51.11111111111111,COMPLETE
693,-964.5496078859333,2026-01-15 23:53:08.671678,2026-01-15 23:53:24.496145,0 days 00:00:15.824467,30,2.2,3.4000000000000004,1.7,148,CCI,PARABOLIC_SAR,2.0,42,19,12,0.037,69,33,14,0.01,82,15,13,0.046000000000000006,ATR,2.7,12,3m,SUPERTREND,False,False,False,False,False,0.44999999999999996,CCI,2.0,-47.54498629409311,-84.63562370661766,-66.09030500035539,778.9948749790691,20.60181914046628,399.7983470597677,3m,38,45,41.5,SUPERTREND,55.81871345029239,60.526315789473685,51.11111111111111,COMPLETE
694,-69.57938801589171,2026-01-15 23:53:12.468884,2026-01-15 23:53:26.140471,0 days 00:00:13.671587,29,2.1,3.4000000000000004,1.7,150,CCI,PARABOLIC_SAR,2.0,43,19,14,0.038,69,32,14,0.01,82,15,13,0.045000000000000005,ATR,2.6,12,1h,SUPERTREND,False,False,False,False,False,0.44999999999999996,CCI,2.0,-31.953591071220792,-82.55880329547948,-57.25619718335014,2297.1409900984318,-27.652294022962277,1134.7443480377347,1h,36,47,41.5,SUPERTREND,57.476359338061464,63.888888888888886,51.06382978723404,COMPLETE
695,-692.2241539023753,2026-01-15 23:53:19.948818,2026-01-15 23:53:36.961617,0 days 00:00:17.012799,29,2.1,3.5,1.7,150,BOLLINGER,PARABOLIC_SAR,1.9500000000000002,43,19,12,0.038,69,34,14,0.04,82,15,13,0.045000000000000005,ATR,2.7,14,3m,EMA,False,False,False,False,False,0.44,BOLLINGER,1.9500000000000002,-68.99540618500464,-91.9791619602857,-80.48728407264517,445.76557459545285,-73.70773950499768,186.02891754522759,3m,81,89,85.0,EMA,48.286863642668884,49.382716049382715,47.19101123595505,COMPLETE
696,-3117.7780636136276,2026-01-15 23:53:24.183381,2026-01-15 23:53:45.393928,0 days 00:00:21.210547,29,5.1,3.5,1.9,150,BOLLINGER,PARABOLIC_SAR,2.0,43,19,14,0.037,70,33,14,0.011,82,15,13,0.045000000000000005,ATR,2.6,12,3m,HMA,False,False,False,False,False,0.44999999999999996,BOLLINGER,2.0,-83.56449445382002,-87.93207222768447,-85.74828334075224,78.7701816319945,5.141648455460393,41.95591504372745,3m,22,26,24.0,HMA,42.30769230769231,50.0,34.61538461538461,COMPLETE
697,-760.9207582567342,2026-01-15 23:53:25.151977,2026-01-15 23:53:43.839859,0 days 00:00:18.687882,29,2.0,2.4000000000000004,1.7,150,BOLLINGER,PARABOLIC_SAR,2.0,34,19,14,0.037,70,34,14,0.01,82,15,12,0.047,ATR,2.6,14,3m,EMA,False,False,False,False,False,0.44999999999999996,BOLLINGER,2.0,-68.26991688841058,-88.6379119432767,-78.45391441584364,277.8910673399007,-36.401588885255904,120.7447392273224,3m,91,91,91.0,EMA,46.7032967032967,47.25274725274725,46.15384615384615,COMPLETE
698,-856.6006425594096,2026-01-15 23:53:25.320162,2026-01-15 23:53:43.060930,0 days 00:00:17.740768,29,1.7,3.5,1.7,147,BOLLINGER,PARABOLIC_SAR,2.0,85,19,14,0.038,70,34,14,0.01,82,15,12,0.045000000000000005,ATR,2.6,14,3m,SMA,False,False,False,False,False,0.44999999999999996,BOLLINGER,2.0,-72.83105863186307,-84.77284013023848,-78.80194938105078,55.92465091138584,-23.851381888186758,16.03663451159954,3m,127,113,120.0,SMA,42.79492718277472,44.881889763779526,40.707964601769916,COMPLETE
699,-685.1818188908182,2026-01-15 23:53:26.051359,2026-01-15 23:53:45.405034,0 days 00:00:19.353675,29,2.1,3.5,1.7,150,BOLLINGER,PARABOLIC_SAR,2.0,34,19,14,0.035,70,33,14,0.01,81,15,13,0.045000000000000005,ATR,2.6,14,3m,EMA,False,False,False,False,False,0.44999999999999996,BOLLINGER,2.0,-70.06763657637592,-89.34759141069748,-79.7076139935367,451.87953716904144,-62.606772652504276,194.63638225826858,3m,81,88,84.5,EMA,48.55499438832772,49.382716049382715,47.72727272727273,COMPLETE
700,-1188.5826022783986,2026-01-15 23:53:27.159542,2026-01-15 23:53:46.777133,0 days 00:00:19.617591,30,2.0,3.5,2.7,147,BOLLINGER,PARABOLIC_SAR,2.05,34,19,14,0.035,70,33,13,0.011,81,15,12,0.047,ATR,2.6,14,3m,HMA,False,False,False,False,False,0.44,BOLLINGER,2.05,-33.30354013393619,-66.97210481248804,-50.13782247321211,364.7551585433974,-24.625280633718184,170.0649389548396,3m,34,40,37.0,HMA,54.411764705882355,58.82352941176471,50.0,COMPLETE
701,-762.8640693223833,2026-01-15 23:53:42.433438,2026-01-15 23:54:08.039776,0 days 00:00:25.606338,30,2.3,3.5,1.6,146,BOLLINGER,PARABOLIC_SAR,2.05,34,18,11,0.035,70,33,13,0.012,81,15,13,0.047,ATR,2.5,9,3m,HMA,False,False,False,False,False,0.44,BOLLINGER,2.05,-70.76240927639056,-92.73703857887135,-81.74972392763095,360.11738779199544,-24.503965209785196,167.80671129110513,3m,62,76,69.0,HMA,46.26485568760611,45.16129032258064,47.368421052631575,COMPLETE
702,458.9403775136161,2026-01-15 23:53:43.246948,2026-01-15 23:53:59.225194,0 days 00:00:15.978246,30,2.0,3.5,1.6,146,BOLLINGER,PARABOLIC_SAR,2.05,126,18,11,0.035,70,34,13,0.012,81,15,12,0.047,ATR,2.5,14,3m,SUPERTREND,False,False,False,False,False,0.44,BOLLINGER,2.05,-34.61296612738731,-77.93475273534325,-56.27385943136528,2133.1946230028525,29.069693161283737,1081.1321580820681,3m,72,72,72.0,SUPERTREND,53.47222222222222,59.72222222222222,47.22222222222222,COMPLETE
703,-678.0060889629522,2026-01-15 23:53:45.333377,2026-01-15 23:54:08.134151,0 days 00:00:22.800774,30,2.3,3.5,1.6,147,BOLLINGER,PARABOLIC_SAR,1.9,32,17,13,0.035,70,33,13,0.011,81,14,13,0.047,ATR,2.5,9,3m,HMA,False,False,False,False,False,0.43,BOLLINGER,1.9,-67.23496727638802,-89.36594249085465,-78.30045488362134,435.83116220093353,44.15514334149952,239.99315277121653,3m,61,74,67.5,HMA,47.27514399645547,45.90163934426229,48.64864864864865,COMPLETE
704,347.7844204904568,2026-01-15 23:53:46.182232,2026-01-15 23:54:09.117993,0 days 00:00:22.935761,30,2.0,3.5,1.6,146,BOLLINGER,PARABOLIC_SAR,1.9,33,17,13,0.035,68,31,13,0.012,81,14,13,0.047,ATR,2.5,15,3m,SUPERTREND,False,False,False,False,False,0.43,BOLLINGER,1.9,-32.3096004757229,-74.1821605175887,-53.2458804966558,1797.7496227488245,42.82828288122809,920.2889528150263,3m,72,72,72.0,SUPERTREND,53.47222222222222,59.72222222222222,47.22222222222222,COMPLETE
705,1140.427151604913,2026-01-15 23:53:46.609912,2026-01-15 23:54:08.599441,0 days 00:00:21.989529,30,2.3,3.5,1.6,146,BOLLINGER,PARABOLIC_SAR,1.9,32,17,13,0.035,68,33,13,0.012,81,14,13,0.047,ATR,2.5,9,3m,SUPERTREND,False,False,False,False,False,0.43,BOLLINGER,1.9,-26.667507260564545,-76.71723220180235,-51.69236973118345,2830.1329097781013,64.86949153042613,1447.5012006542638,3m,52,61,56.5,SUPERTREND,56.998738965952086,61.53846153846154,52.459016393442624,COMPLETE
706,1137.8518618514636,2026-01-15 23:53:46.868941,2026-01-15 23:54:10.325931,0 days 00:00:23.456990,30,2.3,3.6,1.6,146,BOLLINGER,PARABOLIC_SAR,1.9,38,18,13,0.034,68,31,14,0.012,81,14,13,0.048,ATR,2.5,9,3m,SUPERTREND,False,False,False,False,False,0.43,BOLLINGER,1.9,-26.667507260564545,-76.71603941139034,-51.691773335977445,2830.1329097781013,62.485640248264254,1446.3092750131827,3m,52,61,56.5,SUPERTREND,56.998738965952086,61.53846153846154,52.459016393442624,COMPLETE
707,1137.8518618514636,2026-01-15 23:54:01.660458,2026-01-15 23:54:15.765845,0 days 00:00:14.105387,30,2.3,3.6,1.6,146,BOLLINGER,PARABOLIC_SAR,1.9,32,17,13,0.034,68,33,14,0.012,81,14,13,0.048,ATR,2.5,9,3m,SUPERTREND,False,False,False,False,False,0.43,BOLLINGER,1.9,-26.667507260564545,-76.71603941139034,-51.691773335977445,2830.1329097781013,62.485640248264254,1446.3092750131827,3m,52,61,56.5,SUPERTREND,56.998738965952086,61.53846153846154,52.459016393442624,COMPLETE
708,-309.02679608948347,2026-01-15 23:54:08.154056,2026-01-15 23:54:15.641048,0 days 00:00:07.486992,30,2.4,3.6,1.7,145,BOLLINGER,PARABOLIC_SAR,1.9,38,18,13,0.033,68,23,14,0.012,81,14,13,0.048,ATR,3.0,11,2h,SUPERTREND,False,False,False,False,False,0.43,BOLLINGER,1.9,-33.655508084270494,-83.56809636739126,-58.61180222583088,1633.2661401696416,87.21479672378501,860.2404684467133,2h,44,46,45.0,SUPERTREND,55.73122529644269,63.63636363636363,47.82608695652174,COMPLETE
709,878.7429984507826,2026-01-15 23:54:08.839575,2026-01-15 23:54:25.210076,0 days 00:00:16.370501,30,2.2,3.6,1.6,146,BOLLINGER,PARABOLIC_SAR,1.9500000000000002,114,17,13,0.034,68,33,14,0.012,81,14,13,0.048,ATR,2.5,9,5m,SUPERTREND,False,False,False,False,False,0.43,BOLLINGER,1.9500000000000002,-25.738927004975622,-83.6653538960856,-54.702140450530614,2294.8529293337742,0.7511041590823793,1147.8020167464283,5m,56,63,59.5,SUPERTREND,54.960317460317455,60.71428571428571,49.2063492063492,COMPLETE
710,1058.0820371289392,2026-01-15 23:54:09.166049,2026-01-15 23:54:28.027052,0 days 00:00:18.861003,30,2.2,3.6,1.6,146,BOLLINGER,PARABOLIC_SAR,1.9500000000000002,38,17,13,0.034,68,33,14,0.012,81,14,13,0.048,ATR,2.8,9,3m,SUPERTREND,False,False,False,False,False,0.39,BOLLINGER,1.9500000000000002,-26.356238760131177,-79.6726260360235,-53.01443239807734,2607.1761686924474,63.47666491999318,1335.3264168062203,3m,56,64,60.0,SUPERTREND,56.138392857142854,60.71428571428571,51.5625,COMPLETE
711,-1217.6538850310271,2026-01-15 23:54:09.230821,2026-01-15 23:54:23.806388,0 days 00:00:14.575567,30,2.2,3.6,2.2,146,BOLLINGER,PARABOLIC_SAR,1.9500000000000002,38,17,13,0.034,68,32,14,0.012,81,14,13,0.048,ATR,2.8,9,3m,SUPERTREND,False,False,False,False,False,0.43,BOLLINGER,1.9500000000000002,-35.64548216921587,-80.52110047339536,-58.083291321305616,381.3199065467096,-40.200920777596885,170.55949288455636,3m,42,45,43.5,SUPERTREND,49.60317460317461,54.761904761904766,44.44444444444444,COMPLETE
712,1058.0820371289392,2026-01-15 23:54:10.431582,2026-01-15 23:54:28.075054,0 days 00:00:17.643472,30,2.2,3.6,1.6,146,BOLLINGER,PARABOLIC_SAR,1.9500000000000002,37,17,13,0.033,68,31,14,0.011,81,14,13,0.048,ATR,2.5,9,3m,SUPERTREND,False,False,False,False,False,0.43,BOLLINGER,1.9500000000000002,-26.356238760131177,-79.6726260360235,-53.01443239807734,2607.1761686924474,63.47666491999318,1335.3264168062203,3m,56,64,60.0,SUPERTREND,56.138392857142854,60.71428571428571,51.5625,COMPLETE
713,1075.8209949137026,2026-01-15 23:54:15.750345,2026-01-15 23:54:40.940536,0 days 00:00:25.190191,30,2.2,3.6,1.6,147,BOLLINGER,PARABOLIC_SAR,1.9500000000000002,38,17,13,0.033,68,33,14,0.011,81,14,13,0.047,ATR,2.5,9,3m,SUPERTREND,False,False,False,False,False,0.42,BOLLINGER,1.9500000000000002,-26.356238760131177,-79.57709109243194,-52.96666492628156,2613.2944255387224,78.1631746037194,1345.7288000712208,3m,56,64,60.0,SUPERTREND,56.138392857142854,60.71428571428571,51.5625,COMPLETE
714,1075.8209949137026,2026-01-15 23:54:18.260476,2026-01-15 23:54:35.179441,0 days 00:00:16.918965,30,2.2,3.6,1.6,147,BOLLINGER,PARABOLIC_SAR,1.9500000000000002,93,17,13,0.033,68,33,14,0.011,81,13,13,0.046000000000000006,ATR,2.5,9,3m,SUPERTREND,False,False,False,False,False,0.42,BOLLINGER,1.9500000000000002,-26.356238760131177,-79.57709109243194,-52.96666492628156,2613.2944255387224,78.1631746037194,1345.7288000712208,3m,56,64,60.0,SUPERTREND,56.138392857142854,60.71428571428571,51.5625,COMPLETE
715,1073.1421564219645,2026-01-15 23:54:24.791941,2026-01-15 23:54:48.345808,0 days 00:00:23.553867,30,2.2,3.6,1.6,148,BOLLINGER,PARABOLIC_SAR,1.9500000000000002,37,17,13,0.033,68,33,14,0.028999999999999998,81,14,13,0.046000000000000006,ATR,2.5,8,3m,SUPERTREND,False,False,False,False,False,0.42,BOLLINGER,1.9500000000000002,-26.356238760131177,-79.71120224207982,-53.0337205011055,2604.277584919749,79.1783994719995,1341.7279921958743,3m,56,64,60.0,SUPERTREND,56.138392857142854,60.71428571428571,51.5625,COMPLETE
716,1073.1421564219645,2026-01-15 23:54:25.551422,2026-01-15 23:54:47.582940,0 days 00:00:22.031518,30,2.2,3.6,1.6,148,BOLLINGER,PARABOLIC_SAR,1.9500000000000002,37,17,13,0.033,68,33,14,0.011,81,13,13,0.046000000000000006,ATR,2.5,8,3m,SUPERTREND,False,False,False,False,False,0.42,BOLLINGER,1.9500000000000002,-26.356238760131177,-79.71120224207982,-53.0337205011055,2604.277584919749,79.1783994719995,1341.7279921958743,3m,56,64,60.0,SUPERTREND,56.138392857142854,60.71428571428571,51.5625,COMPLETE
717,1185.955145419206,2026-01-15 23:54:28.202978,2026-01-15 23:54:48.819945,0 days 00:00:20.616967,29,2.3,3.6,1.6,150,BOLLINGER,PARABOLIC_SAR,1.9,31,17,13,0.033,67,33,13,0.01,81,13,12,0.046000000000000006,ATR,2.4000000000000004,7,3m,SUPERTREND,False,False,False,False,False,0.42,BOLLINGER,1.9,-26.228850815728716,-72.64621671691587,-49.4375337663223,2621.0773538127773,126.79649071185854,1373.936922262318,3m,53,60,56.5,SUPERTREND,57.688679245283026,60.37735849056604,55.00000000000001,COMPLETE
718,1185.955145419206,2026-01-15 23:54:28.193897,2026-01-15 23:54:50.780796,0 days 00:00:22.586899,29,2.3,3.6,1.6,150,BOLLINGER,PARABOLIC_SAR,1.9,31,17,13,0.033,67,32,13,0.01,81,13,13,0.046000000000000006,ATR,2.4000000000000004,8,3m,SUPERTREND,False,False,False,False,False,0.42,BOLLINGER,1.9,-26.228850815728716,-72.64621671691587,-49.4375337663223,2621.0773538127773,126.79649071185854,1373.936922262318,3m,53,60,56.5,SUPERTREND,57.688679245283026,60.37735849056604,55.00000000000001,COMPLETE
719,-2897.502237125564,2026-01-15 23:54:35.818473,2026-01-15 23:54:56.291917,0 days 00:00:20.473444,29,2.1,3.6,2.8,150,BOLLINGER,PARABOLIC_SAR,1.9,166,17,13,0.033,67,33,13,0.01,81,13,12,0.047,ATR,2.7,7,3m,SUPERTREND,False,False,False,False,False,0.41,BOLLINGER,1.9,-57.482538831778875,-63.75114689029672,-60.616842861037796,162.67952851258045,0.5171831678747316,81.59835584022758,3m,26,28,27.0,SUPERTREND,51.92307692307692,53.84615384615385,50.0,COMPLETE
720,1185.955145419206,2026-01-15 23:54:42.527384,2026-01-15 23:55:01.940182,0 days 00:00:19.412798,29,2.3,3.6,1.6,150,BOLLINGER,PARABOLIC_SAR,1.9,32,17,13,0.033,67,33,13,0.01,81,13,13,0.046000000000000006,ATR,2.4000000000000004,7,3m,SUPERTREND,False,False,False,False,False,0.41,BOLLINGER,1.9,-26.228850815728716,-72.64621671691587,-49.4375337663223,2621.0773538127773,126.79649071185854,1373.936922262318,3m,53,60,56.5,SUPERTREND,57.688679245283026,60.37735849056604,55.00000000000001,COMPLETE
721,1189.5255968480706,2026-01-15 23:54:48.732827,2026-01-15 23:55:12.085550,0 days 00:00:23.352723,29,2.3,3.5,1.6,150,BOLLINGER,PARABOLIC_SAR,1.9,31,16,12,0.034,67,34,13,0.01,82,13,13,0.047,ATR,2.7,7,3m,SUPERTREND,False,False,False,False,False,0.43,BOLLINGER,1.9,-26.228850815728716,-72.64722218986425,-49.438036502796486,2621.0773538127773,130.12385615995126,1375.6006049863643,3m,53,60,56.5,SUPERTREND,57.688679245283026,60.37735849056604,55.00000000000001,COMPLETE
722,721.830321927896,2026-01-15 23:54:48.751232,2026-01-15 23:55:09.931062,0 days 00:00:21.179830,29,2.1,3.6,1.6,150,BOLLINGER,PARABOLIC_SAR,1.9,31,16,12,0.033,67,32,13,0.01,82,13,12,0.044000000000000004,ATR,2.7,7,3m,SUPERTREND,False,False,False,False,False,0.42,BOLLINGER,1.9,-29.264169008364306,-74.77004646852049,-52.0171077384424,2051.449443903033,29.50976603036085,1040.479604966697,3m,64,69,66.5,SUPERTREND,52.038043478260875,56.25,47.82608695652174,COMPLETE
723,1185.955145419206,2026-01-15 23:54:50.388725,2026-01-15 23:55:12.806788,0 days 00:00:22.418063,29,2.3,3.6,1.6,150,BOLLINGER,PARABOLIC_SAR,1.9,30,17,12,0.033,68,32,13,0.01,82,13,12,0.044000000000000004,ATR,2.7,7,3m,SUPERTREND,False,False,False,False,False,0.42,BOLLINGER,1.9,-26.228850815728716,-72.64621671691587,-49.4375337663223,2621.0773538127773,126.79649071185854,1373.936922262318,3m,53,60,56.5,SUPERTREND,57.688679245283026,60.37735849056604,55.00000000000001,COMPLETE
724,838.9606782746796,2026-01-15 23:54:53.104701,2026-01-15 23:55:16.166314,0 days 00:00:23.061613,29,2.3,3.6,1.6,144,BOLLINGER,PARABOLIC_SAR,1.9,28,16,12,0.033,67,32,13,0.01,82,13,12,0.044000000000000004,ATR,2.4000000000000004,7,3m,SUPERTREND,False,False,False,False,False,0.41,BOLLINGER,1.9,-30.084765815529597,-76.25078602492663,-53.16777592022811,2516.7699236977483,144.63391393163408,1330.7019188146912,3m,53,59,56.0,SUPERTREND,56.45986568596099,60.37735849056604,52.54237288135594,COMPLETE
725,358.99647558868855,2026-01-15 23:54:58.320025,2026-01-15 23:55:17.306603,0 days 00:00:18.986578,29,2.1,3.7,1.6,145,BOLLINGER,PARABOLIC_SAR,1.9,29,16,13,0.033,67,32,13,0.01,82,13,12,0.045000000000000005,ATR,2.4000000000000004,7,3m,SUPERTREND,False,False,False,False,False,0.41,BOLLINGER,1.9,-31.07389663839197,-80.73149113918092,-55.902693888786445,1862.347413769041,-9.035027620652505,926.6561930741942,3m,65,69,67.0,SUPERTREND,52.41917502787068,58.46153846153847,46.3768115942029,COMPLETE
726,719.9584899085767,2026-01-15 23:55:03.943534,2026-01-15 23:55:22.551952,0 days 00:00:18.608418,29,2.1,3.7,1.6,150,BOLLINGER,PARABOLIC_SAR,1.9,30,16,12,0.032,67,32,13,0.01,82,13,12,0.044000000000000004,ATR,2.4000000000000004,7,3m,SUPERTREND,False,False,False,False,False,0.41,BOLLINGER,1.9,-29.264169008364306,-74.76842974384361,-52.01629937610396,2051.449443903033,27.609708761716938,1039.529576332375,3m,64,69,66.5,SUPERTREND,52.038043478260875,56.25,47.82608695652174,COMPLETE
727,-629.6274207166625,2026-01-15 23:55:12.101395,2026-01-15 23:55:28.904362,0 days 00:00:16.802967,29,1.9,3.7,1.6,150,BOLLINGER,PARABOLIC_SAR,1.9500000000000002,27,16,12,0.032,67,32,13,0.01,82,13,12,0.044000000000000004,ATR,2.4000000000000004,5,3m,SMA,False,False,False,False,False,0.4,BOLLINGER,1.9500000000000002,-57.64618154618943,-87.78460388481253,-72.71539271550098,410.816207515929,29.742693065178607,220.27945029055383,3m,101,102,101.5,SMA,46.311395845466905,47.524752475247524,45.09803921568628,COMPLETE
728,757.9312652848566,2026-01-15 23:55:12.742124,2026-01-15 23:55:36.835070,0 days 00:00:24.092946,28,2.1,3.7,1.6,150,BOLLINGER,PARABOLIC_SAR,1.9500000000000002,29,16,12,0.032,67,32,13,0.01,82,13,12,0.044000000000000004,ATR,2.4000000000000004,5,3m,SUPERTREND,False,False,False,False,False,0.41,BOLLINGER,1.9500000000000002,-29.92131869669951,-76.08253073938181,-53.00192471804066,2178.2343943686806,23.042910056003603,1100.638652212342,3m,64,69,66.5,SUPERTREND,52.038043478260875,56.25,47.82608695652174,COMPLETE
729,-666.7099146199726,2026-01-15 23:55:15.057517,2026-01-15 23:55:38.602686,0 days 00:00:23.545169,28,1.8,3.7,1.6,150,BOLLINGER,PARABOLIC_SAR,1.9500000000000002,27,16,12,0.032,67,32,13,0.01,82,13,12,0.045000000000000005,ATR,2.4000000000000004,5,3m,SMA,False,False,False,False,False,0.41,BOLLINGER,1.9500000000000002,-46.82237945579054,-86.82638399153953,-66.82438172366503,339.71995362569623,-6.905004155456449,166.4074747351199,3m,113,110,111.5,SMA,45.69991954947707,48.67256637168141,42.72727272727273,COMPLETE
730,515.8332074440732,2026-01-15 23:55:17.162859,2026-01-15 23:55:42.400009,0 days 00:00:25.237150,28,2.0,3.7,1.6,150,BOLLINGER,PARABOLIC_SAR,1.9500000000000002,30,16,11,0.032,67,32,13,0.01,82,13,12,0.044000000000000004,ATR,2.4000000000000004,6,3m,SUPERTREND,False,False,False,False,False,0.41,BOLLINGER,1.9500000000000002,-32.26456181169257,-78.50424736981819,-55.38440459075538,2153.310107121621,32.22931175902309,1092.769709440322,3m,71,72,71.5,SUPERTREND,52.48435054773083,57.74647887323944,47.22222222222222,COMPLETE
731,757.9312652848566,2026-01-15 23:55:18.870980,2026-01-15 23:55:39.375995,0 days 00:00:20.505015,28,2.1,3.7,1.6,150,BOLLINGER,PARABOLIC_SAR,1.9500000000000002,30,16,11,0.032,67,32,13,0.01,82,13,12,0.046000000000000006,ATR,2.6,5,3m,SUPERTREND,False,False,False,False,False,0.39,BOLLINGER,1.9500000000000002,-29.92131869669951,-76.08253073938181,-53.00192471804066,2178.2343943686806,23.042910056003603,1100.638652212342,3m,64,69,66.5,SUPERTREND,52.038043478260875,56.25,47.82608695652174,COMPLETE
