number,value,datetime_start,datetime_complete,duration,params_ADX_THRESHOLD,params_ATR_MULTIPLIER,params_ATR_STOP_LOSS_MULT,params_BB_STD,params_ENTRY_PERIOD,params_ENTRY_TYPE,params_EXIT_TYPE,params_LEVERAGE,params_MA_PERIOD,params_MFI_THRESHOLD,params_MFI_WINDOW,params_RISK_PER_TRADE,params_RSI_OVERBOUGHT,params_RSI_OVERSOLD,params_RSI_WINDOW,params_SAR_STEP,params_STOCH_OVERBOUGHT,params_STOCH_OVERSOLD,params_STOCH_WINDOW,params_STOP_LOSS_PCT,params_STOP_LOSS_TYPE,params_SUPERTREND_MULT,params_SUPERTREND_PERIOD,params_TIMEFRAME,params_TREND_FILTER_TYPE,params_USE_ADX,params_USE_MFI,params_USE_RSI,params_USE_STOCHASTIC,params_USE_VHF,params_VHF_THRESHOLD,user_attrs_entry_type,user_attrs_leverage,user_attrs_mdd_BTC_USDT,user_attrs_mdd_ETH_USDT,user_attrs_mdd_avg,user_attrs_return_BTC_USDT,user_attrs_return_ETH_USDT,user_attrs_return_avg,user_attrs_timeframe,user_attrs_trades_BTC_USDT,user_attrs_trades_ETH_USDT,user_attrs_trades_avg,user_attrs_trend_filter,user_attrs_win_rate_avg,user_attrs_winrate_BTC_USDT,user_attrs_winrate_ETH_USDT,state
560,898.0398684872889,2026-01-15 23:48:01.914441,2026-01-15 23:48:13.788872,0 days 00:00:11.874431,16,2.4,1.4,1.7,147,BOLLINGER,PARABOLIC_SAR,1.8,118,17,12,0.034,72,24,14,0.013000000000000001,80,14,13,0.048,ATR,1.9,15,5m,SUPERTREND,False,False,False,False,False,0.54,BOLLINGER,1.8,-22.174922709237315,-64.87099574106516,-43.52295922515124,1961.6600071224814,82.73016462155134,1022.1950858720163,5m,52,59,55.5,SUPERTREND,49.80443285528031,53.84615384615385,45.76271186440678,COMPLETE
561,71.75992870247865,2026-01-15 23:48:04.165035,2026-01-15 23:48:19.237954,0 days 00:00:15.072919,26,2.4,3.4000000000000004,1.9,147,BOLLINGER,PARABOLIC_SAR,1.8,123,17,12,0.034,72,24,14,0.013000000000000001,80,14,14,0.048,ATR,1.9,15,5m,SUPERTREND,False,False,False,False,False,0.54,BOLLINGER,1.8,-25.448902167836124,-63.76847957693099,-44.60869087238356,1683.445421603652,75.52459116831858,879.4850063859853,5m,41,42,41.5,SUPERTREND,55.545876887340306,65.85365853658537,45.23809523809524,COMPLETE
562,186.633456573898,2026-01-15 23:48:07.613999,2026-01-15 23:48:25.211212,0 days 00:00:17.597213,16,2.4,3.4000000000000004,1.9,56,BOLLINGER,PARABOLIC_SAR,1.8,37,17,12,0.034,72,26,14,0.013000000000000001,80,14,13,0.049,ATR,1.9,15,5m,SUPERTREND,False,False,False,False,False,0.41,BOLLINGER,1.8,-65.24355420893116,-39.34420757347484,-52.293880891203,735.3335345958277,826.6321177816391,780.9828261887334,5m,50,50,50.0,SUPERTREND,53.0,56.00000000000001,50.0,COMPLETE
563,569.7877694378521,2026-01-15 23:48:10.243806,2026-01-15 23:48:20.346395,0 days 00:00:10.102589,16,2.4,1.4,1.7,19,BOLLINGER,PARABOLIC_SAR,1.8,35,33,12,0.034,71,26,14,0.013000000000000001,80,14,14,0.049,ATR,1.7000000000000002,15,5m,SUPERTREND,False,False,False,False,False,0.52,BOLLINGER,1.8,-60.47949099582873,-46.23584262908143,-53.35766681245508,657.6978722109213,1566.9858613258612,1112.3418667683914,5m,82,76,79.0,SUPERTREND,43.6617458279846,43.90243902439025,43.42105263157895,COMPLETE
564,71.79333018179568,2026-01-15 23:48:13.029280,2026-01-15 23:48:26.852874,0 days 00:00:13.823594,16,2.4,3.5,2.3,18,BOLLINGER,PARABOLIC_SAR,1.9,30,18,13,0.034,80,26,14,0.013000000000000001,80,16,14,0.049,ATR,1.7000000000000002,13,5m,SUPERTREND,False,False,False,False,False,0.52,BOLLINGER,1.9,-70.6522055115189,-48.92752617079567,-59.78986584115729,106.85933888374794,1609.100647302407,857.9799930930775,5m,64,55,59.5,SUPERTREND,50.710227272727266,46.875,54.54545454545454,COMPLETE
565,-244.4798694897072,2026-01-15 23:48:13.027778,2026-01-15 23:48:24.788852,0 days 00:00:11.761074,30,2.4,3.5,1.7,18,BOLLINGER,PARABOLIC_SAR,1.9,30,18,13,0.034,72,26,14,0.013000000000000001,80,17,14,0.049,ATR,1.7000000000000002,13,5m,SUPERTREND,False,False,False,False,False,0.52,BOLLINGER,1.9,-67.35631897292082,-74.21882857496,-70.78757377394041,988.646827211212,265.2494756994609,626.9481514553364,5m,72,74,73.0,SUPERTREND,47.2972972972973,50.0,44.5945945945946,COMPLETE
566,447.62944337729914,2026-01-15 23:48:14.066034,2026-01-15 23:48:27.806082,0 days 00:00:13.740048,29,2.5,3.5,1.7,60,BOLLINGER,PARABOLIC_SAR,1.9,41,18,13,0.034,72,26,14,0.013000000000000001,80,16,14,0.049,ATR,1.7000000000000002,13,5m,SUPERTREND,False,False,False,False,False,0.52,BOLLINGER,1.9,-52.965695043732985,-46.97623287088526,-49.970963957309124,1225.154017289874,1164.2966082637217,1194.7253127767979,5m,48,52,50.0,SUPERTREND,51.04166666666667,52.083333333333336,50.0,COMPLETE
567,-2300.0,2026-01-15 23:48:21.823342,2026-01-15 23:48:39.274481,0 days 00:00:17.451139,16,2.5,3.5,1.7,144,KELTNER,PARABOLIC_SAR,1.9,110,18,14,0.037,65,25,15,0.012,80,17,14,0.049,ATR,2.1,13,5m,SUPERTREND,False,False,False,True,False,0.53,KELTNER,1.9,0.0,0.0,0.0,0.0,0.0,0.0,5m,0,0,0.0,SUPERTREND,0.0,0.0,0.0,COMPLETE
568,-2300.0,2026-01-15 23:48:21.991749,2026-01-15 23:48:39.141561,0 days 00:00:17.149812,29,2.5,3.5,1.7,145,KELTNER,PARABOLIC_SAR,1.9,109,18,14,0.037,72,25,15,0.012,80,15,14,0.049,ATR,2.1,13,5m,SUPERTREND,False,False,False,True,False,0.53,KELTNER,1.9,0.0,0.0,0.0,0.0,0.0,0.0,5m,0,0,0.0,SUPERTREND,0.0,0.0,0.0,COMPLETE
569,-1989.4123926547918,2026-01-15 23:48:25.034899,2026-01-15 23:48:40.485085,0 days 00:00:15.450186,16,2.5,3.6,1.8,145,BOLLINGER,PARABOLIC_SAR,1.9,41,18,13,0.035,72,25,15,0.012,80,15,14,0.049,ATR,2.1,16,5m,SUPERTREND,False,False,False,True,False,0.53,BOLLINGER,1.9,-22.785827794110382,-71.56534076309428,-47.17558427860233,878.7909434909366,39.532898265781654,459.1619208783591,5m,26,27,26.5,SUPERTREND,54.77207977207976,57.692307692307686,51.85185185185185,COMPLETE
570,-2300.0,2026-01-15 23:48:26.095212,2026-01-15 23:48:40.490971,0 days 00:00:14.395759,16,2.5,3.6,1.8,144,KELTNER,PARABOLIC_SAR,1.85,41,18,14,0.037,73,25,15,0.012,81,16,14,0.049,ATR,2.1,12,5m,SUPERTREND,False,False,False,True,False,0.53,KELTNER,1.85,0.0,0.0,0.0,0.0,0.0,0.0,5m,0,0,0.0,SUPERTREND,0.0,0.0,0.0,COMPLETE
571,-2300.0,2026-01-15 23:48:27.136804,2026-01-15 23:48:41.928704,0 days 00:00:14.791900,29,5.8,3.6,1.8,144,KELTNER,PARABOLIC_SAR,1.85,41,18,14,0.037,73,25,15,0.012,80,15,14,0.049,ATR,2.0,16,5m,SUPERTREND,False,False,False,True,False,0.53,KELTNER,1.85,0.0,0.0,0.0,0.0,0.0,0.0,5m,0,0,0.0,SUPERTREND,0.0,0.0,0.0,COMPLETE
572,-2300.0,2026-01-15 23:48:27.930306,2026-01-15 23:48:41.873428,0 days 00:00:13.943122,16,2.1,3.6,1.8,144,KELTNER,PARABOLIC_SAR,1.85,98,18,14,0.035,73,25,15,0.012,81,15,14,0.05,ATR,2.1,16,5m,SUPERTREND,False,False,False,True,False,0.53,KELTNER,1.85,0.0,0.0,0.0,0.0,0.0,0.0,5m,0,0,0.0,SUPERTREND,0.0,0.0,0.0,COMPLETE
573,424.5371794975954,2026-01-15 23:48:40.474564,2026-01-15 23:48:53.110876,0 days 00:00:12.636312,17,2.1,3.7,1.7,139,BOLLINGER,PARABOLIC_SAR,1.85,28,19,13,0.035,73,25,15,0.01,81,14,14,0.05,ATR,1.8,14,5m,SUPERTREND,False,False,False,False,False,0.44999999999999996,BOLLINGER,1.85,-27.868831741037308,-76.45300629115664,-52.160919016096976,1379.7797803647356,41.68177457649321,710.7307774706144,5m,61,62,61.5,SUPERTREND,52.868852459016395,55.73770491803278,50.0,COMPLETE
574,496.6968674227319,2026-01-15 23:48:40.504191,2026-01-15 23:48:53.067593,0 days 00:00:12.563402,17,2.0,3.7,1.7,139,BOLLINGER,PARABOLIC_SAR,1.85,29,19,13,0.035,73,25,13,0.01,81,14,14,0.05,ATR,3.4000000000000004,9,5m,SUPERTREND,False,False,False,False,False,0.44999999999999996,BOLLINGER,1.85,-24.242287456645602,-76.87412642886034,-50.55820694275297,1396.762834026338,48.02955799719109,722.3961960117645,5m,67,65,66.0,SUPERTREND,51.481056257175666,53.73134328358209,49.23076923076923,COMPLETE
575,424.5371794975954,2026-01-15 23:48:40.759958,2026-01-15 23:48:53.449472,0 days 00:00:12.689514,17,2.1,3.7,1.7,139,BOLLINGER,PARABOLIC_SAR,1.85,29,19,13,0.035,73,25,13,0.01,81,14,14,0.05,ATR,1.8,9,5m,SUPERTREND,False,False,False,False,False,0.44999999999999996,BOLLINGER,1.85,-27.868831741037308,-76.45300629115664,-52.160919016096976,1379.7797803647356,41.68177457649321,710.7307774706144,5m,61,62,61.5,SUPERTREND,52.868852459016395,55.73770491803278,50.0,COMPLETE
576,1118.8398041980035,2026-01-15 23:48:40.808799,2026-01-15 23:48:56.365384,0 days 00:00:15.556585,17,2.4,3.7,1.7,150,BOLLINGER,PARABOLIC_SAR,1.85,29,19,13,0.035,73,25,13,0.01,81,14,14,0.05,ATR,1.8,14,5m,SUPERTREND,False,False,False,False,False,0.44999999999999996,BOLLINGER,1.85,-26.147642853266934,-77.58938052227415,-51.86851168777054,3059.638333530749,43.86483065703141,1551.7515820938902,5m,44,54,49.0,SUPERTREND,59.090909090909086,68.18181818181817,50.0,COMPLETE
577,-944.2391216131809,2026-01-15 23:48:42.016979,2026-01-15 23:48:54.905943,0 days 00:00:12.888964,17,2.1,3.7,1.7,139,BOLLINGER,PARABOLIC_SAR,1.85,28,19,13,0.023,73,26,13,0.01,81,19,15,0.05,ATR,1.8,9,5m,ICHIMOKU,False,False,True,False,False,0.44999999999999996,BOLLINGER,1.85,-59.046031333248116,-82.04447957199721,-70.54525545262267,31.189384811456755,-26.029008568350225,2.580188121553265,5m,57,57,57.0,ICHIMOKU,43.859649122807014,43.859649122807014,43.859649122807014,COMPLETE
578,-671.6703863909024,2026-01-15 23:48:42.038806,2026-01-15 23:48:56.894435,0 days 00:00:14.855629,21,2.5,3.7,1.7,139,BOLLINGER,PARABOLIC_SAR,1.85,30,19,13,0.035,73,26,15,0.01,81,13,15,0.05,ATR,1.8,14,5m,SUPERTREND,False,False,True,False,False,0.44999999999999996,BOLLINGER,1.85,-22.201664323881815,-80.52791740872821,-51.364790866305015,1107.5017249948721,40.76634370516767,574.1340343500199,5m,29,34,31.5,SUPERTREND,54.310344827586206,58.620689655172406,50.0,COMPLETE
579,-599.7694979477756,2026-01-15 23:48:53.895767,2026-01-15 23:49:05.021845,0 days 00:00:11.126078,16,2.5,1.2,1.6,150,BOLLINGER,PARABOLIC_SAR,1.9500000000000002,34,18,13,0.036000000000000004,73,26,15,0.014,81,13,15,0.048,ATR,2.0,14,5m,ICHIMOKU,False,False,True,False,False,0.42,BOLLINGER,1.9500000000000002,-47.24715827865331,-70.86338014059638,-59.05526920962484,390.76627202342695,127.31194537935305,259.03910870139,5m,51,59,55.0,ICHIMOKU,42.04054503157195,45.09803921568628,38.983050847457626,COMPLETE
580,-318.9463113171696,2026-01-15 23:48:53.934389,2026-01-15 23:49:06.925507,0 days 00:00:12.991118,16,2.5,1.6,1.6,148,BOLLINGER,PARABOLIC_SAR,1.9500000000000002,35,18,13,0.036000000000000004,73,26,15,0.014,81,13,15,0.048,ATR,2.0,14,5m,SUPERTREND,False,False,True,False,False,0.54,BOLLINGER,1.9500000000000002,-23.40106135076003,-82.53357072157839,-52.96731603616921,977.9803382628858,63.67067613903274,520.8255072009592,5m,35,40,37.5,SUPERTREND,50.89285714285714,54.285714285714285,47.5,COMPLETE
581,-623.7879838141607,2026-01-15 23:48:53.929327,2026-01-15 23:49:04.517776,0 days 00:00:10.588449,16,2.5,3.3000000000000003,1.6,148,BOLLINGER,PARABOLIC_SAR,1.9500000000000002,33,18,13,0.036000000000000004,73,26,15,0.014,81,13,15,0.048,ATR,2.0,14,5m,SUPERTREND,False,False,True,False,False,0.54,BOLLINGER,1.9500000000000002,-30.264982470336786,-86.30867655103984,-58.286829510688314,1010.4497472200503,85.69778306769624,548.0737651438733,5m,33,38,35.5,SUPERTREND,53.78787878787879,57.57575757575758,50.0,COMPLETE
582,-318.63287954013776,2026-01-15 23:48:55.597995,2026-01-15 23:49:02.975000,0 days 00:00:07.377005,16,2.5,3.3000000000000003,1.6,148,BOLLINGER,PARABOLIC_SAR,1.8,35,18,13,0.036000000000000004,72,26,15,0.014,79,13,14,0.048,ATR,2.0,14,30m,SUPERTREND,False,False,False,False,False,0.44,BOLLINGER,1.8,-32.58651312166256,-77.80690331758458,-55.196708219623574,1514.3590328200225,128.19905790539067,821.2790453627066,30m,47,49,48.0,SUPERTREND,52.19279201042119,57.446808510638306,46.93877551020408,COMPLETE
583,100.531346399217,2026-01-15 23:48:56.607223,2026-01-15 23:49:00.397887,0 days 00:00:03.790664,16,2.5,3.6,1.7,150,BOLLINGER,PARABOLIC_SAR,1.9500000000000002,19,19,13,0.036000000000000004,72,25,14,0.011,80,13,13,0.05,ATR,3.1,14,30m,SUPERTREND,False,False,False,False,False,0.44,BOLLINGER,1.9500000000000002,-35.116324720092585,-81.43505324553618,-58.27568898281439,2409.886519044064,167.08305793415948,1288.4847884891117,30m,42,46,44.0,SUPERTREND,54.86542443064182,61.904761904761905,47.82608695652174,COMPLETE
584,138.5836264744421,2026-01-15 23:48:56.974111,2026-01-15 23:49:06.255297,0 days 00:00:09.281186,16,2.3,1.6,1.7,150,BOLLINGER,PARABOLIC_SAR,1.9500000000000002,35,19,13,0.036000000000000004,72,25,14,0.011,80,13,13,0.048,ATR,2.7,14,30m,SUPERTREND,False,False,False,False,False,0.42,BOLLINGER,1.9500000000000002,-37.85145367808036,-75.43182890036127,-56.641641289220814,1463.0906498090997,113.29059238062248,788.1906210948611,30m,51,57,54.0,SUPERTREND,54.85036119711043,58.82352941176471,50.877192982456144,COMPLETE
585,579.3900765313683,2026-01-15 23:49:01.471401,2026-01-15 23:49:12.332088,0 days 00:00:10.860687,16,2.3,3.3000000000000003,1.8,150,BOLLINGER,PARABOLIC_SAR,1.9,34,18,13,0.036000000000000004,73,24,14,0.011,80,14,14,0.048,ATR,2.0,11,5m,SUPERTREND,False,False,False,False,False,0.43,BOLLINGER,1.9,-28.946805463444058,-72.73790850765577,-50.84235698554991,1976.0082770876875,48.86450275498356,1012.4363899213355,5m,46,52,49.0,SUPERTREND,57.48327759197325,63.04347826086957,51.92307692307693,COMPLETE
586,-2978.887326042751,2026-01-15 23:49:03.524499,2026-01-15 23:49:16.452334,0 days 00:00:12.927835,23,2.3,3.5,3.0,150,BOLLINGER,PARABOLIC_SAR,1.9,20,17,13,0.036000000000000004,73,24,14,0.011,80,14,14,0.049,ATR,2.6,11,5m,SUPERTREND,False,False,False,False,False,0.44,BOLLINGER,1.9,-64.1702862023374,-57.86762481134454,-61.01895550684097,80.33881340686888,-40.35312761991211,19.992842893478386,5m,17,22,19.5,SUPERTREND,49.19786096256685,52.94117647058824,45.45454545454545,COMPLETE
587,632.1273773510429,2026-01-15 23:49:04.922689,2026-01-15 23:49:15.916400,0 days 00:00:10.993711,17,2.3,3.6,1.7,150,BOLLINGER,PARABOLIC_SAR,1.9,20,17,13,0.035,73,24,14,0.011,80,14,14,0.034,ATR,1.9,11,5m,SUPERTREND,False,False,False,False,False,0.43,BOLLINGER,1.9,-30.85044748218772,-71.9228656868638,-51.38665658452576,2415.6329106753747,94.30582512816491,1254.9693679017698,5m,49,56,52.5,SUPERTREND,59.31122448979592,63.26530612244898,55.35714285714286,COMPLETE
588,736.6891578265577,2026-01-15 23:49:05.772289,2026-01-15 23:49:17.172976,0 days 00:00:11.400687,20,2.3,3.6,1.7,150,BOLLINGER,PARABOLIC_SAR,1.8,22,17,13,0.035,73,24,14,0.011,80,14,14,0.049,ATR,1.9,10,5m,SUPERTREND,False,False,False,False,False,0.43,BOLLINGER,1.8,-29.35812565818889,-69.53743618355622,-49.44778092087256,2121.3287664223417,101.96422482146663,1111.6464956219043,5m,49,56,52.5,SUPERTREND,59.31122448979592,63.26530612244898,55.35714285714286,COMPLETE
589,641.6903215515194,2026-01-15 23:49:06.799096,2026-01-15 23:49:20.745678,0 days 00:00:13.946582,17,2.3,3.5,1.8,148,BOLLINGER,PARABOLIC_SAR,1.9,21,17,13,0.035,73,25,14,0.011,80,14,14,0.049,ATR,1.9,11,5m,SUPERTREND,False,False,False,False,False,0.43,BOLLINGER,1.9,-28.946215008690153,-73.22568811491477,-51.08595156180246,2116.0347422974883,42.51618287694729,1079.2754625872178,5m,45,52,48.5,SUPERTREND,57.072649572649574,62.22222222222222,51.92307692307693,COMPLETE
590,594.5197856013638,2026-01-15 23:49:07.009407,2026-01-15 23:49:21.397479,0 days 00:00:14.388072,17,2.3,3.5,1.7,148,BOLLINGER,PARABOLIC_SAR,1.9,22,17,13,0.035,72,24,14,0.011,80,14,14,0.049,ATR,1.9,12,5m,SUPERTREND,False,False,False,False,False,0.44,BOLLINGER,1.9,-30.850444159651268,-72.67810753078282,-51.76427584521704,2359.2373772477613,84.84301616587804,1222.0401967068196,5m,49,56,52.5,SUPERTREND,59.31122448979592,63.26530612244898,55.35714285714286,COMPLETE
591,1149.9676334569913,2026-01-15 23:49:13.300755,2026-01-15 23:49:29.594985,0 days 00:00:16.294230,22,2.4,3.5,1.7,142,BOLLINGER,PARABOLIC_SAR,1.9,22,17,13,0.035,73,25,14,0.012,80,14,14,0.049,ATR,2.4000000000000004,12,5m,SUPERTREND,False,False,False,False,False,0.44,BOLLINGER,1.9,-26.852387876079774,-75.15277818280856,-51.00258302944417,3255.0986405657673,23.50339130065874,1639.301015933213,5m,44,52,48.0,SUPERTREND,57.95454545454545,65.9090909090909,50.0,COMPLETE
592,1018.4761490962082,2026-01-15 23:49:17.120789,2026-01-15 23:49:31.064286,0 days 00:00:13.943497,22,2.4,3.5,1.7,143,BOLLINGER,PARABOLIC_SAR,1.8,26,34,13,0.035,79,25,13,0.012,79,14,14,0.05,ATR,2.4000000000000004,12,5m,SUPERTREND,False,False,False,False,False,0.47,BOLLINGER,1.8,-25.441520675934044,-72.71837849144022,-49.07994958368713,2786.7021322314313,31.29223135405062,1408.997181792741,5m,44,52,48.0,SUPERTREND,57.95454545454545,65.9090909090909,50.0,COMPLETE
593,-800.0649336274782,2026-01-15 23:49:17.257622,2026-01-15 23:49:31.589933,0 days 00:00:14.332311,17,2.4,3.4000000000000004,2.1,142,BOLLINGER,PARABOLIC_SAR,1.85,28,19,14,0.035,72,25,14,0.012,79,14,14,0.05,ATR,2.4000000000000004,12,5m,SMA,False,False,False,False,False,0.47,BOLLINGER,1.85,-50.97200251751601,-80.18519243389593,-65.57859747570598,247.55093820991556,-28.92626732061058,109.31233544465249,5m,50,52,51.0,SMA,47.15384615384615,52.0,42.30769230769231,COMPLETE
594,-1456.8678104258288,2026-01-15 23:49:17.862783,2026-01-15 23:49:31.856611,0 days 00:00:13.993828,17,2.4,3.5,2.2,143,BOLLINGER,PARABOLIC_SAR,1.85,41,19,14,0.035,72,25,14,0.012,79,14,14,0.05,ATR,2.4000000000000004,12,5m,SMA,False,False,False,False,False,0.47,BOLLINGER,1.85,-63.15752697774934,-80.70962750143235,-71.93357723959085,119.09817590417144,-51.801311064113484,33.64843242002898,5m,48,48,48.0,SMA,44.79166666666667,52.083333333333336,37.5,COMPLETE
595,-1161.237507249616,2026-01-15 23:49:21.355669,2026-01-15 23:49:36.402517,0 days 00:00:15.046848,16,2.6,3.4000000000000004,1.7,33,BOLLINGER,PARABOLIC_SAR,1.85,26,19,14,0.034,72,25,13,0.012,79,14,14,0.05,ATR,2.4000000000000004,12,5m,SMA,False,False,False,False,False,0.47,BOLLINGER,1.85,-63.768963401652165,-103.87800457710148,-83.82348398937683,229.4960780313951,-109.04954083496146,60.22326859821681,5m,90,30,60.0,SMA,45.55555555555556,47.77777777777778,43.333333333333336,COMPLETE
596,-868.8300636122176,2026-01-15 23:49:21.739750,2026-01-15 23:49:36.421906,0 days 00:00:14.682156,16,2.4,2.3,1.7,142,BOLLINGER,PARABOLIC_SAR,1.85,26,19,14,0.034,72,25,13,0.012,79,14,14,0.05,ATR,2.4000000000000004,16,5m,SMA,False,False,False,False,False,0.44999999999999996,BOLLINGER,1.85,-87.92108644874557,-82.14587115021513,-85.03347879948035,74.75620255638107,78.92064710316198,76.83842482977153,5m,62,67,64.5,SMA,50.43331728454501,51.61290322580645,49.25373134328358,COMPLETE
597,1093.6382967929421,2026-01-15 23:49:30.243274,2026-01-15 23:49:40.740312,0 days 00:00:10.497038,30,2.4,3.4000000000000004,1.7,142,BOLLINGER,PARABOLIC_SAR,1.85,25,19,14,0.035,72,25,14,0.012,79,14,13,0.05,ATR,2.4000000000000004,13,5m,SUPERTREND,False,False,False,False,False,0.44,BOLLINGER,1.85,-26.14695944687668,-74.03024541719849,-50.08860243203758,3031.414933939487,29.77993015574948,1530.5974320476182,5m,44,52,48.0,SUPERTREND,57.95454545454545,65.9090909090909,50.0,COMPLETE
598,-255.4700942068921,2026-01-15 23:49:32.381619,2026-01-15 23:49:40.323332,0 days 00:00:07.941713,21,2.6,3.4000000000000004,1.7,135,BOLLINGER,PARABOLIC_SAR,1.9,17,19,13,0.035,79,25,13,0.01,79,14,13,0.049,ATR,2.5,12,2h,SUPERTREND,False,False,False,False,False,0.55,BOLLINGER,1.9,-37.86775968828944,-86.50415531363518,-62.18595750096231,2030.8166872646539,1.9949919271459338,1016.4058395958999,2h,38,42,40.0,SUPERTREND,56.70426065162907,65.78947368421053,47.61904761904761,COMPLETE
599,482.910450651716,2026-01-15 23:49:32.375076,2026-01-15 23:49:41.017692,0 days 00:00:08.642616,22,2.6,3.4000000000000004,1.7,136,BOLLINGER,PARABOLIC_SAR,1.9,11,33,13,0.035,72,25,13,0.01,77,14,13,0.049,ATR,2.4000000000000004,12,5m,SUPERTREND,False,False,False,False,False,0.55,BOLLINGER,1.9,-27.837051277268415,-77.98595434307524,-52.911502810171825,2865.341323601803,64.17621821219744,1464.7587709070003,5m,40,44,42.0,SUPERTREND,57.38636363636364,62.5,52.27272727272727,COMPLETE
600,-244.7684761036735,2026-01-15 23:49:32.382620,2026-01-15 23:49:40.157834,0 days 00:00:07.775214,23,2.6,3.4000000000000004,1.7,48,BOLLINGER,PARABOLIC_SAR,1.9,17,19,13,0.035,69,25,13,0.01,79,14,13,0.049,ATR,2.4000000000000004,12,2h,SUPERTREND,False,False,False,False,False,0.52,BOLLINGER,1.9,-76.21063649264603,-36.41254970218925,-56.31159309741764,453.84869622716826,827.1435894274852,640.4961428273267,2h,51,49,50.0,SUPERTREND,54.92196878751501,58.82352941176471,51.02040816326531,COMPLETE
601,-769.4766301208965,2026-01-15 23:49:36.732524,2026-01-15 23:49:46.672468,0 days 00:00:09.939944,22,2.6,3.4000000000000004,1.8,136,BOLLINGER,PARABOLIC_SAR,1.9,11,34,13,0.035,69,25,13,0.01,81,14,13,0.049,ATR,2.5,10,2h,SUPERTREND,False,False,False,False,False,0.44,BOLLINGER,1.9,-37.86302451594859,-74.26795559849147,-56.06549005722003,949.0287153641084,53.39020526109939,501.2094603126039,2h,39,38,38.5,SUPERTREND,55.73549257759784,64.1025641025641,47.368421052631575,COMPLETE
602,-602.2995726939444,2026-01-15 23:49:36.761373,2026-01-15 23:49:50.488335,0 days 00:00:13.726962,20,2.6,3.4000000000000004,1.8,141,BOLLINGER,PARABOLIC_SAR,1.9,14,18,13,0.035,78,25,13,0.01,81,14,13,0.049,ATR,2.5,12,2h,SUPERTREND,False,False,False,False,False,0.44,BOLLINGER,1.9,-37.888073113734826,-72.37340884657479,-55.13074098015481,1237.331676407819,52.873218384041756,645.1024473959304,2h,37,38,37.5,SUPERTREND,57.46799431009957,67.56756756756756,47.368421052631575,COMPLETE
603,565.0467007504003,2026-01-15 23:49:40.339707,2026-01-15 23:49:49.862856,0 days 00:00:09.523149,16,2.2,3.6,1.8,141,BOLLINGER,PARABOLIC_SAR,2.0,12,33,13,0.036000000000000004,72,25,13,0.012,78,15,14,0.048,ATR,2.3,10,5m,SUPERTREND,False,False,False,False,False,0.44,BOLLINGER,2.0,-27.906963196520618,-80.3523625864585,-54.12966289148956,1684.7080268035832,20.714677858815506,852.7113523311994,5m,50,56,53.0,SUPERTREND,55.0,60.0,50.0,COMPLETE
604,537.1446600331456,2026-01-15 23:49:40.396284,2026-01-15 23:49:46.282650,0 days 00:00:05.886366,22,2.2,3.6,1.8,141,BOLLINGER,PARABOLIC_SAR,1.9500000000000002,11,18,13,0.036000000000000004,71,25,13,0.012,78,15,14,0.048,ATR,2.3,10,5m,SUPERTREND,False,False,False,False,False,0.51,BOLLINGER,1.9500000000000002,-27.26801097333082,-79.44795516170863,-53.357983067519726,1599.1663299027216,24.358983184805975,811.7626565437638,5m,50,56,53.0,SUPERTREND,55.0,60.0,50.0,COMPLETE
