number,value,datetime_start,datetime_complete,duration,params_ADX_THRESHOLD,params_ATR_MULTIPLIER,params_ATR_STOP_LOSS_MULT,params_BB_STD,params_ENTRY_PERIOD,params_ENTRY_TYPE,params_EXIT_TYPE,params_LEVERAGE,params_MA_PERIOD,params_MFI_THRESHOLD,params_MFI_WINDOW,params_RISK_PER_TRADE,params_RSI_OVERBOUGHT,params_RSI_OVERSOLD,params_RSI_WINDOW,params_SAR_STEP,params_STOCH_OVERBOUGHT,params_STOCH_OVERSOLD,params_STOCH_WINDOW,params_STOP_LOSS_PCT,params_STOP_LOSS_TYPE,params_SUPERTREND_MULT,params_SUPERTREND_PERIOD,params_TIMEFRAME,params_TREND_FILTER_TYPE,params_USE_ADX,params_USE_MFI,params_USE_RSI,params_USE_STOCHASTIC,params_USE_VHF,params_VHF_THRESHOLD,user_attrs_entry_type,user_attrs_leverage,user_attrs_mdd_BTC_USDT,user_attrs_mdd_ETH_USDT,user_attrs_mdd_avg,user_attrs_return_BTC_USDT,user_attrs_return_ETH_USDT,user_attrs_return_avg,user_attrs_timeframe,user_attrs_trades_BTC_USDT,user_attrs_trades_ETH_USDT,user_attrs_trades_avg,user_attrs_trend_filter,user_attrs_win_rate_avg,user_attrs_winrate_BTC_USDT,user_attrs_winrate_ETH_USDT,state
904,82.9553659100502,2026-01-16 00:06:09.570521,2026-01-16 00:06:27.895944,0 days 00:00:18.325423,24,2.3,2.1,1.6,145,BOLLINGER,PARABOLIC_SAR,2.1,133,16,10,0.03,67,35,13,0.011,84,12,12,0.044000000000000004,ATR,3.2,5,3m,SUPERTREND,False,False,False,False,True,0.37,BOLLINGER,2.1,-28.9626765014804,-66.15932990726371,-47.56100320437206,1820.3598211406245,91.24375264500306,955.8017868928138,3m,41,45,43.0,SUPERTREND,58.3739837398374,63.41463414634146,53.333333333333336,COMPLETE
905,-677.1033014224786,2026-01-16 00:06:10.127296,2026-01-16 00:06:30.279974,0 days 00:00:20.152678,24,2.3,2.0,1.6,146,BOLLINGER,PARABOLIC_SAR,2.1,153,16,10,0.028000000000000004,67,35,13,0.022,84,12,12,0.044000000000000004,ATR,3.2,5,3m,DEMA,False,False,False,False,True,0.37,BOLLINGER,2.1,-78.81227727934557,-62.735372044739556,-70.77382466204256,196.55226955539985,227.37116606944414,211.961717812422,3m,55,54,54.5,DEMA,55.05050505050505,54.54545454545454,55.55555555555556,COMPLETE
906,-284.1270467751401,2026-01-16 00:06:11.308190,2026-01-16 00:06:32.859587,0 days 00:00:21.551397,24,2.3,2.1,1.6,147,BOLLINGER,PARABOLIC_SAR,2.1,132,16,10,0.03,67,35,13,0.011,84,12,12,0.035,ATR,3.2,5,3m,DEMA,False,False,False,False,True,0.39,BOLLINGER,2.1,-57.579626779862316,-55.87913180612861,-56.72937929299546,591.5547455855094,356.5101299633222,474.0324377744158,3m,51,50,50.5,DEMA,56.43137254901961,56.86274509803921,56.00000000000001,COMPLETE
907,-349.5131073157763,2026-01-16 00:06:27.335166,2026-01-16 00:06:47.726916,0 days 00:00:20.391750,24,2.0,2.1,1.6,147,BOLLINGER,PARABOLIC_SAR,2.1,152,15,10,0.026000000000000002,65,35,13,0.036000000000000004,84,12,12,0.043000000000000003,ATR,3.1,10,3m,HMA,False,False,False,False,True,0.39,BOLLINGER,2.1,-54.67398384472707,-58.067532486680506,-56.37075816570379,582.5443410918327,334.3503727531714,458.4473569225021,3m,68,59,63.5,HMA,53.589232303090725,52.94117647058824,54.23728813559322,COMPLETE
908,-825.2649543379084,2026-01-16 00:06:28.433867,2026-01-16 00:06:49.463413,0 days 00:00:21.029546,25,2.0,2.0,1.6,147,BOLLINGER,PARABOLIC_SAR,2.1,146,15,11,0.03,65,22,12,0.049,86,12,12,0.034,ATR,3.0,10,3m,HMA,False,False,False,False,False,0.39,BOLLINGER,2.1,-76.55859216615578,-91.73820219438652,-84.14839718027115,170.103359932428,-34.423608747453635,67.83987559248718,3m,88,92,90.0,HMA,47.25790513833992,48.86363636363637,45.65217391304348,COMPLETE
909,515.6930520010683,2026-01-16 00:06:28.605892,2026-01-16 00:06:42.604292,0 days 00:00:13.998400,25,2.0,3.3000000000000003,1.6,147,BOLLINGER,PARABOLIC_SAR,2.1,152,15,11,0.03,65,35,12,0.047,86,12,12,0.042,ATR,3.0,10,3m,SUPERTREND,False,False,False,False,False,0.39,BOLLINGER,2.1,-35.3402479296821,-77.73656368321669,-56.53840580644939,2264.4878539360657,39.611006454928074,1152.0494301954968,3m,72,72,72.0,SUPERTREND,53.47222222222222,59.72222222222222,47.22222222222222,COMPLETE
910,-716.2557523445894,2026-01-16 00:06:31.277236,2026-01-16 00:06:51.123589,0 days 00:00:19.846353,25,2.0,3.3000000000000003,1.6,147,BOLLINGER,PARABOLIC_SAR,2.2,152,15,11,0.03,65,21,12,0.041,85,12,12,0.043000000000000003,ATR,3.0,10,3m,HMA,False,False,False,False,False,0.39,BOLLINGER,2.2,-66.42649540939614,-91.92943744188227,-79.1779664256392,357.3399357658876,-39.89092659450014,158.72450458569375,3m,88,92,90.0,HMA,47.25790513833992,48.86363636363637,45.65217391304348,COMPLETE
911,-305.6518528591887,2026-01-16 00:06:31.281601,2026-01-16 00:06:55.111172,0 days 00:00:23.829571,25,2.0,2.2,2.1,147,BOLLINGER,PARABOLIC_SAR,2.2,146,15,11,0.03,65,21,12,0.036000000000000004,85,12,12,0.037,ATR,3.0,10,3m,HMA,False,False,False,False,False,0.39,BOLLINGER,2.2,-48.69766598040467,-85.02222285215757,-66.85994441628112,1020.3289428713412,9.65315249759094,514.991047684466,3m,62,68,65.0,HMA,50.806451612903224,51.61290322580645,50.0,COMPLETE
912,-711.8925817678692,2026-01-16 00:06:32.899705,2026-01-16 00:06:59.233751,0 days 00:00:26.334046,25,2.0,3.3000000000000003,1.6,148,BOLLINGER,PARABOLIC_SAR,2.2,151,15,11,0.032,65,35,12,0.01,85,12,12,0.043000000000000003,ATR,3.0,10,3m,HMA,False,False,False,False,False,0.33999999999999997,BOLLINGER,2.2,-68.60666751163018,-91.62706175507115,-80.11686463335067,372.08303101507863,-40.16715246328765,165.95793927589548,3m,89,92,90.5,HMA,46.98339032730826,48.31460674157304,45.65217391304348,COMPLETE
913,605.3249194304999,2026-01-16 00:06:45.630183,2026-01-16 00:07:04.528511,0 days 00:00:18.898328,25,2.0,3.3000000000000003,1.6,148,BOLLINGER,PARABOLIC_SAR,2.2,160,15,11,0.032,66,35,12,0.01,83,12,12,0.043000000000000003,ATR,3.1,7,3m,SUPERTREND,False,False,False,False,False,0.33999999999999997,BOLLINGER,2.2,-36.12291846360643,-79.8714616044365,-57.99719003402147,2522.2294962452233,30.71152665326854,1276.470511449246,3m,72,72,72.0,SUPERTREND,52.77777777777778,58.333333333333336,47.22222222222222,COMPLETE
914,610.4037880360611,2026-01-16 00:06:48.782167,2026-01-16 00:07:10.534304,0 days 00:00:21.752137,25,2.1,3.3000000000000003,1.6,148,BOLLINGER,PARABOLIC_SAR,2.2,145,15,11,0.032,66,35,12,0.04,85,12,12,0.041,ATR,3.0,7,3m,SUPERTREND,False,False,False,False,False,0.38,BOLLINGER,2.2,-33.99327582393703,-85.4796282945415,-59.73645205923927,2553.7206812226254,-22.233175026318037,1265.7437530981538,3m,65,70,67.5,SUPERTREND,51.26373626373626,55.38461538461539,47.14285714285714,COMPLETE
915,-931.2032752747036,2026-01-16 00:06:51.560028,2026-01-16 00:07:14.661995,0 days 00:00:23.101967,27,2.1,3.2,1.5,143,BOLLINGER,PARABOLIC_SAR,2.1500000000000004,143,15,11,0.032,66,35,13,0.048,83,12,12,0.041,ATR,3.0,7,3m,SUPERTREND,False,False,True,False,False,0.38,BOLLINGER,2.1500000000000004,-28.955123456121633,-82.96222479857167,-55.958674127346654,272.19477692486805,-46.4927334455077,112.85102173968018,3m,34,43,38.5,SUPERTREND,48.01641586867305,58.82352941176471,37.2093023255814,COMPLETE
916,-2752.6915417156924,2026-01-16 00:06:51.806176,2026-01-16 00:07:11.464382,0 days 00:00:19.658206,27,2.1,2.2,2.0,143,BOLLINGER,PARABOLIC_SAR,2.1500000000000004,163,15,11,0.032,66,35,13,0.048,83,12,12,0.038,ATR,3.1,7,3m,SUPERTREND,False,False,True,False,False,0.38,BOLLINGER,2.1500000000000004,-35.828512806685104,-67.28102543294348,-51.554769119814296,215.57179048278695,75.32132941209211,145.44655994743954,3m,24,25,24.5,SUPERTREND,53.16666666666667,58.333333333333336,48.0,COMPLETE
917,-814.6895022246572,2026-01-16 00:06:55.690275,2026-01-16 00:07:17.694264,0 days 00:00:22.003989,27,2.1,3.2,1.5,142,BOLLINGER,PARABOLIC_SAR,2.1500000000000004,165,15,11,0.032,66,35,13,0.01,83,12,12,0.041,ATR,3.1,7,3m,SUPERTREND,False,False,True,False,False,0.38,BOLLINGER,2.1500000000000004,-28.985926688522774,-82.92261611631179,-55.95427140241728,436.8521907155299,-46.496624452605104,195.1777831314624,3m,35,43,39.0,SUPERTREND,48.6046511627907,60.0,37.2093023255814,COMPLETE
918,1006.181902863399,2026-01-16 00:06:59.387811,2026-01-16 00:07:22.697361,0 days 00:00:23.309550,26,2.1,3.2,1.5,143,BOLLINGER,PARABOLIC_SAR,2.1500000000000004,164,15,10,0.032,66,34,13,0.011,83,12,12,0.041,ATR,3.1,7,3m,SUPERTREND,False,False,False,False,False,0.38,BOLLINGER,2.1500000000000004,-29.507665333708317,-71.60285523213787,-50.55526028292309,2602.523812840249,83.34921582756284,1342.936514333906,3m,68,70,69.0,SUPERTREND,51.53361344537815,57.35294117647059,45.714285714285715,COMPLETE
919,1006.181902863399,2026-01-16 00:07:05.783399,2026-01-16 00:07:30.633075,0 days 00:00:24.849676,27,2.1,3.2,1.5,143,BOLLINGER,PARABOLIC_SAR,2.1500000000000004,144,15,10,0.032,66,34,13,0.028000000000000004,83,12,11,0.041,ATR,2.9000000000000004,7,3m,SUPERTREND,False,False,False,False,False,0.38,BOLLINGER,2.1500000000000004,-29.507665333708317,-71.60285523213787,-50.55526028292309,2602.523812840249,83.34921582756284,1342.936514333906,3m,68,70,69.0,SUPERTREND,51.53361344537815,57.35294117647059,45.714285714285715,COMPLETE
920,1685.9802465218881,2026-01-16 00:07:10.830196,2026-01-16 00:07:31.225259,0 days 00:00:20.395063,26,2.3,3.2,1.5,143,BOLLINGER,PARABOLIC_SAR,2.1500000000000004,136,16,10,0.031,66,34,13,0.011,83,11,12,0.042,ATR,3.1,7,3m,SUPERTREND,False,False,False,False,False,0.38,BOLLINGER,2.1500000000000004,-29.66801360778007,-71.12477761529452,-50.396395611537294,4072.958335502531,237.40170156561175,2155.180018534071,3m,56,61,58.5,SUPERTREND,56.586651053864166,60.71428571428571,52.459016393442624,COMPLETE
921,1685.9802465218881,2026-01-16 00:07:12.846735,2026-01-16 00:07:30.833973,0 days 00:00:17.987238,26,2.3,3.2,1.5,143,BOLLINGER,PARABOLIC_SAR,2.1500000000000004,143,16,10,0.031,66,34,13,0.011,84,11,11,0.041,ATR,2.9000000000000004,6,3m,SUPERTREND,False,False,False,False,False,0.4,BOLLINGER,2.1500000000000004,-29.66801360778007,-71.12477761529452,-50.396395611537294,4072.958335502531,237.40170156561175,2155.180018534071,3m,56,61,58.5,SUPERTREND,56.586651053864166,60.71428571428571,52.459016393442624,COMPLETE
922,1774.9586656762067,2026-01-16 00:07:15.370463,2026-01-16 00:07:38.354772,0 days 00:00:22.984309,26,2.3,3.1,1.5,141,BOLLINGER,PARABOLIC_SAR,2.1500000000000004,137,16,10,0.031,66,34,13,0.011,84,11,11,0.042,ATR,2.9000000000000004,6,3m,SUPERTREND,False,False,False,False,False,0.4,BOLLINGER,2.1500000000000004,-29.667949471371163,-63.86630067531899,-46.76712507334508,3954.470567188883,323.4599458034018,2138.9652564961425,3m,56,61,58.5,SUPERTREND,55.69379391100703,58.92857142857143,52.459016393442624,COMPLETE
923,1311.008961514257,2026-01-16 00:07:17.989423,2026-01-16 00:07:42.503828,0 days 00:00:24.514405,26,2.3,3.1,1.6,150,BOLLINGER,PARABOLIC_SAR,2.05,122,16,10,0.031,67,34,13,0.011,84,11,11,0.042,ATR,2.9000000000000004,6,3m,SUPERTREND,False,False,False,False,False,0.4,BOLLINGER,2.05,-28.297127037241825,-78.19884124104368,-53.24798413914275,3160.9305452832887,103.97418019974019,1632.4523627415144,3m,53,60,56.5,SUPERTREND,57.688679245283026,60.37735849056604,55.00000000000001,COMPLETE
924,-3047.057500317012,2026-01-16 00:07:24.738435,2026-01-16 00:07:45.299784,0 days 00:00:20.561349,26,2.3,1.9,3.0,150,BOLLINGER,PARABOLIC_SAR,2.05,136,16,10,0.031,67,34,13,0.011,84,11,11,0.042,ATR,2.9000000000000004,8,3m,SUPERTREND,False,False,False,False,False,0.4,BOLLINGER,2.05,-64.49609753018603,-54.382107137350445,-59.43910233376824,-27.79978204130018,-44.782221485873904,-36.29100176358704,3m,20,22,21.0,SUPERTREND,40.45454545454545,40.0,40.909090909090914,COMPLETE
925,386.2247150141857,2026-01-16 00:07:30.880359,2026-01-16 00:07:42.557628,0 days 00:00:11.677269,26,2.3,3.1,1.5,141,BOLLINGER,PARABOLIC_SAR,2.1500000000000004,143,16,10,0.031,67,34,13,0.012,84,11,11,0.039,ATR,2.8,6,1h,SUPERTREND,False,False,False,False,False,0.4,BOLLINGER,2.1500000000000004,-41.43092147881848,-73.44799558057669,-57.43945852969759,2084.3854777061088,93.42428811767569,1088.9048829118922,1h,53,58,55.5,SUPERTREND,55.18867924528302,60.37735849056604,50.0,COMPLETE
926,-445.4467464504678,2026-01-16 00:07:31.379287,2026-01-16 00:07:45.220331,0 days 00:00:13.841044,26,2.4,3.1,1.5,139,BOLLINGER,PARABOLIC_SAR,2.1500000000000004,136,16,10,0.031,66,34,13,0.012,83,11,11,0.04,ATR,3.4000000000000004,6,1h,ICHIMOKU,False,False,False,False,False,0.4,BOLLINGER,2.1500000000000004,-58.27081602083916,-84.01994811571127,-71.14538206827521,895.1455228121938,-21.13768535758037,437.0039187273067,1h,64,73,68.5,ICHIMOKU,47.699058219178085,51.5625,43.83561643835616,COMPLETE
927,-98.24370387360341,2026-01-16 00:07:32.202754,2026-01-16 00:07:46.693639,0 days 00:00:14.490885,26,2.4,3.1,1.5,140,BOLLINGER,PARABOLIC_SAR,2.1500000000000004,136,16,10,0.031,66,34,13,0.012,83,11,11,0.042,ATR,3.1,49,3m,ICHIMOKU,False,False,False,False,False,0.4,BOLLINGER,2.1500000000000004,-63.31374930199459,-87.65813411894908,-75.48594171047183,1631.0406163441492,-28.52407715281834,801.2582695956654,3m,68,80,74.0,ICHIMOKU,48.86029411764706,51.470588235294116,46.25,COMPLETE
928,424.0015984278325,2026-01-16 00:07:39.052482,2026-01-16 00:07:53.700659,0 days 00:00:14.648177,26,2.4,3.0,1.5,139,BOLLINGER,PARABOLIC_SAR,2.2,135,16,10,0.031,66,34,13,0.012,83,11,11,0.04,ATR,2.9000000000000004,6,1h,SUPERTREND,False,False,False,False,False,0.4,BOLLINGER,2.2,-41.43686838699454,-79.80484031190336,-60.62085434944895,2685.133800369048,12.536890918349988,1348.835345643699,1h,48,56,52.0,SUPERTREND,53.42261904761905,60.416666666666664,46.42857142857143,COMPLETE
929,-428.3576344099729,2026-01-16 00:07:43.573449,2026-01-16 00:07:52.866197,0 days 00:00:09.292748,26,2.4,2.6,1.5,140,BOLLINGER,PARABOLIC_SAR,2.2,129,16,10,0.03,66,34,13,0.012,83,11,11,0.042,ATR,2.8,49,2h,ICHIMOKU,False,False,False,False,False,0.4,BOLLINGER,2.2,-60.33605897933361,-88.68844565225987,-74.51225231579674,985.8485951642789,-52.33635179882192,466.75612168272846,2h,63,72,67.5,ICHIMOKU,48.41269841269842,52.38095238095239,44.44444444444444,COMPLETE
930,1617.469934552717,2026-01-16 00:07:44.282483,2026-01-16 00:07:56.559027,0 days 00:00:12.276544,26,2.4,3.1,1.5,139,BOLLINGER,PARABOLIC_SAR,2.2,128,16,10,0.031,66,34,13,0.012,83,11,11,0.042,ATR,2.8,5,3m,SUPERTREND,False,False,False,False,False,0.4,BOLLINGER,2.2,-31.984998054923686,-73.99050596593298,-52.98775201042834,5267.738512584166,63.498086914897456,2665.6182997495316,3m,51,59,55.0,SUPERTREND,53.98803589232303,58.82352941176471,49.152542372881356,COMPLETE
931,1620.947467781205,2026-01-16 00:07:45.334580,2026-01-16 00:07:56.325754,0 days 00:00:10.991174,26,2.4,3.0,1.5,139,BOLLINGER,PARABOLIC_SAR,2.2,126,16,10,0.03,66,34,13,0.012,83,11,11,0.042,ATR,2.8,5,3m,SUPERTREND,False,False,False,False,False,0.41,BOLLINGER,2.2,-31.984998054923686,-73.99218293669001,-52.98859049580685,5267.738512584166,66.27470033031067,2667.006606457238,3m,51,59,55.0,SUPERTREND,53.98803589232303,58.82352941176471,49.152542372881356,COMPLETE
932,1677.790170076647,2026-01-16 00:07:46.528444,2026-01-16 00:08:01.412118,0 days 00:00:14.883674,26,2.4,2.6,1.5,140,BOLLINGER,PARABOLIC_SAR,2.2,122,16,10,0.03,66,34,13,0.012,83,11,11,0.042,ATR,2.8,33,3m,SUPERTREND,False,False,False,False,False,0.4,BOLLINGER,2.2,-31.98507308342431,-74.25312857994282,-53.11910083168357,5398.024413207841,86.62755207951554,2742.325982643678,3m,51,59,55.0,SUPERTREND,53.98803589232303,58.82352941176471,49.152542372881356,COMPLETE
933,-2261.048759651656,2026-01-16 00:07:46.744698,2026-01-16 00:07:56.402332,0 days 00:00:09.657634,26,2.4,3.0,1.5,140,DONCHIAN,PARABOLIC_SAR,2.2,128,16,10,0.03,66,34,13,0.012,83,11,11,0.042,ATR,2.8,5,2h,SUPERTREND,False,False,False,False,False,0.4,DONCHIAN,2.2,-45.731265530020735,-61.276923505877534,-53.504094517949135,125.1765975012216,87.97955524146774,106.57807637134466,2h,33,26,29.5,SUPERTREND,51.16550116550117,48.484848484848484,53.84615384615385,COMPLETE
934,1686.2410329936183,2026-01-16 00:07:53.142040,2026-01-16 00:08:13.842921,0 days 00:00:20.700881,26,2.4,3.0,1.5,140,BOLLINGER,PARABOLIC_SAR,2.2,133,16,10,0.03,66,34,13,0.012,83,11,11,0.041,ATR,2.8,5,3m,SUPERTREND,False,False,False,False,False,0.41,BOLLINGER,2.2,-31.98507308342431,-74.26509378974178,-53.12508343658305,5398.024413207841,93.35701370532189,2745.6907134565813,3m,51,59,55.0,SUPERTREND,53.98803589232303,58.82352941176471,49.152542372881356,COMPLETE
935,-2232.4997655101256,2026-01-16 00:07:56.118831,2026-01-16 00:08:18.235069,0 days 00:00:22.116238,26,2.4,3.0,1.5,140,DONCHIAN,PARABOLIC_SAR,2.25,123,16,10,0.03,66,34,13,0.011,84,11,11,0.042,ATR,2.8,6,3m,SUPERTREND,False,False,False,False,False,0.41,DONCHIAN,2.25,-49.08866341078355,-59.03637383692644,-54.062518623855,355.42803171077526,15.751800012129639,185.58991586145245,3m,35,29,32.0,SUPERTREND,49.85221674876847,51.42857142857142,48.275862068965516,COMPLETE
936,1926.0650449398745,2026-01-16 00:07:56.514743,2026-01-16 00:08:18.005960,0 days 00:00:21.491217,26,2.4,3.0,1.5,136,BOLLINGER,PARABOLIC_SAR,2.25,122,16,10,0.03,66,34,13,0.012,83,10,11,0.041,ATR,2.8,5,3m,SUPERTREND,False,False,False,False,False,0.41,BOLLINGER,2.25,-32.72179821934764,-74.6888237677306,-53.705310993539115,6490.505089717935,108.6721123485734,3299.5886010332542,3m,50,58,54.0,SUPERTREND,55.0,60.0,50.0,COMPLETE
937,1682.744731457101,2026-01-16 00:07:56.929366,2026-01-16 00:08:19.351732,0 days 00:00:22.422366,26,2.4,2.7,1.5,139,BOLLINGER,PARABOLIC_SAR,2.25,132,16,10,0.03,66,34,13,0.012,83,11,11,0.041,ATR,2.8,5,3m,SUPERTREND,False,False,False,False,False,0.41,BOLLINGER,2.25,-32.711100480875885,-75.11455609663079,-53.91282828875334,5601.041920445372,67.73938711221473,2834.3906537787934,3m,51,59,55.0,SUPERTREND,53.98803589232303,58.82352941176471,49.152542372881356,COMPLETE
938,1873.8395784159393,2026-01-16 00:07:57.109377,2026-01-16 00:08:18.079312,0 days 00:00:20.969935,26,2.4,3.0,1.5,134,BOLLINGER,PARABOLIC_SAR,2.25,125,16,10,0.03,66,34,13,0.011,83,10,11,0.041,ATR,2.8,5,3m,SUPERTREND,False,False,False,False,False,0.41,BOLLINGER,2.25,-32.72179821934764,-73.93219210252013,-53.32699516093389,6257.24358427067,104.48553440489079,3180.8645593377805,3m,50,59,54.5,SUPERTREND,54.57627118644068,60.0,49.152542372881356,COMPLETE
939,2041.6518501515638,2026-01-16 00:08:01.826866,2026-01-16 00:08:26.083158,0 days 00:00:24.256292,26,2.4,3.0,1.5,137,BOLLINGER,ATR,2.25,122,16,10,0.028999999999999998,66,34,13,0.012,83,10,11,0.041,ATR,2.8,34,3m,SUPERTREND,False,False,False,False,False,0.41,BOLLINGER,2.25,-32.72179821934764,-74.8346048868687,-53.778201553108175,7075.775732210998,111.82521401677914,3593.8004731138885,3m,50,58,54.0,SUPERTREND,55.0,60.0,50.0,COMPLETE
940,115.58513788020991,2026-01-16 00:08:14.358948,2026-01-16 00:08:32.991781,0 days 00:00:18.632833,26,2.4,2.7,1.5,136,BOLLINGER,ATR,2.25,135,16,10,0.028000000000000004,66,34,13,0.012,83,10,10,0.041,ATR,2.8,5,3m,EMA,False,False,False,False,False,0.41,BOLLINGER,2.25,-59.52618759923094,-89.19999122458252,-74.36308941190673,2100.6934046091556,-38.990128660367475,1030.851637974394,3m,69,81,75.0,EMA,48.20182501341922,50.72463768115942,45.67901234567901,COMPLETE
941,1618.1193521484583,2026-01-16 00:08:18.202421,2026-01-16 00:08:41.202428,0 days 00:00:23.000007,26,2.5,2.9000000000000004,1.5,135,BOLLINGER,ATR,2.25,119,16,10,0.028999999999999998,66,34,13,0.012,83,10,10,0.041,ATR,2.8,5,3m,SUPERTREND,False,False,False,False,False,0.41,BOLLINGER,2.25,-34.245697106394715,-80.79289837368349,-57.5192977400391,5336.896030154453,166.502122022754,2751.6990760886033,3m,49,54,51.5,SUPERTREND,53.66591080876795,59.183673469387756,48.148148148148145,COMPLETE
942,1544.7368059570144,2026-01-16 00:08:18.160723,2026-01-16 00:08:41.131531,0 days 00:00:22.970808,26,2.5,2.9000000000000004,1.5,134,BOLLINGER,PARABOLIC_SAR,2.25,123,16,10,0.028000000000000004,66,34,13,0.012,83,10,10,0.041,ATR,2.8,5,3m,SUPERTREND,False,False,False,False,False,0.41,BOLLINGER,2.25,-34.79571792530959,-82.45963383591302,-58.62767588061131,5240.343426115275,138.12847100547802,2689.2359485603765,3m,49,55,52.0,SUPERTREND,54.24860853432282,61.224489795918366,47.27272727272727,COMPLETE
943,-642.5877638100856,2026-01-16 00:08:19.245795,2026-01-16 00:08:41.480201,0 days 00:00:22.234406,26,2.5,3.0,1.5,135,BOLLINGER,ATR,2.3,121,16,10,0.028000000000000004,66,34,13,0.012,83,10,10,0.041,ATR,2.8,5,3m,MACD,False,False,False,False,False,0.41,BOLLINGER,2.3,-64.34655836278635,-93.18591348977873,-78.76623592628255,593.9487395532315,-53.52771535404054,270.21051209959546,3m,59,67,63.0,MACD,46.319251201619025,50.847457627118644,41.7910447761194,COMPLETE
944,-973.3536399837176,2026-01-16 00:08:20.560238,2026-01-16 00:08:41.530763,0 days 00:00:20.970525,26,2.5,2.6,1.5,136,BOLLINGER,ATR,2.3,118,16,10,0.028000000000000004,66,34,13,0.012,83,10,10,0.041,ATR,2.8,5,3m,MACD,False,False,False,True,False,0.41,BOLLINGER,2.3,-82.41545842088344,-92.1919162567256,-87.30368733880452,26.745424190568595,-73.26445740195257,-23.259516605691985,3m,50,53,51.5,MACD,43.75471698113208,46.0,41.509433962264154,COMPLETE
945,-525.4707100282894,2026-01-16 00:08:27.544881,2026-01-16 00:08:59.345942,0 days 00:00:31.801061,26,2.5,3.0,1.5,134,BOLLINGER,ATR,2.3,121,16,10,0.028999999999999998,66,34,13,0.012,83,10,10,0.041,ATR,2.8,34,3m,SUPERTREND,False,False,False,True,False,0.41,BOLLINGER,2.3,-54.936824978775874,-86.38386605441363,-70.66034551659476,1535.8545448154996,169.42023576232236,852.637390288911,3m,40,38,39.0,SUPERTREND,52.43421052631578,57.49999999999999,47.368421052631575,COMPLETE
946,-742.7037243760833,2026-01-16 00:08:34.838409,2026-01-16 00:08:54.982129,0 days 00:00:20.143720,26,2.5,2.7,1.5,133,BOLLINGER,PARABOLIC_SAR,2.3,117,16,10,0.028999999999999998,66,34,13,0.012,83,10,11,0.041,ATR,2.8,31,3m,SUPERTREND,False,False,False,True,False,0.41,BOLLINGER,2.3,-59.61547615830376,-88.25304536990025,-73.934260764102,1201.5100378026116,125.86220236460437,663.686120083608,3m,38,37,37.5,SUPERTREND,51.92034139402561,57.89473684210527,45.94594594594595,COMPLETE
