number,value,datetime_start,datetime_complete,duration,params_ADX_THRESHOLD,params_ATR_MULTIPLIER,params_ATR_STOP_LOSS_MULT,params_BB_STD,params_ENTRY_PERIOD,params_ENTRY_TYPE,params_EXIT_TYPE,params_LEVERAGE,params_MA_PERIOD,params_MFI_THRESHOLD,params_MFI_WINDOW,params_RISK_PER_TRADE,params_RSI_OVERBOUGHT,params_RSI_OVERSOLD,params_RSI_WINDOW,params_SAR_STEP,params_STOCH_OVERBOUGHT,params_STOCH_OVERSOLD,params_STOCH_WINDOW,params_STOP_LOSS_PCT,params_STOP_LOSS_TYPE,params_SUPERTREND_MULT,params_SUPERTREND_PERIOD,params_TIMEFRAME,params_TREND_FILTER_TYPE,params_USE_ADX,params_USE_MFI,params_USE_RSI,params_USE_STOCHASTIC,params_USE_VHF,params_VHF_THRESHOLD,user_attrs_entry_type,user_attrs_leverage,user_attrs_mdd_BTC_USDT,user_attrs_mdd_ETH_USDT,user_attrs_mdd_avg,user_attrs_return_BTC_USDT,user_attrs_return_ETH_USDT,user_attrs_return_avg,user_attrs_timeframe,user_attrs_trades_BTC_USDT,user_attrs_trades_ETH_USDT,user_attrs_trades_avg,user_attrs_trend_filter,user_attrs_win_rate_avg,user_attrs_winrate_BTC_USDT,user_attrs_winrate_ETH_USDT,state
431,788.2616325115832,2026-01-15 23:43:55.038731,2026-01-15 23:44:08.383397,0 days 00:00:13.344666,15,2.5,3.8000000000000003,1.6,148,BOLLINGER,PARABOLIC_SAR,1.85,61,18,15,0.033,73,27,17,0.047,80,14,14,0.048,ATR,2.1,16,5m,SUPERTREND,False,True,False,False,False,0.44999999999999996,BOLLINGER,1.85,-28.160018986578905,-79.92555008937144,-54.04278453797517,2273.7537203368715,101.67168763227514,1187.7127039845734,5m,47,51,49.0,SUPERTREND,54.38047559449311,61.702127659574465,47.05882352941176,COMPLETE
432,788.2616325115832,2026-01-15 23:43:56.462195,2026-01-15 23:44:09.358301,0 days 00:00:12.896106,15,2.5,3.7,1.6,148,BOLLINGER,PARABOLIC_SAR,1.85,61,18,15,0.033,73,27,17,0.014,80,14,14,0.047,ATR,2.1,16,5m,SUPERTREND,False,True,False,False,False,0.44,BOLLINGER,1.85,-28.160018986578905,-79.92555008937144,-54.04278453797517,2273.7537203368715,101.67168763227514,1187.7127039845734,5m,47,51,49.0,SUPERTREND,54.38047559449311,61.702127659574465,47.05882352941176,COMPLETE
433,-361.35117852520034,2026-01-15 23:44:00.924821,2026-01-15 23:44:10.403595,0 days 00:00:09.478774,15,2.5,3.7,1.6,148,BOLLINGER,PARABOLIC_SAR,1.85,39,18,15,0.033,72,26,17,0.014,80,14,14,0.047,ATR,2.1,16,1h,SUPERTREND,False,True,False,False,False,0.44,BOLLINGER,1.85,-34.187005653864844,-78.74685448934409,-56.466930071604466,1562.9763772563722,75.80642069009508,819.3913989732337,1h,45,49,47.0,SUPERTREND,54.48979591836735,60.0,48.97959183673469,COMPLETE
434,-2243.130521035626,2026-01-15 23:44:06.420736,2026-01-15 23:44:12.052204,0 days 00:00:05.631468,15,2.4,3.7,1.6,148,DONCHIAN,PARABOLIC_SAR,1.8,40,18,15,0.033,72,27,17,0.013000000000000001,80,14,14,0.047,ATR,2.0,16,1h,SUPERTREND,False,True,False,False,False,0.45999999999999996,DONCHIAN,1.8,-50.18882308279192,-49.961129519877176,-50.074976301334544,74.89775440544912,122.30350279325563,98.60062859935238,1h,34,26,30.0,SUPERTREND,50.452488687782804,47.05882352941176,53.84615384615385,COMPLETE
435,-2181.096822492433,2026-01-15 23:44:06.598248,2026-01-15 23:44:12.892523,0 days 00:00:06.294275,15,2.4,3.7,1.6,148,DONCHIAN,PARABOLIC_SAR,1.8,38,18,15,0.033,72,27,17,0.013000000000000001,80,14,14,0.047,ATR,2.0,16,5m,SUPERTREND,False,True,False,False,False,0.45999999999999996,DONCHIAN,1.8,-45.13789872711772,-48.23240564842204,-46.68515218776988,204.00605030796788,117.02601795782164,160.51603413289476,5m,35,27,31.0,SUPERTREND,51.64021164021163,51.42857142857142,51.85185185185185,COMPLETE
436,940.0407557904364,2026-01-15 23:44:08.157423,2026-01-15 23:44:22.449393,0 days 00:00:14.291970,15,2.4,3.7,1.6,150,BOLLINGER,PARABOLIC_SAR,1.8,39,18,15,0.033,72,27,17,0.013000000000000001,80,14,14,0.047,ATR,1.9,17,5m,SUPERTREND,False,True,False,False,False,0.45999999999999996,BOLLINGER,1.8,-25.965333603839614,-72.41031297394477,-49.18782328889219,2540.194777862669,70.20837461633161,1305.2015762395004,5m,48,56,52.0,SUPERTREND,57.29166666666667,64.58333333333334,50.0,COMPLETE
437,-2266.01945998436,2026-01-15 23:44:08.939928,2026-01-15 23:44:12.768803,0 days 00:00:03.828875,15,2.4,3.6,2.4,148,DONCHIAN,PARABOLIC_SAR,1.8,47,18,15,0.033,72,27,17,0.013000000000000001,80,14,14,0.047,ATR,2.0,16,1h,SUPERTREND,False,True,False,False,False,0.45999999999999996,DONCHIAN,1.8,-50.18882308279192,-49.961129519877176,-50.074976301334544,74.89775440544912,99.2451902046375,87.0714723050433,1h,34,26,30.0,SUPERTREND,50.452488687782804,47.05882352941176,53.84615384615385,COMPLETE
438,950.0224332309817,2026-01-15 23:44:09.507636,2026-01-15 23:44:18.488465,0 days 00:00:08.980829,15,2.4,3.6,1.6,147,BOLLINGER,PARABOLIC_SAR,1.8,39,18,15,0.034,72,27,16,0.013000000000000001,80,13,14,0.047,ATR,1.9,17,5m,SUPERTREND,False,True,False,False,False,0.45999999999999996,BOLLINGER,1.8,-26.753008773030558,-74.56235376047074,-50.65768126675065,2738.9049438253514,20.29683407366206,1379.6008889495067,5m,47,57,52.0,SUPERTREND,57.54012691302725,65.95744680851064,49.122807017543856,COMPLETE
439,-2214.502949345198,2026-01-15 23:44:11.369129,2026-01-15 23:44:26.080378,0 days 00:00:14.711249,15,2.4,3.6,1.6,150,DONCHIAN,PARABOLIC_SAR,1.8,43,17,15,0.034,73,27,16,0.013000000000000001,80,13,14,0.047,ATR,1.9,17,5m,SUPERTREND,False,True,False,False,False,0.45999999999999996,DONCHIAN,1.8,-45.13789872711772,-48.2173156951794,-46.67760721114856,204.00605030796788,85.2396260877484,144.62283819785813,5m,35,27,31.0,SUPERTREND,51.64021164021163,51.42857142857142,51.85185185185185,COMPLETE
440,913.862391980043,2026-01-15 23:44:12.259531,2026-01-15 23:44:26.585298,0 days 00:00:14.325767,15,2.4,3.6,1.6,150,BOLLINGER,PARABOLIC_SAR,1.8,47,17,15,0.034,73,27,16,0.012,80,13,14,0.05,ATR,1.9,17,5m,SUPERTREND,False,True,False,False,False,0.45999999999999996,BOLLINGER,1.8,-25.965333603839614,-72.39572675161308,-49.18053017772635,2540.194777862669,45.27905901614213,1292.7369184394056,5m,48,56,52.0,SUPERTREND,57.29166666666667,64.58333333333334,50.0,COMPLETE
441,980.0328562744571,2026-01-15 23:44:12.833282,2026-01-15 23:44:28.692280,0 days 00:00:15.858998,15,2.4,3.8000000000000003,1.6,146,BOLLINGER,PARABOLIC_SAR,1.8,43,17,15,0.034,73,27,16,0.013000000000000001,80,13,14,0.05,ATR,1.9,17,5m,SUPERTREND,False,True,False,False,False,0.45999999999999996,BOLLINGER,1.8,-26.756624399007816,-75.1498911752982,-50.95325778715301,2772.4265877074013,35.854420549909584,1404.1405041286555,5m,47,57,52.0,SUPERTREND,57.54012691302725,65.95744680851064,49.122807017543856,COMPLETE
442,-314.545557774567,2026-01-15 23:44:12.952252,2026-01-15 23:44:28.690277,0 days 00:00:15.738025,15,2.4,3.8000000000000003,1.6,150,BOLLINGER,PARABOLIC_SAR,1.8,43,17,15,0.034,73,27,16,0.015,80,13,14,0.047,ATR,1.8,17,5m,ICHIMOKU,False,True,False,False,False,0.45999999999999996,BOLLINGER,1.8,-51.01237299487285,-85.69499112875617,-68.35368206181451,1073.7411874989289,-23.53570809087986,525.1027397040245,5m,64,74,69.0,ICHIMOKU,50.992398648648646,54.6875,47.2972972972973,COMPLETE
443,870.5294228171506,2026-01-15 23:44:22.064530,2026-01-15 23:44:33.055072,0 days 00:00:10.990542,15,2.3,3.8000000000000003,1.6,146,BOLLINGER,PARABOLIC_SAR,1.8,43,17,15,0.034,73,27,16,0.012,80,13,14,0.047,ATR,1.9,17,5m,SUPERTREND,False,True,False,False,False,0.44999999999999996,BOLLINGER,1.8,-26.169018072664308,-78.62383649021439,-52.396427281439344,2201.6362480622074,43.72857934809327,1122.6824137051503,5m,52,60,56.0,SUPERTREND,56.6025641025641,61.53846153846154,51.66666666666667,COMPLETE
444,-469.37403517721305,2026-01-15 23:44:25.323223,2026-01-15 23:44:35.677028,0 days 00:00:10.353805,15,2.3,3.8000000000000003,1.6,150,BOLLINGER,PARABOLIC_SAR,1.8,43,17,15,0.034,74,27,16,0.012,80,13,14,0.036000000000000004,ATR,1.9,17,5m,ICHIMOKU,False,True,False,False,False,0.45999999999999996,BOLLINGER,1.8,-54.168202772218486,-87.68359616721109,-70.92589946971479,804.9885668151492,-13.307439143467741,395.8405638358407,5m,70,78,74.0,ICHIMOKU,50.07326007326007,51.42857142857142,48.717948717948715,COMPLETE
445,-640.9915430704878,2026-01-15 23:44:26.871336,2026-01-15 23:44:40.170475,0 days 00:00:13.299139,15,2.3,3.6,1.7,146,BOLLINGER,PARABOLIC_SAR,1.75,38,17,15,0.034,72,27,16,0.012,80,13,14,0.05,ATR,2.3,15,5m,ICHIMOKU,False,True,False,False,False,0.44999999999999996,BOLLINGER,1.75,-64.1667934238981,-74.70300836491705,-69.43490089440758,482.9866261906495,48.04542294978141,265.51602457021545,5m,67,72,69.5,ICHIMOKU,53.25456053067994,53.73134328358209,52.77777777777778,COMPLETE
446,775.7674049035577,2026-01-15 23:44:27.342075,2026-01-15 23:44:43.040220,0 days 00:00:15.698145,15,2.3,3.6,1.6,150,BOLLINGER,PARABOLIC_SAR,1.75,35,17,14,0.034,72,27,16,0.012,80,13,14,0.049,ATR,2.3,17,5m,SUPERTREND,False,True,False,False,False,0.44999999999999996,BOLLINGER,1.75,-24.69860300562375,-72.97627968953981,-48.83744134758178,1867.8721773689397,69.55190894698514,968.7120431579624,5m,53,59,56.0,SUPERTREND,56.45986568596099,60.37735849056604,52.54237288135594,COMPLETE
447,1007.6383536325638,2026-01-15 23:44:28.890386,2026-01-15 23:44:41.640147,0 days 00:00:12.749761,15,2.4,3.6,1.7,146,BOLLINGER,PARABOLIC_SAR,1.75,35,17,14,0.035,72,27,16,0.012,80,13,14,0.05,ATR,1.9,17,5m,SUPERTREND,False,True,False,False,False,0.44999999999999996,BOLLINGER,1.75,-24.735976182820444,-69.9021447801791,-47.319060481499776,2644.105280751387,56.67272671090351,1350.3890037311453,5m,44,53,48.5,SUPERTREND,58.426243567753005,65.9090909090909,50.943396226415096,COMPLETE
448,736.6891578265577,2026-01-15 23:44:29.353530,2026-01-15 23:44:42.363234,0 days 00:00:13.009704,15,2.3,3.6,1.7,150,BOLLINGER,PARABOLIC_SAR,1.8,36,17,14,0.035,72,27,16,0.012,80,13,14,0.05,ATR,1.9,17,5m,SUPERTREND,False,True,False,False,False,0.44999999999999996,BOLLINGER,1.8,-29.35812565818889,-69.53743618355622,-49.44778092087256,2121.3287664223417,101.96422482146663,1111.6464956219043,5m,49,56,52.5,SUPERTREND,59.31122448979592,63.26530612244898,55.35714285714286,COMPLETE
449,628.4267276465052,2026-01-15 23:44:34.124414,2026-01-15 23:44:45.698103,0 days 00:00:11.573689,15,2.2,3.6,1.7,150,BOLLINGER,PARABOLIC_SAR,1.75,35,17,14,0.035,72,27,16,0.012,80,13,14,0.05,ATR,1.9,17,5m,SUPERTREND,False,True,False,False,False,0.44999999999999996,BOLLINGER,1.75,-24.973316889943206,-74.47472302202999,-49.7240199559866,1685.3619393123581,21.696579130121297,853.5292592212397,5m,53,60,56.5,SUPERTREND,57.075471698113205,64.15094339622641,50.0,COMPLETE
450,683.8676229663088,2026-01-15 23:44:38.296491,2026-01-15 23:44:53.326700,0 days 00:00:15.030209,15,2.3,3.5,1.7,146,BOLLINGER,PARABOLIC_SAR,1.75,33,17,14,0.035,72,27,16,0.012,80,13,14,0.05,ATR,2.3,17,5m,SUPERTREND,False,True,False,False,False,0.44999999999999996,BOLLINGER,1.75,-29.29842271090537,-61.67787722227565,-45.48814996659051,1912.8439909578963,146.6277515457053,1029.7358712518007,5m,49,55,52.0,SUPERTREND,59.814471243042675,63.26530612244898,56.36363636363636,COMPLETE
451,680.6102544747537,2026-01-15 23:44:41.633629,2026-01-15 23:44:54.020304,0 days 00:00:12.386675,15,2.3,3.6,1.7,146,BOLLINGER,PARABOLIC_SAR,1.75,41,17,14,0.035,72,27,16,0.012,80,13,14,0.05,ATR,1.9,17,5m,SUPERTREND,False,True,False,False,False,0.44999999999999996,BOLLINGER,1.75,-29.29842271090537,-61.67696090258071,-45.487691806743044,1912.8439909578963,143.37077437055902,1028.1073826642275,5m,49,55,52.0,SUPERTREND,59.814471243042675,63.26530612244898,56.36363636363636,COMPLETE
452,815.6418326748244,2026-01-15 23:44:41.710725,2026-01-15 23:44:53.609271,0 days 00:00:11.898546,15,2.3,3.6,1.6,150,BOLLINGER,PARABOLIC_SAR,1.8,32,17,14,0.035,71,27,16,0.011,80,13,14,0.05,ATR,1.9,17,5m,SUPERTREND,False,True,False,False,False,0.44999999999999996,BOLLINGER,1.8,-25.364681010089107,-74.13268536544967,-49.74868318776939,1991.9331949277737,65.10094465209897,1028.5170697899364,5m,53,59,56.0,SUPERTREND,56.45986568596099,60.37735849056604,52.54237288135594,COMPLETE
453,661.922493688854,2026-01-15 23:44:42.605727,2026-01-15 23:44:53.916200,0 days 00:00:11.310473,15,2.3,3.6,1.7,146,BOLLINGER,PARABOLIC_SAR,1.9500000000000002,32,17,14,0.035,71,27,16,0.011,80,13,14,0.049,ATR,1.8,17,5m,SUPERTREND,False,True,False,False,False,0.44,BOLLINGER,1.9500000000000002,-32.32624873340691,-66.71438182298162,-49.52031527819427,2470.1555988276477,130.49518996664676,1300.3253943971472,5m,49,55,52.0,SUPERTREND,59.814471243042675,63.26530612244898,56.36363636363636,COMPLETE
454,196.2209940253797,2026-01-15 23:44:43.895757,2026-01-15 23:44:55.041631,0 days 00:00:11.145874,22,2.3,3.7,1.6,146,BOLLINGER,PARABOLIC_SAR,1.9,30,17,14,0.035,72,27,16,0.011,80,13,14,0.05,ATR,1.8,14,30m,SUPERTREND,False,True,False,False,False,0.44,BOLLINGER,1.9,-33.45023509766774,-82.81965490880722,-58.13494500323748,1576.4597233091695,29.157035081156437,802.808379195163,30m,52,58,55.0,SUPERTREND,52.88461538461539,55.769230769230774,50.0,COMPLETE
455,223.5575644029759,2026-01-15 23:44:46.132783,2026-01-15 23:44:55.350354,0 days 00:00:09.217571,15,2.3,3.7,1.6,146,BOLLINGER,PARABOLIC_SAR,1.9500000000000002,33,17,14,0.035,73,27,16,0.011,80,13,14,0.05,ATR,1.8,17,30m,SUPERTREND,False,True,False,False,False,0.44,BOLLINGER,1.9500000000000002,-34.23361826297136,-83.7376946428977,-58.98565645293453,1657.7913403687103,24.425860816967884,841.1086005928391,30m,52,58,55.0,SUPERTREND,52.88461538461539,55.769230769230774,50.0,COMPLETE
456,-2830.9782373313305,2026-01-15 23:44:53.705579,2026-01-15 23:45:00.623589,0 days 00:00:06.918010,15,2.4,3.7,2.7,146,BOLLINGER,PARABOLIC_SAR,1.9,38,18,14,0.035,71,27,15,0.011,80,13,14,0.049,ATR,1.8,14,30m,SUPERTREND,False,True,False,False,False,0.44,BOLLINGER,1.9,-51.945336860371135,-42.89638619499214,-47.42086152768164,161.99431439461605,75.52406768629652,118.75919104045629,30m,22,22,22.0,SUPERTREND,52.272727272727266,54.54545454545454,50.0,COMPLETE
457,1074.312432756442,2026-01-15 23:44:53.661414,2026-01-15 23:45:06.247566,0 days 00:00:12.586152,15,2.4,3.5,1.6,146,BOLLINGER,PARABOLIC_SAR,1.9,38,18,14,0.035,73,27,15,0.011,80,13,14,0.049,ATR,1.9,15,5m,SUPERTREND,False,True,False,False,False,0.44,BOLLINGER,1.9,-28.074925928618587,-77.38500089425021,-52.7299634114344,3184.6716549773605,8.423754256879143,1596.5477046171197,5m,47,57,52.0,SUPERTREND,57.54012691302725,65.95744680851064,49.122807017543856,COMPLETE
458,443.98604225964755,2026-01-15 23:44:53.964760,2026-01-15 23:44:58.217385,0 days 00:00:04.252625,16,2.4,3.5,1.6,145,BOLLINGER,PARABOLIC_SAR,1.9,40,18,15,0.034,73,26,18,0.013000000000000001,80,13,14,0.049,ATR,1.8,14,30m,SUPERTREND,False,True,False,False,False,0.45999999999999996,BOLLINGER,1.9,-35.39442018466786,-79.74575655734435,-57.57008837100611,2352.901360958121,81.15480446584075,1217.028082711981,30m,46,53,49.5,SUPERTREND,54.019688269073015,60.86956521739131,47.16981132075472,COMPLETE
459,443.98604225964755,2026-01-15 23:44:54.443050,2026-01-15 23:45:05.013001,0 days 00:00:10.569951,16,2.4,3.7,1.6,145,BOLLINGER,PARABOLIC_SAR,1.9,40,18,15,0.034,73,26,15,0.013000000000000001,80,13,14,0.049,ATR,1.8,14,30m,SUPERTREND,False,True,False,False,False,0.43,BOLLINGER,1.9,-35.39442018466786,-79.74575655734435,-57.57008837100611,2352.901360958121,81.15480446584075,1217.028082711981,30m,46,53,49.5,SUPERTREND,54.019688269073015,60.86956521739131,47.16981132075472,COMPLETE
460,985.7892966102763,2026-01-15 23:44:55.195678,2026-01-15 23:45:04.531150,0 days 00:00:09.335472,16,2.4,3.5,1.6,145,BOLLINGER,PARABOLIC_SAR,1.8,39,18,15,0.034,73,26,14,0.013000000000000001,80,13,14,0.049,ATR,2.2,15,5m,SUPERTREND,False,True,False,False,False,0.45999999999999996,BOLLINGER,1.8,-27.47952890410112,-74.40228055941192,-50.94090473175652,2726.7115124144157,77.52009771625856,1402.115805065337,5m,47,55,51.0,SUPERTREND,57.524177949709866,65.95744680851064,49.09090909090909,COMPLETE
461,1129.067732565134,2026-01-15 23:44:55.409093,2026-01-15 23:45:05.035171,0 days 00:00:09.626078,16,2.4,3.8000000000000003,1.6,145,BOLLINGER,PARABOLIC_SAR,1.9,39,18,15,0.034,73,26,15,0.013000000000000001,80,13,14,0.049,ATR,2.2,15,5m,SUPERTREND,False,True,False,False,False,0.45999999999999996,BOLLINGER,1.9,-28.82412190773538,-76.73391595660536,-52.779018932170366,3129.5443088010834,96.66164095996851,1613.1029748805258,5m,47,55,51.0,SUPERTREND,57.524177949709866,65.95744680851064,49.09090909090909,COMPLETE
462,980.0328562744571,2026-01-15 23:44:58.778387,2026-01-15 23:45:09.985361,0 days 00:00:11.206974,16,2.4,3.8000000000000003,1.6,146,BOLLINGER,PARABOLIC_SAR,1.8,38,18,15,0.034,73,27,15,0.013000000000000001,81,15,14,0.048,ATR,2.0,15,5m,SUPERTREND,False,True,False,False,False,0.53,BOLLINGER,1.8,-26.756624399007816,-75.1498911752982,-50.95325778715301,2772.4265877074013,35.854420549909584,1404.1405041286555,5m,47,57,52.0,SUPERTREND,57.54012691302725,65.95744680851064,49.122807017543856,COMPLETE
463,1072.0092738184085,2026-01-15 23:45:01.375892,2026-01-15 23:45:09.911762,0 days 00:00:08.535870,16,2.4,3.8000000000000003,1.6,145,BOLLINGER,PARABOLIC_SAR,1.85,44,18,15,0.034,73,27,15,0.013000000000000001,81,15,14,0.048,ATR,2.0,15,5m,SUPERTREND,False,True,False,False,False,0.45999999999999996,BOLLINGER,1.85,-28.154107932918215,-75.59640018567751,-51.87525405929786,2923.099005708773,101.05255144204163,1512.0757785754072,5m,47,55,51.0,SUPERTREND,57.524177949709866,65.95744680851064,49.09090909090909,COMPLETE
464,1072.0092738184085,2026-01-15 23:45:04.854861,2026-01-15 23:45:21.137099,0 days 00:00:16.282238,16,2.4,3.8000000000000003,1.6,145,BOLLINGER,PARABOLIC_SAR,1.85,39,18,15,0.034,73,26,15,0.013000000000000001,81,15,14,0.048,ATR,2.0,15,5m,SUPERTREND,False,True,False,False,False,0.45999999999999996,BOLLINGER,1.85,-28.154107932918215,-75.59640018567751,-51.87525405929786,2923.099005708773,101.05255144204163,1512.0757785754072,5m,47,55,51.0,SUPERTREND,57.524177949709866,65.95744680851064,49.09090909090909,COMPLETE
465,667.0275900848674,2026-01-15 23:45:06.108110,2026-01-15 23:45:22.479163,0 days 00:00:16.371053,16,2.2,3.5,1.7,150,BOLLINGER,PARABOLIC_SAR,1.8,37,18,16,0.034,73,26,15,0.012,81,15,14,0.048,ATR,2.2,15,5m,SUPERTREND,False,True,False,False,False,0.45999999999999996,BOLLINGER,1.8,-25.64984454715118,-75.60109363345092,-50.625469090301046,1795.335507545515,19.396725762431323,907.3661166539731,5m,53,60,56.5,SUPERTREND,57.075471698113205,64.15094339622641,50.0,COMPLETE
466,1097.2037143463067,2026-01-15 23:45:06.108612,2026-01-15 23:45:15.862745,0 days 00:00:09.754133,16,2.4,3.5,1.7,150,BOLLINGER,PARABOLIC_SAR,1.85,37,18,13,0.034,73,27,15,0.012,81,14,14,0.049,ATR,2.0,15,5m,SUPERTREND,False,True,False,False,False,0.53,BOLLINGER,1.85,-26.147642853266934,-77.57557316506484,-51.861608009165884,3059.638333530749,23.80954966213375,1541.7239415964414,5m,44,54,49.0,SUPERTREND,59.090909090909086,68.18181818181817,50.0,COMPLETE
467,1097.2037143463067,2026-01-15 23:45:06.351276,2026-01-15 23:45:21.310037,0 days 00:00:14.958761,16,2.4,3.5,1.7,150,BOLLINGER,PARABOLIC_SAR,1.85,37,18,13,0.034,73,26,14,0.012,81,14,14,0.049,ATR,2.2,15,5m,SUPERTREND,False,True,False,False,False,0.53,BOLLINGER,1.85,-26.147642853266934,-77.57557316506484,-51.861608009165884,3059.638333530749,23.80954966213375,1541.7239415964414,5m,44,54,49.0,SUPERTREND,59.090909090909086,68.18181818181817,50.0,COMPLETE
468,-2335.8704531102817,2026-01-15 23:45:10.620553,2026-01-15 23:45:23.717958,0 days 00:00:13.097405,16,2.1,3.5,1.7,143,BOLLINGER,PARABOLIC_SAR,1.8,35,18,13,0.035,73,26,15,0.012,81,15,14,0.05,ATR,2.0,15,5m,SUPERTREND,False,True,False,False,True,0.53,BOLLINGER,1.8,-52.17180631391444,-45.25496638465171,-48.71338634928307,143.9517847476562,-11.24367448458064,66.35405513153778,5m,32,23,27.5,SUPERTREND,54.211956521739125,56.25,52.17391304347826,COMPLETE
469,-2347.347476095591,2026-01-15 23:45:10.707687,2026-01-15 23:45:24.366825,0 days 00:00:13.659138,16,2.2,3.5,1.7,142,BOLLINGER,PARABOLIC_SAR,1.8,36,18,13,0.035,73,26,15,0.012,81,15,14,0.05,ATR,2.2,15,5m,SUPERTREND,False,True,False,False,True,0.53,BOLLINGER,1.8,-53.71093517715244,-49.70815783081127,-51.709546503981855,147.2460070152217,-22.945762528962035,62.15012224312983,5m,30,22,26.0,SUPERTREND,51.06060606060606,56.666666666666664,45.45454545454545,COMPLETE
470,-2877.32936595269,2026-01-15 23:45:16.952758,2026-01-15 23:45:33.503386,0 days 00:00:16.550628,16,2.2,3.5,1.7,150,BOLLINGER,PARABOLIC_SAR,1.8,33,18,13,0.035,73,26,15,0.011,81,14,14,0.05,ATR,2.0,15,5m,SUPERTREND,False,True,False,False,True,0.53,BOLLINGER,1.8,-49.39489842427467,-50.15363839451549,-49.77426840939508,173.27277820021126,-23.650695505560886,74.81104134732519,5m,29,22,25.5,SUPERTREND,52.037617554858926,58.620689655172406,45.45454545454545,COMPLETE
471,-2300.0,2026-01-15 23:45:21.664397,2026-01-15 23:45:36.611859,0 days 00:00:14.947462,16,2.2,3.5,1.7,13,BOLLINGER,PARABOLIC_SAR,1.9,29,18,13,0.035,73,26,15,0.011,81,15,14,0.05,ATR,2.2,14,5m,SUPERTREND,False,False,False,False,False,0.53,BOLLINGER,1.9,0.0,0.0,0.0,0.0,0.0,0.0,5m,0,0,0.0,SUPERTREND,0.0,0.0,0.0,COMPLETE
472,605.2628162122228,2026-01-15 23:45:21.845541,2026-01-15 23:45:33.485200,0 days 00:00:11.639659,16,2.2,3.5,1.8,150,BOLLINGER,PARABOLIC_SAR,1.9,28,18,13,0.035,73,26,15,0.011,81,15,14,0.05,ATR,2.4000000000000004,14,5m,SUPERTREND,False,False,False,False,False,0.53,BOLLINGER,1.9,-26.637003370137517,-76.5309477186912,-51.58397554441436,1693.600733944009,31.128465672989236,862.3645998084992,5m,50,56,53.0,SUPERTREND,56.892857142857146,62.0,51.78571428571429,COMPLETE
473,-2321.2308258322096,2026-01-15 23:45:22.949632,2026-01-15 23:45:35.915756,0 days 00:00:12.966124,16,2.1,3.4000000000000004,1.7,150,BOLLINGER,PARABOLIC_SAR,1.9,30,18,13,0.035,72,26,15,0.011,81,15,14,0.05,ATR,2.5,14,5m,SUPERTREND,False,False,False,False,True,0.53,BOLLINGER,1.9,-49.80269899353863,-46.63739924741538,-48.220049120477,179.28346468232158,-12.990103700370238,83.14668049097567,5m,31,23,27.0,SUPERTREND,55.11921458625526,58.06451612903226,52.17391304347826,COMPLETE
