number,value,datetime_start,datetime_complete,duration,params_ADX_THRESHOLD,params_ATR_MULTIPLIER,params_ATR_STOP_LOSS_MULT,params_BB_STD,params_ENTRY_PERIOD,params_ENTRY_TYPE,params_EXIT_TYPE,params_LEVERAGE,params_MA_PERIOD,params_MFI_THRESHOLD,params_MFI_WINDOW,params_RISK_PER_TRADE,params_RSI_OVERBOUGHT,params_RSI_OVERSOLD,params_RSI_WINDOW,params_SAR_STEP,params_STOCH_OVERBOUGHT,params_STOCH_OVERSOLD,params_STOCH_WINDOW,params_STOP_LOSS_PCT,params_STOP_LOSS_TYPE,params_SUPERTREND_MULT,params_SUPERTREND_PERIOD,params_TIMEFRAME,params_TREND_FILTER_TYPE,params_USE_ADX,params_USE_MFI,params_USE_RSI,params_USE_STOCHASTIC,params_USE_VHF,params_VHF_THRESHOLD,user_attrs_entry_type,user_attrs_leverage,user_attrs_mdd_BTC_USDT,user_attrs_mdd_ETH_USDT,user_attrs_mdd_avg,user_attrs_return_BTC_USDT,user_attrs_return_ETH_USDT,user_attrs_return_avg,user_attrs_timeframe,user_attrs_trades_BTC_USDT,user_attrs_trades_ETH_USDT,user_attrs_trades_avg,user_attrs_trend_filter,user_attrs_win_rate_avg,user_attrs_winrate_BTC_USDT,user_attrs_winrate_ETH_USDT,state
947,-504.8058894830401,2026-01-16 00:08:41.355827,2026-01-16 00:08:54.995360,0 days 00:00:13.639533,26,2.5,2.9000000000000004,1.5,133,BOLLINGER,ATR,2.3,120,16,10,0.028999999999999998,66,34,13,0.012,83,10,10,0.04,ATR,2.8,34,3m,MACD,False,False,False,False,False,0.4,BOLLINGER,2.3,-55.281939140306356,-93.12458317968817,-74.20326115999727,792.7851733834818,-52.65070865476892,370.06723236435647,3m,59,68,63.5,MACD,47.706879361914254,54.23728813559322,41.17647058823529,COMPLETE
948,1654.4877705460722,2026-01-16 00:08:41.394839,2026-01-16 00:09:03.442406,0 days 00:00:22.047567,26,2.5,2.9000000000000004,1.5,133,BOLLINGER,ATR,2.3,121,16,10,0.028999999999999998,66,34,13,0.013000000000000001,83,10,10,0.039,ATR,2.8,5,3m,SUPERTREND,False,False,False,False,False,0.41,BOLLINGER,2.3,-35.53666485540414,-83.47973120820433,-59.508198031804234,5806.714658028194,126.727824487203,2966.7212412576987,3m,48,55,51.5,SUPERTREND,54.88636363636364,62.5,47.27272727272727,COMPLETE
949,1628.5242034759576,2026-01-16 00:08:41.582054,2026-01-16 00:09:04.490239,0 days 00:00:22.908185,26,2.5,2.9000000000000004,1.5,132,BOLLINGER,ATR,2.3,121,16,10,0.028000000000000004,66,34,13,0.013000000000000001,83,10,10,0.039,ATR,2.8,5,3m,SUPERTREND,False,False,False,False,False,0.41,BOLLINGER,2.3,-36.01408891898764,-83.8220622636084,-59.91807559129802,5782.792823744494,119.37446331791533,2951.0836435312044,3m,48,55,51.5,SUPERTREND,54.88636363636364,62.5,47.27272727272727,COMPLETE
950,1659.1065942231899,2026-01-16 00:08:41.614078,2026-01-16 00:09:02.964499,0 days 00:00:21.350421,26,2.5,2.8,1.5,133,BOLLINGER,ATR,2.3,115,16,10,0.028000000000000004,66,34,13,0.013000000000000001,83,10,10,0.04,ATR,2.8,5,3m,SUPERTREND,False,False,False,False,False,0.41,BOLLINGER,2.3,-35.53666485540414,-83.48050109830214,-59.50858297685314,5806.714658028194,130.7088126608719,2968.711735344533,3m,48,55,51.5,SUPERTREND,54.88636363636364,62.5,47.27272727272727,COMPLETE
951,1603.1895668469606,2026-01-16 00:08:57.933818,2026-01-16 00:09:17.653380,0 days 00:00:19.719562,26,2.5,2.8,1.5,133,BOLLINGER,ATR,2.25,124,16,10,0.028000000000000004,66,34,13,0.013000000000000001,83,10,10,0.039,ATR,2.8,34,3m,SUPERTREND,False,False,False,False,False,0.41,BOLLINGER,2.25,-34.78201323347572,-82.55690611504053,-58.66945967425813,5458.529407287186,139.60628691032193,2799.0678470987536,3m,48,55,51.5,SUPERTREND,54.88636363636364,62.5,47.27272727272727,COMPLETE
952,1618.1193521484583,2026-01-16 00:08:57.966294,2026-01-16 00:09:16.013826,0 days 00:00:18.047532,26,2.5,2.9000000000000004,1.5,135,BOLLINGER,ATR,2.25,123,16,10,0.028999999999999998,66,34,13,0.013000000000000001,83,10,10,0.039,ATR,2.8,33,3m,SUPERTREND,False,False,False,False,False,0.41,BOLLINGER,2.25,-34.245697106394715,-80.79289837368349,-57.5192977400391,5336.896030154453,166.502122022754,2751.6990760886033,3m,49,54,51.5,SUPERTREND,53.66591080876795,59.183673469387756,48.148148148148145,COMPLETE
953,663.9214183872,2026-01-16 00:09:00.736352,2026-01-16 00:09:13.873588,0 days 00:00:13.137236,26,2.5,2.8,1.5,134,BOLLINGER,ATR,2.25,124,16,10,0.028999999999999998,66,34,13,0.013000000000000001,83,10,10,0.039,ATR,2.8,36,4h,SUPERTREND,False,False,False,False,False,0.41,BOLLINGER,2.25,-34.235415850473075,-86.93119278857341,-60.58330431952324,2974.127058570841,-8.41567466128324,1482.8556919547789,4h,47,52,49.5,SUPERTREND,56.91489361702128,63.829787234042556,50.0,COMPLETE
954,1361.2612637910024,2026-01-16 00:09:03.050608,2026-01-16 00:09:16.939797,0 days 00:00:13.889189,26,2.6,2.9000000000000004,1.5,132,BOLLINGER,ATR,2.25,114,16,10,0.028000000000000004,66,34,13,0.013000000000000001,83,10,10,0.041,ATR,2.8,32,3m,SUPERTREND,False,False,False,False,False,0.41,BOLLINGER,2.25,-38.54353993732661,-83.8126823592923,-61.178111148309455,5081.902411058729,90.17023084383537,2586.036320951282,3m,45,53,49.0,SUPERTREND,53.58490566037736,60.0,47.16981132075472,COMPLETE
955,1016.9368992592217,2026-01-16 00:09:03.951466,2026-01-16 00:09:20.234299,0 days 00:00:16.282833,26,2.6,2.9000000000000004,1.5,130,BOLLINGER,ATR,2.3,114,16,10,0.028000000000000004,66,34,13,0.013000000000000001,83,10,10,0.039,ATR,2.8,35,3m,SUPERTREND,False,False,False,False,False,0.41,BOLLINGER,2.3,-39.395956787644835,-84.00364992952342,-61.69980335858413,4039.4053295038875,71.46455893837079,2055.434944221129,3m,46,53,49.5,SUPERTREND,52.93273174733388,58.69565217391305,47.16981132075472,COMPLETE
956,1055.09601624878,2026-01-16 00:09:04.579485,2026-01-16 00:09:19.942665,0 days 00:00:15.363180,26,2.6,2.8,1.5,130,BOLLINGER,ATR,2.3,113,16,10,0.028000000000000004,66,34,13,0.013000000000000001,83,10,10,0.039,ATR,2.8,34,4h,SUPERTREND,False,False,False,False,False,0.41,BOLLINGER,2.3,-33.74493347078494,-94.25317670580043,-63.999055088292685,4218.853097881429,-71.25102735127598,2073.8010352650763,4h,42,51,46.5,SUPERTREND,53.71148459383754,64.28571428571429,43.13725490196079,COMPLETE
957,1603.2288735820084,2026-01-16 00:09:15.710798,2026-01-16 00:09:38.568305,0 days 00:00:22.857507,26,2.5,2.9000000000000004,1.5,131,BOLLINGER,ATR,2.3,123,16,10,0.027000000000000003,66,34,13,0.013000000000000001,83,10,10,0.038,ATR,2.8,5,3m,SUPERTREND,False,False,False,False,False,0.41,BOLLINGER,2.3,-36.053799873177375,-83.25932763389025,-59.65656375353382,5731.436448979909,108.5257492952155,2919.981099137562,3m,48,55,51.5,SUPERTREND,54.88636363636364,62.5,47.27272727272727,COMPLETE
958,1398.4573681573202,2026-01-16 00:09:16.854033,2026-01-16 00:09:29.720103,0 days 00:00:12.866070,26,2.6,2.9000000000000004,1.5,131,BOLLINGER,ATR,2.3,115,16,10,0.028000000000000004,66,34,13,0.013000000000000001,83,10,10,0.039,ATR,2.8,33,3m,SUPERTREND,False,False,False,False,False,0.41,BOLLINGER,2.3,-39.38662872838353,-84.20704589943327,-61.7968373139084,5373.1499902365085,71.815796172933,2722.4828932047208,3m,45,53,49.0,SUPERTREND,53.58490566037736,60.0,47.16981132075472,COMPLETE
959,1007.3433810743372,2026-01-16 00:09:18.568828,2026-01-16 00:09:35.731862,0 days 00:00:17.163034,26,2.6,2.9000000000000004,1.5,129,BOLLINGER,ATR,2.3,114,16,10,0.028000000000000004,66,34,13,0.013000000000000001,83,10,10,0.038,ATR,2.8,33,3m,SUPERTREND,False,False,False,False,False,0.41,BOLLINGER,2.3,-39.39303303480041,-90.07623593237496,-64.73463448358768,3985.7615855181707,82.13594735448075,2033.9487664363257,3m,46,53,49.5,SUPERTREND,52.93273174733388,58.69565217391305,47.16981132075472,COMPLETE
960,1007.3433810743372,2026-01-16 00:09:18.744897,2026-01-16 00:09:39.541828,0 days 00:00:20.796931,26,2.6,2.9000000000000004,1.5,129,BOLLINGER,ATR,2.3,113,16,10,0.027000000000000003,66,34,13,0.013000000000000001,83,10,10,0.038,ATR,2.8,33,3m,SUPERTREND,False,False,False,False,False,0.41,BOLLINGER,2.3,-39.39303303480041,-90.07623593237496,-64.73463448358768,3985.7615855181707,82.13594735448075,2033.9487664363257,3m,46,53,49.5,SUPERTREND,52.93273174733388,58.69565217391305,47.16981132075472,COMPLETE
961,-1363.6850362007672,2026-01-16 00:09:20.000337,2026-01-16 00:09:43.351033,0 days 00:00:23.350696,26,2.6,2.9000000000000004,1.5,131,CCI,ATR,2.3,116,16,10,0.027000000000000003,66,34,13,0.013000000000000001,83,10,10,0.038,ATR,2.8,33,3m,SUPERTREND,False,False,False,False,False,0.41,CCI,2.3,-36.74032898316678,-74.53655737841393,-55.63844318079036,3336.0659937235623,140.2885441761027,1738.1772689498325,3m,27,29,28.0,SUPERTREND,59.32311621966794,70.37037037037037,48.275862068965516,COMPLETE
962,-1382.613025270236,2026-01-16 00:09:21.620746,2026-01-16 00:09:46.296588,0 days 00:00:24.675842,26,2.6,2.9000000000000004,1.5,132,CCI,ATR,2.25,116,16,10,0.027000000000000003,66,34,13,0.013000000000000001,83,10,10,0.038,ATR,2.8,32,3m,SUPERTREND,False,False,False,False,False,0.41,CCI,2.25,-35.94388697117654,-73.30498318218775,-54.62443507668215,3167.748003273892,148.6763266932926,1658.2121649835924,3m,27,29,28.0,SUPERTREND,59.32311621966794,70.37037037037037,48.275862068965516,COMPLETE
963,1419.7721597495774,2026-01-16 00:09:31.195354,2026-01-16 00:09:49.072702,0 days 00:00:17.877348,26,2.6,2.9000000000000004,1.5,132,BOLLINGER,ATR,2.3,116,16,10,0.027000000000000003,66,34,13,0.014,83,10,10,0.039,ATR,2.8,33,3m,SUPERTREND,False,False,False,False,False,0.41,BOLLINGER,2.3,-39.34875230560405,-84.68956460218115,-62.0191584538926,5412.471546834915,81.65563374433637,2747.0635902896256,3m,45,53,49.0,SUPERTREND,53.58490566037736,60.0,47.16981132075472,COMPLETE
964,-97.07281733187665,2026-01-16 00:09:36.905450,2026-01-16 00:09:54.575592,0 days 00:00:17.670142,26,2.6,2.9000000000000004,1.5,124,CCI,ATR,2.3,124,16,10,0.027000000000000003,66,34,13,0.014,83,10,10,0.038,ATR,2.8,32,3m,SUPERTREND,False,False,False,False,False,0.41,CCI,2.3,-36.74032898316678,-74.48091664322808,-55.61062281319744,3203.187399135969,21.853393998360726,1612.5203965671649,3m,26,31,28.5,SUPERTREND,59.11910669975185,73.07692307692307,45.16129032258064,COMPLETE
965,1066.8948952422688,2026-01-16 00:09:39.520337,2026-01-16 00:10:04.857122,0 days 00:00:25.336785,26,2.6,2.8,1.5,123,BOLLINGER,ATR,2.35,117,16,10,0.027000000000000003,66,34,13,0.014,83,10,10,0.039,ATR,2.8,34,3m,SUPERTREND,False,False,False,False,False,0.41,BOLLINGER,2.35,-44.84046264216971,-89.31691792610074,-67.07869028413523,4443.6160293875755,102.61748653326602,2273.1167579604207,3m,46,53,49.5,SUPERTREND,54.019688269073015,60.86956521739131,47.16981132075472,COMPLETE
966,-64.84324764561461,2026-01-16 00:09:40.421210,2026-01-16 00:09:58.570520,0 days 00:00:18.149310,26,2.6,2.8,1.5,124,CCI,ATR,2.35,117,16,10,0.027000000000000003,66,34,13,0.014,83,10,10,0.038,ATR,2.8,32,3m,SUPERTREND,False,False,False,False,False,0.41,CCI,2.35,-37.536699547268185,-75.63920003920744,-56.58794979323781,3368.11454049439,5.078543872676812,1686.5965421835333,3m,26,31,28.5,SUPERTREND,59.11910669975185,73.07692307692307,45.16129032258064,COMPLETE
967,1475.4212274210386,2026-01-16 00:09:46.157785,2026-01-16 00:10:11.220510,0 days 00:00:25.062725,26,2.6,2.7,1.5,132,BOLLINGER,ATR,2.35,124,16,10,0.027000000000000003,66,34,13,0.014,83,10,10,0.038,ATR,2.8,33,3m,SUPERTREND,False,False,False,False,False,0.41,BOLLINGER,2.35,-40.14936102542849,-85.52297333294017,-62.83616717918433,5758.587088269366,71.46539294527383,2915.02624060732,3m,45,53,49.0,SUPERTREND,53.58490566037736,60.0,47.16981132075472,COMPLETE
968,1089.0079581449309,2026-01-16 00:09:48.313607,2026-01-16 00:10:12.691997,0 days 00:00:24.378390,26,2.6,2.8,1.5,124,BOLLINGER,ATR,2.35,125,16,10,0.026000000000000002,66,34,13,0.014,83,10,10,0.039,ATR,2.7,32,3m,SUPERTREND,False,False,False,False,False,0.41,BOLLINGER,2.35,-44.16268292627834,-89.33493055025734,-66.74880673826785,4476.264526226886,102.91933577305954,2289.5919309999726,3m,46,53,49.5,SUPERTREND,52.93273174733388,58.69565217391305,47.16981132075472,COMPLETE
969,-553.3735385553218,2026-01-16 00:09:50.890518,2026-01-16 00:10:10.301621,0 days 00:00:19.411103,26,2.7,2.8,1.5,124,BOLLINGER,ATR,2.35,125,16,10,0.027000000000000003,66,34,13,0.014,83,10,10,0.038,ATR,2.7,32,3m,EMA,False,False,False,False,False,0.41,BOLLINGER,2.35,-77.07300268981867,-91.9430998903341,-84.50805129007638,790.3058585060785,-11.264372349822569,389.52074307812796,3m,62,66,64.0,EMA,49.340175953079175,53.2258064516129,45.45454545454545,COMPLETE
970,1547.651001778093,2026-01-16 00:09:55.135511,2026-01-16 00:10:15.877372,0 days 00:00:20.741861,26,2.7,2.8,1.5,133,BOLLINGER,ATR,2.35,124,16,10,0.026000000000000002,66,34,13,0.014,83,10,10,0.037,ATR,2.7,35,3m,SUPERTREND,False,False,False,False,False,0.41,BOLLINGER,2.35,-38.20653904210132,-84.15935825415802,-61.18294864812967,5563.053772647026,140.13109816270452,2851.5924354048652,3m,42,50,46.0,SUPERTREND,55.95238095238095,61.904761904761905,50.0,COMPLETE
971,-328.41094456266,2026-01-16 00:09:59.853372,2026-01-16 00:10:19.900685,0 days 00:00:20.047313,26,2.7,2.8,1.5,127,BOLLINGER,ATR,2.35,110,16,10,0.027000000000000003,66,34,13,0.014,83,10,10,0.039,ATR,2.7,35,3m,EMA,False,False,False,False,False,0.41,BOLLINGER,2.35,-70.42815152217393,-91.9093662827325,-81.16875890245322,1189.8627807936964,-9.556416876465548,590.1531819586154,3m,60,66,63.0,EMA,50.984848484848484,55.00000000000001,46.96969696969697,COMPLETE
972,-378.39137655556533,2026-01-16 00:10:05.335410,2026-01-16 00:10:26.953040,0 days 00:00:21.617630,26,2.7,2.7,1.5,127,BOLLINGER,ATR,2.25,124,16,10,0.026000000000000002,66,34,13,0.014,83,10,10,0.039,ATR,2.7,35,3m,EMA,False,False,False,False,False,0.41,BOLLINGER,2.25,-70.21518534501816,-90.57772050616,-80.39645292558907,1053.6641592234384,7.386930637940228,530.5255449306893,3m,60,66,63.0,EMA,50.984848484848484,55.00000000000001,46.96969696969697,COMPLETE
973,1442.2393493051495,2026-01-16 00:10:11.746730,2026-01-16 00:10:32.749724,0 days 00:00:21.002994,26,2.7,2.7,1.5,133,BOLLINGER,ATR,2.25,107,16,10,0.026000000000000002,66,34,13,0.014,83,10,10,0.037,ATR,2.7,35,3m,SUPERTREND,False,False,False,False,False,0.41,BOLLINGER,2.25,-36.58101854879973,-82.31331550548828,-59.447167027144005,4921.75989996607,163.04050019619856,2542.4002000811347,3m,42,50,46.0,SUPERTREND,55.95238095238095,61.904761904761905,50.0,COMPLETE
974,1364.7732619908593,2026-01-16 00:10:12.656197,2026-01-16 00:10:35.486441,0 days 00:00:22.830244,26,2.6,2.8,1.5,132,BOLLINGER,ATR,2.25,107,16,10,0.028000000000000004,66,34,13,0.014,83,10,10,0.039,ATR,2.7,35,3m,SUPERTREND,False,False,False,False,False,0.41,BOLLINGER,2.25,-38.54353993732661,-83.81353688678449,-61.178538412055545,5081.902411058729,93.40031820687022,2587.6513646327994,3m,45,53,49.0,SUPERTREND,53.58490566037736,60.0,47.16981132075472,COMPLETE
975,-2741.0260134205882,2026-01-16 00:10:14.054572,2026-01-16 00:10:37.535731,0 days 00:00:23.481159,26,2.6,2.9000000000000004,1.5,127,BOLLINGER,ATR,2.25,109,16,10,0.026000000000000002,66,34,13,0.014,83,10,10,0.039,ATR,2.7,34,3m,SUPERTREND,False,False,True,False,False,0.41,BOLLINGER,2.25,-62.514093830831676,-86.52358007430982,-74.51883695257075,196.65591076924383,261.98693808127257,229.32142442525821,3m,26,27,26.5,SUPERTREND,50.925925925925924,50.0,51.85185185185185,COMPLETE
976,-2383.206686212361,2026-01-16 00:10:16.885567,2026-01-16 00:10:37.543968,0 days 00:00:20.658401,26,2.7,2.7,1.5,133,BOLLINGER,ATR,2.25,121,16,10,0.026000000000000002,66,34,13,0.014,83,10,10,0.037,ATR,2.7,34,3m,SUPERTREND,False,False,True,False,False,0.41,BOLLINGER,2.25,-52.48622455271455,-67.51441871849315,-60.000321635603854,275.57621470384254,708.3626486821269,491.9694316929847,3m,24,26,25.0,SUPERTREND,53.84615384615384,50.0,57.692307692307686,COMPLETE
977,-2601.1337221909484,2026-01-16 00:10:21.686395,2026-01-16 00:10:37.426005,0 days 00:00:15.739610,26,2.7,2.7,1.5,133,BOLLINGER,ATR,2.3,122,16,10,0.026000000000000002,66,34,13,0.014,83,10,10,0.037,ATR,2.7,33,30m,SUPERTREND,False,False,True,False,False,0.41,BOLLINGER,2.3,-56.360619941218125,-79.99188981134822,-68.17625487628317,269.0626954408204,363.12240065468535,316.09254804775287,30m,24,26,25.0,SUPERTREND,51.76282051282051,45.83333333333333,57.692307692307686,COMPLETE
978,-2383.5280817334938,2026-01-16 00:10:29.409998,2026-01-16 00:10:56.787633,0 days 00:00:27.377635,26,2.7,2.7,1.5,133,BOLLINGER,ATR,2.3,122,16,10,0.025,66,33,13,0.014,83,10,10,0.037,ATR,2.7,33,3m,SUPERTREND,False,False,True,False,False,0.41,BOLLINGER,2.3,-53.38612579344192,-68.81327611271382,-61.09970095307787,278.7942677288273,714.2742079541899,496.5342378415086,3m,24,26,25.0,SUPERTREND,53.84615384615384,50.0,57.692307692307686,COMPLETE
979,468.1001918503962,2026-01-16 00:10:34.722464,2026-01-16 00:10:44.734263,0 days 00:00:10.011799,26,2.7,2.7,1.5,133,BOLLINGER,ATR,2.3,120,16,10,0.026000000000000002,66,33,13,0.014,83,10,10,0.038,ATR,2.7,33,30m,SUPERTREND,False,False,False,False,False,0.41,BOLLINGER,2.3,-39.7181579556593,-93.82213810637143,-66.77014803101537,4349.321851158715,-13.830141928723641,2167.7458546149956,30m,41,47,44.0,SUPERTREND,54.955889984431764,60.97560975609756,48.93617021276596,COMPLETE
980,1498.0528474737866,2026-01-16 00:10:36.856967,2026-01-16 00:10:55.936438,0 days 00:00:19.079471,26,2.7,2.7,1.5,133,BOLLINGER,ATR,2.3,120,16,10,0.025,66,33,13,0.015,83,10,10,0.037,ATR,2.7,34,3m,SUPERTREND,False,False,False,False,False,0.41,BOLLINGER,2.3,-37.393764357751245,-83.25609337368151,-60.32492886571637,5235.386595137504,153.8817496578233,2694.6341723976634,3m,42,50,46.0,SUPERTREND,55.95238095238095,61.904761904761905,50.0,COMPLETE
981,1592.0154655165124,2026-01-16 00:10:37.467431,2026-01-16 00:10:56.886059,0 days 00:00:19.418628,26,2.7,2.7,1.5,134,BOLLINGER,ATR,2.3,120,16,10,0.026000000000000002,66,33,13,0.015,83,10,10,0.037,ATR,2.7,34,3m,SUPERTREND,False,False,False,False,False,0.41,BOLLINGER,2.3,-37.39384320618458,-83.11781794694038,-60.255830576562474,5584.902204667812,157.39793678349574,2871.1500707256537,3m,42,50,46.0,SUPERTREND,55.95238095238095,61.904761904761905,50.0,COMPLETE
982,1217.5287714190872,2026-01-16 00:10:37.658896,2026-01-16 00:10:53.135103,0 days 00:00:15.476207,26,2.8,2.7,1.5,134,BOLLINGER,ATR,2.3,119,16,10,0.027000000000000003,66,33,13,0.015,83,10,10,0.037,ATR,2.8,33,3m,SUPERTREND,False,False,False,False,False,0.4,BOLLINGER,2.3,-39.71073755739278,-85.40209192673584,-62.556414742064305,5307.017990120609,451.4074388574228,2879.212714489016,3m,41,43,42.0,SUPERTREND,57.23199092456041,60.97560975609756,53.48837209302325,COMPLETE
983,1123.852106511099,2026-01-16 00:10:37.663393,2026-01-16 00:10:55.295422,0 days 00:00:17.632029,26,2.8,2.7,1.5,133,BOLLINGER,ATR,2.3,127,16,10,0.027000000000000003,66,33,13,0.014,83,10,10,0.036000000000000004,ATR,2.8,36,3m,SUPERTREND,False,False,False,False,False,0.4,BOLLINGER,2.3,-39.698199605663184,-85.50540660700958,-62.60180310633638,4967.575233146247,443.8710786664424,2705.723155906345,3m,41,43,42.0,SUPERTREND,57.23199092456041,60.97560975609756,53.48837209302325,COMPLETE
984,-2220.4898924312643,2026-01-16 00:10:48.033655,2026-01-16 00:11:12.360655,0 days 00:00:24.327000,27,2.8,2.9000000000000004,1.5,135,DONCHIAN,ATR,2.3,126,16,10,0.025,66,33,13,0.015,83,10,10,0.036000000000000004,ATR,2.8,33,3m,SUPERTREND,False,False,False,False,False,0.4,DONCHIAN,2.3,-54.46215104600882,-50.47787420001757,-52.47001262301319,226.82367958057435,82.15153941813884,154.4876094993566,3m,32,26,29.0,SUPERTREND,53.48557692307692,53.125,53.84615384615385,COMPLETE
985,1010.5837715264479,2026-01-16 00:10:54.493484,2026-01-16 00:11:12.351583,0 days 00:00:17.858099,27,2.7,2.9000000000000004,1.5,129,BOLLINGER,ATR,2.35,126,16,10,0.025,66,33,13,0.015,83,10,10,0.036000000000000004,ATR,2.8,36,3m,SUPERTREND,False,False,False,False,False,0.4,BOLLINGER,2.35,-38.20611592216095,-89.93686590932263,-64.07149091574179,4083.0356306764934,27.545561481553175,2055.290596079023,3m,43,51,47.0,SUPERTREND,55.90515275877793,62.7906976744186,49.01960784313725,COMPLETE
986,-2132.867404435596,2026-01-16 00:10:56.548004,2026-01-16 00:11:17.059496,0 days 00:00:20.511492,27,2.7,2.8,1.5,131,DONCHIAN,ATR,2.35,127,16,10,0.025,66,34,13,0.015,83,10,10,0.036000000000000004,ATR,2.7,34,3m,SUPERTREND,False,False,False,False,False,0.41,DONCHIAN,2.35,-52.235770778263245,-47.88387141902007,-50.059821098641656,305.9062199889012,93.65512892224184,199.78067445557153,3m,32,28,30.0,SUPERTREND,55.13392857142857,53.125,57.14285714285714,COMPLETE
987,-2093.421808416133,2026-01-16 00:10:56.567549,2026-01-16 00:11:13.543432,0 days 00:00:16.975883,27,2.7,2.8,1.5,129,DONCHIAN,ATR,2.35,126,16,10,0.025,66,34,13,0.015,83,10,10,0.036000000000000004,ATR,2.7,36,3m,SUPERTREND,False,False,False,False,False,0.41,DONCHIAN,2.35,-52.235770778263245,-47.89340257975319,-50.064586679008215,305.9062199889012,130.9475403998013,218.42688019435127,3m,32,28,30.0,SUPERTREND,55.13392857142857,53.125,57.14285714285714,COMPLETE
988,-2073.4081816415705,2026-01-16 00:10:56.926037,2026-01-16 00:11:18.432046,0 days 00:00:21.506009,27,2.9000000000000004,2.8,1.5,129,DONCHIAN,ATR,2.35,127,16,10,0.026000000000000002,66,34,13,0.015,83,10,10,0.036000000000000004,ATR,2.7,36,3m,SUPERTREND,False,False,False,False,False,0.41,DONCHIAN,2.35,-52.06288374725582,-58.82528166650596,-55.44408270688089,180.53130170597797,231.61416956401885,206.07273563499842,3m,31,26,28.5,SUPERTREND,54.65260545905707,51.61290322580645,57.692307692307686,COMPLETE
989,-2084.7550522648166,2026-01-16 00:10:57.030556,2026-01-16 00:11:17.106608,0 days 00:00:20.076052,27,2.8,2.6,1.5,129,DONCHIAN,ATR,2.35,127,16,10,0.025,66,34,13,0.015,83,10,10,0.036000000000000004,ATR,2.7,35,3m,SUPERTREND,False,False,False,False,False,0.41,DONCHIAN,2.35,-55.327500488237526,-51.990345691865656,-53.65892309005159,230.4591456195733,183.6425208703807,207.050833244977,3m,32,27,29.5,SUPERTREND,54.34027777777778,53.125,55.55555555555556,COMPLETE
